Title,Price,Area,Location,type
"Cho thuê kho xưởng đẹp 200m2 ở đường 1, Quận Bình Tân",25 triệu/tháng,200 m²,"Bình Tân, Hồ Chí Minh",cho-thue-kho-nha-xuong-dat
Kho Nguyễn Văn Lượng 2.500m2 tại Gò Vấp,500 triệu/tháng,2.500 m²,"Gò Vấp, Hồ Chí Minh",cho-thue-kho-nha-xuong-dat
Cho thuê kho xưởng mặt tiền đường Phạm Hữu Lầu,65 triệu/tháng,1.000 m²,"Quận 7, Hồ Chí Minh",cho-thue-kho-nha-xuong-dat
"Xưởng trong khu công nghiệp Đồng An 2, dt 3400m2 giấy tờ pháp lí đủ. Người nước ngoài đứng tên",280 triệu/tháng,3.400 m²,"Thủ Dầu Một, Bình Dương",cho-thue-kho-nha-xuong-dat
"Xưởng Khánh Bình Tân Uyên giấy tờ đầy đủ pccc tự động: 1500m2 PCCC tự động, giá 105 tr thương lượng",105 triệu/tháng,1.500 m²,"Tân Uyên, Bình Dương",cho-thue-kho-nha-xuong-dat
Cho thuê kho 650m2 kế bên cầu Ông Lãnh Q1,117 triệu/tháng,650 m²,"Quận 1, Hồ Chí Minh",cho-thue-kho-nha-xuong-dat
"Cho thuê xưởng cơ khí, nhà kho, nhà văn phòng, có sẵn cẩu trục, điện 3 pha (thương lượng)",35 triệu/tháng,864 m²,"Biên Hòa, Đồng Nai",cho-thue-kho-nha-xuong-dat
"Cho thuê kho xưởng KCN Thọ Quang và An Đồn, Sơn Trà 500m2, 750m2, 1000m2, 2200m2",60 nghìn/m²,800 m²,"Sơn Trà, Đà Nẵng",cho-thue-kho-nha-xuong-dat
"Đất có diện tích lớn, rộng lớn cho thuê giá hấp dẫn 22,000m2",80 triệu/tháng,22.000 m²,"Củ Chi, Hồ Chí Minh",cho-thue-kho-nha-xuong-dat
"Cho thuê kho nhà xưởng KCN Hòa Khánh, Liên Chiểu Đà Nẵng",55 triệu/tháng,1.100 m²,"Liên Chiểu, Đà Nẵng",cho-thue-kho-nha-xuong-dat
"Cho thuê kho xưởng trong cụm công nghiệp Hố Nai, Đồng Nai",230 triệu/tháng,4.600 m²,"Biên Hòa, Đồng Nai",cho-thue-kho-nha-xuong-dat
"Cho thuê kho 250m2 giá: 25tr/tháng, nền bê tông tại Tân Thành",25 triệu/tháng,250 m²,"Tân Phú, Hồ Chí Minh",cho-thue-kho-nha-xuong-dat
Cho thuê kho 1.800m2 tại trung tâm Quận 7,200 triệu/tháng,1.800 m²,"Quận 7, Hồ Chí Minh",cho-thue-kho-nha-xuong-dat
Mặt tiền đường Đào Sư Tích cho thuê kho 1.500m2,120 triệu/tháng,1.500 m²,"Nhà Bè, Hồ Chí Minh",cho-thue-kho-nha-xuong-dat
Cho thuê kho 1.500 m2 mặt tiền Lộ Vòng Cung có điện 3 pha,20 triệu/tháng,1.500 m²,"Ninh Kiều, Cần Thơ",cho-thue-kho-nha-xuong-dat
Cho thuê kho xưởng mặt tiền Lũy Bán Bích có DT 1.100m2 ở Tân Phú,110 triệu/tháng,1.100 m²,"Tân Phú, Hồ Chí Minh",cho-thue-kho-nha-xuong-dat
"Cho thuê xưởng/ tổng 3.000m2 1.100m2 tại Thái Mỹ, Củ Chi",70 triệu/tháng,3.000 m²,"Củ Chi, Hồ Chí Minh",cho-thue-kho-nha-xuong-dat
"Cần cho thuê kho đường Chế Lan Viên, Q. Tân Phú, gần Trường Chinh, DTKV: 1500m2, DT kho 1050m2",60 triệu/tháng,1.500 m²,"Tân Phú, Hồ Chí Minh",cho-thue-kho-nha-xuong-dat
"Mặt tiền Võ Văn Bích, cho thuê xưởng 14.000m2",450 triệu/tháng,14.000 m²,"Củ Chi, Hồ Chí Minh",cho-thue-kho-nha-xuong-dat
"Kho xưởng cho thuê 260m2, Bình Tân giá 18tr/tháng",18 triệu/tháng,260 m²,"Bình Tân, Hồ Chí Minh",cho-thue-kho-nha-xuong-dat
Cho thuê 500m2 đất thổ cư giá 40tr/tháng tại Quận7,40 triệu/tháng,500 m²,"Quận 7, Hồ Chí Minh",cho-thue-kho-nha-xuong-dat
Nhà xưởng đường Lũy Bán Bích cho thuê 1.000m2 giá hấp dẫn,100 triệu/tháng,1.000 m²,"Tân Phú, Hồ Chí Minh",cho-thue-kho-nha-xuong-dat
"Cho thuê nhà xưởng - kho - văn phòng ~4,2 ha tại khu công nghiệp Nam Cầu Kiền",Giá thỏa thuận,"41.683,73 m²","Thủy Nguyên, Hải Phòng",cho-thue-kho-nha-xuong-dat
"Cho thuê nhà kho Mặt tiền đường Vành Đai 2 đường Ụ Ghe, Phường Tam Phú, Thủ Đức",12 triệu/tháng,200 m²,"Thủ Đức, Hồ Chí Minh",cho-thue-kho-nha-xuong-dat
Đất mặt tiền cho thuê 5500m2 đường Liên Phường,70 triệu/tháng,5.500 m²,"Quận 9, Hồ Chí Minh",cho-thue-kho-nha-xuong-dat
Cho thuê bãi đất trống 1.000m2 Q.7 giá hấp dẫn,40 triệu/tháng,1.000 m²,"Quận 7, Hồ Chí Minh",cho-thue-kho-nha-xuong-dat
"DT 4.000m2 cho thuê đất đường Trường Lưu, phường Long Trường, Quận 9",55 triệu/tháng,4.000 m²,"Quận 9, Hồ Chí Minh",cho-thue-kho-nha-xuong-dat
"Cho Thuê Kho Xưởng 1350m2 - Mặt Tiền QL1A, Phường Tam Bình, Quận Thủ Đức",110 triệu/tháng,1.350 m²,"Thủ Đức, Hồ Chí Minh",cho-thue-kho-nha-xuong-dat
"600m2 - Cho thuê nhà xưởng Đường Quốc Lộ 22, Xã Trung Chánh, Hóc Môn",52 triệu/tháng,600 m²,"Hóc Môn, Hồ Chí Minh",cho-thue-kho-nha-xuong-dat
"Cho thuê đất mặt tiền Đường Nguyễn Văn Hưởng, 40 triệu/tháng",40 triệu/tháng,320 m²,"Thủ Đức, Hồ Chí Minh",cho-thue-kho-nha-xuong-dat
Cho thuê nhà xưởng 1000m2 Hóc Môn,40 triệu/tháng,1.000 m²,"Hóc Môn, Hồ Chí Minh",cho-thue-kho-nha-xuong-dat
"Cho thuê kho xưởng đẹp 260m2 ở Liên Khu 5-6, Quận Bình Tân",18 triệu/tháng,260 m²,"Bình Tân, Hồ Chí Minh",cho-thue-kho-nha-xuong-dat
"Cho thuê kho 360m2 - 36 triệu/th, đường Hậu Giang, cont 40F vào ok, PCCC tự động",36 triệu/tháng,360 m²,"Quận 6, Hồ Chí Minh",cho-thue-kho-nha-xuong-dat
Cho thuê 60m2 mặt tiền đường 30m tại đường Vành Đai phía Tây thị trấn Quán Lào - giá cực hợp lý,Giá thỏa thuận,4.000 m²,"Yên Định, Thanh Hóa",cho-thue-kho-nha-xuong-dat
"Nằm ngay giáp ranh Quận 1 cho thuê đất 105m2, Bình Thạnh giá 20tr/tháng",20 triệu/tháng,105 m²,"Bình Thạnh, Hồ Chí Minh",cho-thue-kho-nha-xuong-dat
Kho xưởng phù hợp nhiều ngành nghề giá 45 triệu - 500m2 tại quận Tân Phú,45 triệu/tháng,500 m²,"Tân Phú, Hồ Chí Minh",cho-thue-kho-nha-xuong-dat
Ngay mặt tiền đường Quang Trung cho thuê xưởng 726m2,50 triệu/tháng,726 m²,"Gò Vấp, Hồ Chí Minh",cho-thue-kho-nha-xuong-dat
"DT 5.500m2 hàng hiếm - cho thuê đất mặt tiền Đường Liên Phường, Phường Phú Hữu, Quận 9",70 triệu/tháng,5.500 m²,"Quận 9, Hồ Chí Minh",cho-thue-kho-nha-xuong-dat
"Cho thuê 5000m2 đất trống mặt tiền Phan Văn Bảy, Nhà Bè giá hấp dẫn",80 triệu/tháng,5.000 m²,"Nhà Bè, Hồ Chí Minh",cho-thue-kho-nha-xuong-dat
"Cho thuê kho Bình Lợi - Bình Thạnh, DT 10x20m (200m2) giá 25tr/th TL",25 triệu/tháng,200 m²,"Bình Thạnh, Hồ Chí Minh",cho-thue-kho-nha-xuong-dat
Đất 5.300m2 mặt tiền xã Vĩnh Lộc B cho thuê,40 triệu/tháng,5.300 m²,"Bình Chánh, Hồ Chí Minh",cho-thue-kho-nha-xuong-dat
"Cho thuê kho xưởng ở Tân Kiên, Bình Chánh - DT 4.600m2",150 triệu/tháng,4.600 m²,"Bình Chánh, Hồ Chí Minh",cho-thue-kho-nha-xuong-dat
"DT 1.000m2 Cho thuê gấp kho xưởng mặt tiền Phạm Hữu Lầu vị trí đẹp, kinh doanh tốt",65 triệu/tháng,1.000 m²,"Quận 7, Hồ Chí Minh",cho-thue-kho-nha-xuong-dat
Kho 500m2 có văn phòng làm việc giá 95k/m2 gần chợ quận Tân Bình,95 nghìn/m²,500 m²,"Tân Bình, Hồ Chí Minh",cho-thue-kho-nha-xuong-dat
"DT 500m2 cho thuê đất thổ cư đường Kiều Đàm, Phường Tân Hưng, Quận 7 - 10 năm",40 triệu/tháng,500 m²,"Quận 7, Hồ Chí Minh",cho-thue-kho-nha-xuong-dat
"DT 161m2 Cho thuê kho mặt tiền Ngô Chí Quốc, Quận Thủ Đức",38 triệu/tháng,161 m²,"Thủ Đức, Hồ Chí Minh",cho-thue-kho-nha-xuong-dat
Cho thuê Kho xưởng đẹp 400m2 ở Kha Vạn Cân Quận Thủ Đức,12 triệu/tháng,400 m²,"Thủ Đức, Hồ Chí Minh",cho-thue-kho-nha-xuong-dat
Cho thuê kho xưởng đẹp 100m2 ở Nguyễn Văn Linh Phường 7 Quận 8,7 triệu/tháng,100 m²,"Quận 8, Hồ Chí Minh",cho-thue-kho-nha-xuong-dat
