Title,Price,Area,Location,type
"Cho thuê kho 700m2, đường Tây Lân, xe tải vào trong kho - Phường Tân Tạo, Bình Tân",45 triệu/tháng,700 m²,"Bình Tân, Hồ Chí Minh",cho-thue-kho-nha-xuong-dat
"Mặt bằng trống, đã trang bị máy che ở ĐS7, Thủ Đức - DT 1.086m2",75 triệu/tháng,1.086 m²,"Thủ Đức, Hồ Chí Minh",cho-thue-kho-nha-xuong-dat
Cho thuê kho xưởng đẹp 350m2 ở Hồ Văn Long Phường Tân Tạo Quận Bình Tân,35 triệu/tháng,350 m²,"Bình Tân, Hồ Chí Minh",cho-thue-kho-nha-xuong-dat
Cho thuê kho 1000m2 đường Huỳnh Tấn Phát giá 80tr/th. LH: Duy 0347 756 ***,80 triệu/tháng,1.000 m²,"Quận 7, Hồ Chí Minh",cho-thue-kho-nha-xuong-dat
Cho thuê kho xưởng đẹp 450m2 ở 19/5 Phường Sơn Kỳ Quận Tân Phú,28 triệu/tháng,450 m²,"Tân Phú, Hồ Chí Minh",cho-thue-kho-nha-xuong-dat
Cho thuê Kho xưởng đẹp 600m2 ở Tân Hiệp 8 Xã Tân Hiệp Huyện Hóc Môn,30 triệu/tháng,600 m²,"Hóc Môn, Hồ Chí Minh",cho-thue-kho-nha-xuong-dat
"Cho thuê kho xưởng đẹp 700m2 ở 181, xã Bình Mỹ, huyện Củ Chi",25 triệu/tháng,700 m²,"Củ Chi, Hồ Chí Minh",cho-thue-kho-nha-xuong-dat
"Cho thuê kho Phan Huy Ích Gò Vấp, điện 3 pha. giao thông thuận tiện - DT 1000m2",90 triệu/tháng,1.000 m²,"Gò Vấp, Hồ Chí Minh",cho-thue-kho-nha-xuong-dat
Cho thuê khu du lịch sinh thái đất đắc địa tại Củ Chi - DT 22000m2,80 triệu/tháng,22.000 m²,"Củ Chi, Hồ Chí Minh",cho-thue-kho-nha-xuong-dat
"Cho thuê kho - có sẵn vp mặt tiền QL1A - Tiền Lân 13, Bà Điểm - diện tích 1100m2",120 triệu/tháng,1.100 m²,"Hóc Môn, Hồ Chí Minh",cho-thue-kho-nha-xuong-dat
"Giá rẻ cho thuê kho xưởng Quận 7 DT 290m2, giá rẻ chỉ 24tr/th",24 triệu/tháng,290 m²,"Quận 7, Hồ Chí Minh",cho-thue-kho-nha-xuong-dat
"Cho thuê kho đắc địa, Quốc Lộ 1A, P. Linh Trung, Q. Thủ Đức - DT 3400m2",323 triệu/tháng,3.400 m²,"Thủ Đức, Hồ Chí Minh",cho-thue-kho-nha-xuong-dat
"Cho thuê xưởng DT 15000m2 ở Tân Phú Trung, Củ Chi - Giá 160 triệu/tháng",160 triệu/tháng,15.000 m²,"Củ Chi, Hồ Chí Minh",cho-thue-kho-nha-xuong-dat
"Đường Võ Thành Trang - Cho thuê kho bãi 366m2 Phường 11, Tân Bình",45 triệu/tháng,366 m²,"Tân Bình, Hồ Chí Minh",cho-thue-kho-nha-xuong-dat
Cho thuê kho xưởng đẹp 500m2 ở Thoại Ngọc Hầu Phường Tân Thành Quận Tân Phú,25 triệu/tháng,500 m²,"Tân Phú, Hồ Chí Minh",cho-thue-kho-nha-xuong-dat
"Cho thuê kho - diện tích 7200m2 công nghiệp đẳng cấp - An Phú Đông, Quận 12 - đầy đủ tiện",275 triệu/tháng,7.200 m²,"Quận 12, Hồ Chí Minh",cho-thue-kho-nha-xuong-dat
"Cho thuê kho xưởng Quận 7 PCCC phun nước tự động DT 2000m2 chia nhỏ 300m, 500m, 1000m2 xe cont 24/7",180 triệu/tháng,2.000 m²,"Quận 7, Hồ Chí Minh",cho-thue-kho-nha-xuong-dat
"Cho thuê kho ở QL1A, An Phú Đông - 350tr/tháng - DT 4681m2",350 triệu/tháng,4.681 m²,"Quận 12, Hồ Chí Minh",cho-thue-kho-nha-xuong-dat
Cho thuê kho mặt tiền ở Lê Thánh Tôn - Quận 1 - DT 719m2,110 triệu/tháng,719 m²,"Quận 1, Hồ Chí Minh",cho-thue-kho-nha-xuong-dat
"Đường Bà Thiên - kho xưởng rộng 2.700m2 tiện ích đầy đủ tại Xã Nhuận Đức, Củ Chi",40 triệu/tháng,2.700 m²,"Củ Chi, Hồ Chí Minh",cho-thue-kho-nha-xuong-dat
Nhà xưởng 1 trệt 1 lầu giá 40 triệu đường Lê Lợi - Tân Hiệp - Hóc Môn,40 triệu/tháng,1.000 m²,"Hóc Môn, Hồ Chí Minh",cho-thue-kho-nha-xuong-dat
"Cho thuê kho đường Bạch Đằng 2, Tân Bình - Diện tích 580m2",100 triệu/tháng,580 m²,"Tân Bình, Hồ Chí Minh",cho-thue-kho-nha-xuong-dat
"Cho thuê đất vị trí hiếm ở đường Điện Biên Phủ, Phường 15, Bình Thạnh",20 triệu/tháng,105 m²,"Bình Thạnh, Hồ Chí Minh",cho-thue-kho-nha-xuong-dat
"MB kho bãi xưởng 2000m2, 3500m2, 6000m2, 8000m2, 11000m2, 16000m2 Ql1A Q12",120 triệu/tháng,2.000 m²,"Quận 12, Hồ Chí Minh",cho-thue-kho-nha-xuong-dat
"Cho thuê nhà xưởng, kho vận - DT 3.000m2 ở Vĩnh Lộc, Bình Chánh",120 triệu/tháng,3.000 m²,"Bình Chánh, Hồ Chí Minh",cho-thue-kho-nha-xuong-dat
"Cho thuê xưởng - Ở Đường Ấp 4, Xã Xuân Thới Thượng, Hóc Môn - DT 2.800m2",95 triệu/tháng,2.800 m²,"Hóc Môn, Hồ Chí Minh",cho-thue-kho-nha-xuong-dat
"Cho thuê kho Quốc lộ 1A, Phường An Phú Đông, Quận 12 - DT 5.380m2",145 triệu/tháng,5.380 m²,"Quận 12, Hồ Chí Minh",cho-thue-kho-nha-xuong-dat
Đường Đào Trí - cho thuê đất mặt tiền 1.000 m2 tại Quận 7,40 triệu/tháng,1.000 m²,"Quận 7, Hồ Chí Minh",cho-thue-kho-nha-xuong-dat
Đường Dương Đức Hiền - Cho thuê đất trống 400m2 Phường Tây Thạnh Quận Tân Phú,40 triệu/tháng,400 m²,"Tân Phú, Hồ Chí Minh",cho-thue-kho-nha-xuong-dat
"Cho thuê nhà xưởng, kho tại Tỉnh lộ 10, đường Trần Văn Giàu, giá cực tốt, đầy đủ hệ thống PCCC",70 nghìn/m²,5.000 m²,"Bình Chánh, Hồ Chí Minh",cho-thue-kho-nha-xuong-dat
Đường Huỳnh Tấn Phát - Cho thuê bãi đất trống 1.000m2 Q. 7,40 triệu/tháng,1.000 m²,"Quận 7, Hồ Chí Minh",cho-thue-kho-nha-xuong-dat
Cho thuê nhà xưởng mới xây dựng theo chuẩn quốc tế - Tiện ích đạt chuẩn BSCI,"84,59 nghìn/m²",18.485 m²,"Củ Chi, Hồ Chí Minh",cho-thue-kho-nha-xuong-dat
"Đường Kiều Đàm - cần cho thuê 500m2 đất thổ cư, Phường Tân Hưng, Quận 7 - giá 40tr/tháng",40 triệu/tháng,500 m²,"Quận 7, Hồ Chí Minh",cho-thue-kho-nha-xuong-dat
"Cho thuê kho xưởng đẹp 700m2 ở Võ Hữu Lợi, Xã Lê Minh Xuân, Huyện Bình Chánh",20 triệu/tháng,700 m²,"Bình Chánh, Hồ Chí Minh",cho-thue-kho-nha-xuong-dat
"Đường Võ Thị Liễu - cho thuê đất 4.000m2 tại An Phú Đông, Quận 12 - thích hợp làm xưởng, kho bãi",40 triệu/tháng,4.000 m²,"Quận 12, Hồ Chí Minh",cho-thue-kho-nha-xuong-dat
"Đường Phan Anh - Cho thuê đất trống 390m2 - Phường Hiệp Tân, Tân Phú","399,99 triệu/tháng",390 m²,"Tân Phú, Hồ Chí Minh",cho-thue-kho-nha-xuong-dat
Kho xưởng từ 600 đến 1500m2 vị trí ngay quốc lộ xe container đi 24/24 tại Quận 12,120 nghìn/m²,1.500 m²,"Quận 12, Hồ Chí Minh",cho-thue-kho-nha-xuong-dat
"Đường Đặng Công Bỉnh - Cho thuê kho 900m2, Xuân Thới Thượng, Hóc Môn - Đường xe tải, điện 3 pha",40 triệu/tháng,900 m²,"Hóc Môn, Hồ Chí Minh",cho-thue-kho-nha-xuong-dat
"Đường Liên Phường - Cho thuê kho mặt tiền 600m2, Phước Long B, TP Thủ Đức",40 triệu/tháng,600 m²,"Quận 9, Hồ Chí Minh",cho-thue-kho-nha-xuong-dat
"Đường Nhị Bình 8, cho thuê kho xưởng 800m2 Xã Nhị Bình, Hóc Môn",40 triệu/tháng,800 m²,"Hóc Môn, Hồ Chí Minh",cho-thue-kho-nha-xuong-dat
"Cho thuê kho MT: An Phú 13, P. An Phú - Thuận An - BD (DT: 15x60) kho đẹp, đang trống, xe container",50 triệu/tháng,900 m²,"Thuận An, Bình Dương",cho-thue-kho-nha-xuong-dat
Đường Ngô Chí Quốc - cần cho thuê kho 161 m2 mặt tiền Quận Thủ Đức,38 triệu/tháng,161 m²,"Thủ Đức, Hồ Chí Minh",cho-thue-kho-nha-xuong-dat
Cho thuê đất vị trí hiếm 1.800m2 ở Nguyễn Thị Sáu Phường Thạnh Lộc Quận 12,30 triệu/tháng,1.800 m²,"Quận 12, Hồ Chí Minh",cho-thue-kho-nha-xuong-dat
Đường Nguyễn Văn Hưởng - Cho thuê đất trống 320m2 Mặt tiền đường - Vị trí đắc địa cho kinh doanh,40 triệu/tháng,320 m²,"Quận 2, Hồ Chí Minh",cho-thue-kho-nha-xuong-dat
"Cho thuê đất chính chủ mặt tiền QL51 - 2 mặt trước sau, cách ngã 3 Thái Lan 300m, phù hợp làm gara",15 triệu/tháng,525 m²,"Biên Hòa, Đồng Nai",cho-thue-kho-nha-xuong-dat
"Cho thuê đất vị trí hiếm 2.400m2 ở Cây Da, Xã Tân Phú Trung, Huyện Củ Chi",25 triệu/tháng,2.400 m²,"Củ Chi, Hồ Chí Minh",cho-thue-kho-nha-xuong-dat
"Cho thuê đất làm bãi xe: MT Đường Phước Bình, DT: 14.224m2 (60m ngang)",70 triệu/tháng,14.224 m²,"Long Thành, Đồng Nai",cho-thue-kho-nha-xuong-dat
Kho xưởng 2000m2 trong cụm kho KCN Cát Lái Quận 2,130 nghìn/m²,2.000 m²,"Quận 2, Hồ Chí Minh",cho-thue-kho-nha-xuong-dat
"Đường 1B - cho thuê kho 5.300m2 mặt tiền xã Vĩnh Lộc B, cách ngã tư Võ Văn Vân và đường 1A (1km)",40 triệu/tháng,5.300 m²,"Bình Chánh, Hồ Chí Minh",cho-thue-kho-nha-xuong-dat
"Đường Bình Chiểu - cần cho thuê xưởng 500m2 mặt tiền P. Bình Chiểu, TP Thủ Đức",38 triệu/tháng,500 m²,"Thủ Đức, Hồ Chí Minh",cho-thue-kho-nha-xuong-dat
"Cho thuê đất vị trí hiếm 10.000m2 ở Nguyễn Văn Khạ, Xã Phú Hòa Đông, Huyện Củ Chi",25 triệu/tháng,10.000 m²,"Củ Chi, Hồ Chí Minh",cho-thue-kho-nha-xuong-dat
"Cho thuê đất MT - DT 11.000m2 Võ Trần Chí, Bình Chánh",150 triệu/tháng,11.000 m²,"Bình Chánh, Hồ Chí Minh",cho-thue-kho-nha-xuong-dat
"Mặt bằng Kinh Dương Vương, Bình Tân cho thuê - DT 1300m2",120 triệu/tháng,1.300 m²,"Bình Tân, Hồ Chí Minh",cho-thue-kho-nha-xuong-dat
Cho thuê kho xưởng đẹp 300m2 ở Nguyễn Trọng Quyền Phường Tân Thới Hoà Quận Tân Phú,24 triệu/tháng,300 m²,"Tân Phú, Hồ Chí Minh",cho-thue-kho-nha-xuong-dat
"Chính chủ cho thuê kho bãi trống DT 5.000m2 phù hợp chứa hàng hóa, tại huyện Bình Chánh",70 nghìn/m²,5.000 m²,"Bình Chánh, Hồ Chí Minh",cho-thue-kho-nha-xuong-dat
"Đường CN13 - Cho thuê kho chứa hàng 300m2 phường Tây Thạnh, Tân Phú",36 triệu/tháng,300 m²,"Tân Phú, Hồ Chí Minh",cho-thue-kho-nha-xuong-dat
"Đường Quốc Lộ 1A - Cho thuê kho xưởng 500m2 Thị trấn Tân Túc, Bình Chánh",40 triệu/tháng,500 m²,"Bình Chánh, Hồ Chí Minh",cho-thue-kho-nha-xuong-dat
Cho thuê kho xưởng đẹp 230m2 ở Lũy Bán Bích Phường Phú Trung Quận Tân Phú,24 triệu/tháng,230 m²,"Tân Phú, Hồ Chí Minh",cho-thue-kho-nha-xuong-dat
Nha xưởng 1100m2 phù hợp nhiều ngành nghề tại xã Bà Điểm - Hóc Môn,110 triệu/tháng,1.100 m²,"Hóc Môn, Hồ Chí Minh",cho-thue-kho-nha-xuong-dat
Cho thuê nhà xưởng 900m2 Hóc Môn,30 triệu/tháng,900 m²,"Hóc Môn, Hồ Chí Minh",cho-thue-kho-nha-xuong-dat
Đường Bình Long - cho thuê kho xưởng mặt tiền đường quận Tân Phú - 31 triệu/tháng - 195m2,31 triệu/tháng,195 m²,"Tân Phú, Hồ Chí Minh",cho-thue-kho-nha-xuong-dat
5.500m2 cụm KCN Trảng Bom giá 250 triệu,250 triệu/tháng,5.500 m²,"Trảng Bom, Đồng Nai",cho-thue-kho-nha-xuong-dat
"Đường Hà Huy Giáp - Cho thuê kho xưởng gỗ 1.000m2 - Phường Thạnh Xuân, Quận 12",38 triệu/tháng,1.000 m²,"Quận 12, Hồ Chí Minh",cho-thue-kho-nha-xuong-dat
"Đường Tân Thới Nhất 7 - cho thuê kho, diện tích sử dụng 400m2, gần đường Trường Chinh",36 triệu/tháng,250 m²,"Quận 12, Hồ Chí Minh",cho-thue-kho-nha-xuong-dat
"Cho thuê kho xưởng đẹp 500m2 ở Đông Lân, Xã Bà Điểm, Huyện Hóc Môn",25 triệu/tháng,500 m²,"Hóc Môn, Hồ Chí Minh",cho-thue-kho-nha-xuong-dat
Cho thuê kho xưởng đẹp 180m2 ở Bình Lợi Phường 13 Quận Bình Thạnh,29 triệu/tháng,180 m²,"Bình Thạnh, Hồ Chí Minh",cho-thue-kho-nha-xuong-dat
"Cho thuê nhà kho mặt tiền tuyến tránh, đoạn gần cầu ba nhỏ. (nhận tìm kho, mặt bằng kinh doanh)",12 triệu/tháng,360 m²,"Rạch Giá, Kiên Giang",cho-thue-kho-nha-xuong-dat
"Cho thuê 2.000m2 kho tại Tỉnh lộ 10, pháp lý đầy đủ hệ thống PCCC, điện 3 pha giá cực tốt, Lh ngay",75 nghìn/m²,2.000 m²,"Bình Tân, Hồ Chí Minh",cho-thue-kho-nha-xuong-dat
"Cho thuê kho, xưởng tại Bắc Ninh trong và ngoài KCN",30 triệu/tháng,500 m²,"Quế Võ, Bắc Ninh",cho-thue-kho-nha-xuong-dat
Cho thuê đất vị trí hiếm 1.800m2 ở An Phú Đông Phường An Phú Đông Quận 12,27 triệu/tháng,1.800 m²,"Quận 12, Hồ Chí Minh",cho-thue-kho-nha-xuong-dat
Cho thuê mặt bằng kinh doanh rộng gần 2000m2 đã có nhà sẵn,Giá thỏa thuận,1.950 m²,"Hạ Long, Quảng Ninh",cho-thue-kho-nha-xuong-dat
"Đường Hà Huy Giáp - Cho thuê nhà xưởng 800m2 Phường Thạnh Xuân, Quận 12 giá 35tr/tháng",35 triệu/tháng,800 m²,"Quận 12, Hồ Chí Minh",cho-thue-kho-nha-xuong-dat
Đường An Dương Vương cho thuê nhà xưởng 276m2 tại Q. 6,33 triệu/tháng,276 m²,"Quận 6, Hồ Chí Minh",cho-thue-kho-nha-xuong-dat
Cho thuê kho xưởng đẹp 600m2 ở Tỉnh Lộ 41 Phường Thạnh Lộc Quận 12,26 triệu/tháng,600 m²,"Quận 12, Hồ Chí Minh",cho-thue-kho-nha-xuong-dat
"Đường Hoài Thanh cho thuê kho 500m2 ở Phường 14, Quận 8",35 triệu/tháng,500 m²,"Quận 8, Hồ Chí Minh",cho-thue-kho-nha-xuong-dat
"Cho thuê kho xưởng diện tích 720m2 tại KCN Cát lái, Quận 2 - Thạnh Mỹ Lợi","79,2 triệu/tháng",720 m²,"Quận 2, Hồ Chí Minh",cho-thue-kho-nha-xuong-dat
"Cho thuê kho 500m2 Đào Sư Tích, xã Phước Kiển ra trung tâm gần",50 triệu/tháng,500 m²,"Nhà Bè, Hồ Chí Minh",cho-thue-kho-nha-xuong-dat
"Cho thuê kho hơn 200m2 Phạm Hữu Lầu, xã Phước Kiển",13 triệu/tháng,216 m²,"Nhà Bè, Hồ Chí Minh",cho-thue-kho-nha-xuong-dat
Nhà xưởng 1 trệt 1 lầu tổng 3500m2 có PCCC tự động thẩm duyệt tại Quận 12,220 triệu/tháng,3.500 m²,"Quận 12, Hồ Chí Minh",cho-thue-kho-nha-xuong-dat
Cho thuê kho xưởng đẹp 230m2 ở Lê Đình Cẩn Phường Tân Tạo Quận Bình Tân,14 triệu/tháng,230 m²,"Bình Tân, Hồ Chí Minh",cho-thue-kho-nha-xuong-dat
"Cho thuê lô GÓC mặt tiền Đinh Bộ Lĩnh, Phường 24, Quận Bình Thạnh",180 triệu/tháng,783 m²,"Bình Thạnh, Hồ Chí Minh",cho-thue-kho-nha-xuong-dat
"Cho thuê kho giá rẻ tại đường Tôn Thất Thuyết, Q4 - DT 700m2",125 triệu/tháng,700 m²,"Quận 4, Hồ Chí Minh",cho-thue-kho-nha-xuong-dat
Cho thuê xưởng KCN Long Mỹ 28.000m2 có trạm điện,510 triệu/tháng,28.000 m²,"Quy Nhơn, Bình Định",cho-thue-kho-nha-xuong-dat
Kho xưởng đẹp 700m2 trần cao 7-8m giá tốt triệu tại Quận 12,50 triệu/tháng,700 m²,"Quận 12, Hồ Chí Minh",cho-thue-kho-nha-xuong-dat
"Đường Hương lộ 2 - Cho thuê gấp xưởng Phường Bình Trị Đông A, Bình Tân với DT 450 m2",35 triệu/tháng,450 m²,"Bình Tân, Hồ Chí Minh",cho-thue-kho-nha-xuong-dat
"Cho thuê kho làm sân cầu lông, golf điện tử, Quận 7, HCM",120 nghìn/m²,1.600 m²,"Quận 7, Hồ Chí Minh",cho-thue-kho-nha-xuong-dat
"Cho thuê kho xưởng 470m2 đường xe công chạy, xã Bắc Sơn, Trảng Bom, Đồng Nai",15 triệu/tháng,470 m²,"Trảng Bom, Đồng Nai",cho-thue-kho-nha-xuong-dat
"Cho thuê xưởng đường Kênh A, xã Lê Minh Xuân, Bình Chánh",35 triệu/tháng,820 m²,"Bình Chánh, Hồ Chí Minh",cho-thue-kho-nha-xuong-dat
"Cho thuê kho mặt tiền Huỳnh Tấn Phát Q7 DT: 10x25m trệt lầu, giá 40tr/tháng",40 triệu/tháng,250 m²,"Quận 7, Hồ Chí Minh",cho-thue-kho-nha-xuong-dat
"Cho thuê kho xưởng KCN Bình Dương. TDT 19.000m2. DTX 10.000m2. Giá 84.591,8 đ/m²/tháng. VP 850m2","84,59 nghìn/m²",10.000 m²,"Thuận An, Bình Dương",cho-thue-kho-nha-xuong-dat
"Cho thuê khuôn đất 3600m2 mặt tiền đường Trần Não, P. Bình An, Quận 2 - Giá 750 tr/th thương lượng",750 triệu/tháng,3.600 m²,"Quận 2, Hồ Chí Minh",cho-thue-kho-nha-xuong-dat
"Cho thuê xưởng giá rẻ sản xuất đa ngành nghề tại Bình Dương, pháp lý chuẩn chỉ",400 triệu/tháng,8.000 m²,"Tân Uyên, Bình Dương",cho-thue-kho-nha-xuong-dat
"Chính chủ cho thuê 1000m2 chỉ 70 triệu mặt tiền 20m đường Lê Văn Việt, P. Tăng nhơn Phú A, Quận 9",70 triệu/tháng,1.000 m²,"Quận 9, Hồ Chí Minh",cho-thue-kho-nha-xuong-dat
Cho thuê kho Bình Tân - DT kho: 15.000m2 - PCCC tự động kiểm duyệt - đường xe container 24 - 24,100 nghìn/m²,15.000 m²,"Bình Tân, Hồ Chí Minh",cho-thue-kho-nha-xuong-dat
Cho thuê kho mặt tiền đường Hương Lộ 2 - Bình Trị Đông - Bình Tân. Diện tích: 3.100m2,Giá thỏa thuận,3.100 m²,"Bình Tân, Hồ Chí Minh",cho-thue-kho-nha-xuong-dat
Cho thuê kho KCN Tân Bình. DT kho: 7.000m2. PCCC tự động kiểm duyệt. Đường xe container 24 - 24,Giá thỏa thuận,7.000 m²,"Tân Bình, Hồ Chí Minh",cho-thue-kho-nha-xuong-dat
Cho thuê kho xưởng trung tâm TP.BMT đầy đủ giấy phép pccc đường xe container,50 triệu/tháng,1.000 m²,"Buôn Ma Thuột, Đắk Lắk",cho-thue-kho-nha-xuong-dat
Cho thuê kho xưởng sản xuất đa ngành nghề pháp lí đầy đủ giấy tờ có PCCC,50 nghìn/m²,3.700 m²,"Krông Pắc, Đắk Lắk",cho-thue-kho-nha-xuong-dat
"Cho thuê kho trong khu công nghiệp Vsip 2 Bình Dương 2500, 3500, 6000, 15.000m2",Giá thỏa thuận,15.000 m²,"Thủ Dầu Một, Bình Dương",cho-thue-kho-nha-xuong-dat
Cho thuê 6.600m2 trong khu sản xuất cụm CN Thuận An giá 60.105 đ/m2/tháng,"60,1 nghìn/m²",6.600 m²,"Thuận An, Bình Dương",cho-thue-kho-nha-xuong-dat
Cho thuê 2000m2 kho xưởng trong cụm CN Tân Uyên giá: 125 tr/tháng,125 triệu/tháng,2.000 m²,"Tân Uyên, Bình Dương",cho-thue-kho-nha-xuong-dat
"Cho thuê kho xưởng 8x25m. Có gác mặt tiền đường Nguyễn Thị Kiểu, Phường Hiệp Thành, Q12",20 triệu/tháng,200 m²,"Quận 12, Hồ Chí Minh",cho-thue-kho-nha-xuong-dat
Chính chủ cho thuê kho đường Đông Lợi 4,10 triệu/tháng,150 m²,"Thanh Khê, Đà Nẵng",cho-thue-kho-nha-xuong-dat
"Đất lớn: Cho thuê lô đất 5500m2 (3300m2 thổ cư) 3 mặt tiền Nguyễn Văn Hưởng, Thảo Điền 668 tr/th",668 triệu/tháng,5.500 m²,"Quận 2, Hồ Chí Minh",cho-thue-kho-nha-xuong-dat
"Cho thuê lô đất 878m2 full thổ cư 3 mặt tiền Nguyễn Văn Hưởng, giá 99 tr/th",99 triệu/tháng,878 m²,"Quận 2, Hồ Chí Minh",cho-thue-kho-nha-xuong-dat
"Lô đất 30x37m, 1110m2 full thổ cư góc 3 mặt tiền Lương Định Của, gần Lưu Đình Lễ, 160 tr/th, hè 6m",168 triệu/tháng,1.110 m²,"Quận 2, Hồ Chí Minh",cho-thue-kho-nha-xuong-dat
"Cho thuê xưởng 500m2 giá chốt 20 triệu/th, đường Võ Văn Hát, P. Long Trường, Thủ Đức",20 triệu/tháng,500 m²,"Quận 9, Hồ Chí Minh",cho-thue-kho-nha-xuong-dat
"Cho thuê xưởng 600m2, 25 triệu/th đường Nguyễn Xiển, P. Long Thạnh Mỹ, Thủ Đức",25 triệu/tháng,600 m²,"Quận 9, Hồ Chí Minh",cho-thue-kho-nha-xuong-dat
"Cho thuê mặt bằng đẹp 500m2. Góc 2MT Đường TA16, gần ngay Lê Thị Riêng, Phường Thới An. Q12",30 triệu/tháng,500 m²,"Quận 12, Hồ Chí Minh",cho-thue-kho-nha-xuong-dat
"Cho thuê đất mặt tiền Xa lộ Hà Nội, Phường Thảo Điền",250 triệu/tháng,935 m²,"Thủ Đức, Hồ Chí Minh",cho-thue-kho-nha-xuong-dat
"Cho thuê đất mặt tiền Phan Đình Giót, Phường 2, Tân Bình - 300m2, giá chỉ 80 triệu/Tháng",80 triệu/tháng,300 m²,"Tân Bình, Hồ Chí Minh",cho-thue-kho-nha-xuong-dat
"Cho thuê đất 950m2 đường Quốc Hương, Q2. Giá 150tr/tháng",150 triệu/tháng,950 m²,"Quận 2, Hồ Chí Minh",cho-thue-kho-nha-xuong-dat
"Kho xưởng mới cho thuê ở Liên Phường, Phường Phước Long B, Quận 9 DT 600m2",40 triệu/tháng,600 m²,"Quận 9, Hồ Chí Minh",cho-thue-kho-nha-xuong-dat
"Kho xưởng mới cho thuê ở Nhị Bình 8, Xã Nhị Bình, Huyện Hóc Môn DT 800m2",40 triệu/tháng,800 m²,"Hóc Môn, Hồ Chí Minh",cho-thue-kho-nha-xuong-dat
"Cho thuê kho mặt tiền Quốc Lộ 1A, Bình Tân thích hợp showroom - diện tích 900m2",70 triệu/tháng,900 m²,"Bình Tân, Hồ Chí Minh",cho-thue-kho-nha-xuong-dat
Cho thuê nhà xưởng xã Xuân Thới Thượng có DT 1.200m2,50 triệu/tháng,1.200 m²,"Hóc Môn, Hồ Chí Minh",cho-thue-kho-nha-xuong-dat
"Đường Nhị Bình 8, Xã Nhị Bình, Hóc Môn, Hồ Chí Minh - Cho thuê nhà xưởng 800m2",40 triệu/tháng,800 m²,"Hóc Môn, Hồ Chí Minh",cho-thue-kho-nha-xuong-dat
Cho thuê kho xưởng MT Hồng Bàng; Phường 3; Quận 6,51 triệu/tháng,300 m²,"Quận 6, Hồ Chí Minh",cho-thue-kho-nha-xuong-dat
"Cho thuê kho 300m2 giá hấp dẫn 30 triệu/tháng tại Đường 40, Phường Thảo Điền",30 triệu/tháng,300 m²,"Quận 2, Hồ Chí Minh",cho-thue-kho-nha-xuong-dat
"Kho xưởng mới cho thuê ở CN13, Phường Tây Thạnh, Quận Tân Phú DT 300m2",36 triệu/tháng,300 m²,"Tân Phú, Hồ Chí Minh",cho-thue-kho-nha-xuong-dat
"Kho xưởng mới cho thuê ở 2B, Phường Bình Hưng Hoà B, Quận Bình Tân DT 260m2",26 triệu/tháng,260 m²,"Bình Tân, Hồ Chí Minh",cho-thue-kho-nha-xuong-dat
"Kho Xưởng Cho Thuê ở Hoàng Văn Thụ, Phú Nhuận - DT 600m2",60 triệu/tháng,600 m²,"Phú Nhuận, Hồ Chí Minh",cho-thue-kho-nha-xuong-dat
"Cho thuê kho xưởng 2.500m2 đường Vĩnh Lộc, Xã Vĩnh Lộc B, Bình Chánh, Hồ Chí Minh",90 triệu/tháng,2.500 m²,"Bình Chánh, Hồ Chí Minh",cho-thue-kho-nha-xuong-dat
"Cho thuê đất mặt tiền Phạm Văn Chiêu, P. 14, Q. Gò Vấp - 2.300m2, giá 150 triệu/tháng",150 triệu/tháng,2.300 m²,"Gò Vấp, Hồ Chí Minh",cho-thue-kho-nha-xuong-dat
Đường Nguyễn Văn Hưởng- cho thuê đất 320m2 trống 2 mặt tiền đường - vị trí đắc địa cho kinh doanh,40 triệu/tháng,320 m²,"Quận 2, Hồ Chí Minh",cho-thue-kho-nha-xuong-dat
"Cho thuê xưởng 500m2 mặt tiền đường Bình Chiểu, P. Bình Chiểu, TP Thủ Đức - Giá thuê 38 triệu/tháng",28 triệu/tháng,500 m²,"Thủ Đức, Hồ Chí Minh",cho-thue-kho-nha-xuong-dat
"Kho xưởng mới cho thuê ở Mai Bá Hương, Xã Lê Minh Xuân, Huyện Bình Chánh, DT 1.500m2",100 triệu/tháng,1.500 m²,"Bình Chánh, Hồ Chí Minh",cho-thue-kho-nha-xuong-dat
"Kho cho thuê đường Cầu Xây, 500m2",30 triệu/tháng,500 m²,"Quận 9, Hồ Chí Minh",cho-thue-kho-nha-xuong-dat
Kho xưởng mới cho thuê ở Cầu Xây Phường Tân Phú Quận 9 DT 500m2,30 triệu/tháng,500 m²,"Quận 9, Hồ Chí Minh",cho-thue-kho-nha-xuong-dat
"Kho cho thuê có đường lớn 500m2 đường Cầu Xây Phường Tân Phú, Quận 9. Xe tải ra vô thoải mái",30 triệu/tháng,500 m²,"Quận 9, Hồ Chí Minh",cho-thue-kho-nha-xuong-dat
"Cần cho thuê kho xưởng 1.000m2 Võ Hữu Lợi, Xã Lê Minh Xuân, huyện Bình Chánh",45 triệu/tháng,1.000 m²,"Bình Chánh, Hồ Chí Minh",cho-thue-kho-nha-xuong-dat
"Cho thuê kho có DT 366m2 đường Võ Thành Trang, Phường 11, Tân Bình, Hồ Chí Minh",45 triệu/tháng,366 m²,"Tân Bình, Hồ Chí Minh",cho-thue-kho-nha-xuong-dat
"Kho xưởng mới cho thuê ở 1B Xã Tân Nhựt, Huyện Bình Chánh, DT 1.800m2",60 triệu/tháng,1.800 m²,"Bình Chánh, Hồ Chí Minh",cho-thue-kho-nha-xuong-dat
"Cho thuê kho đường CN13, Quận Tân Phú 300m2",36 triệu/tháng,300 m²,"Tân Phú, Hồ Chí Minh",cho-thue-kho-nha-xuong-dat
"Cho thuê kho đường Bạch Đằng, Tân Bình - Có DT 580m2",100 triệu/tháng,580 m²,"Tân Bình, Hồ Chí Minh",cho-thue-kho-nha-xuong-dat
Cho thuê kho Thoại Ngọc Hầu giá 25 triệu/tháng HD dài hạn - DT 500m2,25 triệu/tháng,500 m²,"Tân Phú, Hồ Chí Minh",cho-thue-kho-nha-xuong-dat
Cho thuê kho 260m2 khu 2B Quận Bình Tân,26 triệu/tháng,260 m²,"Bình Tân, Hồ Chí Minh",cho-thue-kho-nha-xuong-dat
"Cho thuê 3 kho liền nhau khu kho bãi Kênh 19/5 - Lê Trọng Tấn, Tân Phú có DT 450m2",28 triệu/tháng,450 m²,"Tân Phú, Hồ Chí Minh",cho-thue-kho-nha-xuong-dat
"Cho thuê kho 900m2 đường Đặng Công Bỉnh Xuân Thới Thượng, Hóc Môn - đường xe tải, điện 3 pha",40 triệu/tháng,900 m²,"Hóc Môn, Hồ Chí Minh",cho-thue-kho-nha-xuong-dat
"Kho xưởng mới cho thuê ở 13, phường Bình Hưng Hoà A, Quận Bình Tân DT 250m2",20 triệu/tháng,250 m²,"Bình Tân, Hồ Chí Minh",cho-thue-kho-nha-xuong-dat
Cho thuê kho chứa hàng 300m2 đường CN13 Tân Phú - giá thuê 36 triệu /tháng,36 triệu/tháng,300 m²,"Tân Phú, Hồ Chí Minh",cho-thue-kho-nha-xuong-dat
Kho xưởng mới cho thuê ở 104A Phường Thạnh Mỹ Lợi Quận 2 DT 432m2,65 triệu/tháng,432 m²,"Quận 2, Hồ Chí Minh",cho-thue-kho-nha-xuong-dat
Đất vị trí hiếm cho thuê ở Tỉnh Lộ 10 Phường Tân Tạo Quận Bình Tân. DT 300m2,25 triệu/tháng,300 m²,"Bình Tân, Hồ Chí Minh",cho-thue-kho-nha-xuong-dat
"Cho thuê kho xưởng 800m2 đường Nhị Bình 8, Xã Nhị Bình, Hóc Môn - Đường lớn, xe container vào được",40 triệu/tháng,800 m²,"Hóc Môn, Hồ Chí Minh",cho-thue-kho-nha-xuong-dat
"Cho thuê kho bãi Tân Phú - 500 m2 - Đường Tây Thạnh, Phường Tây Thạnh, Tân Phú, Hồ Chí Minh",50 triệu/tháng,500 m²,"Tân Phú, Hồ Chí Minh",cho-thue-kho-nha-xuong-dat
"Cho thuê kho chứa hàng 300m2 đường CN13 Phường Tây Thạnh, Tân Phú - vị trí rất thuận tiện",36 triệu/tháng,300 m²,"Tân Phú, Hồ Chí Minh",cho-thue-kho-nha-xuong-dat
"Phường Tân Tạo A, quận Bình Tân cho thuê đất 8.000m2",100 triệu/tháng,8.000 m²,"Bình Tân, Hồ Chí Minh",cho-thue-kho-nha-xuong-dat
