Title,Price,Area,Location,type
"Cho thuê đất công nghiệp dài hạn và kho xưởng tại Long An, gần Sài Gòn",Giá thỏa thuận,10.000 m²,"Cần Đước, Long An",cho-thue-kho-nha-xuong-dat
Cho thuê đất làm nhà xưởng với giá ưu đãi tại KCN Long Hậu,Giá thỏa thuận,2.600 m²,"Cần Giuộc, Long An",cho-thue-kho-nha-xuong-dat
"Cho thuê kho xưởng KCX Tân Thuận quận 7 giá cực tốt, liên hệ 0913 105 ***",Giá thỏa thuận,1.000 m²,"Quận 7, Hồ Chí Minh",cho-thue-kho-nha-xuong-dat
"Cho thuê kho bãi xưởng giá rẻ 600m2, 1400m2, 2000m2, 3400m2 Thạnh Xuân Quận 12",70 triệu/tháng,1.400 m²,"Quận 12, Hồ Chí Minh",cho-thue-kho-nha-xuong-dat
Chính chủ có kho trống 100m và 140m tại ngõ 300 Nguyễn Xiển - Tân Triều cho thuê giá 65k 1 m2,"6,5 triệu/tháng",100 m²,"Thanh Xuân, Hà Nội",cho-thue-kho-nha-xuong-dat
55k 1 m2 chính chủ có kho trống 270m2 tại ngõ 300 Nguyễn Xiển cho thuê ngắn hạn chứa hàng tết,15 triệu/tháng,270 m²,"Thanh Xuân, Hà Nội",cho-thue-kho-nha-xuong-dat
Kho đẹp giá tốt. Cont 24/24. QL1A. Bảo vệ 24/24. PCCC thẩm duyệt,49 triệu/tháng,700 m²,"Thủ Đức, Hồ Chí Minh",cho-thue-kho-nha-xuong-dat
"Cho thuê mặt bằng kinh doanh (kho xưởng), mặt tiền Nguyễn Trường Tộ, P. Tân Biên, Biên Hòa",15 triệu/tháng,420 m²,"Biên Hòa, Đồng Nai",cho-thue-kho-nha-xuong-dat
Cho thuê mặt bằng đường Song Hành có sẵn chỗ ngủ.. Kinh doanh buôn bán sầm uất,17 triệu/tháng,700 m²,"Hóc Môn, Hồ Chí Minh",cho-thue-kho-nha-xuong-dat
"Cho thuê kho xưởng 300m2 - 500m2 - 600m2 - 1200m2 - 2300m2 - 5000m2 tại TP Vinh, Nghệ An",35 triệu/tháng,1.200 m²,"Vinh, Nghệ An",cho-thue-kho-nha-xuong-dat
"Chính chủ cho thuê 2 lô đất ngay mặt đường quốc lộ 3, khu vực dân cư đông đúc, hợp kinh doanh","1,5 triệu/tháng",600 m²,"Hòa An, Cao Bằng",cho-thue-kho-nha-xuong-dat
"Cho thuê kho 550m2 tại Tôn Thất Thuyết Q4, TPHCM",99 triệu/tháng,550 m²,"Quận 4, Hồ Chí Minh",cho-thue-kho-nha-xuong-dat
"Cho thuê lô góc Hoàng Kế Viêm và An Thượng 6, kinh doanh siêu hợp lý",55 triệu/tháng,"306,5 m²","Ngũ Hành Sơn, Đà Nẵng",cho-thue-kho-nha-xuong-dat
"Cho thuê xưởng 3000m2. Điện hạ trạm, PCCC thẩm duyệt, SX đa nghề, Hội Nghĩa, Tân Uyên, Bình Dương",140 triệu/tháng,3.000 m²,"Tân Uyên, Bình Dương",cho-thue-kho-nha-xuong-dat
"Kho, xưởng SX 9x20m y như hình, ngay Aeon Tân Phú",15 triệu/tháng,180 m²,"Tân Phú, Hồ Chí Minh",cho-thue-kho-nha-xuong-dat
"Cho thuê kho, xưởng SX 300m2 y như hình, đường xe công 40f Dương Thị Giang",27 triệu/tháng,300 m²,"Quận 12, Hồ Chí Minh",cho-thue-kho-nha-xuong-dat
"Cho thuê kho 1250m2-5000m2 khu cảng Trường Thọ, Tp Thủ Đức",70 nghìn/m²,1.250 m²,"Thủ Đức, Hồ Chí Minh",cho-thue-kho-nha-xuong-dat
"Cho thuê kho 1000m2 và 6000m2 Linh Trung, Tp Thủ Đức","116,91 nghìn/m²",6.000 m²,"Thủ Đức, Hồ Chí Minh",cho-thue-kho-nha-xuong-dat
"Cho thuê kho 1000m2 - 2000m2 KCN Cát Lái, Quận 2",130 nghìn/m²,1.000 m²,"Quận 2, Hồ Chí Minh",cho-thue-kho-nha-xuong-dat
Cho thuê kho tiêu chuẩn chuyển phát 8 cửa xuất nhập - PCCC Tự Động - thông XLHN và QL 1A,110 nghìn/m²,6.000 m²,"Thủ Đức, Hồ Chí Minh",cho-thue-kho-nha-xuong-dat
Cho thuê kho tiêu chuẩn chuyển phát 8 cửa xuất nhập - PCCC Tự Động - thông XLHN và QL 1A,110 nghìn/m²,6.000 m²,"Thủ Đức, Hồ Chí Minh",cho-thue-kho-nha-xuong-dat
"Kho xưởng ở Hải Bối, Đông Anh xe công vào tận đất từ 180m2 - 500 - 1000 - 2000 - 3000m2",Giá thỏa thuận,200 m²,"Đông Anh, Hà Nội",cho-thue-kho-nha-xuong-dat
"Chính chủ cho thuê xưởng tại Yên Nghĩa, DT 300m2 & 400m2 & 600m2. LH: 0988 646 ***",38 nghìn/m²,600 m²,"Hà Đông, Hà Nội",cho-thue-kho-nha-xuong-dat
Cho thuê kho giá rẻ 10x70. Giá 27tr tháng. Liên khu 45 Bình Hưng Hòa B Bình Tân,27 triệu/tháng,700 m²,"Bình Tân, Hồ Chí Minh",cho-thue-kho-nha-xuong-dat
Cho thuê kho chung - kho dịch vụ xuất nhập hàng,Giá thỏa thuận,1.000 m²,"Đông Anh, Hà Nội",cho-thue-kho-nha-xuong-dat
"Cho thuê nhà máy sản xuất, kho xưởng cao cấp tại KCN Đồng Văn, DT 5.000m2 đến 2ha, full tiện ích",50 nghìn/m²,5.000 m²,"Kim Bảng, Hà Nam",cho-thue-kho-nha-xuong-dat
"Giảm còn 25tr. Cho thuê Kho - Xưởng SX MT Nguyễn Duy Trinh, 300m2. Điện 3PHA. Kho rất đẹp",25 triệu/tháng,300 m²,"Quận 9, Hồ Chí Minh",cho-thue-kho-nha-xuong-dat
Cho thuê 650 m2 nhà khung thép tiền chế,25 triệu/tháng,650 m²,"Ân Thi, Hưng Yên",cho-thue-kho-nha-xuong-dat
"Cho thuê kho xưởng DT 1200m2, 2000m2, 2700m2, 3500m2 KCN Yên Phong, Bắc Ninh. LH 0979 929 ***",Giá thỏa thuận,2.000 m²,"Yên Phong, Bắc Ninh",cho-thue-kho-nha-xuong-dat
"Cho thuê nhà kho, xưởng, Long Biên, Hà Nội. PCCC tự động DT 3600m2",130 nghìn/m²,3.600 m²,"Long Biên, Hà Nội",cho-thue-kho-nha-xuong-dat
"Cho thuê kho xưởng DT 800m2 - 5000m2 KCN Tiên Sơn, Từ Sơn, Bắc Ninh",Giá thỏa thuận,800 m²,"Từ Sơn, Bắc Ninh",cho-thue-kho-nha-xuong-dat
"Cho thuê kho xưởng tại CCN Tân Quang, Văn Lâm, Hưng Yên. DT: 1500m2, 2500m2, 5000m2, 17.500m2",Giá thỏa thuận,5.000 m²,"Văn Lâm, Hưng Yên",cho-thue-kho-nha-xuong-dat
"Cho thuê nhanh kho xưởng 800m2 còn mới và kiên cố, đường Phạm Hữu Lầu, Phước Kiển giá 60tr/tháng TL",60 triệu/tháng,800 m²,"Nhà Bè, Hồ Chí Minh",cho-thue-kho-nha-xuong-dat
"Cho thuê/Chuyển nhượng 4000m2 (mặt tiền hơn 80m), TP Quảng Ngãi 0905 170 ***",Giá thỏa thuận,4.000 m²,"Quảng Ngãi, Quảng Ngãi",cho-thue-kho-nha-xuong-dat
"Cho thuê nhà xưởng Hóc môn 800m2, 1400m2, 2000m2",38 triệu/tháng,800 m²,"Hóc Môn, Hồ Chí Minh",cho-thue-kho-nha-xuong-dat
Kho xưởng 135m2 Tô Ngọc Vân tải 5 tấn,"9,5 triệu/tháng",1.352 m²,"Thủ Đức, Hồ Chí Minh",cho-thue-kho-nha-xuong-dat
"Cho thuê kho xưởng KCN Thái Hòa, DT: 2.000m2, giá: 65k/m2, Long An",130 triệu/tháng,2.000 m²,"Đức Hòa, Long An",cho-thue-kho-nha-xuong-dat
Cho thuê kho 8x20 hẻm 8m Lê Văn Quới 11tr/th,11 triệu/tháng,160 m²,"Bình Tân, Hồ Chí Minh",cho-thue-kho-nha-xuong-dat
Cho thuê đất trống rộng hơn 11.000m2 Hoà Khương - Hoà Vang - Đà Nẵng. Liên hệ My 0935 872 *** tư vấn,70 triệu/tháng,11.000 m²,"Hòa Vang, Đà Nẵng",cho-thue-kho-nha-xuong-dat
Cho thuê xưởng 10x20m Hương Lộ 2 giá 12 triệu/tháng,12 triệu/tháng,200 m²,"Bình Tân, Hồ Chí Minh",cho-thue-kho-nha-xuong-dat
"Cho thuê xưởng đường Mã Lò 200m2, giá 13tr/th TL",13 triệu/tháng,200 m²,"Bình Tân, Hồ Chí Minh",cho-thue-kho-nha-xuong-dat
Cho thuê xưởng 1500m2 giá chỉ 85tr tại Lái Thiêu - Bình Dương,85 triệu/tháng,1.500 m²,"Thuận An, Bình Dương",cho-thue-kho-nha-xuong-dat
Cho thuê kho xưởng MT Ao Đôi 200m2 giá 15tr/th,15 triệu/tháng,200 m²,"Bình Tân, Hồ Chí Minh",cho-thue-kho-nha-xuong-dat
"Cho thuê mặt bằng kho xưởng 900m2 mặt tiền Quốc Lộ 13, P. Hiệp Bình Chánh, Thủ Đức",90 triệu/tháng,900 m²,"Thủ Đức, Hồ Chí Minh",cho-thue-kho-nha-xuong-dat
Cho thuê hoặc hợp tác đầu tư đất depot - xây dựng kho xưởng dài hạn - đường xe container,15 nghìn/m²,38.000 m²,"Tân Uyên, Bình Dương",cho-thue-kho-nha-xuong-dat
"Cho thuê đất làm khu cắm trại - camping, tổ chức sự kiện, farm stay hoặc khu du lịch tổng hợp",Giá thỏa thuận,50.000 m²,"Sơn Tây, Hà Nội",cho-thue-kho-nha-xuong-dat
Cho thuê nhà xưởng Đức Hòa 5000m2 - 7000m - 10000m - 16000m2,200 triệu/tháng,5.200 m²,"Đức Hòa, Long An",cho-thue-kho-nha-xuong-dat
"Cho thuê, 250m2 kho Mỹ Đình ô tô đỗ cửa. Giá: 15tr",15 triệu/tháng,250 m²,"Nam Từ Liêm, Hà Nội",cho-thue-kho-nha-xuong-dat
Cho thuê nhà xưởng đường Tô Ngọc Vân P. Thạnh Xuân Quận 12 DT: 500m2 giá 25 triệu LH: 0944 977 ***,25 triệu/tháng,500 m²,"Quận 12, Hồ Chí Minh",cho-thue-kho-nha-xuong-dat
Cho thuê nhà xưởng DT: 400m2 giá 25 triệu/tháng đường Phan Văn Hớn quận 12. LH: 0944 977 ***,25 triệu/tháng,400 m²,"Quận 12, Hồ Chí Minh",cho-thue-kho-nha-xuong-dat
"Cho thuê kho xưởng 620m2 đường Tân Kỳ Tân Quý, P. Bình Hưng Hoà, Quận Bình Tân",90 nghìn/m²,620 m²,"Bình Tân, Hồ Chí Minh",cho-thue-kho-nha-xuong-dat
"Cho thuê kho xưởng 5000m2, 11.000m2 trong KCN Sóng Thần 1, có PCCC tự động",85 nghìn/m²,5.000 m²,"Dĩ An, Bình Dương",cho-thue-kho-nha-xuong-dat
Cho thuê đất MT Phạm Văn Chiêu 2000m2. Kinh doanh tự do. Hợp đồng dài hạn chỉ 110tr/th,110 triệu/tháng,2.000 m²,"Gò Vấp, Hồ Chí Minh",cho-thue-kho-nha-xuong-dat
"TTB. Cho thuê kho xưởng 800m2, 1200m2, 2500m2, 10.000m2, 20.000m2 trong khu công nghiệp Sóng Thần 1",80 nghìn/m²,800 m²,"Dĩ An, Bình Dương",cho-thue-kho-nha-xuong-dat
"Cho thuê kho xưởng 1250m2, 2000m2, 5000m2 đường Xa Lộ Hà Nội, P. Trường Thọ, TP Thủ Đức",70 nghìn/m²,1.250 m²,"Thủ Đức, Hồ Chí Minh",cho-thue-kho-nha-xuong-dat
"TTB. Cho thuê kho xưởng trong KCN Cát Lái, Quận 2; DT 600m2, 1200m2, 2000m2, 3000m2",103 nghìn/m²,600 m²,"Quận 2, Hồ Chí Minh",cho-thue-kho-nha-xuong-dat
Cho thuê mặt bằng 2MT Kinh doanh đường Hoàng Thị Loan,100 triệu/tháng,500 m²,"Liên Chiểu, Đà Nẵng",cho-thue-kho-nha-xuong-dat
Cho thuê lô góc 2 mặt tiền trục kinh doanh Nguyễn Phước Lan ngay cầu Hòa Xuân,45 triệu/tháng,200 m²,"Cẩm Lệ, Đà Nẵng",cho-thue-kho-nha-xuong-dat
"Chuyên cho thuê kho xưởng KCN Long Hậu, DT từ 200m2 - 15.000m2, LH: 0933 194 *** Mr. Thành",20 triệu/tháng,300 m²,"Cần Giuộc, Long An",cho-thue-kho-nha-xuong-dat
"Cho thuê kho nhà xưởng gần ngay KCN Hiệp Phước, TP HCM, giá ưu đãi. LH: 0933 194 ***",100 nghìn/m²,100 m²,"Nhà Bè, Hồ Chí Minh",cho-thue-kho-nha-xuong-dat
"Cho thuê kho xưởng lớn nhỏ Thạnh Lộc, Thạnh Xuân, Thới An, An Phú Đông. LH: 0909 298 ***",25 triệu/tháng,330 m²,"Quận 12, Hồ Chí Minh",cho-thue-kho-nha-xuong-dat
"Cho thuê nhà kho/xưởng đường Lạc Long Quân Phường 5, Quận 11 40 triệu/tháng 400m2",40 triệu/tháng,400 m²,"Quận 11, Hồ Chí Minh",cho-thue-kho-nha-xuong-dat
Cho thuê kho ngã 3 Âu Dương Lân - QL1A và VPLV đường Nguyễn Tất Thành (đảm bảo không bị ngập nước),Giá thỏa thuận,1.000 m²,"Hòa Vang, Đà Nẵng",cho-thue-kho-nha-xuong-dat
"Cho thuê 442,2m2 mặt tiền Nguyễn Du siêu đẹp, khu trung tâm",Giá thỏa thuận,"442,2 m²","Hải Châu, Đà Nẵng",cho-thue-kho-nha-xuong-dat
"Cho thuê kho 1250m2 - 2000m2 PCCC tự động thuộc KCN Cát Lái, Quận 2 (TP Thủ Đức)",Giá thỏa thuận,1.250 m²,"Quận 2, Hồ Chí Minh",cho-thue-kho-nha-xuong-dat
"Cho thuê kho xưởng 2300m2 KCN Bình Chiểu, Phường Bình Chiểu, TP Thủ Đức","133,96 nghìn/m²",2.300 m²,"Thủ Đức, Hồ Chí Minh",cho-thue-kho-nha-xuong-dat
"Cho thuê lô đất Đỗ Bá, gần biển, thuận tiện kinh doanh",8 triệu/tháng,70 m²,"Ngũ Hành Sơn, Đà Nẵng",cho-thue-kho-nha-xuong-dat
"Cho thuê nhà xưởng 2 lô liền kề 2 tầng 29/3, DT sàn 400m2",25 triệu/tháng,"200,5 m²","Cẩm Lệ, Đà Nẵng",cho-thue-kho-nha-xuong-dat
"Cho thuê 400, 600, 900 m2 kho xưởng tại khu công nghiệp Nguyên Khê, Đông Anh, Hà Nội",60 nghìn/m²,900 m²,"Đông Anh, Hà Nội",cho-thue-kho-nha-xuong-dat
Cho thuê kho và giữ xe tháng 4ch-30ch,20 triệu/tháng,500 m²,"Phú Nhuận, Hồ Chí Minh",cho-thue-kho-nha-xuong-dat
"Cho thuê kho xưởng tổng DT 2000m2, giá 139tr/th (60k/m2), PCCC đầy đủ, cont 40F vào thỏa mái",139 triệu/tháng,2.500 m²,"Bình Tân, Hồ Chí Minh",cho-thue-kho-nha-xuong-dat
"Cho thuê kho xưởng 550m2 - 41tr/th, đường Tải lớn vào ok, mái cao thoáng",41 triệu/tháng,550 m²,"Bình Tân, Hồ Chí Minh",cho-thue-kho-nha-xuong-dat
"Cho thuê kho xưởng DT kho 1000m2 - 85tr/th - đường Mã Lò, cont 40F vào, có PCCC",85 triệu/tháng,1.000 m²,"Bình Tân, Hồ Chí Minh",cho-thue-kho-nha-xuong-dat
"Cho thuê kho xưởng 550m2 - 45tr/th, đường cont 40f vào ok, mái cao thoáng",45 triệu/tháng,550 m²,"Bình Tân, Hồ Chí Minh",cho-thue-kho-nha-xuong-dat
"Cho thuê kho xưởng 950m2 - 65tr/th, đường Cont40f vào ok, mái cao thoáng",65 triệu/tháng,950 m²,"Bình Tân, Hồ Chí Minh",cho-thue-kho-nha-xuong-dat
Chính chủ cho thuê đất 170m2 có 2 mặt tiền gần chung cư Bcon,6 triệu/tháng,170 m²,"Dĩ An, Bình Dương",cho-thue-kho-nha-xuong-dat
Cho thuê kho xưởng 250m2 có 2 mặt tiền xa lộ Hà Nội,8 triệu/tháng,250 m²,"Thủ Đức, Hồ Chí Minh",cho-thue-kho-nha-xuong-dat
"Cc cho thuê 250m2 kho tôn mát cao 6m, vs, điện 3p, nước SĐ, khu Tân Triều giá 25tr/th LH 0903 244 ***",25 triệu/tháng,250 m²,"Thanh Trì, Hà Nội",cho-thue-kho-nha-xuong-dat
"Cho thuê kho xưởng (DT 800m2) mặt tiền đường 3/2, Phường 8, TP Vũng Tàu. Phù hợp kho xưởng",40 triệu/tháng,800 m²,"Vũng Tàu, Bà Rịa Vũng Tàu",cho-thue-kho-nha-xuong-dat
Cho thuê kho xưởng trung tâm TP Vũng Tàu (DT 2000m2). Có thẩm định nghiệm thu giá tốt,Giá thỏa thuận,2.000 m²,"Vũng Tàu, Bà Rịa Vũng Tàu",cho-thue-kho-nha-xuong-dat
Cho thuê kho xưởng (DT 1000400 010 ***m2) (Đường 36m). Vị trí trung chuyển giá 30 tr/ tháng,30 triệu/tháng,1.000 m²,"Bà Rịa, Bà Rịa Vũng Tàu",cho-thue-kho-nha-xuong-dat
Cho thuê mặt tiền kinh doanh 650m2 đường Mã Lò,75 triệu/tháng,650 m²,"Bình Tân, Hồ Chí Minh",cho-thue-kho-nha-xuong-dat
"Cho thuê kho 700m2 (mặt tiền 10.3m, hình chữ L) Nguyễn Thị Định",45 triệu/tháng,700 m²,"Quận 2, Hồ Chí Minh",cho-thue-kho-nha-xuong-dat
"Cho thuê hơn 700m2 đất(15x50m) mặt tiền đường khu Nguyễn Văn Hưởng, Thảo Điền Quận 2",75 triệu/tháng,700 m²,"Quận 2, Hồ Chí Minh",cho-thue-kho-nha-xuong-dat
"Cho thuê kho phố Trần Điền, điện 3fa, xe 10 tấn, kho đẹp: 110 m2 - 10 tr, 350 m2 - 15 tr. Chính chủ",15 triệu/tháng,350 m²,"Hoàng Mai, Hà Nội",cho-thue-kho-nha-xuong-dat
Cho thuê đất xây trường học tại KĐT lớn Vinhomes Quận 9,Giá thỏa thuận,17.688 m²,"Quận 9, Hồ Chí Minh",cho-thue-kho-nha-xuong-dat
"Cho thuê kho, văn phòng làm việc tại 146 Duy Tân, TP. Đà Nẵng. Giá siêu sale 70k - 80k/1m2/tháng",80 nghìn/m²,400 m²,"Hải Châu, Đà Nẵng",cho-thue-kho-nha-xuong-dat
"Kho xưởng, Tân Triều, Triều Khúc. 100, 200, 300... 2.000 m2, 65 K/m2/th, điện 3 fa, xe công đỗ cửa",65 nghìn/m²,130 m²,"Thanh Trì, Hà Nội",cho-thue-kho-nha-xuong-dat
"Cho thuê kho Tân Triều, Triều Khúc. Cuối ngõ 300 Nguyễn Xiển, 100m2 & 140m2, xe 5 tấn, 8 tr/th","7,5 triệu/tháng",140 m²,"Thanh Trì, Hà Nội",cho-thue-kho-nha-xuong-dat
"Cho thuê kho xưởng 1000m2, 2000m2, 5000m2, 10.000m2, 20.000m2 KCN Sóng Thần 1, PCCC giá 80.000đ/m2",80 nghìn/m²,1.000 m²,"Dĩ An, Bình Dương",cho-thue-kho-nha-xuong-dat
"Cho thuê kho xưởng 500m2, 900m2, 1000m2 Tăng Nhơn Phú, Phường Phước Long B, xe cont",75 triệu/tháng,1.000 m²,"Quận 9, Hồ Chí Minh",cho-thue-kho-nha-xuong-dat
Cho thuê nhà xưởng 800m2 tại phường Thạnh Xuân Quận 12,25 triệu/tháng,800 m²,"Quận 12, Hồ Chí Minh",cho-thue-kho-nha-xuong-dat
"Cho thuê kho xưởng 2500m2, 5000m2, 10000m2 KCN Hạnh Phúc, KCN Hải Sơn, KCN Tân Đức,Đức Hoà, Long An",60 nghìn/m²,2.500 m²,"Đức Hòa, Long An",cho-thue-kho-nha-xuong-dat
"Cho thuê kho bãi 18.000m2 (kho 1.600m2) Phan Đăng Lưu, Long Bình chỉ 120tr/th",120 triệu/tháng,18.000 m²,"Biên Hòa, Đồng Nai",cho-thue-kho-nha-xuong-dat
"Cho thuê kho DT 743, Dĩ An, Bình Dương DT 500m2; 1000m2; 1500m2; 2000m2; 3000m2; 5000m2",70 nghìn/m²,500 m²,"Dĩ An, Bình Dương",cho-thue-kho-nha-xuong-dat
"Cho thuê kho xưởng Tỉnh Lộ 43, P. Bình Chiểu, Thủ Đức DT 800m2, 1000m2, 2000m2, 3500m2, 5000m2",80 nghìn/m²,800 m²,"Thủ Đức, Hồ Chí Minh",cho-thue-kho-nha-xuong-dat
"Cho thuê kho xưởng 2000m2-6000m2 Quốc Lộ 1A, Phường Linh Trung, Thủ Đức, có PCCC tự động",115 nghìn/m²,6.000 m²,"Thủ Đức, Hồ Chí Minh",cho-thue-kho-nha-xuong-dat
"Cho thuê kho xưởng 280m2, 900m2 đường Tăng Nhơn Phú, Phước Long B, Quận 9",22 triệu/tháng,280 m²,"Quận 9, Hồ Chí Minh",cho-thue-kho-nha-xuong-dat
"Kho riêng (tự quản), xưởng, kho chung có QL tại TP HCM DT: 5m3, 50m2 đến 50,000m2 giá 60000đ/m2/th",60 nghìn/m²,3.000 m²,"Quận 7, Hồ Chí Minh",cho-thue-kho-nha-xuong-dat
"Cho thuê đất 2 mặt tiền Tỉnh Lộ 10, Bình Chánh, chỉ 33tr/tháng, DT 1100m2 nở hậu, vị trí trung tâm",33 triệu/tháng,1.100 m²,"Bình Chánh, Hồ Chí Minh",cho-thue-kho-nha-xuong-dat
"Xưởng mặt tiền Dĩ An gần QL1A, giáp Linh Xuân, Thủ Đức",600 triệu/tháng,5.600 m²,"Dĩ An, Bình Dương",cho-thue-kho-nha-xuong-dat
"750m2, Bình Tân, Có gác, nền eroxxy",35 triệu/tháng,750 m²,"Bình Tân, Hồ Chí Minh",cho-thue-kho-nha-xuong-dat
"Nhà xưởng tiêu chuẩn cho thuê Bắc Sơn, Trảng Bom. DT tổng: 2300m2",60 triệu/tháng,2.300 m²,"Trảng Bom, Đồng Nai",cho-thue-kho-nha-xuong-dat
"Cho thuê xưởng 1000m2, 45 triệu/th, đường Nguyễn Xiển, P. Long Thạnh Mỹ, Quận 9 cũ",45 triệu/tháng,1.000 m²,"Quận 9, Hồ Chí Minh",cho-thue-kho-nha-xuong-dat
"Cho thuê xưởng 1000m2, PCCC, điện Hạ Bình, 70 triệu/th đường Nguyễn Xiển, Thủ Đức",70 triệu/tháng,1.000 m²,"Quận 9, Hồ Chí Minh",cho-thue-kho-nha-xuong-dat
"Cho thuê xưởng mới 400, 500, 1000m2 đường Nguyễn Xiển, Thủ Đức",24 triệu/tháng,400 m²,"Quận 9, Hồ Chí Minh",cho-thue-kho-nha-xuong-dat
"Kho đường container đậu trước nhà: 1000m2 mặt đường Hồ Văn Long, khu nhiều kho xưởng cho thuê",65 triệu/tháng,1.000 m²,"Bình Tân, Hồ Chí Minh",cho-thue-kho-nha-xuong-dat
"Cho thuê mặt bằng mặt tiền 4000m2 - Số 306C Bà Triệu, KD xe ô tô điện (có sẵn kho + VP + showroom)",250 triệu/tháng,4.000 m²,"Thanh Hóa, Thanh Hóa",cho-thue-kho-nha-xuong-dat
Cho thuê Cụm Kho Xưởng 1550 m2 ngay Trung tâm TP. BMT đường Container ra vào - sân bãi rộng rãi,50 nghìn/m²,1.550 m²,"Buôn Ma Thuột, Đắk Lắk",cho-thue-kho-nha-xuong-dat
"Cho thuê gấp kho kho 100m2 - 200m2 - 300m2 - 500m2 - 1000m2 gần ngã 3 Ngọc Hồi, QL1A",Giá thỏa thuận,300 m²,"Thanh Trì, Hà Nội",cho-thue-kho-nha-xuong-dat
Cho thuê lô đất từ 320m2-1000m2 khu Thảo Điền - Giá từ 40 triệu - Hợp đồng 8-10 năm,40 triệu/tháng,320 m²,"Quận 2, Hồ Chí Minh",cho-thue-kho-nha-xuong-dat
Cho thuê Kho trong KCN Tân Thuận theo các diện tích khác nhau,130 triệu/tháng,690 m²,"Quận 7, Hồ Chí Minh",cho-thue-kho-nha-xuong-dat
"Kho cho thuê 10x30m đường công 20 feet 15 tr, đường Bình Thành Bình Hưng Hòa B Bình Tân",15 triệu/tháng,300 m²,"Bình Tân, Hồ Chí Minh",cho-thue-kho-nha-xuong-dat
"Cho thuê mặt bằng (kho - xưởng) 10x20m, góc 2 MT, Bình Lợi, Quận BT",28 triệu/tháng,200 m²,"Bình Thạnh, Hồ Chí Minh",cho-thue-kho-nha-xuong-dat
Cho thuê kho Đặng Thùy Trâm; 200m2 giá thuê 17tr - hẻm xe tải tránh nhau,17 triệu/tháng,200 m²,"Bình Thạnh, Hồ Chí Minh",cho-thue-kho-nha-xuong-dat
"Nhà kho 220 m2, 10x22m mặt tiền đường 12m Bình Lợi - Bình Thạnh",20 triệu/tháng,220 m²,"Bình Thạnh, Hồ Chí Minh",cho-thue-kho-nha-xuong-dat
Kho cho thuê 5x20m 6 tr Điện 3 pha hẻm 6 m thông Đường số 1 Bình Hưng Hòa B Bình Tân,6 triệu/tháng,100 m²,"Bình Tân, Hồ Chí Minh",cho-thue-kho-nha-xuong-dat
"Cho thuê kho, xưởng trong và ngoài KCX Tân Thuận q7 DT: 50m2...1000m2, 1400m2, 15000m2 giá: 50N/m2",50 nghìn/m²,50 m²,"Quận 7, Hồ Chí Minh",cho-thue-kho-nha-xuong-dat
"Cho thuê kho 620m2, đường tải vào tới kho, kho mới đẹp",59 triệu/tháng,620 m²,"Tân Phú, Hồ Chí Minh",cho-thue-kho-nha-xuong-dat
"Cho thuê kho xưởng 450m2 đường Hương Lộ 2, Q. Bình Tân giá 35tr/tháng, xin LH: 0329 241 ***",35 triệu/tháng,450 m²,"Bình Tân, Hồ Chí Minh",cho-thue-kho-nha-xuong-dat
"Cho thuê kho độc lập, xưởng Q8 DT: 50m2, 100m2, 500m2, 1000m2, 10,000m2, 20,000m2. LH: 0902 593 ***",50 nghìn/m²,5.000 m²,"Quận 8, Hồ Chí Minh",cho-thue-kho-nha-xuong-dat
"Kho xưởng mới xây nhiều diện tích Q4 từ m3, palet, 5m2, 50m2 đến 20,000m2 giá từ 60 - 80.000đ/m2/th",80 nghìn/m²,4.000 m²,"Quận 4, Hồ Chí Minh",cho-thue-kho-nha-xuong-dat
"Kho riêng (tự quản), xưởng, kho chung có QL tại TP HCM DT: 5m3, 50m2 đến 50,000m2 giá 60000đ/m2/th",60 nghìn/m²,3.000 m²,"Quận 7, Hồ Chí Minh",cho-thue-kho-nha-xuong-dat
"Cho thuê xưởng 2000m2 - 8900m2 KCN Nhơn Trạch 1, Đồng Nai",Giá thỏa thuận,8.900 m²,"Nhơn Trạch, Đồng Nai",cho-thue-kho-nha-xuong-dat
"Cho thuê xưởng 2700m2 - 7000m2 KCN Mỹ Xuân B1, Tân Thành, Phú Mỹ, BRVT",72 nghìn/m²,2.700 m²,"Phú Mỹ, Bà Rịa Vũng Tàu",cho-thue-kho-nha-xuong-dat
Cho thuê kho xưởng tại CCN Ngọc Hồi - Thanh Trì - Hà Nội,Giá thỏa thuận,10.700 m²,"Thanh Trì, Hà Nội",cho-thue-kho-nha-xuong-dat
"Cho thuê kho xưởng 200m2, 500m2, 1000m2, 3000m2, 4000m2 tại khu vực An Khánh, Hoài Đức, Hà Nội",70 nghìn/m²,1.000 m²,"Hoài Đức, Hà Nội",cho-thue-kho-nha-xuong-dat
"Cho thuê kho xưởng 200m2, 500m2, 1000m2, 3000m2, 5000m2 tại khu vực Nhổn, Bắc Từ Liêm, HN",65 nghìn/m²,5.000 m²,"Bắc Từ Liêm, Hà Nội",cho-thue-kho-nha-xuong-dat
"Cho thuê 1000m2 - 10ha đất + kho xưởng An Phú - Quận 2. (Hd 10 năm, có gpxd)",40 nghìn/m²,10.000 m²,"Quận 2, Hồ Chí Minh",cho-thue-kho-nha-xuong-dat
"Cho thuê kho xưởng tại cụm CN Ngọc Hồi. Diện tích 2000m2, 1000m2, 650m2, hạ tầng cơ sở thuận tiện.",Giá thỏa thuận,1.000 m²,"Thanh Trì, Hà Nội",cho-thue-kho-nha-xuong-dat
"Cho thuê kho 1700m2. Vị trí: Gần cảng Đình Vũ giao thông thuận tiện, công vào tận cửa",58 nghìn/m²,1.700 m²,"Hải An, Hải Phòng",cho-thue-kho-nha-xuong-dat
"Kho cho thuê 4x25m, tiện cho may 4tr500 đường Võ Văn Vân, Vĩnh Lộc B, Bình Chánh","4,5 triệu/tháng",100 m²,"Bình Chánh, Hồ Chí Minh",cho-thue-kho-nha-xuong-dat
Cho thuê nhà kho 1600m2 - có cẩu trục và sân bãi. Giá tốt LH 0943 425 *** hot hot,50 triệu/tháng,850 m²,"Sơn Trà, Đà Nẵng",cho-thue-kho-nha-xuong-dat
"Cho thuê xưởng MT An Phú Đông 25, DT 1200m2, 80 triệu/tháng",80 triệu/tháng,1.200 m²,"Quận 12, Hồ Chí Minh",cho-thue-kho-nha-xuong-dat
"Chủ cho thuê hơn 1,2ha đất rẫy Xuân Thọ, Đà Lạt",6 triệu/tháng,12.268 m²,"Đà Lạt, Lâm Đồng",cho-thue-kho-nha-xuong-dat
"Cho thuê kho Bình Lợi - Bình Thạnh, DT 10x20m (200m2) giá 25tr/th TL",25 triệu/tháng,200 m²,"Bình Thạnh, Hồ Chí Minh",cho-thue-kho-nha-xuong-dat
"Cho thuê kho 300m2, 500m2 và 1000m2 tại La Khê, Tố Hữu, Hà Đông, kho vào được luôn",65 nghìn/m²,1.000 m²,"Hà Đông, Hà Nội",cho-thue-kho-nha-xuong-dat
"Cho thuê 700m2 kho xưởng đường Hoàng Hữu Nam, phường Long Bình, Quận 9",45 triệu/tháng,700 m²,"Quận 9, Hồ Chí Minh",cho-thue-kho-nha-xuong-dat
"Cho thuê nhà 4pn, kết hợp với kho và VP công ty (tổng dt 500m2) - Võ Văn Hát, p. Long Trường, Q9",25 triệu/tháng,500 m²,"Quận 9, Hồ Chí Minh",cho-thue-kho-nha-xuong-dat
"Cho thuê: 3 nhà xưởng cực rẻ (160m2 - 200m2 - 300m2), đường Số 8,10,14",12 triệu/tháng,160 m²,"Bình Tân, Hồ Chí Minh",cho-thue-kho-nha-xuong-dat
"Cho thuê kho 550m2 và 1000m2 tại KĐT Đặng Xá, Gia Lâm, HN. Có hệ thống PCCC",Giá thỏa thuận,1.000 m²,"Gia Lâm, Hà Nội",cho-thue-kho-nha-xuong-dat
"Cho thuê kho xưởng 1000m2, 1700m2, 2800m2 KCN Cát Lái, Quận 2, có PCCC",105 nghìn/m²,1.000 m²,"Quận 2, Hồ Chí Minh",cho-thue-kho-nha-xuong-dat
"Cho thuê kho xưởng 500m2, 1000m2, 1800m2, 2000m2, 3000m2 Quốc Lộ 1K, cầu vượt Linh Xuân, xe cont",55 nghìn/m²,1.000 m²,"Thủ Đức, Hồ Chí Minh",cho-thue-kho-nha-xuong-dat
Cho thuê xưởng 360m2 tại ngay ngã tư mặt đường Phố Đông và trục đường đôi 40m. Giá 50k/m2,50 nghìn/m²,360 m²,"Hoài Đức, Hà Nội",cho-thue-kho-nha-xuong-dat
"Cho thuê kho xưởng diện tích khuôn viên 19105m2 QL91 tại Thốt Nốt, Cần Thơ mặt tiền giáp sông Hậu",399 triệu/tháng,14.139 m²,"Thốt Nốt, Cần Thơ",cho-thue-kho-nha-xuong-dat
"Cho thuê kho xưởng 500m2, 800m2, 1800m2 QL 1A, Linh Trung, Thủ Đức",55 nghìn/m²,500 m²,"Thủ Đức, Hồ Chí Minh",cho-thue-kho-nha-xuong-dat
"Cho thuê kho xưởng 2000m2, 2500m2, 3500m2, 5000m2 KCN Hải Sơn, KCN Hạnh Phúc, Đức Hoà, Long An",60 nghìn/m²,2.000 m²,"Đức Hòa, Long An",cho-thue-kho-nha-xuong-dat
