Title,Price,Area,Location,type
Cho thuê đất đất rộng lớn mặt tiền Phan Đình Giót - 300m2,80 triệu/tháng,300 m²,"Tân Bình, Hồ Chí Minh",cho-thue-kho-nha-xuong-dat
Cho thuê kho xưởng MT Nguyễn Văn Luông; Phường 6; Quận 6,15 triệu/tháng,100 m²,"Quận 6, Hồ Chí Minh",cho-thue-kho-nha-xuong-dat
Kho xưởng mới cho thuê ở Hương lộ 2 Phường Bình Trị Đông A Quận Bình Tân DT 450 m2,35 triệu/tháng,450 m²,"Bình Tân, Hồ Chí Minh",cho-thue-kho-nha-xuong-dat
Kho xưởng mặt tiền đường Bình Long quận Tân Phú - 195 m2 - 31 triệu/tháng,31 triệu/tháng,195 m²,"Tân Phú, Hồ Chí Minh",cho-thue-kho-nha-xuong-dat
"Cho thuê đất trống đường Phan Anh, Tân Phú có DT 450m2",40 triệu/tháng,450 m²,"Tân Phú, Hồ Chí Minh",cho-thue-kho-nha-xuong-dat
"Cho thuê kho xưởng 700m2 mặt tiền đường Quang Trung Phường 14, Gò Vấp, Hồ Chí Minh",50 triệu/tháng,700 m²,"Gò Vấp, Hồ Chí Minh",cho-thue-kho-nha-xuong-dat
"Cho thuê kho mặt tiền QL1A - Tiền Lân 13, Bà Điểm - có sẵn VP - diện tích 1100m2",120 triệu/tháng,1.100 m²,"Hóc Môn, Hồ Chí Minh",cho-thue-kho-nha-xuong-dat
"Cho thuê kho trong KCN Tân Bình, DT 2000m2",80 nghìn/m²,2.000 m²,"Tân Bình, Hồ Chí Minh",cho-thue-kho-nha-xuong-dat
"Kho xưởng rộng 2.700m2, tiện ích đầy đủ tại đường Bà Thiên, xã Nhuận Đức, huyện Củ Chi - cho thuê",40 triệu/tháng,2.700 m²,"Củ Chi, Hồ Chí Minh",cho-thue-kho-nha-xuong-dat
"Cho thuê kho xưởng 1.500m2 - Đường Quốc Lộ 1A Xã Bình Chánh, Bình Chánh, Hồ Chí Minh",45 triệu/tháng,1.500 m²,"Bình Chánh, Hồ Chí Minh",cho-thue-kho-nha-xuong-dat
"Cho thuê kho xưởng kiên cố 500m2 đường Quốc Lộ 1A thị trấn Tân Túc, Bình Chánh",40 triệu/tháng,500 m²,"Bình Chánh, Hồ Chí Minh",cho-thue-kho-nha-xuong-dat
"Cho thuê kho, gần đường Trường Chinh, Quận 12 - DT 400m2",36 triệu/tháng,400 m²,"Quận 12, Hồ Chí Minh",cho-thue-kho-nha-xuong-dat
"Kho xưởng cho thuê gần 600m2 ngay Quốc Lộ 22, Xã Trung Chánh, H. Hóc Môn",50 triệu/tháng,600 m²,"Hóc Môn, Hồ Chí Minh",cho-thue-kho-nha-xuong-dat
"Cho thuê kho xưởng mặt tiền Quốc lộ 1A đoạn Vĩnh Phương, Nha Trang",90 triệu/tháng,2.400 m²,"Nha Trang, Khánh Hòa",cho-thue-kho-nha-xuong-dat
"Cho thuê kho xưởng tiêu chuẩn tại Cụm công nghiệp Diên Phú, Khánh Hoà",60 nghìn/m²,2.000 m²,"Diên Khánh, Khánh Hòa",cho-thue-kho-nha-xuong-dat
"Cho thuê đất, cơ sở kinh doanh 6500 m2 mặt tiền Quốc Lộ 1A thuộc Diên Phú, Diên Khánh, Khánh Hoà",220 triệu/tháng,6.500 m²,"Diên Khánh, Khánh Hòa",cho-thue-kho-nha-xuong-dat
Xưởng cho thuê khu Nhị Bình 8 Hóc Môn 800m2,40 triệu/tháng,800 m²,"Hóc Môn, Hồ Chí Minh",cho-thue-kho-nha-xuong-dat
"Cho thuê xưởng - tiện nghi đầy đủ, đường xe container 24/24 - dt 600m2",30 triệu/tháng,600 m²,"Hóc Môn, Hồ Chí Minh",cho-thue-kho-nha-xuong-dat
"Kho xưởng mới cho thuê ở Quốc lộ 1A, Phường Linh Trung, Quận Thủ Đức DT 3.400m2",323 triệu/tháng,3.400 m²,"Thủ Đức, Hồ Chí Minh",cho-thue-kho-nha-xuong-dat
"Kho đất mặt tiền đường Nguyễn Hữu Trí, Bình Chánh - đường xe container - có DT 1150m2",65 triệu/tháng,1.150 m²,"Bình Chánh, Hồ Chí Minh",cho-thue-kho-nha-xuong-dat
Nằm ngay mặt tiền đường Phạm Văn Đồng Cho Thuê Đất 3.000m2 Tại Kha Vạn Cân,300 triệu/tháng,3.000 m²,"Thủ Đức, Hồ Chí Minh",cho-thue-kho-nha-xuong-dat
"Cho thuê kho góc 2 mặt tiền Phước Long B, TP Thủ Đức DT 600m2",40 triệu/tháng,600 m²,"Quận 9, Hồ Chí Minh",cho-thue-kho-nha-xuong-dat
"Cho thuê xưởng mới có DT 350m2, điện 3 pha - ở Hồ Văn Long, Bình Tân",35 triệu/tháng,350 m²,"Bình Tân, Hồ Chí Minh",cho-thue-kho-nha-xuong-dat
"Cho thuê kho xưởng MT Phạm Hữu Lầu, xã Phú Xuân, huyện Nhà Bè",60 triệu/tháng,850 m²,"Nhà Bè, Hồ Chí Minh",cho-thue-kho-nha-xuong-dat
"Cho thuê đất trống 2 mặt tiền DT 3800m2, Nguyễn Trọng Quyền",250 triệu/tháng,3.800 m²,"Tân Phú, Hồ Chí Minh",cho-thue-kho-nha-xuong-dat
"Cho thuê kiot ngay Topmarket BigC Tân Phú giá siêu rẻ chỉ đúng 2,5 triệu/tháng, gọi 0945 040 ***","2,5 triệu/tháng","10,8 m²","Tân Phú, Hồ Chí Minh",cho-thue-kho-nha-xuong-dat
"Cho thuê kho xưởng 500m2 Quốc Lộ 1A, Quận 12 - giá 50 triệu/tháng",50 triệu/tháng,500 m²,"Quận 12, Hồ Chí Minh",cho-thue-kho-nha-xuong-dat
"Với diện tích đất lớn 1,300m2 tại đường Huỳnh Tấn Phát, thị trấn Nhà Bè - cho thuê",85 triệu/tháng,1.300 m²,"Nhà Bè, Hồ Chí Minh",cho-thue-kho-nha-xuong-dat
Gần cầu Bà Chi cho thuê kho xưởng 2500m2 đường Vĩnh Lộc giá thuê: 90 triệu/tháng (,90 triệu/tháng,2.500 m²,"Bình Chánh, Hồ Chí Minh",cho-thue-kho-nha-xuong-dat
"Cho thuê kho xưởng đường Trần Văn Giàu, Phạm Văn Hai, Bình Chánh - DT 500m2",30 triệu/tháng,500 m²,"Bình Chánh, Hồ Chí Minh",cho-thue-kho-nha-xuong-dat
"Cho thuê xưởng 15.000m2 ở Tân Phú Trung, Củ Chi - giá 160 tr",160 triệu/tháng,15.000 m²,"Củ Chi, Hồ Chí Minh",cho-thue-kho-nha-xuong-dat
"Cho thuê kho xưởng 400m2, 1200m2 tại ngã tư Túy Loan, Hòa Nhơn, Đà Nẵng giá 50k/m2/th có VAT",45 nghìn/m²,800 m²,"Hòa Vang, Đà Nẵng",cho-thue-kho-nha-xuong-dat
"Cho thuê kho Đường Quốc Lộ 13, Phường 26, Bình Thạnh với DT 239m2",50 triệu/tháng,239 m²,"Bình Thạnh, Hồ Chí Minh",cho-thue-kho-nha-xuong-dat
Cho thuê lô đất rộng lớn Quận Gò Vấp DT 2300m2,150 triệu/tháng,2.300 m²,"Gò Vấp, Hồ Chí Minh",cho-thue-kho-nha-xuong-dat
"Cho thuê kho xưởng gỗ 1000m2 đường Hà Huy Giáp, Phường Thạnh Xuân, Quận 12",38 triệu/tháng,1.000 m²,"Quận 12, Hồ Chí Minh",cho-thue-kho-nha-xuong-dat
"Cho thuê kho mặt tiền Lê Thánh Tôn, Quận 1 có DT 719m2",110 triệu/tháng,719 m²,"Quận 1, Hồ Chí Minh",cho-thue-kho-nha-xuong-dat
"Cho thuê mặt bằng làm nhà xưởng, cửa hàng mặt tiền QL1A, Quận 12 - DT 350m2",32 triệu/tháng,350 m²,"Quận 12, Hồ Chí Minh",cho-thue-kho-nha-xuong-dat
"Cho thuê xưởng mặt tiền đường 181, gần xã Bình Mỹ, huyện Củ Chi có DT 700m2",25 triệu/tháng,700 m²,"Củ Chi, Hồ Chí Minh",cho-thue-kho-nha-xuong-dat
Cho thuê kho trung tâm thành phố đủ diện tích,85 nghìn/m²,1.800 m²,"Hải Châu, Đà Nẵng",cho-thue-kho-nha-xuong-dat
"TP Thủ Đức - Cho thuê kho mặt tiền 600m2 ở Đường Liên Phường, Phước Long B",40 triệu/tháng,600 m²,"Quận 9, Hồ Chí Minh",cho-thue-kho-nha-xuong-dat
Kho xưởng mới cho thuê ở Trần Văn Giàu Xã Phạm Văn Hai Huyện Bình Chánh DT 500m2,30 triệu/tháng,500 m²,"Bình Chánh, Hồ Chí Minh",cho-thue-kho-nha-xuong-dat
"Đường Tây Lân, Bình Tân. Cho thuê kho 700m2",45 triệu/tháng,700 m²,"Bình Tân, Hồ Chí Minh",cho-thue-kho-nha-xuong-dat
"Cho thuê nhà xưởng tại Đông Thạnh, Hóc Môn có DT 4.000m2 - 50tr/tháng",50 triệu/tháng,4.000 m²,"Hóc Môn, Hồ Chí Minh",cho-thue-kho-nha-xuong-dat
"Cho thuê nhà xưởng 4.000m2 tại Đường Đông Thạnh 5, Đông Thạnh, Hóc Môn",50 triệu/tháng,4.000 m²,"Hóc Môn, Hồ Chí Minh",cho-thue-kho-nha-xuong-dat
"Cho thuê kho 300m2 tại đường 40, Phường Thảo Điền Quận 2 - Giá hấp dẫn chỉ có 30 triệu/tháng",30 triệu/tháng,300 m²,"Quận 2, Hồ Chí Minh",cho-thue-kho-nha-xuong-dat
Kho xưởng mới cho thuê ở Trương Thị Hoa Phường Tân Thới Hiệp Quận 12 DT 350m2,25 triệu/tháng,350 m²,"Quận 12, Hồ Chí Minh",cho-thue-kho-nha-xuong-dat
Cho thuê nhà xưởng Thạnh Xuân Q12 35tr/tháng - DT 800m2,35 triệu/tháng,800 m²,"Quận 12, Hồ Chí Minh",cho-thue-kho-nha-xuong-dat
"Kho xưởng mới cho thuê ở Đặng Công Bỉnh, Xã Xuân Thới Thượng, Huyện Hóc Môn DT 900m2",40 triệu/tháng,900 m²,"Hóc Môn, Hồ Chí Minh",cho-thue-kho-nha-xuong-dat
"Kho xưởng mới cho thuê ở đường 1, Phường Tân Tạo A, Quận Bình Tân DT 350m2",25 triệu/tháng,350 m²,"Bình Tân, Hồ Chí Minh",cho-thue-kho-nha-xuong-dat
"Cho thuê xưởng 600m2 - Đường Tân Hiệp 8, Xã Tân Hiệp, Hóc Môn, đường xe container 24/24",30 triệu/tháng,600 m²,"Hóc Môn, Hồ Chí Minh",cho-thue-kho-nha-xuong-dat
Đất vị trí hiếm cho thuê ở Cây Gõ Xã An Phú Huyện Củ Chi DT 22.000m2,80 triệu/tháng,22.000 m²,"Củ Chi, Hồ Chí Minh",cho-thue-kho-nha-xuong-dat
"Cho thuê kho, bãi ở Tân Túc, Bình Chánh có DT 1.000m2",30 triệu/tháng,1.000 m²,"Bình Chánh, Hồ Chí Minh",cho-thue-kho-nha-xuong-dat
Kho xưởng mới cho thuê ở Quốc lộ 1A Phường An Phú Đông Quận 12. DT 1.500m2,65 triệu/tháng,1.500 m²,"Quận 12, Hồ Chí Minh",cho-thue-kho-nha-xuong-dat
