Title,Price,Area,Location,type
"Phòng trọ mới cho thuê ở Tân Quý, Phường Tân Quý, Quận Tân Phú, DT 25m2","4,5 triệu/tháng",25 m²,"Tân Phú, Hồ Chí Minh",cho-thue-nha-tro-phong-tro
"Phòng trọ mới cho thuê ở Cách Mạng Tháng Tám, Phường 12, Quận 3, DT 35m2",7 triệu/tháng,35 m²,"Quận 3, Hồ Chí Minh",cho-thue-nha-tro-phong-tro
Phòng trọ mới cho thuê ở An Dương Vương Phường 10 Quận 6 DT 20m2,"4,3 triệu/tháng",20 m²,"Quận 6, Hồ Chí Minh",cho-thue-nha-tro-phong-tro
Phòng trọ mới cho thuê ở 86 Phường 10 Quận 6 DT 25m2,"4,5 triệu/tháng",25 m²,"Quận 6, Hồ Chí Minh",cho-thue-nha-tro-phong-tro
"Phòng trọ mới cho thuê ở Nguyễn Đình Chiểu, Phường 04, Quận 3, DT 18m2",4 triệu/tháng,18 m²,"Quận 3, Hồ Chí Minh",cho-thue-nha-tro-phong-tro
"Căn hộ mini full nội thất, đầy đủ tiện nghi/khu sân bay",7 triệu/tháng,30 m²,"Tân Bình, Hồ Chí Minh",cho-thue-nha-tro-phong-tro
"Cho thuê phòng ban công riêng, ngay Hoàng Sa",7 triệu/tháng,36 m²,"Tân Bình, Hồ Chí Minh",cho-thue-nha-tro-phong-tro
"Phòng dạng studio full nội thất, ngay khu sân bay",5 triệu/tháng,25 m²,"Tân Bình, Hồ Chí Minh",cho-thue-nha-tro-phong-tro
Trống sẵn 1 phòng ngay khu sân bay,"5,5 triệu/tháng",28 m²,"Tân Bình, Hồ Chí Minh",cho-thue-nha-tro-phong-tro
"Phòng mini full nội thất đầy đủ tiện nghi, khu sân bay, giáp Phú Nhuận","6,5 triệu/tháng",30 m²,"Tân Bình, Hồ Chí Minh",cho-thue-nha-tro-phong-tro
"Studio bancol, đầy đủ tiện nghi, ngay Lê Văn Sỹ",8 triệu/tháng,40 m²,"Phú Nhuận, Hồ Chí Minh",cho-thue-nha-tro-phong-tro
"Căn hộ dịch vụ cao cấp 1PN/2PN, dọn phòng hàng tuần, CV Gia Định",12 triệu/tháng,65 m²,"Tân Bình, Hồ Chí Minh",cho-thue-nha-tro-phong-tro
"Phòng trọ full nội thất, khu sân bay, giáp Phú Nhuận","5,5 triệu/tháng",30 m²,"Tân Bình, Hồ Chí Minh",cho-thue-nha-tro-phong-tro
"Phòng full nội thất đầy đủ tiện nghi, khu sân bay","5,8 triệu/tháng",30 m²,"Tân Bình, Hồ Chí Minh",cho-thue-nha-tro-phong-tro
Cho thuê phòng đối diện VinCom Cộng Hòa,9 triệu/tháng,40 m²,"Tân Bình, Hồ Chí Minh",cho-thue-nha-tro-phong-tro
Studio cửa sổ lớn - full nội thất ngay Nguyễn Duy Trinh - gần Homyland - Lakeview - Nguyễn Thị Định,"5,7 triệu/tháng",30 m²,"Quận 2, Hồ Chí Minh",cho-thue-nha-tro-phong-tro
Cho thuê phòng ban công gần cầu Thị Nghè - sát đường Nguyễn Hữu Cảnh full nội thất,7 triệu/tháng,30 m²,"Bình Thạnh, Hồ Chí Minh",cho-thue-nha-tro-phong-tro
"Phòng trọ mới cho thuê ở Lê Lợi, Phường Bến Thành, Quận 1 DT 25m2",5 triệu/tháng,25 m²,"Quận 1, Hồ Chí Minh",cho-thue-nha-tro-phong-tro
"Phòng trọ mới cho thuê ở Nguyễn Đình Chính, Phường 15, Quận Phú Nhuận DT 45m2",6 triệu/tháng,45 m²,"Phú Nhuận, Hồ Chí Minh",cho-thue-nha-tro-phong-tro
"Phòng trọ mới cho thuê ở Tân Quý, phường Tân Quý, quận Tân Phú, DT 20m2","5,2 triệu/tháng",20 m²,"Tân Phú, Hồ Chí Minh",cho-thue-nha-tro-phong-tro
"Khai trương dự án căn hộ dịch vụ hot nhất Tân Bình, giáp Quận 10, 3","6,5 triệu/tháng",35 m²,"Tân Bình, Hồ Chí Minh",cho-thue-nha-tro-phong-tro
Trống sẵn 1 phòng ngay khu sân bay,5 triệu/tháng,25 m²,"Tân Bình, Hồ Chí Minh",cho-thue-nha-tro-phong-tro
"Căn hộ mini full nội thất, ngay Etown Cộng Hòa",6 triệu/tháng,25 m²,"Tân Bình, Hồ Chí Minh",cho-thue-nha-tro-phong-tro
"Cho thuê phòng 1PN, bếp riêng, bancol, ngay Hoàng Hoa Thám",8 triệu/tháng,45 m²,"Tân Bình, Hồ Chí Minh",cho-thue-nha-tro-phong-tro
Trống sẵn 1 phòng duplex ngay CV Hoàng Văn Thụ,"8,5 triệu/tháng",40 m²,"Tân Bình, Hồ Chí Minh",cho-thue-nha-tro-phong-tro
Phòng trong chung cư mini 1PN/bancol view CV Gia Định,9 triệu/tháng,45 m²,"Tân Bình, Hồ Chí Minh",cho-thue-nha-tro-phong-tro
Phòng studio full NT cửa sổ ban công thoáng mát,7 triệu/tháng,30 m²,"Bình Thạnh, Hồ Chí Minh",cho-thue-nha-tro-phong-tro
"Phòng studio full NT cửa sổ ban công ngay ĐH: GTVT, Hutech","6,5 triệu/tháng",30 m²,"Bình Thạnh, Hồ Chí Minh",cho-thue-nha-tro-phong-tro
"Chính chủ cho thuê phòng Quận 7 full nội thất, mặt tiền đường, phòng mới 100%, giá 4,5tr/th","4,3 triệu/tháng",30 m²,"Quận 7, Hồ Chí Minh",cho-thue-nha-tro-phong-tro
"Cho thuê studio ngay khu K300 gần Lotte Cộng Hoà, quận Tân Bình",8 triệu/tháng,35 m²,"Tân Bình, Hồ Chí Minh",cho-thue-nha-tro-phong-tro
Cho thuê duplex ở nhiều người ngay Lê Văn Sỹ - VX Lăng Cha Cả quận Tân Bình,5 triệu/tháng,35 m²,"Tân Bình, Hồ Chí Minh",cho-thue-nha-tro-phong-tro
"Cho thuê phòng Bình Thạnh. 1PN, 1WC ban công thoáng. Phan Bội Châu, chợ Bà Chiểu","4,5 triệu/tháng",30 m²,"Bình Thạnh, Hồ Chí Minh",cho-thue-nha-tro-phong-tro
"Phòng mới xây tại Bình Thạnh, gần cầu Bình Lợi, diện tích 40m2","7,5 triệu/tháng",40 m²,"Bình Thạnh, Hồ Chí Minh",cho-thue-nha-tro-phong-tro
"Cho thuê phòng tại Bình Thạnh sát Q3 full NT, DT 40m2","7,3 triệu/tháng",40 m²,"Bình Thạnh, Hồ Chí Minh",cho-thue-nha-tro-phong-tro
Cho thuê phòng có nội thất cửa sổ lớn ngay Nguyễn Khoái Quận 4,"6,5 triệu/tháng",40 m²,"Quận 4, Hồ Chí Minh",cho-thue-nha-tro-phong-tro
Phòng trọ có gác bảo vệ gần ĐH Nguyễn Tất Thành CĐ Điện Lực Thạnh Xuân Quận 12,3 triệu/tháng,20 m²,"Quận 12, Hồ Chí Minh",cho-thue-nha-tro-phong-tro
CCMN tại Thanh Xuân - Nguyễn Trãi - 1 ngủ 1 khách 50m2 - vào ở luôn - full đồ,"5,65 triệu/tháng",50 m²,"Thanh Xuân, Hà Nội",cho-thue-nha-tro-phong-tro
Phòng trọ bancol thoáng full nội thất đầy đủ tiện ích gần chợ cầu Gò Vấp thuận tiện di chuyển,4 triệu/tháng,30 m²,"Gò Vấp, Hồ Chí Minh",cho-thue-nha-tro-phong-tro
Chính chủ cần cho thuê phòng trọ có ban công full nội thất giá 4tr,4 triệu/tháng,25 m²,"Quận 2, Hồ Chí Minh",cho-thue-nha-tro-phong-tro
"Cho thuê phòng trọ cao cấp chỉ 2.5 triệu/tháng, cạnh chợ đêm, cách biển 800m. LH: 0877 000 ***","2,5 triệu/tháng",20 m²,"Phú Quốc, Kiên Giang",cho-thue-nha-tro-phong-tro
Trọ 1pn sang - xịn - mịn khu sân bay - công viên Hoàng Văn Thụ - Công viên Gia Định,7 triệu/tháng,40 m²,"Tân Bình, Hồ Chí Minh",cho-thue-nha-tro-phong-tro
"Cho thuê phòng đường Phạm Xuân Ẩn, phường Hòa Xuân","1,5 triệu/tháng",11 m²,"Cẩm Lệ, Đà Nẵng",cho-thue-nha-tro-phong-tro
Phòng trọ ngay mặt tiền đường Âu Cơ gần đại học Văn Hiến - Đại học Công Thương siêu thoáng mát,5 triệu/tháng,40 m²,"Tân Bình, Hồ Chí Minh",cho-thue-nha-tro-phong-tro
"Phòng full nội thất gần trường ĐH Kinh Tế, Văn Hiến và CĐ Kiến Trúc","3,5 triệu/tháng",63 m²,"Bình Chánh, Hồ Chí Minh",cho-thue-nha-tro-phong-tro
Phòng trọ 24m2 Nguyễn Thượng Hiền Gò Vấp,"3,2 triệu/tháng",24 m²,"Gò Vấp, Hồ Chí Minh",cho-thue-nha-tro-phong-tro
