Title,Price,Area,Location,type
Cho thuê phòng có nội thất có ban công Tôn Thất Thuyết Q4,6 triệu/tháng,35 m²,"Quận 4, Hồ Chí Minh",cho-thue-nha-tro-phong-tro
Cho thuê đất có dãy trọ đường Song Hành - Phường Thảo Điền,"26,71 triệu/tháng",477 m²,"Quận 2, Hồ Chí Minh",cho-thue-nha-tro-phong-tro
"Cho thuê phòng có ban công mặt tiền đường Vườn Chuối, Quận 3","5,5 triệu/tháng",30 m²,"Quận 3, Hồ Chí Minh",cho-thue-nha-tro-phong-tro
"Cho thuê phòng khép kín có cửa sổ, máy lạnh và máy nước nóng ở Đường Tô Hiến Thành, P. 15, Quận 10","3,7 triệu/tháng",18 m²,"Quận 10, Hồ Chí Minh",cho-thue-nha-tro-phong-tro
Cho thuê phòng ở đường Nguyễn Văn Đậu - Nơi an cư tiện nghi và đẳng cấp,"6,5 triệu/tháng",30 m²,"Bình Thạnh, Hồ Chí Minh",cho-thue-nha-tro-phong-tro
Cho thuê phòng - 30m2 - mới khai trương ở đường Phan Đăng Lưu - nơi an cư lý tưởng,6 triệu/tháng,30 m²,"Phú Nhuận, Hồ Chí Minh",cho-thue-nha-tro-phong-tro
"Studio bancol full nội thất, khu sân bay, CV Hoàng Văn Thụ",7 triệu/tháng,35 m²,"Phú Nhuận, Hồ Chí Minh",cho-thue-nha-tro-phong-tro
"Cho thuê phòng, đầy đủ nội thất, ngay Lê Văn Sỹ",8 triệu/tháng,45 m²,"Phú Nhuận, Hồ Chí Minh",cho-thue-nha-tro-phong-tro
Cho thuê phòng duplex ngay Lý Thường Kiệt,"6,5 triệu/tháng",30 m²,"Quận 10, Hồ Chí Minh",cho-thue-nha-tro-phong-tro
"Khai trương dự án Duplex ngay Lý Thường Kiệt, Lạc Long Quân","6,5 triệu/tháng",30 m²,"Quận 10, Hồ Chí Minh",cho-thue-nha-tro-phong-tro
"Trống sẵn studio, 1PN, ngay khu sân bay",7 triệu/tháng,40 m²,"Tân Bình, Hồ Chí Minh",cho-thue-nha-tro-phong-tro
"Cho thuê phòng ban công riêng, ngay Hoàng Sa",7 triệu/tháng,36 m²,"Tân Bình, Hồ Chí Minh",cho-thue-nha-tro-phong-tro
"Phòng trọ hiện đại cho thuê ở Kỳ Đồng, Phường 09, Quận 3 DT 20m2","5,2 triệu/tháng",20 m²,"Quận 3, Hồ Chí Minh",cho-thue-nha-tro-phong-tro
"Phòng trọ hiện đại cho thuê ở Cách Mạng Tháng Tám, Phường 05, Quận 3, DT 30m2",5 triệu/tháng,30 m²,"Quận 3, Hồ Chí Minh",cho-thue-nha-tro-phong-tro
Phòng trọ đầy đủ nội thất ban công siêu rộng view đẹp ngay Trường Sa quận 3,"5,5 triệu/tháng",35 m²,"Quận 3, Hồ Chí Minh",cho-thue-nha-tro-phong-tro
"Phòng trọ hiện đại cho thuê ở Nguyễn Đình Chiểu, Phường 04, Quận 3, DT 18m2",4 triệu/tháng,18 m²,"Quận 3, Hồ Chí Minh",cho-thue-nha-tro-phong-tro
Căn hộ duplex 35m2 siêu xịn mới 100% ngay gần CV Gia Định,"6,9 triệu/tháng",35 m²,"Phú Nhuận, Hồ Chí Minh",cho-thue-nha-tro-phong-tro
"Phòng 1PN tách bếp có ban công thoáng full NT, hẻm ô tô ngay Lê Văn Sỹ","7,5 triệu/tháng",35 m²,"Quận 3, Hồ Chí Minh",cho-thue-nha-tro-phong-tro
"Studio 30m2, cửa sổ lớn, full NT, gần học viện Cán Bộ, Chu Văn An, Bình Thạnh","5,2 triệu/tháng",30 m²,"Bình Thạnh, Hồ Chí Minh",cho-thue-nha-tro-phong-tro
Phòng trọ đầy đủ nội thất mới khai trương máy giặt riêng cửa sổ lớn Âu Dương Lân Quận 8,"5,5 triệu/tháng",35 m²,"Quận 8, Hồ Chí Minh",cho-thue-nha-tro-phong-tro
Phòng giá hạt dẻ ngay Phan Văn Trị - gần Emart,"3,5 triệu/tháng",10 m²,"Bình Thạnh, Hồ Chí Minh",cho-thue-nha-tro-phong-tro
Phòng giá hạt dẻ cửa sổ thoáng ngay Phan Văn Trị - gần Emart,"3,5 triệu/tháng",10 m²,"Bình Thạnh, Hồ Chí Minh",cho-thue-nha-tro-phong-tro
"Phòng trọ có gác, đầy đủ NT, ngay gần HVHK, chợ Hoàng Hoa Thám",4 triệu/tháng,28 m²,"Tân Bình, Hồ Chí Minh",cho-thue-nha-tro-phong-tro
Chốt ngay căn hộ view sân bay mới xây 100% đường Nguyễn Văn Công,"6,8 triệu/tháng",35 m²,"Gò Vấp, Hồ Chí Minh",cho-thue-nha-tro-phong-tro
"Cho thuê căn hộ full nội thất 3tr Nguyễn Thị Tú, gần Aeon Tân Phú",3 triệu/tháng,18 m²,"Bình Tân, Hồ Chí Minh",cho-thue-nha-tro-phong-tro
"Studio 30m2, tách bếp riêng, ngay ngã tư Phú Nhuận, Đào Duy Anh, Phú Nhuận",6 triệu/tháng,30 m²,"Phú Nhuận, Hồ Chí Minh",cho-thue-nha-tro-phong-tro
Phòng full nội thất đối diện E.Town Cộng Hòa,6 triệu/tháng,38 m²,"Tân Bình, Hồ Chí Minh",cho-thue-nha-tro-phong-tro
Phòng trong chung cư mini 1PN/bancol view CV Gia Định,9 triệu/tháng,45 m²,"Tân Bình, Hồ Chí Minh",cho-thue-nha-tro-phong-tro
Trống sẵn 1 phòng ngay khu sân bay,5 triệu/tháng,25 m²,"Tân Bình, Hồ Chí Minh",cho-thue-nha-tro-phong-tro
Cho thuê căn hộ dịch vụ full nội thất ngay ngã 4 Phú Nhuận,"7,5 triệu/tháng",35 m²,"Phú Nhuận, Hồ Chí Minh",cho-thue-nha-tro-phong-tro
"Khai trương dự án phòng dịch vụ hot nhất Tân Bình, giáp Quận 10, 3","6,5 triệu/tháng",35 m²,"Tân Bình, Hồ Chí Minh",cho-thue-nha-tro-phong-tro
Cho thuê phòng đối diện VinCom Cộng Hòa,9 triệu/tháng,40 m²,"Tân Bình, Hồ Chí Minh",cho-thue-nha-tro-phong-tro
"Phòng trọ full nội thất, khu sân bay, giáp Phú Nhuận","5,5 triệu/tháng",30 m²,"Tân Bình, Hồ Chí Minh",cho-thue-nha-tro-phong-tro
Căn hộ dịch vụ KDC Him Lam đầy đủ nội thất,"6,5 triệu/tháng",30 m²,"Quận 7, Hồ Chí Minh",cho-thue-nha-tro-phong-tro
"CCMN có gác full NT Từ A - Z, bancol lớn, đối diện etown, ở liền","4,5 triệu/tháng",25 m²,"Tân Bình, Hồ Chí Minh",cho-thue-nha-tro-phong-tro
Trống sẵn 1 phòng ngay khu sân bay,"5,5 triệu/tháng",28 m²,"Tân Bình, Hồ Chí Minh",cho-thue-nha-tro-phong-tro
Cho thuê studio cửa sổ lớn đường Yên Thế Quận Tân Bình,6 triệu/tháng,32 m²,"Tân Bình, Hồ Chí Minh",cho-thue-nha-tro-phong-tro
"Khai trương mới 100%, bancol cửa sổ lớn, ở 3 - 4 ng ngay sát Hufi","3,8 triệu/tháng",25 m²,"Tân Bình, Hồ Chí Minh",cho-thue-nha-tro-phong-tro
Cho thuê phòng ban công gần vòng xoay Điện Biên Phủ full nội thất,7 triệu/tháng,35 m²,"Bình Thạnh, Hồ Chí Minh",cho-thue-nha-tro-phong-tro
Cho thuê phòng có gác nội thất cơ bản giá rẻ chất lượng,"4,5 triệu/tháng",35 m²,"Gò Vấp, Hồ Chí Minh",cho-thue-nha-tro-phong-tro
"Phòng ban công Q3, cửa sổ thoáng, y hình, vòng xoay Dân Chủ, tòa Viettel, VX Phù Đổng CV Lê Văn Tám",4 triệu/tháng,22 m²,"Quận 3, Hồ Chí Minh",cho-thue-nha-tro-phong-tro
"Khai trương phòng trọ cao cấp, gác cao giá rẻ có cửa sổ ánh sáng ngay Tân Hương - Bình Long","3,5 triệu/tháng",25 m²,"Bình Tân, Hồ Chí Minh",cho-thue-nha-tro-phong-tro
Căn hộ full nội thất - thoáng mát - cách ĐH Văn Hiến chỉ 4 phút,"3,5 triệu/tháng",30 m²,"Tân Phú, Hồ Chí Minh",cho-thue-nha-tro-phong-tro
"Phòng rộng - thoáng - Bancol - cửa sổ lớn - tối đa 6 bạn, nhà xe bao rộng, có thang máy",6 triệu/tháng,35 m²,"Quận 9, Hồ Chí Minh",cho-thue-nha-tro-phong-tro
Căn siêu thoáng - Rộng - Bancol giá chỉ 5x triệu,"5,7 triệu/tháng",35 m²,"Quận 9, Hồ Chí Minh",cho-thue-nha-tro-phong-tro
"Cho thuê nhà trọ mặt tiền đường HT05 gần chợ Hiệp Thành, Phường Hiệp Thành Q12","2,5 triệu/tháng",15 m²,"Quận 12, Hồ Chí Minh",cho-thue-nha-tro-phong-tro
"Studio xinh full NT gần Đh Hoa Sen, Đh Bách Khoa, Đh Y Khoa Phạm Ngọc Thạch, Đh UEH, Đh Huflit","6,2 triệu/tháng",25 m²,"Quận 10, Hồ Chí Minh",cho-thue-nha-tro-phong-tro
Cho thuê liền căn studio ngay cầu Kênh Tẻ Quận 7,6 triệu/tháng,30 m²,"Quận 7, Hồ Chí Minh",cho-thue-nha-tro-phong-tro
"Studio full NT gần cầu Nguyễn Văn Cừ VX Trung Sơn, cầu Rạch Ông ĐH RMIT ĐH Tôn Đức Thắng Lotte Mart","6,5 triệu/tháng",30 m²,"Quận 8, Hồ Chí Minh",cho-thue-nha-tro-phong-tro
Dạ Nam Q8 ngay cầu Chữ Y full nội thất cửa sổ thoáng sạch đẹp thang máy,"4,5 triệu/tháng",35 m²,"Quận 8, Hồ Chí Minh",cho-thue-nha-tro-phong-tro
Khai trương phòng trọ cao cấp giá rẻ gác cao sẵn nội thất ngay Lê Thúc Hoạch - Aeon Tân Phú,"3,5 triệu/tháng",25 m²,"Tân Phú, Hồ Chí Minh",cho-thue-nha-tro-phong-tro
Phòng trọ mới tinh cho sinh viên gần khu vui chơi bậc nhất quận Phú Nhuận,"4,9 triệu/tháng",25 m²,"Phú Nhuận, Hồ Chí Minh",cho-thue-nha-tro-phong-tro
"Studio full gần Cv Lê Văn Tám Bờ Kè Hoàng Sa, cầu Bông, cầu Trần Khánh Dư cầu Điện Biên Phủ, Đh UEF","5,5 triệu/tháng",30 m²,"Quận 1, Hồ Chí Minh",cho-thue-nha-tro-phong-tro
Cho thuê phòng Tôn Thất Tùng Q1 gần công viên 23/9 Bến thành,6 triệu/tháng,35 m²,"Quận 1, Hồ Chí Minh",cho-thue-nha-tro-phong-tro
"Chính chủ cần cho thuê phòng trọ tầng 1 có máy lạnh, khu yên tĩnh. LH 0786 847 ***","3,5 triệu/tháng",16 m²,"Quận 4, Hồ Chí Minh",cho-thue-nha-tro-phong-tro
"Cho thuê phòng Dulex và sudio trong NNC có gác, giá rẻ, có hầm xe, PCCC đầy đủ","3,3 triệu/tháng",20 m²,"Quận 7, Hồ Chí Minh",cho-thue-nha-tro-phong-tro
"Nhà trọ thoáng mát, sáng sủa An Thạnh, Thuận An","2,5 triệu/tháng",40 m²,"Thuận An, Bình Dương",cho-thue-nha-tro-phong-tro
"Cho thuê phòng Duplex trong chung cư có gác, giá rẻ, có thang máy, bảo vệ, hầm xe, PCCC đầy đủ","3,6 triệu/tháng",25 m²,"Gò Vấp, Hồ Chí Minh",cho-thue-nha-tro-phong-tro
"Phòng cửa sổ ngay gần ngã tư Bảy Hiền, CV Lê Thị Riêng phòng siêu rộng ưu đãi HSSV","4,9 triệu/tháng",35 m²,"Tân Bình, Hồ Chí Minh",cho-thue-nha-tro-phong-tro
Căn hộ gần sân bay full nội thất bancol rộng rãi hỗ trợ cọc,"5,5 triệu/tháng",40 m²,"Tân Bình, Hồ Chí Minh",cho-thue-nha-tro-phong-tro
"Căn hộ mini full nội thất, bancol rộng gần sân bay quận Tân Bình",6 triệu/tháng,30 m²,"Tân Bình, Hồ Chí Minh",cho-thue-nha-tro-phong-tro
Studio full nội thất ban công thoáng mát gần Lotte Mart Tân Bình,5 triệu/tháng,30 m²,"Tân Bình, Hồ Chí Minh",cho-thue-nha-tro-phong-tro
Căn hộ 1PN ban công rộng full nội thất gần sân bay quận Tân Bình,"6,5 triệu/tháng",45 m²,"Tân Bình, Hồ Chí Minh",cho-thue-nha-tro-phong-tro
Căn hộ mini có bancol full nội thất mới gần sân bay quận Tân Bình,"5,8 triệu/tháng",32 m²,"Tân Bình, Hồ Chí Minh",cho-thue-nha-tro-phong-tro
Căn hộ mini full nội thất mới gần sân bay quận Tân Bình,"5,8 triệu/tháng",32 m²,"Tân Bình, Hồ Chí Minh",cho-thue-nha-tro-phong-tro
"Cho thuê phòng trọ ngay trung tâm TP Nha Trang. 25m2, có gác lửng, giá 1,5 triệu/tháng","1,5 triệu/tháng",25 m²,"Nha Trang, Khánh Hòa",cho-thue-nha-tro-phong-tro
"Phòng trọ cho thuê 692/34, Đường Đoàn Văn Bơ, Phường 16, Quận 4, Tp Hồ Chí Minh","2,3 triệu/tháng",12 m²,"Quận 4, Hồ Chí Minh",cho-thue-nha-tro-phong-tro
"Cho thuê chung cư cao cấp, quận 1 phòng rộng","6,8 triệu/tháng",30 m²,"Quận 1, Hồ Chí Minh",cho-thue-nha-tro-phong-tro
"Cô Giang, Cầu Ông Lãnh Q1 Full nội thất máy giặt riêng cửa sổ đón năng",7 triệu/tháng,35 m²,"Quận 1, Hồ Chí Minh",cho-thue-nha-tro-phong-tro
Studio tách bếp full nội thất ngay khu K300 - Etown - Lotte Mart Cộng Hoà - ưu đãi ngay 500k,8 triệu/tháng,40 m²,"Tân Bình, Hồ Chí Minh",cho-thue-nha-tro-phong-tro
Cho thuê nhà trọ 35m2 Đường Lê Văn Sỹ Quận Phú Nhuận Full NT chỉ cần sách va li vào ở,"6,5 triệu/tháng",35 m²,"Phú Nhuận, Hồ Chí Minh",cho-thue-nha-tro-phong-tro
Cho thuê duplex cao cấp full nội thất hiện đại nằm ngay trung tâm quận 1 gần công viên 23/9,"8,5 triệu/tháng",35 m²,"Quận 1, Hồ Chí Minh",cho-thue-nha-tro-phong-tro
"Căn hộ DV full nội thất cao cấp ngay 137 Bình Quới, gần ĐH Hutech, ĐH Ngoại Thương Bình Thạnh","5,5 triệu/tháng",22 m²,"Bình Thạnh, Hồ Chí Minh",cho-thue-nha-tro-phong-tro
Căn hộ phòng trọ 1PN ban công - full nội thất - khu sân bay,"9,5 triệu/tháng",55 m²,"Tân Bình, Hồ Chí Minh",cho-thue-nha-tro-phong-tro
Khai trương căn hộ phòng trọ 1PN ban công siêu đẹp đối diện công viên gIa Định,9 triệu/tháng,60 m²,"Tân Bình, Hồ Chí Minh",cho-thue-nha-tro-phong-tro
Căn hộ - phòng trọ 1PN - đối diện sân bay,8 triệu/tháng,50 m²,"Tân Bình, Hồ Chí Minh",cho-thue-nha-tro-phong-tro
Khai trương căn hộ - phòng trọ xịn xò khu vip sân bay,9 triệu/tháng,55 m²,"Tân Bình, Hồ Chí Minh",cho-thue-nha-tro-phong-tro
Giảm mạnh 1tr - căn hộ phòng trọ Studio khu VIP sân bay,"5,3 triệu/tháng",35 m²,"Tân Bình, Hồ Chí Minh",cho-thue-nha-tro-phong-tro
Cho thuê phòng có nội thất ngay mặt tiền Tôn Thất Thuyết Quận 4,6 triệu/tháng,35 m²,"Quận 4, Hồ Chí Minh",cho-thue-nha-tro-phong-tro
Căn hộ mới - full nội thất đường Lê Trọng Tấn giá chỉ 3tr2,"3,2 triệu/tháng",20 m²,"Bình Tân, Hồ Chí Minh",cho-thue-nha-tro-phong-tro
Cho thuê 1 phòng ngủ bancon có nội thất Đoàn Văn Bơ Quận 4,"7,5 triệu/tháng",40 m²,"Quận 4, Hồ Chí Minh",cho-thue-nha-tro-phong-tro
"Cho thuê homestay mặt phố Thụy KHuê, Trích Sài, gần SVĐ Quận Ngựa, Q.Tây Hồ. Giá rẻ nhất thị trường","1,2 triệu/tháng",25 m²,"Tây Hồ, Hà Nội",cho-thue-nha-tro-phong-tro
Căn hộ DV mới 100% còn trống dịch vụ full nội thất hiện đại 1PN tách bếp,"9,5 triệu/tháng",35 m²,"Bình Thạnh, Hồ Chí Minh",cho-thue-nha-tro-phong-tro
"Phòng trọ mới cho thuê ở Cao Văn Ngọc, Phường Phú Trung, Quận Tân Phú DT 25m2","4,8 triệu/tháng",25 m²,"Tân Phú, Hồ Chí Minh",cho-thue-nha-tro-phong-tro
Căn phòng dành cho các bạn nữ thích sự nhẹ nhàng mà sang trọng,"7,5 triệu/tháng",30 m²,"Bình Thạnh, Hồ Chí Minh",cho-thue-nha-tro-phong-tro
"Phòng 1PN khu vip sân bay - phường 2, Tân Bình","9,9 triệu/tháng",50 m²,"Tân Bình, Hồ Chí Minh",cho-thue-nha-tro-phong-tro
"Dành cho nam, miễn phí hết, ngay Lê văn Việt, DH Hutech, FPT, SPKT, Khu CNC, Intel, SamSung",1 triệu/tháng,28 m²,"Quận 9, Hồ Chí Minh",cho-thue-nha-tro-phong-tro
Cho thuê phòng full nội thất đường Trường Sơn cách sân bay 2p quận Tân Bình,"8,5 triệu/tháng",40 m²,"Tân Bình, Hồ Chí Minh",cho-thue-nha-tro-phong-tro
Căn hộ sang trọng máy giặt riêng ngay trường đua Phú Thọ Q10,"6,4 triệu/tháng",32 m²,"Quận 10, Hồ Chí Minh",cho-thue-nha-tro-phong-tro
"Studio view thoáng ngay Phú Mỹ Hưng nội thất như hình, gần Lotte, Cresent Mail Q7","9,2 triệu/tháng",39 m²,"Quận 7, Hồ Chí Minh",cho-thue-nha-tro-phong-tro
"Sonata Residence Quận 7 - Studio/Duplex full view city - free pool, gym",8 triệu/tháng,40 m²,"Quận 7, Hồ Chí Minh",cho-thue-nha-tro-phong-tro
"Phòng trọ tại Phú Mỹ Hưng Quận 7, không gian sang chảnh",10 triệu/tháng,30 m²,"Quận 7, Hồ Chí Minh",cho-thue-nha-tro-phong-tro
Cho thuê phòng studio giá cả hợp lý,4 triệu/tháng,25 m²,"Ba Đình, Hà Nội",cho-thue-nha-tro-phong-tro
"Phòng trọ 1 người tại Phạm Thế Hiển, P4, Q8","1,2 triệu/tháng",4 m²,"Quận 8, Hồ Chí Minh",cho-thue-nha-tro-phong-tro
"Studio full nội thất - Nguyễn Thị Minh Khai Q1, ngay Thảo Cầm Viên, cầu Thị Nghè","6,7 triệu/tháng",35 m²,"Quận 1, Hồ Chí Minh",cho-thue-nha-tro-phong-tro
"Cho thuê phòng có nội thất có máy giặt cửa sổ lớn Thành Thái, Quận 10",7 triệu/tháng,40 m²,"Quận 10, Hồ Chí Minh",cho-thue-nha-tro-phong-tro
Cho thuê phòng có nội thất ban công thoáng ngay Nguyễn Trãi Cống Quỳnh Quận 1,"7,5 triệu/tháng",35 m²,"Quận 1, Hồ Chí Minh",cho-thue-nha-tro-phong-tro
Cho thuê 1 phòng ngủ riêng có nội thất ngay Chợ Bến Thành Quận 1,"7,5 triệu/tháng",40 m²,"Quận 1, Hồ Chí Minh",cho-thue-nha-tro-phong-tro
"Cho thuê phòng có nội thất ban công cửa sổ ngay Nam Kỳ Khởi Nghĩa, Quận 3",7 triệu/tháng,35 m²,"Quận 3, Hồ Chí Minh",cho-thue-nha-tro-phong-tro
"Cho thuê phòng có nội thất bancon cửa sổ lớn Cách Mạng Tháng 8, Q10",6 triệu/tháng,35 m²,"Quận 10, Hồ Chí Minh",cho-thue-nha-tro-phong-tro
Cho thuê CHDV hiện đại ban công full nội thất thoáng mát,"6,3 triệu/tháng",35 m²,"Bình Thạnh, Hồ Chí Minh",cho-thue-nha-tro-phong-tro
CHDV siêu phẩm xuất hiện tại Quận Bình Thạnh,"7,5 triệu/tháng",35 m²,"Bình Thạnh, Hồ Chí Minh",cho-thue-nha-tro-phong-tro
Duplex full nội thất siêu xịn sò khu K300-Etown-Lotte Mart Cộng Hoà-view cực chill ngắm cực ghiền,6 triệu/tháng,35 m²,"Tân Bình, Hồ Chí Minh",cho-thue-nha-tro-phong-tro
"Phòng full nội thất cửa sổ trời có gác an ninh tiện nghi hiện đại ngay đường Hoà Bình, Tân Phú","4,6 triệu/tháng",35 m²,"Tân Phú, Hồ Chí Minh",cho-thue-nha-tro-phong-tro
Cho thuê phòng bacon cửa sổ lớn full nội thất Tôn Thất Thuyết quận 4,"6,8 triệu/tháng",45 m²,"Quận 4, Hồ Chí Minh",cho-thue-nha-tro-phong-tro
Khai trương studio full nội thất máy giặt riêng khu ngã tư Bảy Hiền - cách vòng xoay Lê Đại Hành,6 triệu/tháng,35 m²,"Tân Bình, Hồ Chí Minh",cho-thue-nha-tro-phong-tro
"Duplex ban công máy giặt riêng ngay Nguyễn Thị Thập, Lotte Q7","8,5 triệu/tháng",40 m²,"Quận 7, Hồ Chí Minh",cho-thue-nha-tro-phong-tro
Studio ban công full nội thất ngay ngã tư Bảy Hiền - đường Lạc Long Quân - Lý Thường Kiệt,"6,5 triệu/tháng",30 m²,"Tân Bình, Hồ Chí Minh",cho-thue-nha-tro-phong-tro
Cho thuê phòng 1PN full nội thất cao cấp ngay Cửu Long Sân Bay Quận Tân Bình,8 triệu/tháng,40 m²,"Tân Bình, Hồ Chí Minh",cho-thue-nha-tro-phong-tro
Phòng 1PN có ban công full nội thất nội khu sân bay công viên Hoàng Văn Thụ - thuận tiện di chuyển,8 triệu/tháng,30 m²,"Tân Bình, Hồ Chí Minh",cho-thue-nha-tro-phong-tro
"2PN 2 ban công, mặt tiền, Vĩnh Hội Q4, Cầu Kênh Tẻ, ĐH Luật, NTT, TĐT",7 triệu/tháng,45 m²,"Quận 4, Hồ Chí Minh",cho-thue-nha-tro-phong-tro
Cho thuê phòng mới xây cửa sổ lớn Trần Bình Trọng Quận 5,9 triệu/tháng,40 m²,"Quận 5, Hồ Chí Minh",cho-thue-nha-tro-phong-tro
Cho thuê phòng mới xây full nội thất Võ Thị Sáu Q1,5 triệu/tháng,40 m²,"Quận 1, Hồ Chí Minh",cho-thue-nha-tro-phong-tro
"Cho thuê phòng mới xây full nội thất Lý Văn Phức, Q1","7,5 triệu/tháng",40 m²,"Quận 1, Hồ Chí Minh",cho-thue-nha-tro-phong-tro
Cho thuê phòng có ban công full nội thất ngay Dương Bá Trạc Quận 8,"7,7 triệu/tháng",40 m²,"Quận 5, Hồ Chí Minh",cho-thue-nha-tro-phong-tro
Cho thuê phòng mới xây full nội thất ngay Vĩnh Hội Quận 4,7 triệu/tháng,40 m²,"Quận 4, Hồ Chí Minh",cho-thue-nha-tro-phong-tro
"Cho thuê phòng cửa sổ lớn full nội thất Võ Thị Sáu, Quận 3",7 triệu/tháng,40 m²,"Quận 3, Hồ Chí Minh",cho-thue-nha-tro-phong-tro
Cho thuê phòng mới xây full nội thất Nguyễn Công Trứ Quận 1,"7,5 triệu/tháng",40 m²,"Quận 1, Hồ Chí Minh",cho-thue-nha-tro-phong-tro
"Cho thuê phòng Bình Thạnh. 1 PN, 1WC ban công thoáng. Nơ Trang Long, chợ Bà Chiểu","7,3 triệu/tháng",40 m²,"Bình Thạnh, Hồ Chí Minh",cho-thue-nha-tro-phong-tro
Căn hộ studio tone Ngọc Lam tại trung tâm Quận 7,"5,5 triệu/tháng",30 m²,"Quận 7, Hồ Chí Minh",cho-thue-nha-tro-phong-tro
"Cho thuê phòng có máy lạnh 450/130, Đoàn Văn Bơ, Phường 14, Quận 4",3 triệu/tháng,16 m²,"Quận 4, Hồ Chí Minh",cho-thue-nha-tro-phong-tro
"Duplex ban công máy giặt riêng siêu thoáng ngay Nguyễn Thị Thập, Lotte Q7",8 triệu/tháng,40 m²,"Quận 7, Hồ Chí Minh",cho-thue-nha-tro-phong-tro
Cho thuê phòng ban công gần sân bay full nội thất,7 triệu/tháng,35 m²,"Bình Thạnh, Hồ Chí Minh",cho-thue-nha-tro-phong-tro
Cho thuê duplex cửa sổ thoáng mát ngay Trần Bình Trọng,"6,5 triệu/tháng",25 m²,"Bình Thạnh, Hồ Chí Minh",cho-thue-nha-tro-phong-tro
"Siêu phẩm duplex đẹp sang xịn mịn 36m2 tại Nguyễn Văn Khối, P11, Gò Vấp",6 triệu/tháng,36 m²,"Gò Vấp, Hồ Chí Minh",cho-thue-nha-tro-phong-tro
Cho thuê 1 phòng ngủ máy giặt riêng có nội thất Cô Giang Cầu Ông Lãnh Quận 1,9 triệu/tháng,40 m²,"Quận 1, Hồ Chí Minh",cho-thue-nha-tro-phong-tro
"Studio cửa sổ lớn ngay sân vận động Phú Thọ, ĐH Bách Khoa","6,2 triệu/tháng",30 m²,"Quận 10, Hồ Chí Minh",cho-thue-nha-tro-phong-tro
Cho thuê phòng trọ gác cửa sổ bancol ngay Hoà Bình Tô Hiệu,"4,5 triệu/tháng",25 m²,"Tân Phú, Hồ Chí Minh",cho-thue-nha-tro-phong-tro
"Khai trương phòng trọ quận 1, giá rẻ","4,5 triệu/tháng",15 m²,"Quận 1, Hồ Chí Minh",cho-thue-nha-tro-phong-tro
Cuối năm ra mắt hàng loạt phòng giá rẻ cho sinh viên trải nghiệm đây,"4,8 triệu/tháng",30 m²,"Bình Thạnh, Hồ Chí Minh",cho-thue-nha-tro-phong-tro
Chdv cao cấp mới khai trương full nội thất có bancol - cửa sổ lớn cách học viện cán bộ 5p,"7,2 triệu/tháng",35 m²,"Bình Thạnh, Hồ Chí Minh",cho-thue-nha-tro-phong-tro
Căn hộ 35/6 Phạm Văn Đồng Phường 3 GV. ngay vòng xoay gia đinh. Cách sân bay 1KM,"6,5 triệu/tháng",30 m²,"Gò Vấp, Hồ Chí Minh",cho-thue-nha-tro-phong-tro
Căn hộ full NT gần Lotte Mart Nguyễn Văn Lượng,"5,5 triệu/tháng",30 m²,"Gò Vấp, Hồ Chí Minh",cho-thue-nha-tro-phong-tro
Căn hộ DV mới 100% còn trống dịch vụ full nội thất hiện đại 1PN tách bếp,"6,8 triệu/tháng",45 m²,"Bình Thạnh, Hồ Chí Minh",cho-thue-nha-tro-phong-tro
"Cho phòng quận 1, gần ĐH Sài Gòn, cầu Nguyễn Văn Cừ, ĐH Kinh Tế, phố đi bộ Bùi Viện, Nguyễn Huệ","6,5 triệu/tháng",40 m²,"Quận 1, Hồ Chí Minh",cho-thue-nha-tro-phong-tro
Khai trương siêu phẩm full nội thất máy giặt riêng cực thoáng mát,7 triệu/tháng,30 m²,"Quận 2, Hồ Chí Minh",cho-thue-nha-tro-phong-tro
"Phòng trọ ban công, full nội thất, máy giặt riêng gần ngã tư Hàng Xanh",7 triệu/tháng,35 m²,"Bình Thạnh, Hồ Chí Minh",cho-thue-nha-tro-phong-tro
"Studio, duplex, 1PN, 2PN có cửa sổ, ban công ngay Lotte Q7",6 triệu/tháng,35 m²,"Quận 7, Hồ Chí Minh",cho-thue-nha-tro-phong-tro
"Phòng trong nhà nguyên căn ở đường số 6, Linh Xuân Thủ Đức, nvs riêng, có ban công, chỗ để xe, bếp","2,5 triệu/tháng",25 m²,"Thủ Đức, Hồ Chí Minh",cho-thue-nha-tro-phong-tro
"Cho thuê căn hộ 1 PN trong KDC Vạn Phúc, nội thất mới, 5 triệu/tháng",5 triệu/tháng,30 m²,"Thủ Đức, Hồ Chí Minh",cho-thue-nha-tro-phong-tro
"Studio Phú Nhuận 40m2 ban công, Máy giặt riêng, thang máy. Khu Phan Xích Long, Gần Ngã 4 Quận PN",6 triệu/tháng,40 m²,"Phú Nhuận, Hồ Chí Minh",cho-thue-nha-tro-phong-tro
Ký túc xá Gò Vấp giá rẻ ngay chợ Gò Vấp chỉ vài trăm mét,"1,5 triệu/tháng",40 m²,"Gò Vấp, Hồ Chí Minh",cho-thue-nha-tro-phong-tro
"Studio 35m2 đường Huỳnh Văn Bánh, Quận Phú Nhuận","7,3 triệu/tháng",35 m²,"Phú Nhuận, Hồ Chí Minh",cho-thue-nha-tro-phong-tro
Ký túc xá Bình Thạnh cách đại học Hutech chỉ 250m,"1,8 triệu/tháng",45 m²,"Bình Thạnh, Hồ Chí Minh",cho-thue-nha-tro-phong-tro
"Studio bancol full nội thất, khu sân bay, CV Hoàng Văn Thụ",7 triệu/tháng,35 m²,"Phú Nhuận, Hồ Chí Minh",cho-thue-nha-tro-phong-tro
Trống sẵn 1 phòng duplex ngay Bờ Kè Hoàng Sa,"8,5 triệu/tháng",40 m²,"Phú Nhuận, Hồ Chí Minh",cho-thue-nha-tro-phong-tro
Phòng trọ mới cho thuê ở Âu Dương Lân Phường 3 Quận 8 DT 22m2,5 triệu/tháng,22 m²,"Quận 8, Hồ Chí Minh",cho-thue-nha-tro-phong-tro
"Phòng trọ mới cho thuê ở Trần Hưng Đạo, Phường Cầu Kho, Quận 1 DT 20m2",5 triệu/tháng,20 m²,"Quận 1, Hồ Chí Minh",cho-thue-nha-tro-phong-tro
Phòng trọ mới cho thuê ở Bùi Đình Túy Phường 12 Quận Bình Thạnh DT 35m2,6 triệu/tháng,35 m²,"Bình Thạnh, Hồ Chí Minh",cho-thue-nha-tro-phong-tro
"Phòng trọ mới cho thuê ở Kỳ Đồng, Phường 09, Quận 3, DT 20m2","5,2 triệu/tháng",20 m²,"Quận 3, Hồ Chí Minh",cho-thue-nha-tro-phong-tro
"Phòng trọ mới cho thuê ở Hoàng Văn Thụ, Phường 08, Quận Phú Nhuận DT 30m2","5,5 triệu/tháng",30 m²,"Phú Nhuận, Hồ Chí Minh",cho-thue-nha-tro-phong-tro
"Phòng trọ mới cho thuê ở Lê Lợi, Phường Bến Thành Quận 1 DT 17m2",5 triệu/tháng,17 m²,"Quận 1, Hồ Chí Minh",cho-thue-nha-tro-phong-tro
"Phòng trọ mới cho thuê ở Nguyễn Phi Khanh, Phường Tân Định, Quận 1 DT 25m2","6,2 triệu/tháng",25 m²,"Quận 1, Hồ Chí Minh",cho-thue-nha-tro-phong-tro
"Phòng trọ mới cho thuê ở 1 phường Bình Hưng Hoà A, Quận Bình Tân, DT 20m2",4 triệu/tháng,20 m²,"Bình Tân, Hồ Chí Minh",cho-thue-nha-tro-phong-tro
"Phòng trọ mới cho thuê ở 9, Phường 9, Quận Gò Vấp DT 35m2",6 triệu/tháng,35 m²,"Gò Vấp, Hồ Chí Minh",cho-thue-nha-tro-phong-tro
