Title,Price,Area,Location,type
Cần cho thuê đất và nhà xưởng mt đường Đào Trí P. Phú Thuận Quận 7,120 triệu/tháng,3.000 m²,"Quận 7, Hồ Chí Minh",cho-thue-kho-nha-xuong-dat
Cho thuê 10.000m2 nhà xưởng chất lượng cao tại Kcn Sông Công 2 Thái Nguyên,65 nghìn/m²,10.000 m²,"Sông Công, Thái Nguyên",cho-thue-kho-nha-xuong-dat
"Cho thuê kho xưởng 8000m2, 300tr Thuận An",300 triệu/tháng,8.000 m²,"Thuận An, Bình Dương",cho-thue-kho-nha-xuong-dat
Cho thuê 14.000m2 kho xưởng giá rẻ nhất KCN Sông Công 2,65 nghìn/m²,14.000 m²,"Sông Công, Thái Nguyên",cho-thue-kho-nha-xuong-dat
Cho thuê kho xưởng 600m2 giá rẻ nhất KCN Quang Minh,75 nghìn/m²,600 m²,"Mê Linh, Hà Nội",cho-thue-kho-nha-xuong-dat
Cho thuê xưởng 700m2 30tr Cầu Ông Bố - Thuận An,30 triệu/tháng,700 m²,"Thuận An, Bình Dương",cho-thue-kho-nha-xuong-dat
"Cho thuê xưởng 500m2 13tr/th Thuận An, 0907 838 ***",13 triệu/tháng,500 m²,"Thuận An, Bình Dương",cho-thue-kho-nha-xuong-dat
"Cho thuê đất Lê Đức Thọ, DT: 2500m2, Quận 12",40 triệu/tháng,2.500 m²,"Quận 12, Hồ Chí Minh",cho-thue-kho-nha-xuong-dat
Cần cho thuê siêu phẩm đất góc hai mặt tiền 11 x 18m = 200m2,Giá thỏa thuận,200 m²,"Bà Rịa, Bà Rịa Vũng Tàu",cho-thue-kho-nha-xuong-dat
"Cho thuê kho gần 300m2 đường Nguyễn Văn Quỳ, Q7",23 triệu/tháng,280 m²,"Quận 7, Hồ Chí Minh",cho-thue-kho-nha-xuong-dat
"Cho thuê toàn bộ nhà máy tại Phú Xuyên, Hà Nội - kết nối thuận tiện, tiện ích đầy đủ. LH 0906 218 ***",500 triệu/tháng,28.300 m²,"Phú Xuyên, Hà Nội",cho-thue-kho-nha-xuong-dat
"Cho Thuê Kho Xưởng Tại Hải Dương - diện tích lớn, vị trí đắc địa. LH 0906 218 ***",125 nghìn/m²,70.000 m²,"Cẩm Giàng, Hải Dương",cho-thue-kho-nha-xuong-dat
Cho thuê kho xưởng KCN Tân Kim; Xã Tân Kim; Huyện Cần Giuộc; Tỉnh Long An,68 triệu/tháng,500 m²,"Cần Giuộc, Long An",cho-thue-kho-nha-xuong-dat
Kho đẹp diện tích 800m2 giá tốt đường xe tải,60 triệu/tháng,800 m²,"Tân Phú, Hồ Chí Minh",cho-thue-kho-nha-xuong-dat
"Chính chủ cho thuê kho 450m2-800m2 cầu Vĩnh Tuy, cho thuê công lạnh, cảng Hà Nội",Giá thỏa thuận,450 m²,"Hai Bà Trưng, Hà Nội",cho-thue-kho-nha-xuong-dat
"Cho thuê kho bãi Hai Bà Trưng, Vĩnh Tuy, cảng Hà Nội",Giá thỏa thuận,100 m²,"Hai Bà Trưng, Hà Nội",cho-thue-kho-nha-xuong-dat
Chính chủ cho thuê kho 1200-1900m khu CN Vĩnh Tuy Vinh Hoang Hoàng Mai Tam Trinh Lĩnh Nam,Giá thỏa thuận,1.900 m²,"Hoàng Mai, Hà Nội",cho-thue-kho-nha-xuong-dat
"Cần cho thuê lại kho trống 300m2 mặt tiền Trần Bình Trọng, phường 4, quận 5",Giá thỏa thuận,300 m²,"Quận 5, Hồ Chí Minh",cho-thue-kho-nha-xuong-dat
"Cho thuê Kho xưởng sầu riêng xuất khẩu tại huyện Cái Bè, Tiền Giang",144 triệu/tháng,2.500 m²,"Cái Bè, Tiền Giang",cho-thue-kho-nha-xuong-dat
Chính chủ cho thuê kho 2PN 2WC 9x32 2 căn liền kề 2MT hẻm xe tải 18tr chốt 15tr LH 0901 600 *** Phi,15 triệu/tháng,288 m²,"Bình Thạnh, Hồ Chí Minh",cho-thue-kho-nha-xuong-dat
Cho thuê 265m2 xưởng Vạn Phúc Thanh Trì. Đường ô tô. 10 triệu/tháng,10 triệu/tháng,265 m²,"Thanh Trì, Hà Nội",cho-thue-kho-nha-xuong-dat
Cho thuê nhà xưởng Thuận An Bình Dương,70 nghìn/m²,2.200 m²,"Thuận An, Bình Dương",cho-thue-kho-nha-xuong-dat
"Chính chủ cho thuê kho xưởng 900m2 khung zamil ở Phan Huy Ích, Quận Gò Vấp",Giá thỏa thuận,900 m²,"Gò Vấp, Hồ Chí Minh",cho-thue-kho-nha-xuong-dat
X591. Cho thuê kho/xưởng khu vực Hồng Bàng 12000m2 có trạm điện 400KVA xe cont vào thoải mái,55 nghìn/m²,1.200 m²,"Hồng Bàng, Hải Phòng",cho-thue-kho-nha-xuong-dat
Cho thuê kho/xưởng và nhà ở khu vực An Dương 500m2 có điện 3 pha,30 triệu/tháng,500 m²,"An Dương, Hải Phòng",cho-thue-kho-nha-xuong-dat
"Cho thuê mặt bằng từ 200m2 đến 1000m2 - P. Thạnh Mỹ Lợi KCN Cát Lái - Q2, 0985 694 ***",100 nghìn/m²,500 m²,"Quận 2, Hồ Chí Minh",cho-thue-kho-nha-xuong-dat
Cho thuê đất 2 mặt tiền Hoàng Kế Viêm và An Thượng 6. DT 306m2,50 triệu/tháng,306 m²,"Ngũ Hành Sơn, Đà Nẵng",cho-thue-kho-nha-xuong-dat
Cho thuê kho 200m2 đường Số 4 P. Phước Long,24 triệu/tháng,200 m²,"Nha Trang, Khánh Hòa",cho-thue-kho-nha-xuong-dat
Cho thuê kho xưởng 550m2 mặt tiền đường Võ Nguyên Giáp,35 triệu/tháng,550 m²,"Nha Trang, Khánh Hòa",cho-thue-kho-nha-xuong-dat
"Cho thuê nhà 4 tầng 120m2, giá 8-10tr làm kho và bán hàng online",8 triệu/tháng,120 m²,"Hà Đông, Hà Nội",cho-thue-kho-nha-xuong-dat
Cho thuê 6000m2 kho tiêu chuẩn Thủ Đức - giá 115k/m2. (có tách lẻ),115 nghìn/m²,6.000 m²,"Thủ Đức, Hồ Chí Minh",cho-thue-kho-nha-xuong-dat
"Cần cho thuê gấp 1,5ha đất trống - vào khai thác ngay - MT đường Đào Trí, Q7 - Giá rẻ 35 ngàn/m2",35 nghìn/m²,15.000 m²,"Quận 7, Hồ Chí Minh",cho-thue-kho-nha-xuong-dat
"Cho thuê kho xưởng mới DT 230m2 ở Lê Đình Cẩn, Phường Tân Tạo, Quận Bình Tân",12 triệu/tháng,230 m²,"Bình Tân, Hồ Chí Minh",cho-thue-kho-nha-xuong-dat
Khu công nghiệp Châu Đức Bá Rịa Vũng Tàu / cho thuê nhà xưởng,"66,78 nghìn/m²",2.300 m²,"Châu Đức, Bà Rịa Vũng Tàu",cho-thue-kho-nha-xuong-dat
"Cho thuê kho 50m2 Vạn Phúc, Hà Đông",Giá thỏa thuận,50 m²,"Hà Đông, Hà Nội",cho-thue-kho-nha-xuong-dat
"Cho thuê kho xưởng 50m2 khu vực Dương Nội, Hà Đông, Hà Nội",4 triệu/tháng,50 m²,"Hà Đông, Hà Nội",cho-thue-kho-nha-xuong-dat
"Cho thuê kho xưởng mới DT 500m2 ở đường Đông Lân, xã Bà Điểm, Hóc Môn",25 triệu/tháng,500 m²,"Hóc Môn, Hồ Chí Minh",cho-thue-kho-nha-xuong-dat
"Cho thuê kho xưởng 300m2 khu vực ngã tư La Dương, Dương Nội Hà Đông",70 nghìn/m²,300 m²,"Hoài Đức, Hà Nội",cho-thue-kho-nha-xuong-dat
"Cho thuê đất vị trí đẹp đắc địa DT 10.000m2 ở Nguyễn Văn Khạ, xã Phú Hòa Đông, huyện Củ Chi",25 triệu/tháng,10.000 m²,"Củ Chi, Hồ Chí Minh",cho-thue-kho-nha-xuong-dat
"Cho thuê đất vị trí đẹp đắc địa DT 105m2 ở Đường Điện Biên Phủ, Phường 15, Bình Thạnh",20 triệu/tháng,105 m²,"Bình Thạnh, Hồ Chí Minh",cho-thue-kho-nha-xuong-dat
Cho thuê kho xưởng mới DT 324m2 ở Bình Quới Phường 28 Quận Bình Thạnh,25 triệu/tháng,324 m²,"Bình Thạnh, Hồ Chí Minh",cho-thue-kho-nha-xuong-dat
"Cho thuê đất, 1800m2, 36tr, ngay đường Lê Trọng Tấn, Tân Phú, phù hợp chành xe, bãi vật liệu",36 triệu/tháng,1.800 m²,"Tân Phú, Hồ Chí Minh",cho-thue-kho-nha-xuong-dat
Cho thuê kho xưởng mới DT 700m2 ở 181 Xã Bình Mỹ Huyện Củ Chi,25 triệu/tháng,700 m²,"Củ Chi, Hồ Chí Minh",cho-thue-kho-nha-xuong-dat
"Cho thuê kho xưởng mới DT 1.000m2 ở đường Quốc lộ 1A, Phường Tân Tạo A, Bình Tân",80 triệu/tháng,1.000 m²,"Bình Tân, Hồ Chí Minh",cho-thue-kho-nha-xuong-dat
"Cho thuê kho xưởng Quốc lộ 1A, DT: 1.500m2, giá: 60tr/tháng, Bình Tân",60 triệu/tháng,1.500 m²,"Bình Tân, Hồ Chí Minh",cho-thue-kho-nha-xuong-dat
Cho thuê kho xưởng mới DT 600m2 ở Tân Hiệp 8 Xã Tân Hiệp Huyện Hóc Môn,30 triệu/tháng,600 m²,"Hóc Môn, Hồ Chí Minh",cho-thue-kho-nha-xuong-dat
"Cho thuê kho xưởng mới DT 350m2 ở Đường Hồ Văn Long, Phường Tân Tạo, Bình Tân",35 triệu/tháng,350 m²,"Bình Tân, Hồ Chí Minh",cho-thue-kho-nha-xuong-dat
"Cho thuê kho xưởng Sóng Thần, gần khu công nghiệp Bình Chiểu Thủ Đức",75 nghìn/m²,5.000 m²,"Thuận An, Bình Dương",cho-thue-kho-nha-xuong-dat
"Cho thuê kho vận tại phố Hàm Tử Quan, Phúc Tân, DT 100m2,200,300,400m2 thông sàn, 120 nghìn/m2/th",120 nghìn/m²,100 m²,"Hoàn Kiếm, Hà Nội",cho-thue-kho-nha-xuong-dat
Cho thuê kho xưởng mới DT 200m2 ở 1 Phường Bình Hưng Hoà A Quận Bình Tân,25 triệu/tháng,200 m²,"Bình Tân, Hồ Chí Minh",cho-thue-kho-nha-xuong-dat
