Title,Price,Area,Location,type
Khai trương 1 phòng ngủ 35m2 ngay Phan Đăng Lưu - Bình Thạnh,"7,8 triệu/tháng",35 m²,"Bình Thạnh, Hồ Chí Minh",cho-thue-nha-tro-phong-tro
"Còn 1 phòng mới xây 35m2, an ninh - ngay Cầu Bông, Quận Bình Thạnh","6,5 triệu/tháng",30 m²,"Bình Thạnh, Hồ Chí Minh",cho-thue-nha-tro-phong-tro
Phòng trọ giá rẻ - full nội thất - thang máy - ban công tại Võ Duy Ninh,"6,5 triệu/tháng",28 m²,"Bình Thạnh, Hồ Chí Minh",cho-thue-nha-tro-phong-tro
Phòng có gác siêu rộng mới tận 2 ban công tại Hồ Xuân Hương,"6,8 triệu/tháng",35 m²,"Bình Thạnh, Hồ Chí Minh",cho-thue-nha-tro-phong-tro
"Cho thuê căn hộ DV cửa sổ - rộng 40m2 full nội thất tại Hoàng Hoa Thám, Bình Thạnh","7,5 triệu/tháng",40 m²,"Bình Thạnh, Hồ Chí Minh",cho-thue-nha-tro-phong-tro
"Phòng studio thiết kế hiện đại, cửa sổ thoáng, Thuận tiện đi lại. Nguyễn Đình Chính, Phú Nhuận",7 triệu/tháng,35 m²,"Phú Nhuận, Hồ Chí Minh",cho-thue-nha-tro-phong-tro
"Cho thuê phòng Phú Nhuận. 1 PN, 1WC ban công. Nguyễn Kiệm, Ngã Tư Phú Nhuận","5,2 triệu/tháng",30 m²,"Phú Nhuận, Hồ Chí Minh",cho-thue-nha-tro-phong-tro
Phòng giá rẻ nội thất như hình thoáng mát bếp nhà vệ sinh riêng trung tâm Q1,"4,9 triệu/tháng",25 m²,"Quận 1, Hồ Chí Minh",cho-thue-nha-tro-phong-tro
Phòng có gác Nguyễn Thần Hiến Q4 - cửa sổ lớn sáng thoáng - full nội thất,"6,2 triệu/tháng",30 m²,"Quận 4, Hồ Chí Minh",cho-thue-nha-tro-phong-tro
"Cho thuê phòng Bình Thạnh cửa sổ thoáng. Lê Quang Định, chợ Bà Chiểu","4,5 triệu/tháng",30 m²,"Bình Thạnh, Hồ Chí Minh",cho-thue-nha-tro-phong-tro
"Cho thuê căn hộ gác cao 1m7, diện tích lớn 35m2, giá rẻ 4x ngay Mai Chí Thọ, Sala quận 2","4,3 triệu/tháng",35 m²,"Quận 2, Hồ Chí Minh",cho-thue-nha-tro-phong-tro
"Chính chủ cho thuê studio 30m2, full đồ. Giá: 4,5tr/tháng. Liên hệ: 0367 892 ***","4,5 triệu/tháng",30 m²,"Nam Từ Liêm, Hà Nội",cho-thue-nha-tro-phong-tro
"Studio cạnh chợ Tân Quy, sau Lotte Mart, ĐH RMIT, TDT Quận 7","3,5 triệu/tháng",30 m²,"Quận 7, Hồ Chí Minh",cho-thue-nha-tro-phong-tro
"Cho thuê phòng mới xây, không chung chủ, vệ sinh khép kín","3,2 triệu/tháng",15 m²,"Thanh Trì, Hà Nội",cho-thue-nha-tro-phong-tro
"Phòng trọ ngay mặt tiền đường 3/2, quận 10 gần Vạn Hạnh mall","6,5 triệu/tháng",35 m²,"Quận 10, Hồ Chí Minh",cho-thue-nha-tro-phong-tro
"Cho thuê căn hộ Phú Nhuận. 1 phòng ngủ, 1WC ban công, thang máy. Hoàng Văn Thụ, Ngã Tư Phú Nhuận","5,5 triệu/tháng",25 m²,"Phú Nhuận, Hồ Chí Minh",cho-thue-nha-tro-phong-tro
Căn hộ cửa sổ lớn 40m2 - nội thất cao cấp - ngay Thích Quảng Đức Quận Phú Nhuận,"7,5 triệu/tháng",40 m²,"Phú Nhuận, Hồ Chí Minh",cho-thue-nha-tro-phong-tro
"Căn hộ ban công gần Phú Mỹ Hưng, Cresent Mall, SC Vivo, cầu Ánh Sao Quận 7","5,8 triệu/tháng",35 m²,"Quận 7, Hồ Chí Minh",cho-thue-nha-tro-phong-tro
"(Chung cư) Share phòng ban công cho 1 nữ, gần Lotte Q7, Go!, KCX, Phú Mỹ Hưng, Q1, đủ NT chỉ 3.8tr","3,8 triệu/tháng",15 m²,"Quận 7, Hồ Chí Minh",cho-thue-nha-tro-phong-tro
"Phòng trọ 300/23/23a đường Nguyễn Văn Linh, Quận 7","4,3 triệu/tháng","20,5 m²","Quận 7, Hồ Chí Minh",cho-thue-nha-tro-phong-tro
"Căn studio full nội thất, đầy đủ tiện nghi, gần trục đường Trường Chinh",8 triệu/tháng,40 m²,"Tân Bình, Hồ Chí Minh",cho-thue-nha-tro-phong-tro
Cho thuê phòng số 2 Phan Thúc Duyện - P4 - Tân Bình,"4,8 triệu/tháng",20 m²,"Tân Bình, Hồ Chí Minh",cho-thue-nha-tro-phong-tro
Cho thuê phòng trọ cao cấp full nội thất gần Amata,"4,5 triệu/tháng",32 m²,"Biên Hòa, Đồng Nai",cho-thue-nha-tro-phong-tro
"Cho thuê nhiều phòng có nội thất, căn hộ dịch vụ full nội thất ở cát lái, quận 2","3,5 triệu/tháng",18 m²,"Quận 2, Hồ Chí Minh",cho-thue-nha-tro-phong-tro
Cho thuê phòng duplex ngay Lê Văn Sỹ,8 triệu/tháng,45 m²,"Phú Nhuận, Hồ Chí Minh",cho-thue-nha-tro-phong-tro
"Cho thuê phòng, đầy đủ nội thất, ngay Lê Văn Sỹ",8 triệu/tháng,45 m²,"Phú Nhuận, Hồ Chí Minh",cho-thue-nha-tro-phong-tro
Phòng trống sẵn ngay Lê Văn Sỹ,8 triệu/tháng,45 m²,"Phú Nhuận, Hồ Chí Minh",cho-thue-nha-tro-phong-tro
Cho thuê phòng ngay Bờ Kè Hoàng Sa,8 triệu/tháng,40 m²,"Phú Nhuận, Hồ Chí Minh",cho-thue-nha-tro-phong-tro
"Cho thuê Studio, 1PN, ngay CV Lê Thị Riêng",8 triệu/tháng,40 m²,"Quận 10, Hồ Chí Minh",cho-thue-nha-tro-phong-tro
"Duplex đầy đủ nội thất, không giới hạn người và xe, ngay Lý Thường Kiệt","6,5 triệu/tháng",40 m²,"Quận 10, Hồ Chí Minh",cho-thue-nha-tro-phong-tro
"Khai trương studio ban công máy giặt riêng full nội thất, Trần Quốc Thảo trung tâm quận 3","8,5 triệu/tháng",30 m²,"Quận 3, Hồ Chí Minh",cho-thue-nha-tro-phong-tro
Hệ thống căn hộ DV 1PN - 2PN - máy giặt riêng - Thảo Cầm Viên,"6,5 triệu/tháng",40 m²,"Quận 1, Hồ Chí Minh",cho-thue-nha-tro-phong-tro
"(Chung cư) Share phòng cho 1 nữ, gần Lotte Q7, đầy đủ nội thất, cho nuôi pet, chỉ 4.5tr/phòng","4,5 triệu/tháng",15 m²,"Quận 7, Hồ Chí Minh",cho-thue-nha-tro-phong-tro
Khai trương căn hộ DV Bình Thạnh Thoáng mát gần các trường ĐH Hutech VTVT,6 triệu/tháng,30 m²,"Bình Thạnh, Hồ Chí Minh",cho-thue-nha-tro-phong-tro
Cho thuê phòng tại Vạn Phúc - khu vực nhiều tiện ích,"3,7 triệu/tháng",25 m²,"Hà Đông, Hà Nội",cho-thue-nha-tro-phong-tro
Cần cho thuê phòng studio - 30m2 - cho nuôi pet - thảo cầm viên - chợ Tân Định,"5,5 triệu/tháng",30 m²,"Quận 1, Hồ Chí Minh",cho-thue-nha-tro-phong-tro
"Phòng ngủ đẹp Quận Bình Thạnh, gần trường Hutech, Landmark 81, Hàng Xanh, sát Q1, Q2, KDL Văn Thánh","8,5 triệu/tháng",32 m²,"Bình Thạnh, Hồ Chí Minh",cho-thue-nha-tro-phong-tro
"Phòng Studio Siêu rộng có ban công , full nội thất ra vào vân tay an ninh 24/24","7,5 triệu/tháng",45 m²,"Phú Nhuận, Hồ Chí Minh",cho-thue-nha-tro-phong-tro
"Cho thuê CHDV 1PN Full nội thất, Balcon, Gần sân bay TSN, CV Hoàng Văn Thụ, Đỗ Tấn Phong, Phú Nhuận","5,5 triệu/tháng",35 m²,"Phú Nhuận, Hồ Chí Minh",cho-thue-nha-tro-phong-tro
Siêu phẩm gác xếp đủ đồ siêu thoáng - nhiều tiện ích,"4,2 triệu/tháng",20 m²,"Hà Đông, Hà Nội",cho-thue-nha-tro-phong-tro
Tổng hợp những căn duplex hot nhất Quận 2 - Giá chỉ từ 4. Xxx,"4,2 triệu/tháng",30 m²,"Quận 2, Hồ Chí Minh",cho-thue-nha-tro-phong-tro
Cho thuê phòng studio cửa sổ + thang máy + 35m2 + gần Hai Bà Trưng Quận 1,7 triệu/tháng,35 m²,"Quận 1, Hồ Chí Minh",cho-thue-nha-tro-phong-tro
Khai trương căn hộ mới 100% ban công cửa sổ ngay sân bay Tân Sơn Nhất quận Tân Bình,8 triệu/tháng,35 m²,"Tân Bình, Hồ Chí Minh",cho-thue-nha-tro-phong-tro
"Cho thuê duplex, full nội thất, an ninh 24/24, giờ giấc tự do, gần ĐH Văn Lang, Hutech","5,5 triệu/tháng",35 m²,"Bình Thạnh, Hồ Chí Minh",cho-thue-nha-tro-phong-tro
Căn hộ DV siêu rộng 5p ra chợ Bến Thành,"5,3 triệu/tháng",45 m²,"Quận 1, Hồ Chí Minh",cho-thue-nha-tro-phong-tro
Phòng ban công Thạnh Mỹ Lợi gần UBND Q2,"6,5 triệu/tháng",30 m²,"Quận 2, Hồ Chí Minh",cho-thue-nha-tro-phong-tro
"Phòng sang trọng mới toanh ngay Trường Sa Q. 3, giá tốt",7 triệu/tháng,40 m²,"Quận 3, Hồ Chí Minh",cho-thue-nha-tro-phong-tro
"Phòng cho thuê tách bếp thoáng ngay Nguyễn Văn Đậu, Phan Đăng Lưu, Bình Thạnh",6 triệu/tháng,30 m²,"Bình Thạnh, Hồ Chí Minh",cho-thue-nha-tro-phong-tro
"Cho Nữ thuê phòng giá rẻ trung tâm Đường Thích Quảng Đức, Phường 5, Quận Phú Nhuận",2 triệu/tháng,12 m²,"Phú Nhuận, Hồ Chí Minh",cho-thue-nha-tro-phong-tro
"Căn bancon full nội thất, đầy đủ tiện nghi, gần trục đường Cộng Hòa","7,2 triệu/tháng",40 m²,"Tân Bình, Hồ Chí Minh",cho-thue-nha-tro-phong-tro
"Căn hộ dịch vụ 1PN bancon full nội thất, đầy đủ tiện nghi, gần sân bay Tân Sơn Nhất","13,6 triệu/tháng",40 m²,"Tân Bình, Hồ Chí Minh",cho-thue-nha-tro-phong-tro
"Còn 01 phòng gia đình 40m2 Trịnh Văn Bô, Nhà mới TM, giá 4tr/tháng",4 triệu/tháng,40 m²,"Nam Từ Liêm, Hà Nội",cho-thue-nha-tro-phong-tro
