Title,Price,Area,Location,type
"Cho thuê đất MT đường 17 , P Tân Chánh Hiệp, Quận 12",450 triệu/tháng,45.126 m²,"Quận 12, Hồ Chí Minh",cho-thue-kho-nha-xuong-dat
"Cho thuê kho chứa hàng Đường Tam Bình, phường Tam Phú, Thủ Đức",16 triệu/tháng,200 m²,"Thủ Đức, Hồ Chí Minh",cho-thue-kho-nha-xuong-dat
Cho thuê nhà xưởng DT 1600m2 đường Hồ Văn Tắng,15 triệu/tháng,1.600 m²,"Củ Chi, Hồ Chí Minh",cho-thue-kho-nha-xuong-dat
"Cho thuê kho, xưởng DT 230m2, gần chợ Đại Hải đường Phan Văn Hớn",14 triệu/tháng,230 m²,"Hóc Môn, Hồ Chí Minh",cho-thue-kho-nha-xuong-dat
"Cho thuê kho xưởng Đào Sư Tích, 400m2, giá 28 triệu/th, xe 10 tấn",28 triệu/tháng,400 m²,"Nhà Bè, Hồ Chí Minh",cho-thue-kho-nha-xuong-dat
"Chính chủ cho thuê đất mặt tiền đường Nguyễn Hữu Cảnh, Nhơn Trạch, DT: 278m2, giá chỉ 8 triệu",8 triệu/tháng,278 m²,"Nhơn Trạch, Đồng Nai",cho-thue-kho-nha-xuong-dat
Cho thuê 12000m2 nhà xưởng giá 77.900đ/m2/th,"77,9 nghìn/m²",12.000 m²,"Từ Sơn, Bắc Ninh",cho-thue-kho-nha-xuong-dat
"Cho thuê kho xưởng hẻm HXH 109D/40 Lạc Long Quân, DT: 265m2 giá chỉ 30tr/tháng",30 triệu/tháng,265 m²,"Quận 11, Hồ Chí Minh",cho-thue-kho-nha-xuong-dat
Cho thuê xưởng 270m2 P. Long Bình gần KCN 2. KCN Long Bình giá 14tr/tháng,14 triệu/tháng,270 m²,"Biên Hòa, Đồng Nai",cho-thue-kho-nha-xuong-dat
"Cho thuê xưởng Hố Nai, Biên Hòa 1680m2. Gần đường Nguyễn Ái Quốc. Giá chỉ 17tr/tháng",17 triệu/tháng,1.680 m²,"Biên Hòa, Đồng Nai",cho-thue-kho-nha-xuong-dat
"Cho thuê 360m2 kho xưởng Đình Xuyên, Gia Lâm, Hà Nội, giá 60 nghìn/m2 có VAT",60 nghìn/m²,360 m²,"Gia Lâm, Hà Nội",cho-thue-kho-nha-xuong-dat
"Cho thuê kho đường Gò Ô Môi, 220m2, giá 20 triệu/tháng",20 triệu/tháng,220 m²,"Quận 7, Hồ Chí Minh",cho-thue-kho-nha-xuong-dat
"Cho thuê 170m2 kho xưởng đường Tân Khai, giữa Lĩnh Nam và Vĩnh Hưng, xe 2,5 tấn vào, giá 12 triệu",12 triệu/tháng,170 m²,"Hoàng Mai, Hà Nội",cho-thue-kho-nha-xuong-dat
Kho xưởng Thạnh Xuân 25 gần cầu Ba Tấn Quận 12,13 triệu/tháng,242 m²,"Quận 12, Hồ Chí Minh",cho-thue-kho-nha-xuong-dat
Cho thuê kho 2.200m2 giá 146tr/tháng tại kcn Tân Bình,146 triệu/tháng,2.200 m²,"Tân Phú, Hồ Chí Minh",cho-thue-kho-nha-xuong-dat
"Cho thuê xưởng 360m2 có điện 3 pha, có văn phòng tại Vĩnh Phú Bình Dương",25 triệu/tháng,360 m²,"Thuận An, Bình Dương",cho-thue-kho-nha-xuong-dat
Cho thuê kho tại cụm công nghiệp Nam Từ Liêm Hà Nội chính chủ,Giá thỏa thuận,2.000 m²,"Nam Từ Liêm, Hà Nội",cho-thue-kho-nha-xuong-dat
"Cho thuê ngay 10.000 m2 kho, xưởng, nhà máy giá rẻ, có cầu trục, PCCC KCN Thạch Thất Hà Nội",1 tỷ/tháng,10.000 m²,"Thạch Thất, Hà Nội",cho-thue-kho-nha-xuong-dat
"Cho thuê kho tại Quốc lộ 17, Thuận Thành Bắc Ninh từ 1500m2 tới 3300m2 chính chủ có PCCC",70 nghìn/m²,1.500 m²,"Thuận Thành, Bắc Ninh",cho-thue-kho-nha-xuong-dat
Kho xưởng 1/ Hà Huy Giáp - xưởng mới sạch đẹp cho thuê lâu dài,20 triệu/tháng,300 m²,"Quận 12, Hồ Chí Minh",cho-thue-kho-nha-xuong-dat
"2000m2 mặt tiền Tam Đa, Quận 9, cho thuê kho bãi, xưởng",15 nghìn/m²,2.000 m²,"Quận 9, Hồ Chí Minh",cho-thue-kho-nha-xuong-dat
"Cho thuê lô đất đường Minh Khai làm nhà hàng, quán bar, DT 800m2. Liên hệ 0906 218 ***",160 triệu/tháng,800 m²,"Hai Bà Trưng, Hà Nội",cho-thue-kho-nha-xuong-dat
"Cho thuê kho xưởng 2000m2 đường Võ Nguyên Giáp, Cần Thơ",85 triệu/tháng,2.000 m²,"Cái Răng, Cần Thơ",cho-thue-kho-nha-xuong-dat
Cho thuê kho kiệt Dương Thiệu Tước 200m2 giá 2tr/th,2 triệu/tháng,200 m²,"Hương Thủy, Thừa Thiên Huế",cho-thue-kho-nha-xuong-dat
"Cho thuê 1500m2 kho chứa hàng tại Lai Xá, Hoài Đức. LH 0906 218 ***",Giá thỏa thuận,1.500 m²,"Hoài Đức, Hà Nội",cho-thue-kho-nha-xuong-dat
"Cho thuê nhà xưởng hiện đại tại CCN Bình Giang, Hải Dương. LH 0906 218 ***",79 nghìn/m²,4.000 m²,"Bình Giang, Hải Dương",cho-thue-kho-nha-xuong-dat
"Cần tìm đối tác cho lô đất trung tâm Hạ Long 12500m2, làm cấp 1,2 cho thuê, bán, hợp tác",Giá thỏa thuận,12.500 m²,"Hạ Long, Quảng Ninh",cho-thue-kho-nha-xuong-dat
Chính chủ cho thuê kho 1100m2 tại Biên Giang container vào tận xưởng,50 nghìn/m²,1.100 m²,"Hà Đông, Hà Nội",cho-thue-kho-nha-xuong-dat
"Cho thuê mặt bằng kinh doanh đường Phúc Lợi, S= 300m2, phù hợp làm kinh doanh. LH: 0985 914 ***",35 triệu/tháng,350 m²,"Long Biên, Hà Nội",cho-thue-kho-nha-xuong-dat
"Cho thuê lâu dài lô đất 500m2 số 189B Nguyễn Văn Hưởng, Thảo Điền làm nhà hàng quán bar",120 triệu/tháng,500 m²,"Quận 2, Hồ Chí Minh",cho-thue-kho-nha-xuong-dat
"Cho thuê kho diện tích 300m2 tại Thảo Điền, đường xe tải 5 tấn chỉ có 30 triệu",30 triệu/tháng,300 m²,"Quận 2, Hồ Chí Minh",cho-thue-kho-nha-xuong-dat
"Cho thuê đất trống, nền xi măng, gần 600m2 giá chỉ 50 triệu - đường 2",50 triệu/tháng,580 m²,"Quận 2, Hồ Chí Minh",cho-thue-kho-nha-xuong-dat
"Cần cho thuê 1,3 ha đất gần cầu Long Đại, P. Long Phước, TP Thủ Đức",75 triệu/tháng,13.000 m²,"Quận 9, Hồ Chí Minh",cho-thue-kho-nha-xuong-dat
Cho thuê kho mặt tiền đường Lê Cơ,100 triệu/tháng,1.000 m²,"Bình Tân, Hồ Chí Minh",cho-thue-kho-nha-xuong-dat
"Cho thuê kho xưởng mới xây ngay KCN An Phước Đồng Nai, hiện đại, thông thoáng",Giá thỏa thuận,10.000 m²,"Long Thành, Đồng Nai",cho-thue-kho-nha-xuong-dat
Kho xưởng 235m2 Tân Đông Hiệp Dĩ An gần vsip1. Gần 550 giá mùa suy thoái 10tr 1th không có điện 3fa,10 triệu/tháng,235 m²,"Dĩ An, Bình Dương",cho-thue-kho-nha-xuong-dat
"Cho thuê đất đường Trung Văn làm nhà kho, xưởng 120m2, 3 mặt tiền, ô tô đỗ thoải mái giá 15 tr/th",15 triệu/tháng,120 m²,"Nam Từ Liêm, Hà Nội",cho-thue-kho-nha-xuong-dat
Quá rẻ quá đẹp vị trí trung tâm sản xuất đa ngành,130 triệu/tháng,3.100 m²,"Tân Uyên, Bình Dương",cho-thue-kho-nha-xuong-dat
Cho thuê kho logistic khu công nghiệp Vsip 2 từ 2.000m2 - 30.000m2 (và khu vực lân cận Bình Dương),82 nghìn/m²,2.000 m²,"Thủ Dầu Một, Bình Dương",cho-thue-kho-nha-xuong-dat
"Cho thuê kho 280m2 Nguyễn Văn Quỳ, giá 23 triệu/th",23 triệu/tháng,280 m²,"Quận 7, Hồ Chí Minh",cho-thue-kho-nha-xuong-dat
"Cho thuê 1600m2 (ngang 20m) mặt tiền Đại Lộ Bình Dương, P. Phú Thọ, TP. Thủ Dầu Một",80 triệu/tháng,2.000 m²,"Thủ Dầu Một, Bình Dương",cho-thue-kho-nha-xuong-dat
"Cho thuê kho trong KCN Yên Nghĩa, xe công vào tận nơi, phù hợp làm xưởng sản xuất, kho chứa hàng",70 nghìn/m²,200 m²,"Hà Đông, Hà Nội",cho-thue-kho-nha-xuong-dat
Cần cho thuê kho xưởng 500 - 1000m2 tại KCN Thanh Oai,70 nghìn/m²,500 m²,"Thanh Oai, Hà Nội",cho-thue-kho-nha-xuong-dat
"Cho thuê kho xưởng khu Yên Nghĩa diện tích 1000m2, 45k/m2, điện nước đủ, xe công vào thoải mái",45 nghìn/m²,1.000 m²,"Hà Đông, Hà Nội",cho-thue-kho-nha-xuong-dat
"Cho thuê ngay kho xưởng trong KCN Thanh Oai TP Hà Nội, điện 3 pha đầy đủ, xe công thoải mái",65 nghìn/m²,1.000 m²,"Thanh Oai, Hà Nội",cho-thue-kho-nha-xuong-dat
"Cho thuê kho xưởng tại KCN An Khánh Hoài Đức, S từ 300 - 1500m2, điện 3 pha, xe công vào thoải mái",65 nghìn/m²,1.500 m²,"Hoài Đức, Hà Nội",cho-thue-kho-nha-xuong-dat
"Cho thuê kho xưởng khu Đồng Nhân, Xã Đông La, huyện Hoài Đức, diện tích 200 đến 1000m2",45 nghìn/m²,1.000 m²,"Hoài Đức, Hà Nội",cho-thue-kho-nha-xuong-dat
Cho thuê kho / xưởng 650m2 cuối đường Lê Trọng Tấn,50 triệu/tháng,650 m²,"Tân Phú, Hồ Chí Minh",cho-thue-kho-nha-xuong-dat
Kho xưởng 200m trống suốt xe cont 24/24 giá rẻ ngã 4 Bình Phước Chợ Đầu Mối,12 triệu/tháng,200 m²,"Thủ Đức, Hồ Chí Minh",cho-thue-kho-nha-xuong-dat
"Kho 300m2 mặt tiền Trường Chinh, làm showroom, gần cầu Tham Lương, giá rẻ",39 triệu/tháng,300 m²,"Quận 12, Hồ Chí Minh",cho-thue-kho-nha-xuong-dat
"Cho thuê 2000m2 nhà xưởng Hóc Môn, giá tốt",100 triệu/tháng,2.000 m²,"Hóc Môn, Hồ Chí Minh",cho-thue-kho-nha-xuong-dat
"Cho thuê kho xưởng mới dựng, 1000-5000m2 CCN Phú Thị và lân cận tại Gia Lâm. LH 0934 583 ***",65 nghìn/m²,1.000 m²,"Gia Lâm, Hà Nội",cho-thue-kho-nha-xuong-dat
"Cho thuê kho xưởng 1.500m2 gần QL1A, Phường Linh Xuân, TP. Thủ Đức",89 triệu/tháng,1.500 m²,"Thủ Đức, Hồ Chí Minh",cho-thue-kho-nha-xuong-dat
Cho thuê kho 350m2 đường Hoàng Quốc Việt giá 30tr/th. LH: Duy 0789 070 ***,30 triệu/tháng,350 m²,"Quận 7, Hồ Chí Minh",cho-thue-kho-nha-xuong-dat
"Cho thuê xưởng trong và ngoài KCN tại Bắc Giang, Bắc Ninh liên hệ: 0866 686 ***",Giá thỏa thuận,4.500 m²,"Việt Yên, Bắc Giang",cho-thue-kho-nha-xuong-dat
"Cho thuê mặt bằng kho xưởng từ 500m ở Thanh Oai, pháp lí đầy đủ, giá 80k/m2. LH 0965 730 ***",80 nghìn/m²,500 m²,"Thanh Oai, Hà Nội",cho-thue-kho-nha-xuong-dat
Cho thuê kho xưởng quận 12. Diện tích gần 700m2. Điện 400 kVA. Đường công 24/24,40 triệu/tháng,650 m²,"Quận 12, Hồ Chí Minh",cho-thue-kho-nha-xuong-dat
Cho thuê kho xưởng mặt tiền Kha Vạn Cân ngay cầu Bình Triệu gần trung tâm TP. DT 500m2 và 1000m2,50 triệu/tháng,500 m²,"Thủ Đức, Hồ Chí Minh",cho-thue-kho-nha-xuong-dat
"Kho xưởng 3000m2 ngay khu vực Tân Phú cho thuê, ưu tiên cầu lông, chuyển phát nhanh",200 triệu/tháng,3.000 m²,"Tân Phú, Hồ Chí Minh",cho-thue-kho-nha-xuong-dat
"Kho Phan Huy Ích, DT 4.600m2, phù hợp cầu lông, xưởng sản xuất",250 triệu/tháng,4.600 m²,"Tân Bình, Hồ Chí Minh",cho-thue-kho-nha-xuong-dat
"Kho KCN Tân Bình, DT 1000m2, đầy đủ tiện ích, phù hợp làm kho xưởng sản xuất",100 triệu/tháng,1.000 m²,"Tân Phú, Hồ Chí Minh",cho-thue-kho-nha-xuong-dat
Cho thuê kho xưởng*1.720m2 - 2.100m2 - 2.820m2 trong KCN Cát Lái Quận 2,149 triệu/tháng,1.720 m²,"Quận 2, Hồ Chí Minh",cho-thue-kho-nha-xuong-dat
"Cho thuê kho xưởng * 900m2 Tăng Nhơn Phú, Phước Long B, Quận Thủ Đức",72 triệu/tháng,900 m²,"Thủ Đức, Hồ Chí Minh",cho-thue-kho-nha-xuong-dat
"Cho thuê kho MT 94 Nguyễn Văn Cự, (10x42m), 27tr/tháng",27 triệu/tháng,420 m²,"Bình Tân, Hồ Chí Minh",cho-thue-kho-nha-xuong-dat
"Cho thuê kho đất MT Lê Ngung (1200m2), gần Quốc Lộ, ưu tiên thuê dài hạn",30 triệu/tháng,180 m²,"Bình Tân, Hồ Chí Minh",cho-thue-kho-nha-xuong-dat
"Cho thuê 4lô đất 1000 m2 góc 3 mặt tiền đường Tôn Đức Thắng, KĐT Phú Cường, TP Rạch Giá, Kiên Giang",30 triệu/tháng,1.000 m²,"Rạch Giá, Kiên Giang",cho-thue-kho-nha-xuong-dat
"Kho cho thuê diện tích nhỏ ngay cạnh KCN Tân Bình giá tốt, đầy đủ dịch vụ bốc xếp, xe nâng",3 triệu/tháng,20 m²,"Tân Bình, Hồ Chí Minh",cho-thue-kho-nha-xuong-dat
Cho thuê đất khu công nghiệp với cơ sở hạ tầng hoàn thiện 100%,Giá thỏa thuận,5.000 m²,"Hàm Thuận Nam, Bình Thuận",cho-thue-kho-nha-xuong-dat
"Cho thuê kho 5000m2 (XD: 3200m2) ở KCN Hải Sơn. Có văn phòng, PCCC tự động, trạm hạ thế",210 triệu/tháng,3.200 m²,"Đức Hòa, Long An",cho-thue-kho-nha-xuong-dat
Cho thuê nhà xưởng 2000m2 - 5000m2 tại Thanh Hóa. Trong và ngoài khu công nghiệp,10 nghìn/m²,2.500 m²,"Thanh Hóa, Thanh Hóa",cho-thue-kho-nha-xuong-dat
Cho thuê xưởng sản xuất - logistics - nhà kho 396m2 - 1000 - 5000m2,30 triệu/tháng,396 m²,"Bình Chánh, Hồ Chí Minh",cho-thue-kho-nha-xuong-dat
Cho thuê kho xưởng gần sân bay - DTSD: 3197m2,70 nghìn/m²,2.216 m²,"Bình Thủy, Cần Thơ",cho-thue-kho-nha-xuong-dat
"Cho thuê góc đất 2 mặt tiền 491m2. Đường số 18 Hiệp Bình Chánh, Thủ Đức",47 triệu/tháng,491 m²,"Thủ Đức, Hồ Chí Minh",cho-thue-kho-nha-xuong-dat
"Cho thuê kho xưởng 1000-3000-5000m2 LKCN Phú nghĩa Chương Mỹ, giá 65k/m2/th có PCCC, LH 0384 300 ***",75 nghìn/m²,2.000 m²,"Chương Mỹ, Hà Nội",cho-thue-kho-nha-xuong-dat
Cho thuê dài hạn đất góc 3 mặt tiền Võ Nguyên Giáp,300 triệu/tháng,5.000 m²,"Cái Răng, Cần Thơ",cho-thue-kho-nha-xuong-dat
"Cho thuê kho xưởng tại Vân Côn Hoài Đức 300, 400, 500 700, 1000, 3000m2 giá 35 - 40k/m2, 0384 300 ***",55 nghìn/m²,1.000 m²,"Hoài Đức, Hà Nội",cho-thue-kho-nha-xuong-dat
Cho thuê kho hoặc xưởng ở cụm công nghiệp An Lão Hải Phòng,30 nghìn/m²,5.000 m²,"An Lão, Hải Phòng",cho-thue-kho-nha-xuong-dat
"Cần cho thuê Lô đất 3 mặt tiền xây cao tầng gần cầu Nguyễn Tri Phương, Đà Nẵng",40 triệu/tháng,1.110 m²,"Cẩm Lệ, Đà Nẵng",cho-thue-kho-nha-xuong-dat
"Cho thuê kho Đức Thượng đường 32 Hoài Đức DT 200 - 300 - 500 - 1000m2, giá 50k/m2, LH 0384 300 ***",50 nghìn/m²,300 m²,"Hoài Đức, Hà Nội",cho-thue-kho-nha-xuong-dat
Cho thuê kho 1600m2 giá 160 triệu/tháng đường Hồ Học Lãm phường 16 Quận 8 TPHCM,160 triệu/tháng,1.600 m²,"Quận 8, Hồ Chí Minh",cho-thue-kho-nha-xuong-dat
"Cho thuê kho KCN Thạch Thất Quốc Oai 500 - 1000m2, 2000m2, 5000m2, 10.000m2, LH 0384 300 ***",100 nghìn/m²,1.000 m²,"Thạch Thất, Hà Nội",cho-thue-kho-nha-xuong-dat
"Cho thuê kho xưởng 1.000 m2 giá 55 triệu còn thương lượng xã Đức Hòa Hạ, huyện Đức Hòa, Long An",55 triệu/tháng,1.000 m²,"Đức Hòa, Long An",cho-thue-kho-nha-xuong-dat
Cho thuê 1300 - 2500m2 kho xưởng PCCC tự động nghiệm thu tại KCN Phú Nghĩa - Chương Mỹ,70 nghìn/m²,2.500 m²,"Chương Mỹ, Hà Nội",cho-thue-kho-nha-xuong-dat
"Cho thuê kho 3500 m2 giá 65 nghìn đ/m2 đường Trần Đại Nghĩa, xã Tân Nhựt, huyện Bình Chánh TPHCM",65 nghìn/m²,3.500 m²,"Bình Chánh, Hồ Chí Minh",cho-thue-kho-nha-xuong-dat
Cho thuê kho xưởng 500 m2 giá 25 triệu khu công nghiệp Thịnh Phát xã Lương Bình Bến Lức Long An,25 triệu/tháng,500 m²,"Bến Lức, Long An",cho-thue-kho-nha-xuong-dat
"Cho thuê xưởng mặt tiền Ao Đôi, Q. Bình Tân, TP. HCM, 18x40m giá 40tr/tháng",40 triệu/tháng,720 m²,"Bình Tân, Hồ Chí Minh",cho-thue-kho-nha-xuong-dat
Cho thuê kho xưởng KCN VSIP Thuỷ Nguyên,Giá thỏa thuận,5.000 m²,"Thủy Nguyên, Hải Phòng",cho-thue-kho-nha-xuong-dat
"Cho thuê kho xưởng PCCC tại Thụy Phương - Bắc Từ Liêm - HN, Diện tích: 1500 - 3000m2",85 nghìn/m²,3.000 m²,"Bắc Từ Liêm, Hà Nội",cho-thue-kho-nha-xuong-dat
Cho thuê 5000m kho xưởng PCCC tự động nghiệm thu tại cụm CN Hà Bình Phương - Thường Tín,90 nghìn/m²,5.000 m²,"Thường Tín, Hà Nội",cho-thue-kho-nha-xuong-dat
"Cho thuê kho xưởng tại cụm CN Dương Liễu - Hoài Đức - HN, diện tích: 500 - 1000m2",Giá thỏa thuận,1.000 m²,"Hoài Đức, Hà Nội",cho-thue-kho-nha-xuong-dat
"Cho thuê kho tiêu chuẩn PCCC tự động nghiệm thu tại KCN Quang Minh, DT: 3000 - 9000m2",Giá thỏa thuận,9.000 m²,"Mê Linh, Hà Nội",cho-thue-kho-nha-xuong-dat
Cho thuê kho xưởng tại Đồng Tháp - Đan Phượng - HN. DT: 2700m2,50 nghìn/m²,2.700 m²,"Đan Phượng, Hà Nội",cho-thue-kho-nha-xuong-dat
"Cho thuê kho xưởng PCCC nghiệm thu tại Văn Giang - Hưng Yên, diện tích 3000m2",65 nghìn/m²,3.000 m²,"Văn Giang, Hưng Yên",cho-thue-kho-nha-xuong-dat
"Cho thuê kho xưởng Cụm CN Di Trạch - Hoaì Đức - Hà Nội, DT: 1000 - 2000 - 4000m2",50 nghìn/m²,2.000 m²,"Hoài Đức, Hà Nội",cho-thue-kho-nha-xuong-dat
Cho thuê kho xưởng tại Lai Xá - Hoài Đức - HN,70 nghìn/m²,500 m²,"Hoài Đức, Hà Nội",cho-thue-kho-nha-xuong-dat
Cho thuê kho xưởng PCCC tự động tại cụm CN Hà Mãn- Thuận Thành - Bắc Ninh,75 nghìn/m²,3.000 m²,"Thuận Thành, Bắc Ninh",cho-thue-kho-nha-xuong-dat
Cho thuê 150m2 kho xưởng tại Phúc Diễn - Bắc Từ Liêm,13 triệu/tháng,150 m²,"Bắc Từ Liêm, Hà Nội",cho-thue-kho-nha-xuong-dat
"Cho thuê đất MT: 10x27m, Đường 449 Phường Tăng Nhơn Phú A, Quận 9. Giá 10tr/tháng",10 triệu/tháng,270 m²,"Quận 9, Hồ Chí Minh",cho-thue-kho-nha-xuong-dat
"Cho thuê kho 680m2 giá rẻ ngã tư Ga - quận 12, đủ loại diện tích. Cường 0936 379 ***",28 triệu/tháng,680 m²,"Quận 12, Hồ Chí Minh",cho-thue-kho-nha-xuong-dat
"Cho thuê kho 2300m2 trong KCN Tân Bình. PCCC tự động nghiệm thu, 4 cửa xuất nhập.",Giá thỏa thuận,2.300 m²,"Tân Phú, Hồ Chí Minh",cho-thue-kho-nha-xuong-dat
Tôi cho thuê kho - xưởng mặt tiền Quốc lộ 1A và các KCN Đà Nẵng,50 triệu/tháng,1.000 m²,"Liên Chiểu, Đà Nẵng",cho-thue-kho-nha-xuong-dat
Cho thuê nhà xưởng nằm đường Võ Văn Bích Bình Mỹ Củ Chi DT: 300m2 giá 10 tr/th. LH: 0908 561 ***,10 triệu/tháng,300 m²,"Củ Chi, Hồ Chí Minh",cho-thue-kho-nha-xuong-dat
"Cho thuê nhà xưởng đường Phan Văn Hớn, Hóc Môn DT: 400m2 giá 20 triệu/tháng LH: 0908 561 ***",20 triệu/tháng,400 m²,"Hóc Môn, Hồ Chí Minh",cho-thue-kho-nha-xuong-dat
Cho thuê kho liền biệt thự tại Q9,100 triệu/tháng,1.698 m²,"Thủ Đức, Hồ Chí Minh",cho-thue-kho-nha-xuong-dat
Cho thuê Kho 3500m2 - 5000m2 - 7000m2 full PCCC tự động tại KCN Hoà Khánh,200 triệu/tháng,3.500 m²,"Liên Chiểu, Đà Nẵng",cho-thue-kho-nha-xuong-dat
"Cho thuê kho xưởng ngay Cảng Phú Hữu, Q9. DTKV 1000m2, kho 700m2, gác 100m2",110 triệu/tháng,1.000 m²,"Quận 9, Hồ Chí Minh",cho-thue-kho-nha-xuong-dat
"Cho thuê kho xưởng tại Phú Thạnh, Nhơn Trạch, Đồng Nai. TDT 13.500m2, gía 458tr/th",458 triệu/tháng,8.000 m²,"Nhơn Trạch, Đồng Nai",cho-thue-kho-nha-xuong-dat
"Cho thuê đất nông nghiệp trồng lúa nước, KV Kiên Giang",Giá thỏa thuận,500.000 m²,"Hòn Đất, Kiên Giang",cho-thue-kho-nha-xuong-dat
"Cho thuê kho xưởng KCN Thọ Quang và An Đồn, Sơn Trà 200m2, 300m2, 500m2, 750m2, 1000m2, 2200m2",18 triệu/tháng,360 m²,"Sơn Trà, Đà Nẵng",cho-thue-kho-nha-xuong-dat
"Cho thuê kho xưởng 1000m2 tại Thọ Quang, Sơn Trà - Đà Nẵng",60 triệu/tháng,1.000 m²,"Sơn Trà, Đà Nẵng",cho-thue-kho-nha-xuong-dat
"Cho thuê kho mới 1500m2 - 4000m2 KCN Hiệp Phước, Nhà Bè. PCCC tự động, nền Epoxy. Giá từ 105tr",105 triệu/tháng,1.500 m²,"Nhà Bè, Hồ Chí Minh",cho-thue-kho-nha-xuong-dat
"Cho thuê kho mới 2000m2 trong KCN Hải Sơn. PCCC tự động, điện 560kva. Giá 140 triệu/th",140 triệu/tháng,2.000 m²,"Đức Hòa, Long An",cho-thue-kho-nha-xuong-dat
"Cho thuê kho mới 1300m2 ở Bến Lức, giáp Bình Chánh. Đường container, điện 3fa. Giá 45tr",45 triệu/tháng,1.300 m²,"Bến Lức, Long An",cho-thue-kho-nha-xuong-dat
"Cho thuê kho xưởng 2000m2 gần KCN Tân Tạo, đường Cont tự do, trạm hạ thế. Giá 90 tr/th",90 triệu/tháng,1.700 m²,"Bình Tân, Hồ Chí Minh",cho-thue-kho-nha-xuong-dat
"Cho thuê kho 1000m2 - 4000m2 ở QL 1A gần Nguyễn Văn Linh. Container 24/24, PCCC tự động. Giá 70k/m2",70 nghìn/m²,1.500 m²,"Bình Chánh, Hồ Chí Minh",cho-thue-kho-nha-xuong-dat
"Cho thuê kho xưởng (12x30)m, 400m2, giá 25tr/th, ngay cầu tham lương",25 triệu/tháng,450 m²,"Tân Phú, Hồ Chí Minh",cho-thue-kho-nha-xuong-dat
"Cho thuê kho 72m2 Cư Xá Điện Lực, Trường Thọ, Thủ Đức",7 triệu/tháng,72 m²,"Thủ Đức, Hồ Chí Minh",cho-thue-kho-nha-xuong-dat
Kho xưởng cho thuê mặt tiền đường Tô Vĩnh Diện. Kinh doanh được đa ngành nghề!,22 triệu/tháng,330 m²,"Tân Uyên, Bình Dương",cho-thue-kho-nha-xuong-dat
"X578. Cho thuê kho xưởng mặt đường Nguyễn Văn Linh 195,5m2 xe tải nhỏ ra vào thoải mái",25 triệu/tháng,"195,5 m²","Lê Chân, Hải Phòng",cho-thue-kho-nha-xuong-dat
"Cho thuê xưởng hoặc kho chứa hàng, phường An Phú 1500m2 TP. Thuận An, Bình Dương",75 triệu/tháng,1.500 m²,"Thuận An, Bình Dương",cho-thue-kho-nha-xuong-dat
"Cho thuê kho xưởng 2100m2. PCCC vách tường. TP Thuận An, Bình Dương LH: 0908 954 ***",110 triệu/tháng,2.100 m²,"Thuận An, Bình Dương",cho-thue-kho-nha-xuong-dat
"Cho thuê đất làm kho trung chuyển hoặc nhà xe, nuôi gà",5 triệu/tháng,100 m²,"Thuận An, Bình Dương",cho-thue-kho-nha-xuong-dat
"Cho thuê kho hơn 200m2 đường Gò Ô Môi, Phú Thuận, Quận 7",20 triệu/tháng,220 m²,"Quận 7, Hồ Chí Minh",cho-thue-kho-nha-xuong-dat
"Cho thuê mặt bằng 550m2, MT 16m, mặt phố Nguyễn Trãi, Thanh Xuân làm showroom, điện máy, siêu thị",Giá thỏa thuận,550 m²,"Thanh Xuân, Hà Nội",cho-thue-kho-nha-xuong-dat
"Mình cần cho thuê kho quận Bình Thạnh, P13, đường Đặng Thuỳ Trâm - DT 10x13m - đường xe tải 5 tấn",20 triệu/tháng,130 m²,"Bình Thạnh, Hồ Chí Minh",cho-thue-kho-nha-xuong-dat
"Cho thuê kho, xưởng mới khu Tân Quang, Văn Lâm DT 1000,1500m2, 2000m2, 3000m2, 4000m2, 5000m2",Giá thỏa thuận,2.000 m²,"Văn Lâm, Hưng Yên",cho-thue-kho-nha-xuong-dat
Cần cho thuê kho Bình Thạnh - 100m2 - đường xe oto tránh nhau - có gác,17 triệu/tháng,100 m²,"Bình Thạnh, Hồ Chí Minh",cho-thue-kho-nha-xuong-dat
"Mình cần cho thuê kho Bình Thạnh, P13 - 200m2 - giá 27 triệu/tháng",27 triệu/tháng,200 m²,"Bình Thạnh, Hồ Chí Minh",cho-thue-kho-nha-xuong-dat
Mình cần cho thuê kho Bình Thạnh - DTSD 280m2 - giá 25 triệu/tháng - đường xe 5 tấn,25 triệu/tháng,280 m²,"Bình Thạnh, Hồ Chí Minh",cho-thue-kho-nha-xuong-dat
Cần cho thuê kho Bình Thạnh - 200m2 - đường xe tải 5 tấn - có gác 80m2,30 triệu/tháng,200 m²,"Bình Thạnh, Hồ Chí Minh",cho-thue-kho-nha-xuong-dat
"Cần cho thuê kho Bình Thạnh, P13 - DT 200m2 - đường xe tải 5 tấn",30 triệu/tháng,200 m²,"Bình Thạnh, Hồ Chí Minh",cho-thue-kho-nha-xuong-dat
Cho thuê mặt bằng đất trống 78m ngang mặt tiền Quản Lộ Phụng Hiệp,Giá thỏa thuận,7.100 m²,"Phước Long, Bạc Liêu",cho-thue-kho-nha-xuong-dat
"Cho thuê kho, xưởng mới 100% tiêu chuẩn cao khu Vsip, Bắc Ninh DT 1000m2 đến 100.000m2 giá tốt",Giá thỏa thuận,1.000 m²,"Từ Sơn, Bắc Ninh",cho-thue-kho-nha-xuong-dat
"Cần cho thuê gấp 1,5ha, bãi đất trống, mặt tiền đường Đào Trí, P. Phú Thuận, Q7",35 nghìn/m²,15.000 m²,"Quận 7, Hồ Chí Minh",cho-thue-kho-nha-xuong-dat
Cho thuê xưởng 8000m2 400tr Bàu Bàng - Bình Dương,400 triệu/tháng,8.000 m²,"Bàu Bàng, Bình Dương",cho-thue-kho-nha-xuong-dat
Cho thuê xưởng 9000m2 720tr KCN Bến Cát 0907 838 ***,720 triệu/tháng,9.000 m²,"Bến Cát, Bình Dương",cho-thue-kho-nha-xuong-dat
"Cho thuê kho xưởng 4000m2 tại Bàu Bàng, Bình Dương. Kho xưởng chuẩn cho DN, giá cho thuê rẻ",35 nghìn/m²,4.000 m²,"Bàu Bàng, Bình Dương",cho-thue-kho-nha-xuong-dat
Cho thuê xưởng 2000m2 50tr/th Định Hoà - TDM,50 triệu/tháng,2.000 m²,"Thủ Dầu Một, Bình Dương",cho-thue-kho-nha-xuong-dat
"Cho thuê kho xưởng 20,000m2 tại Bàu Bàng, Bình Dương, cho thuê lẻ theo yêu cầu, chuyên kho xưởng",60 nghìn/m²,20.000 m²,"Bàu Bàng, Bình Dương",cho-thue-kho-nha-xuong-dat
"Cho thuê xưởng 2700m2, 100tr Đức Hoà - Long an",100 triệu/tháng,2.700 m²,"Đức Hòa, Long An",cho-thue-kho-nha-xuong-dat
Cho thuê xưởng 2700m2 130tr Dĩ An,130 triệu/tháng,2.700 m²,"Dĩ An, Bình Dương",cho-thue-kho-nha-xuong-dat
"Cho thuê xưởng 3500m2, 150tr An Tây - Bến Cát",150 triệu/tháng,3.500 m²,"Bến Cát, Bình Dương",cho-thue-kho-nha-xuong-dat
Cho thuê xưởng 2500m2 115tr Long Thành - ĐN,115 triệu/tháng,2.500 m²,"Long Thành, Đồng Nai",cho-thue-kho-nha-xuong-dat
"Cho thuê xưởng 4000m2, 150tr/th, Đức Hoà - Long An",150 triệu/tháng,6.000 m²,"Đức Hòa, Long An",cho-thue-kho-nha-xuong-dat
Cho thuê xưởng 2200m2 và 2700m2 KCN Long Thành-ĐN,250 triệu/tháng,2.200 m²,"Long Thành, Đồng Nai",cho-thue-kho-nha-xuong-dat
Cho thuê xưởng 8000m2 450tr Lai Hưng - Bàu Bàng,450 triệu/tháng,8.000 m²,"Bàu Bàng, Bình Dương",cho-thue-kho-nha-xuong-dat
"Cho thuê xưởng 1000m2, 38 triệu/tháng Bình Mỹ gần VSIP 2: 0907 838 ***",38 triệu/tháng,1.000 m²,"Bắc Tân Uyên, Bình Dương",cho-thue-kho-nha-xuong-dat
"Cho thuê xưởng 15,000m2, Long Thành, 0907 838 ***",750 triệu/tháng,15.000 m²,"Long Thành, Đồng Nai",cho-thue-kho-nha-xuong-dat
"Cho thuê xưởng 500m2, 25tr Dĩ An, 0907 838 ***",30 triệu/tháng,500 m²,"Dĩ An, Bình Dương",cho-thue-kho-nha-xuong-dat
Cho thuê xưởng 1800m2 65tr Thuận an 0907 838 ***,65 triệu/tháng,1.800 m²,"Thuận An, Bình Dương",cho-thue-kho-nha-xuong-dat
