Title,Price,Area,Location,type
"Đường Lý Tự Trọng, Phường Bến Thành, Quận 1 - 80m2 - cho thuê mặt bằng kinh doanh",55 triệu/tháng,80 m²,"Quận 1, Hồ Chí Minh",cho-thue-sang-nhuong-cua-hang-ki-ot
"Cho thuê mặt bằng 100m2 mặt tiền Dân Chủ, Bình Thọ",22 triệu/tháng,100 m²,"Thủ Đức, Hồ Chí Minh",cho-thue-sang-nhuong-cua-hang-ki-ot
"Chính chủ cho thuê mặt bằng số 12A Phan Đình Giót - Nha Trang, liên hệ: 0769 583 ***",4 triệu/tháng,70 m²,"Nha Trang, Khánh Hòa",cho-thue-sang-nhuong-cua-hang-ki-ot
"Cho thuê nguyên quán 800m2 mặt tiền Tiểu La, 80tr/th, 6 phòng vip full đồ tiện ích",80 triệu/tháng,800 m²,"Hải Châu, Đà Nẵng",cho-thue-sang-nhuong-cua-hang-ki-ot
"Cho thuê mặt bằng ở Quốc Lộ 50, Bình Chánh - Giá 70 triệu/tháng - diện tích rộng 1.000m2",70 triệu/tháng,1.000 m²,"Bình Chánh, Hồ Chí Minh",cho-thue-sang-nhuong-cua-hang-ki-ot
"Quốc Lộ 50, Bình Chánh - cho thuê mặt bằng diện tích rộng 1.000m2 - giá 70 triệu/tháng",70 triệu/tháng,1.000 m²,"Bình Chánh, Hồ Chí Minh",cho-thue-sang-nhuong-cua-hang-ki-ot
"Cho thuê mặt bằng kinh doanh - Nguyễn Văn Quá Phường Tân Hưng Thuận Quận 12, DT 1150m2",130 triệu/tháng,1.150 m²,"Quận 12, Hồ Chí Minh",cho-thue-sang-nhuong-cua-hang-ki-ot
"Cho thuê mặt bằng - giá 100 triệu/tháng, Đường An Dương Vương, Phường 16, Quận 8 - DT 1.200m2",100 triệu/tháng,1.200 m²,"Quận 8, Hồ Chí Minh",cho-thue-sang-nhuong-cua-hang-ki-ot
Cho thuê MB đường Nguyễn Bính Khiêm 500m2,170 triệu/tháng,500 m²,"Quận 1, Hồ Chí Minh",cho-thue-sang-nhuong-cua-hang-ki-ot
Cho thuê mặt bằng kinh doanh đắc địa ở Hoàng Diệu Phường 10 Quận Phú Nhuận. DT 55m2,10 triệu/tháng,55 m²,"Phú Nhuận, Hồ Chí Minh",cho-thue-sang-nhuong-cua-hang-ki-ot
Mặt bằng An Dương Vương phường 4 Quận 5 - cho thuê với DT: 100 m2 - có lối đi riêng biệt,35 triệu/tháng,100 m²,"Quận 5, Hồ Chí Minh",cho-thue-sang-nhuong-cua-hang-ki-ot
"Cho thuê MB 2500m2 Nguyễn Văn Lượng, Gò Vấp - 130 tr/tháng",130 triệu/tháng,2.500 m²,"Gò Vấp, Hồ Chí Minh",cho-thue-sang-nhuong-cua-hang-ki-ot
"Cho thuê mặt bằng có DT 240m2 mặt tiền kinh doanh Lê Trọng Tấn, Tân Phú",75 triệu/tháng,240 m²,"Tân Phú, Hồ Chí Minh",cho-thue-sang-nhuong-cua-hang-ki-ot
Cho thuê mặt bằng kinh doanh đắc địa ở Thăng Long Phường 04 Quận Tân Bình DT 132m2,30 triệu/tháng,132 m²,"Tân Bình, Hồ Chí Minh",cho-thue-sang-nhuong-cua-hang-ki-ot
Cho thuê MB đẹp ngang 10m mặt tiền kinh doanh góc 2 mặt tiền Biên Hoà,50 triệu/tháng,380 m²,"Biên Hòa, Đồng Nai",cho-thue-sang-nhuong-cua-hang-ki-ot
"Lý Thường Kiệt, Quận 11 - Cho thuê mặt bằng trống mặt tiền DT 270m2 - vị trí đẹp",70 triệu/tháng,270 m²,"Quận 11, Hồ Chí Minh",cho-thue-sang-nhuong-cua-hang-ki-ot
"Mặt bằng trống cho thuê ở mặt tiền Lý Thường Kiệt, Quận 11 - DT 270m2",70 triệu/tháng,270 m²,"Quận 11, Hồ Chí Minh",cho-thue-sang-nhuong-cua-hang-ki-ot
Cho thuê mặt bằng kinh doanh đắc địa ở Đồng Đen Phường 14 Quận Tân Bình DT 45m2,18 triệu/tháng,45 m²,"Tân Bình, Hồ Chí Minh",cho-thue-sang-nhuong-cua-hang-ki-ot
"Cho thuê MB 190m2 mặt tiền Huỳnh Tấn Phát, cách Phú Mỹ Hưng 200m, ngay ngã tư Phú Thuận",38 triệu/tháng,190 m²,"Quận 7, Hồ Chí Minh",cho-thue-sang-nhuong-cua-hang-ki-ot
Cho thuê mặt bằng kinh doanh đắc địa ở Xô Viết Nghệ Tĩnh Phường 24 Quận Bình Thạnh DT 40m2,12 triệu/tháng,40 m²,"Bình Thạnh, Hồ Chí Minh",cho-thue-sang-nhuong-cua-hang-ki-ot
Cho thuê mặt bằng kinh doanh đắc địa ở Xô Viết Nghệ Tĩnh Phường 15 Quận Bình Thạnh DT 60m2,12 triệu/tháng,60 m²,"Bình Thạnh, Hồ Chí Minh",cho-thue-sang-nhuong-cua-hang-ki-ot
"Đường Phan Huy Ích, Phường 12, Gò Vấp - cho thuê mặt bằng 168m2 - MB nở hậu (9m rất rộng)",35 triệu/tháng,168 m²,"Gò Vấp, Hồ Chí Minh",cho-thue-sang-nhuong-cua-hang-ki-ot
"Cho thuê mặt bằng mặt tiền kinh doanh Hoàng Văn Thụ, Phú Nhuận - DT 553m2",450 triệu/tháng,553 m²,"Phú Nhuận, Hồ Chí Minh",cho-thue-sang-nhuong-cua-hang-ki-ot
"Cho thuê mặt bằng kinh doanh - đường Quang Trung, Gò Vấp - DT 2.400m2 - vị trí đắc địa",960 triệu/tháng,2.400 m²,"Gò Vấp, Hồ Chí Minh",cho-thue-sang-nhuong-cua-hang-ki-ot
"Cho thuê cửa hàng đường Nguyễn Bỉnh Khiêm, P. Đa Kao, Q1 DT: 5x20m 1 trệt giá 55tr/th LH 0789 162 ***",55 triệu/tháng,100 m²,"Quận 1, Hồ Chí Minh",cho-thue-sang-nhuong-cua-hang-ki-ot
"Đường Đỗ Thúc Tịnh, Phường 12, Gò Vấp - cho thuê mặt bằng kinh doanh mặt tiền 360m2. Nở hậu 18m",50 triệu/tháng,360 m²,"Gò Vấp, Hồ Chí Minh",cho-thue-sang-nhuong-cua-hang-ki-ot
"Cho thuê mặt bằng kinh doanh đắc địa ở Hoàng Văn Thụ, Phường 9, Quận Phú Nhuận DT 600m2",60 triệu/tháng,600 m²,"Phú Nhuận, Hồ Chí Minh",cho-thue-sang-nhuong-cua-hang-ki-ot
"Cho thuê mặt bằng 2 góc mặt tiền Tô Hiến Thành, Quận 10 - nở hậu, giá 180tr/tháng - DT 160m2",180 triệu/tháng,160 m²,"Quận 10, Hồ Chí Minh",cho-thue-sang-nhuong-cua-hang-ki-ot
"Cho thuê mặt bằng tiện nghi tại Hoàng Văn Thụ, Phú Nhuận - 600m2, 60 triệu/tháng",60 triệu/tháng,600 m²,"Phú Nhuận, Hồ Chí Minh",cho-thue-sang-nhuong-cua-hang-ki-ot
"Cho thuê cửa hàng MT 66 Đinh Tiên Hoàng, P. Đa Kao, Q1 - DT: 4x16m 4 tầng 45tr/th - LH 0789 162 ***",45 triệu/tháng,64 m²,"Quận 1, Hồ Chí Minh",cho-thue-sang-nhuong-cua-hang-ki-ot
Đầu tư 1tỷ300 nay không có thời gian quản lí nên sang lỗ lại giá chỉ 300tr cho nhà hàng DT 760m2,15 triệu/tháng,760 m²,"Diên Khánh, Khánh Hòa",cho-thue-sang-nhuong-cua-hang-ki-ot
"Cho thuê mặt bằng kinh doanh đắc địa ở Bàn Cờ, Phường 03, Quận 3 DT 44m2",9 triệu/tháng,44 m²,"Quận 3, Hồ Chí Minh",cho-thue-sang-nhuong-cua-hang-ki-ot
Cho thuê cửa hàng kinh doanh đường Nguyễn Thị Minh Khai Q1 - DT: 5x18m 1 trệt 50tr/th LH 0789 162 ***,50 triệu/tháng,90 m²,"Quận 1, Hồ Chí Minh",cho-thue-sang-nhuong-cua-hang-ki-ot
"Cho thuê mặt bằng kinh doanh đắc địa ở Hoàng Văn Thụ, Phường 2, Quận Tân Bình DT 600m2",60 triệu/tháng,600 m²,"Tân Bình, Hồ Chí Minh",cho-thue-sang-nhuong-cua-hang-ki-ot
Xô Viết Nghệ Tĩnh Phường 26 Quận Bình Thạnh mặt bằng 190m2 - Cho thuê kinh doanh,55 triệu/tháng,190 m²,"Bình Thạnh, Hồ Chí Minh",cho-thue-sang-nhuong-cua-hang-ki-ot
Cho thuê mặt bằng rộng Quận Tân Bình DT 600m2,60 triệu/tháng,600 m²,"Tân Bình, Hồ Chí Minh",cho-thue-sang-nhuong-cua-hang-ki-ot
"Đường Trần Văn Kiểu, Phường 10, Quận 6 cho thuê mặt bằng MT có DT 158m2",60 triệu/tháng,158 m²,"Quận 6, Hồ Chí Minh",cho-thue-sang-nhuong-cua-hang-ki-ot
Cho thuê mặt bằng kinh doanh đắc địa ở Nguyễn Thái Bình Phường 12 Quận Tân Bình DT 180m2,20 triệu/tháng,180 m²,"Tân Bình, Hồ Chí Minh",cho-thue-sang-nhuong-cua-hang-ki-ot
"Cho thuê cửa hàng MT 33 Mai Thị Lựu, P. Đa Kao Q1 - DT: 9,5x27m 2 tầng - 150tr/th - LH 0789 162 ***",150 triệu/tháng,"256,5 m²","Quận 1, Hồ Chí Minh",cho-thue-sang-nhuong-cua-hang-ki-ot
"Cho thuê mặt bằng kinh doanh đắc địa ở Nguyễn Thái Bình, Phường Nguyễn Thái Bình, Quận 1 DT 88m2",25 triệu/tháng,88 m²,"Quận 1, Hồ Chí Minh",cho-thue-sang-nhuong-cua-hang-ki-ot
"Đường Phan Xích Long, Phú Nhuận cho thuê mặt bằng kinh doanh tự do 55 triệu/tháng - 140m2",55 triệu/tháng,140 m²,"Phú Nhuận, Hồ Chí Minh",cho-thue-sang-nhuong-cua-hang-ki-ot
"Cho thuê mặt bằng kinh doanh đắc địa ở Huỳnh Văn Bánh, phường 15, Quận Phú Nhuận DT 70m2",10 triệu/tháng,70 m²,"Phú Nhuận, Hồ Chí Minh",cho-thue-sang-nhuong-cua-hang-ki-ot
"Cho thuê cửa hàng kinh doanh 282 Cao Thắng, P12, Q10 - DT: 4x20m 5 tầng 60tr/th - LH 0789 162 ***",60 triệu/tháng,80 m²,"Quận 10, Hồ Chí Minh",cho-thue-sang-nhuong-cua-hang-ki-ot
"Cho thuê cửa hàng MT 128C Nguyễn Đình Chiểu P5 Q3-DT:4,5x28m 2 tầng-70tr/th-LH 0789 162 ***",70 triệu/tháng,126 m²,"Quận 3, Hồ Chí Minh",cho-thue-sang-nhuong-cua-hang-ki-ot
"Cho thuê mặt bằng kinh doanh đắc địa ở Nguyễn Bỉnh Khiêm, Phường Đa Kao, Quận 1 DT 140m2",25 triệu/tháng,140 m²,"Quận 1, Hồ Chí Minh",cho-thue-sang-nhuong-cua-hang-ki-ot
Cần sang nhượng tiệm tóc nam nữ spa xã Minh Thành - huyện Chơn Thành - Bình Phước,8 triệu/tháng,300 m²,"Chơn Thành, Bình Phước",cho-thue-sang-nhuong-cua-hang-ki-ot
"Cộng Hòa, phường 04 Quận Tân Bình - MB cho thuê 100m2 ngay mặt tiền vòng xoay Lăng Cha Cả",40 triệu/tháng,100 m²,"Tân Bình, Hồ Chí Minh",cho-thue-sang-nhuong-cua-hang-ki-ot
Cho thuê mặt bằng kinh doanh đắc địa ở Nam Kỳ Khởi NghĩaPhường 09Quận 3 DT 61m2,20 triệu/tháng,61 m²,"Quận 3, Hồ Chí Minh",cho-thue-sang-nhuong-cua-hang-ki-ot
Cho thuê mặt bằng kinh doanh đắc địa ở Bạch Đằng Phường 02 Quận Tân Bình DT 90m2,20 triệu/tháng,90 m²,"Tân Bình, Hồ Chí Minh",cho-thue-sang-nhuong-cua-hang-ki-ot
"Ki ốt mới Chòm Sao, gần ST Aeon, Thuận An, Bình Dương","4,5 triệu/tháng",65 m²,"Thuận An, Bình Dương",cho-thue-sang-nhuong-cua-hang-ki-ot
"Cho thuê shop tại Vinhomes Trần Duy Hưng D'Capitale phù hợp làm tóc, cà phê, quán ăn, văn phòng",30 triệu/tháng,70 m²,"Cầu Giấy, Hà Nội",cho-thue-sang-nhuong-cua-hang-ki-ot
"Chuyên cho thuê Shophouse Vinhomes Central Park, 0901 511 *** Ms Hà","124,12 triệu/tháng",170 m²,"Bình Thạnh, Hồ Chí Minh",cho-thue-sang-nhuong-cua-hang-ki-ot
Tết đến rồi - kinh doanh ngay - tiền về tay - bán ki - ot ngay chợ hàn - Han Square,"11,2 triệu/tháng","3,25 m²","Hải Châu, Đà Nẵng",cho-thue-sang-nhuong-cua-hang-ki-ot
"Cho thuê mặt bằng làm cửa hàng diện tích 9x22m2 đường Lê Văn Sỹ, Quận 3. Mặt bằng đẹp hơn 200m2",35 triệu/tháng,200 m²,"Quận 3, Hồ Chí Minh",cho-thue-sang-nhuong-cua-hang-ki-ot
"Mở bán 45 suất kiot chợ Hàn chỉ với 20tr, cam kết lợi nhuận, ưu đãi chiết khách cho 10 khách hàng",10 triệu/tháng,5 m²,"Hải Châu, Đà Nẵng",cho-thue-sang-nhuong-cua-hang-ki-ot
"Cho thuê MB rộng rãi đường Nguyễn Phi Khanh, gần Sân bay Đà Nẵng",11 triệu/tháng,180 m²,"Thanh Khê, Đà Nẵng",cho-thue-sang-nhuong-cua-hang-ki-ot
Cho thuê mặt bằng kinh doanh đường Huỳnh Tấn Phát,50 triệu/tháng,300 m²,"Quận 7, Hồ Chí Minh",cho-thue-sang-nhuong-cua-hang-ki-ot
"Cho thuê mặt bằng mặt tiền đường Phạm Hùng, Bình Chánh - DT 640m2",160 triệu/tháng,640 m²,"Bình Chánh, Hồ Chí Minh",cho-thue-sang-nhuong-cua-hang-ki-ot
"Cho thuê mặt bằng 40 triệu/tháng ở Quốc lộ 1, Phường Bình Trị Đông A, Quận Bình Tân - 400 m2",40 triệu/tháng,400 m²,"Bình Tân, Hồ Chí Minh",cho-thue-sang-nhuong-cua-hang-ki-ot
"Lê Văn Khương Phường Hiệp Thành, Quận 12 - Cho thuê mặt bằng mặt tiền với diện tích 750m2",55 triệu/tháng,750 m²,"Quận 12, Hồ Chí Minh",cho-thue-sang-nhuong-cua-hang-ki-ot
"Tăng Nhơn Phú, Quận 9 - cho thuê mặt bằng có DT 190m2 - nằm trên con đường sầm uất",60 triệu/tháng,190 m²,"Quận 9, Hồ Chí Minh",cho-thue-sang-nhuong-cua-hang-ki-ot
"Cho thuê nhà hàng mặt tiền Lê Lai, P. Bến Thành, Quận 1. DT 8,5x20m, trệt 2 lầu ST. Giá 240tr/th TL",240 triệu/tháng,500 m²,"Quận 1, Hồ Chí Minh",cho-thue-sang-nhuong-cua-hang-ki-ot
"Cho thuê mặt bằng kinh doanh đường đông người qua lại ở Thảo Điền, Q2 giá 26 triệu",26 triệu/tháng,55 m²,"Quận 2, Hồ Chí Minh",cho-thue-sang-nhuong-cua-hang-ki-ot
Navi mở bán 45 kiot trung tâm thương mại chợ Hàn - Đà Nẵng (Han Sizang Square),"11,2 triệu/tháng","3,25 m²","Hải Châu, Đà Nẵng",cho-thue-sang-nhuong-cua-hang-ki-ot
"Khởi nghiệp với kiot trung tâm thương mại ngay cạnh chợ Hàn, kinh doanh siêu lợi nhuận",11 triệu/tháng,10 m²,"Hải Châu, Đà Nẵng",cho-thue-sang-nhuong-cua-hang-ki-ot
"Cho thuê nhà nguyên căn mặt tiền ngang 8m, nhà 1 trệt 2 lầu K300 Quận Tân Bình bao đẹp",25 triệu/tháng,100 m²,"Tân Bình, Hồ Chí Minh",cho-thue-sang-nhuong-cua-hang-ki-ot
"Cho thuê cửa hàng, kiot mặt tiền đường Nguyễn Ảnh Thủ, Phường Hiệp Thành Q12",22 triệu/tháng,180 m²,"Quận 12, Hồ Chí Minh",cho-thue-sang-nhuong-cua-hang-ki-ot
