Title,Price,Area,Location,type
Cho thuê kho 1000m2 đường Trần Trọng Cung giá 130tr/th. LH: Duy 0789 070 ***,130 triệu/tháng,1.000 m²,"Quận 7, Hồ Chí Minh",cho-thue-kho-nha-xuong-dat
Cho thuê nhà xưởng 800m2 đường Hà Huy Giáp - Thạnh Xuân Q12 - nền xi măng,35 triệu/tháng,800 m²,"Quận 12, Hồ Chí Minh",cho-thue-kho-nha-xuong-dat
"Kho xưởng lớn trong khu công nghiệp, mái cao 12m",250 triệu/tháng,2.100 m²,"Tân Phú, Hồ Chí Minh",cho-thue-kho-nha-xuong-dat
"Cho thuê đất 2 mặt tiền Cam Ly, phường 7, Đà Lạt gần các Khu du lịch đông khách qua lại",30 triệu/tháng,2.400 m²,"Đà Lạt, Lâm Đồng",cho-thue-kho-nha-xuong-dat
"Cho thuê đất mặt tiền Bạch Đằng, phường 7, Đà Lạt có sẵn nhà nhỏ trên đất 55 triệu/tháng",55 triệu/tháng,3.000 m²,"Đà Lạt, Lâm Đồng",cho-thue-kho-nha-xuong-dat
"Cho thuê kho 1.150m2 mặt tiền đường Nguyễn Hữu Trí, Bình Chánh, điện 3 pha",65 triệu/tháng,1.150 m²,"Bình Chánh, Hồ Chí Minh",cho-thue-kho-nha-xuong-dat
"Cho thuê 500m2 kho xưởng đường Trần Văn Giàu, Phạm Văn Hai, Bình Chánh, có điện 3Fa",30 triệu/tháng,500 m²,"Bình Chánh, Hồ Chí Minh",cho-thue-kho-nha-xuong-dat
Cho thuê kho 500m2 Thoại Ngọc Hầu giá 25 triệu/tháng có PCCC đầy đủ,25 triệu/tháng,500 m²,"Tân Phú, Hồ Chí Minh",cho-thue-kho-nha-xuong-dat
"Cho thuê đất trống với DT 450m2 đường Phan Anh, Phường Hiệp Tân, Quận Tân Phú",40 triệu/tháng,450 m²,"Tân Phú, Hồ Chí Minh",cho-thue-kho-nha-xuong-dat
"Cho thuê xưởng mặt tiền Đường 181, gần xã Bình Mỹ, huyện Củ Chi - Diện tích sử dụng: 700 m2",25 triệu/tháng,700 m²,"Củ Chi, Hồ Chí Minh",cho-thue-kho-nha-xuong-dat
Cho thuê kho đường Bạch Đằng Tân Bình - Diện tích sử dụng: 580 m2,100 triệu/tháng,580 m²,"Tân Bình, Hồ Chí Minh",cho-thue-kho-nha-xuong-dat
Cho thuê 3 kho 450 m2 liền nhau khu kho bãi Kênh 19/5 - có sân trước,28 triệu/tháng,450 m²,"Tân Phú, Hồ Chí Minh",cho-thue-kho-nha-xuong-dat
"Cho thuê đất vị trí hiếm 320m2 ở đường Nguyễn Văn Hưởng, Phường Thảo Điền, Quận 2",40 triệu/tháng,320 m²,"Quận 2, Hồ Chí Minh",cho-thue-kho-nha-xuong-dat
"Cho thuê đất mặt tiền Xô Viết Nghệ Tĩnh, phường 8, Đà Lạt thuận tiện kinh doanh đa dạng",30 triệu/tháng,500 m²,"Đà Lạt, Lâm Đồng",cho-thue-kho-nha-xuong-dat
"Cho Thuê Kho 400m Phường Hiệp Bình Phước Thủ Đức. Gần Hiệp Bình, QL13 và Phạm Văn Đồng",22 triệu/tháng,400 m²,"Thủ Đức, Hồ Chí Minh",cho-thue-kho-nha-xuong-dat
"Kho đẹp ở Tiền Lân 13, Hóc Môn, kế bên QL 1 A. Diện tích: 1.100m2",120 triệu/tháng,1.100 m²,"Hóc Môn, Hồ Chí Minh",cho-thue-kho-nha-xuong-dat
"Đường Lê Thánh Tôn, Phường Bến Thành, Quận 1 cho thuê kho, diện tích sử dụng: 719m2",110 triệu/tháng,719 m²,"Quận 1, Hồ Chí Minh",cho-thue-kho-nha-xuong-dat
Kho xưởng mới cho thuê 300m2 ở 40 Phường Thảo Điền Quận 2,30 triệu/tháng,300 m²,"Quận 2, Hồ Chí Minh",cho-thue-kho-nha-xuong-dat
Cho thuê đất vị trí hiếm 508m2 ở Quốc Lộ 13 Phường Hiệp Bình Chánh Quận Thủ Đức,25 triệu/tháng,508 m²,"Thủ Đức, Hồ Chí Minh",cho-thue-kho-nha-xuong-dat
Cần cho thuê kho 380m2 đường Trần Trọng Cung giá tốt với 45.5tr/th. LH: Duy 0789 070 ***,"45,5 triệu/tháng",380 m²,"Quận 7, Hồ Chí Minh",cho-thue-kho-nha-xuong-dat
"Cho thuê nhà xưởng, kho vận, bãi xe 24 đường đường Vĩnh Lộc - Diện tích sử dụng: 3.000 m2",120 triệu/tháng,3.000 m²,"Bình Chánh, Hồ Chí Minh",cho-thue-kho-nha-xuong-dat
"Có kho, bãi 1.000 m2 siêu đẹp ngay trung tâm thị trấn mặt tiền đường Tân Túc, BC",30 triệu/tháng,1.000 m²,"Bình Chánh, Hồ Chí Minh",cho-thue-kho-nha-xuong-dat
"Cho thuê nhà xưởng đường Liên Ấp 4 - 5, xã Đa Phước, huyện Bình Chánh - Diện tích sử dụng: 700 m2",52 triệu/tháng,700 m²,"Bình Chánh, Hồ Chí Minh",cho-thue-kho-nha-xuong-dat
Cho thuê nhà xưởng xã Xuân Thới Thượng - Diện tích sử dụng: 1.200 m2,50 triệu/tháng,1.200 m²,"Hóc Môn, Hồ Chí Minh",cho-thue-kho-nha-xuong-dat
Xưởng 700m2 đường Võ Hữu Lợi - cho thuê kho có văn phòng nhỏ,23 triệu/tháng,700 m²,"Bình Chánh, Hồ Chí Minh",cho-thue-kho-nha-xuong-dat
"Cho thuê kho DT 5.380m2 Quốc Lộ 1A, Phường An Phú Đông, Quận 12",145 triệu/tháng,5.380 m²,"Quận 12, Hồ Chí Minh",cho-thue-kho-nha-xuong-dat
"Cho thuê xưởng/kho điện 3 pha, 150m2 Dĩ An, Bình Dương",5 triệu/tháng,150 m²,"Dĩ An, Bình Dương",cho-thue-kho-nha-xuong-dat
"Cho thuê nhà xưởng, nhà kho, VP đường Số 8, Linh Xuân, TP. Thủ Đức",89 triệu/tháng,1.500 m²,"Thủ Đức, Hồ Chí Minh",cho-thue-kho-nha-xuong-dat
"Cho thuê đất vườn dài hạn đường Liên Hoa, xã Vĩnh Ngọc, TP. Nha Trang, tỉnh Khánh Hòa",Giá thỏa thuận,500 m²,"Nha Trang, Khánh Hòa",cho-thue-kho-nha-xuong-dat
"Cho thuê kho Bình Tân, 700m2, đường Tây Lân, có điện, nước",45 triệu/tháng,700 m²,"Bình Tân, Hồ Chí Minh",cho-thue-kho-nha-xuong-dat
"Cho thuê nhà xưởng tại Đông Thạnh, Hóc Môn với DTSD 4.000m2",50 triệu/tháng,4.000 m²,"Hóc Môn, Hồ Chí Minh",cho-thue-kho-nha-xuong-dat
Kho xưởng mái cao khu vực gần trung tâm đường Khuông Việt,180 triệu/tháng,2.000 m²,"Tân Phú, Hồ Chí Minh",cho-thue-kho-nha-xuong-dat
"Kho xưởng mới cho thuê 366m2 ở Võ Thành Trang, Phường 11, Quận Tân Bình",45 triệu/tháng,366 m²,"Tân Bình, Hồ Chí Minh",cho-thue-kho-nha-xuong-dat
"Cho thuê kho lưu trữ, phân phối hàng hóa chuyên nghiệp ngay ICD Long Bình, Đồng Nai",Giá thỏa thuận,31.000 m²,"Biên Hòa, Đồng Nai",cho-thue-kho-nha-xuong-dat
"Cho thuê kho khu công nghiệp An Đồn - có thể làm văn phòng, kho hàng, thuận tiện, an ninh",Giá thỏa thuận,400 m²,"Sơn Trà, Đà Nẵng",cho-thue-kho-nha-xuong-dat
Cho thuê kho xưởng mặt tiền đường Tân Kỳ Tân Quý 500m2,55 triệu/tháng,500 m²,"Tân Phú, Hồ Chí Minh",cho-thue-kho-nha-xuong-dat
"Cho thuê kho 500m2 Hoài Thanh, Phường 14, Quận 8 - xe cont ra vào được",35 triệu/tháng,500 m²,"Quận 8, Hồ Chí Minh",cho-thue-kho-nha-xuong-dat
"Cho thuê nhà xưởng 276m2 đường An Dương Vương Q6, điện nước riêng",33 triệu/tháng,276 m²,"Quận 6, Hồ Chí Minh",cho-thue-kho-nha-xuong-dat
"Cho thuê nhà xưởng 1.000 m2 đường Bà Điểm, Hóc Môn gần ngã tư An Sương. Có PCCC",50 triệu/tháng,1.000 m²,"Hóc Môn, Hồ Chí Minh",cho-thue-kho-nha-xuong-dat
"Cho thuê kho 1.000m2 Phan Huy ích Gò Vấp, điện 3 pha. Giao thông thuận lợi",90 triệu/tháng,1.000 m²,"Gò Vấp, Hồ Chí Minh",cho-thue-kho-nha-xuong-dat
"Kho mới 250m2 Vườn Lài, Quận 12 cần cho thuê - Đường xe tải",24 triệu/tháng,250 m²,"Quận 12, Hồ Chí Minh",cho-thue-kho-nha-xuong-dat
"CHo thuê kho mặt tiền đường Lê Quát, DT Từ 1000 - 5000m2",100 triệu/tháng,1.000 m²,"Tân Phú, Hồ Chí Minh",cho-thue-kho-nha-xuong-dat
"Đường Quốc Lộ 1A, Phường An Phú Đông, Quận 12 - Kho mới đẹp 1200m2 - cần cho thuê",120 triệu/tháng,1.200 m²,"Quận 12, Hồ Chí Minh",cho-thue-kho-nha-xuong-dat
Kho đa dạng 1600m2 cần cho thuê tại đường Tô Ký Q12,120 triệu/tháng,1.600 m²,"Quận 12, Hồ Chí Minh",cho-thue-kho-nha-xuong-dat
"Cho thuê 320m2 đất mặt tiền Đặng Hữu Phổ, Thảo Điền, Quận 2",100 triệu/tháng,320 m²,"Quận 2, Hồ Chí Minh",cho-thue-kho-nha-xuong-dat
"Kho xưởng mới cho thuê ở Đường Nguyễn Văn Linh Phường 07, Quận 8, DT 100m2",7 triệu/tháng,100 m²,"Quận 8, Hồ Chí Minh",cho-thue-kho-nha-xuong-dat
Cho thuê kho xưởng mặt tiền Lũy Bán Bích,50 triệu/tháng,500 m²,"Tân Phú, Hồ Chí Minh",cho-thue-kho-nha-xuong-dat
Cho thuê đất vị trí hiếm 22000m2 ở Cây Gõ Xã An Phú Huyện Củ Chi,80 triệu/tháng,22.000 m²,"Củ Chi, Hồ Chí Minh",cho-thue-kho-nha-xuong-dat
"Cho thuê kho khu công nghiệp An Đồn - có thể làm văn phòng, kho hàng, thuận tiện, an ninh",Giá thỏa thuận,755 m²,"Sơn Trà, Đà Nẵng",cho-thue-kho-nha-xuong-dat
"Kho xưởng mới cho thuê 250m2 ở 13, Phường Bình Hưng Hoà A, Quận Bình Tân",20 triệu/tháng,250 m²,"Bình Tân, Hồ Chí Minh",cho-thue-kho-nha-xuong-dat
"Kho xưởng mới cho thuê 200m2 ở 1, Phường Bình Hưng Hoà A, Quận Bình Tân",25 triệu/tháng,200 m²,"Bình Tân, Hồ Chí Minh",cho-thue-kho-nha-xuong-dat
"Kho xưởng mới cho thuê 350m2 ở Hồ Văn Long, Phường Tân Tạo, Quận Bình Tân",35 triệu/tháng,350 m²,"Bình Tân, Hồ Chí Minh",cho-thue-kho-nha-xuong-dat
"Kho xưởng mới cho thuê 600m2 ở Tân Hiệp 8, Xã Tân Hiệp, Huyện Hóc Môn",30 triệu/tháng,600 m²,"Hóc Môn, Hồ Chí Minh",cho-thue-kho-nha-xuong-dat
"Kho xưởng mới cho thuê 900m2 ở Quốc lộ 1A, Phường Tân Tạo A, Quận Bình Tân",70 triệu/tháng,900 m²,"Bình Tân, Hồ Chí Minh",cho-thue-kho-nha-xuong-dat
"Cho thuê MBKD 400m2 đất đường Nguyễn Văn Hưởng, P. Thảo Điền, Quận 2. Giá 40 tr/th TL",40 triệu/tháng,400 m²,"Quận 2, Hồ Chí Minh",cho-thue-kho-nha-xuong-dat
Kho xưởng mới cho thuê 700m2 ở 181 Xã Bình Mỹ Huyện Củ Chi,25 triệu/tháng,700 m²,"Củ Chi, Hồ Chí Minh",cho-thue-kho-nha-xuong-dat
"Cho thuê xưởng 300m2 Vsip II - Tân Uyên, Bình Dương có điện 3 pha đầy đủ",17 triệu/tháng,300 m²,"Tân Uyên, Bình Dương",cho-thue-kho-nha-xuong-dat
"Cho thuê kho xưởng 10.600m2 tại An Phú, Thuận An, Bình Dương","81,52 nghìn/m²",10.671 m²,"Thuận An, Bình Dương",cho-thue-kho-nha-xuong-dat
"Cho thuê nhà xưởng 2500m2 trong KCN Thuộc Biên Hòa, Đồng Nai",75 nghìn/m²,2.500 m²,"Biên Hòa, Đồng Nai",cho-thue-kho-nha-xuong-dat
"Cho thuê nhà xưởng 20.000m2 tại Bến Cát, Bình Dương","57,88 nghìn/m²",33.000 m²,"Bến Cát, Bình Dương",cho-thue-kho-nha-xuong-dat
Cho thuê kho xưởng tại mặt đường Hoà Lạc 0985 119 ***,50 nghìn/m²,2.400 m²,"Quốc Oai, Hà Nội",cho-thue-kho-nha-xuong-dat
Cho thuê đất 160m2 cạnh Vista Verde giá 18 triệu/tháng,18 triệu/tháng,160 m²,"Quận 2, Hồ Chí Minh",cho-thue-kho-nha-xuong-dat
Cho thuê đất ngang 7.5m bên cạnh Vinhomes Grand Park giá thuê 10 triệu/tháng,10 triệu/tháng,107 m²,"Quận 9, Hồ Chí Minh",cho-thue-kho-nha-xuong-dat
Cho thuê nhà kho góc 2MT đường Nguyễn Xiển và đường số 10 giá 18 triệu/tháng,18 triệu/tháng,350 m²,"Quận 9, Hồ Chí Minh",cho-thue-kho-nha-xuong-dat
"Chuyên cho thuê kho, DT: 100m2, 300m2, 500m2, 1000m2, 2000m2, 3000m2, Duy 0789 070 ***",110 nghìn/m²,500 m²,"Quận 7, Hồ Chí Minh",cho-thue-kho-nha-xuong-dat
"Chính chủ cho thuê đất thổ cư 100%, đất ở, thuận tiện xây xưởng, làm cửa hàng tạp hóa",2 triệu/tháng,750 m²,"Bến Cầu, Tây Ninh",cho-thue-kho-nha-xuong-dat
Cho thuê kho đường nội bộ Phạm Hùng,19 triệu/tháng,168 m²,"Quận 8, Hồ Chí Minh",cho-thue-kho-nha-xuong-dat
"Cho thuê xưởng Hòa Phú DT: 1300m2, xây dựng xưởng 1000m. Giá thuê: 25tr/ tháng. LH 0918 325 *** phong",25 triệu/tháng,1.300 m²,"Củ Chi, Hồ Chí Minh",cho-thue-kho-nha-xuong-dat
"Cho thuê xưởng Hòa Phú DT 600m2, xây dựng 400m2. Giá thuê: 14tr/ tháng. LH 0918 325 *** Phong",14 triệu/tháng,600 m²,"Củ Chi, Hồ Chí Minh",cho-thue-kho-nha-xuong-dat
"Cho thuê xưởng, Hòa Phú DT:2000m. Giá thuê:75tr / tháng. LH 0918 325 *** phong",75 triệu/tháng,2.000 m²,"Củ Chi, Hồ Chí Minh",cho-thue-kho-nha-xuong-dat
Kho - Bình Quới P27 Bình Thạnh - 160m2 - 15tr/tháng,15 triệu/tháng,160 m²,"Bình Thạnh, Hồ Chí Minh",cho-thue-kho-nha-xuong-dat
"Cho thuê đất đường Trần Bạch Đằng, góc 2 mặt tiền trước sau, sát Đỗ Bá",Giá thỏa thuận,600 m²,"Ngũ Hành Sơn, Đà Nẵng",cho-thue-kho-nha-xuong-dat
Cho thuê mặt tiền Võ Nguyên Giáp,190 triệu/tháng,800 m²,"Ngũ Hành Sơn, Đà Nẵng",cho-thue-kho-nha-xuong-dat
Nhà xưởng lên đến 10ha chỉ có ở Biên Hòa Đồng Nai,84 nghìn/m²,55.379 m²,"Biên Hòa, Đồng Nai",cho-thue-kho-nha-xuong-dat
"Cho thuê nhà 80m2 hẻm 1/ Dương Quảng Hàm, chỉ 7 triệu / tháng",7 triệu/tháng,80 m²,"Gò Vấp, Hồ Chí Minh",cho-thue-kho-nha-xuong-dat
"Cho thuê đất, nhà xưởng, kho bãi huyện Bình Chánh, TP Hồ Chí Minh giá 20.00 triệu",20 triệu/tháng,700 m²,"Bình Chánh, Hồ Chí Minh",cho-thue-kho-nha-xuong-dat
"Cho thuê nhà kho đường Cù Chính Lan, phường Vĩnh Lạc, thành phố Rạch Giá, Kiên Giang",23 triệu/tháng,450 m²,"Rạch Giá, Kiên Giang",cho-thue-kho-nha-xuong-dat
Chính chủ cần cho thuê gấp kho ở Tân Kim - Long An. Liên hệ 0916 276 ***,20 triệu/tháng,400 m²,"Cần Giuộc, Long An",cho-thue-kho-nha-xuong-dat
"Cho thuê đất 1000m2 đường Nguyễn Văn Linh giá rẻ chỉ 30tr, LH: Duy 0789 070 ***",30 triệu/tháng,1.000 m²,"Quận 7, Hồ Chí Minh",cho-thue-kho-nha-xuong-dat
"Cho thuê kho 1250m2 giá tốt chỉ với 140 triệu, LH: Duy 0789 070 ***",140 triệu/tháng,1.250 m²,"Quận 7, Hồ Chí Minh",cho-thue-kho-nha-xuong-dat
"2500m2 MTKD 947 - 949 Hậu Giang. Thời hạn lâu dài, bàn giao ngay, làm việc thương lượng chính chủ",Giá thỏa thuận,2.500 m²,"Quận 6, Hồ Chí Minh",cho-thue-kho-nha-xuong-dat
Cho thuê kho xưởng giáp Vsip 2 Bình Dương,"77,91 nghìn/m²",1.900 m²,"Bến Cát, Bình Dương",cho-thue-kho-nha-xuong-dat
Cho thuê kho xưởng cụm Tân Uyên,"66,78 nghìn/m²",30.000 m²,"Tân Uyên, Bình Dương",cho-thue-kho-nha-xuong-dat
Cho thuê xưởng 300m2 mặt tiền DB4 - TP Tân Uyên. Có điện 3 pha,15 triệu/tháng,300 m²,"Tân Uyên, Bình Dương",cho-thue-kho-nha-xuong-dat
Cho thuê xưởng 300m2 MT DB4 - đối diện KDC Sun casa Central VSIP II - TP Tân Uyên,15 triệu/tháng,300 m²,"Tân Uyên, Bình Dương",cho-thue-kho-nha-xuong-dat
Cho thuê nhà máy Singapore 2 chỉ 80 nghìn/m2/th,80 nghìn/m²,10.000 m²,"Tân Uyên, Bình Dương",cho-thue-kho-nha-xuong-dat
Cho thuê xưởng 300m mặt tiền Db4 - Đối diện Sun Casa central VSIP II thành phố Tân Uyên,15 triệu/tháng,300 m²,"Tân Uyên, Bình Dương",cho-thue-kho-nha-xuong-dat
"900m2 MTKD góc 2 MT 663 Âu Cơ. 15m x 43m, Nở Hậu 21m. Thuê lâu dài 5 - 10năm, làm việc chính chủ",Giá thỏa thuận,900 m²,"Tân Phú, Hồ Chí Minh",cho-thue-kho-nha-xuong-dat
"1585m2 2 MT trước & sau 149 Trần Huy Liệu, 18x55m, nở hậu 47m. Thời hạn lâu dài 5 - 10 năm",Giá thỏa thuận,1.585 m²,"Phú Nhuận, Hồ Chí Minh",cho-thue-kho-nha-xuong-dat
"2900m2 MTKD Lê Văn Quới, 39m x 80m. Vị trí cực đẹp, khu hành chính, sầm uất, hợp đồng lâu dài",Giá thỏa thuận,2.900 m²,"Bình Tân, Hồ Chí Minh",cho-thue-kho-nha-xuong-dat
"900m2 MTKD 953 - 955 Hậu Giang. 10m x 40m, Nở Hậu 25m Hợp đồng lâu dài, làm việc chính chủ",Giá thỏa thuận,900 m²,"Quận 6, Hồ Chí Minh",cho-thue-kho-nha-xuong-dat
"Cho thuê 1700m2 Bình Thạnh mặt tiền 51-53-55 Quốc Lộ 13, 20m x 40m, nở hậu 58m, sàn trống như hình",200 triệu/tháng,1.700 m²,"Bình Thạnh, Hồ Chí Minh",cho-thue-kho-nha-xuong-dat
"25tr/th 600m2 cho thuê kho xưởng ngay góc Liên Phường, Bưng Ông Thoàn, P.Phú Hữu, Q9, bao GP. PCCC",25 triệu/tháng,600 m²,"Quận 9, Hồ Chí Minh",cho-thue-kho-nha-xuong-dat
"Cho thuê kho xưởng có sẵn văn phòng tại Diên Phú, Diên Khánh. LH 0913 511 ***",Giá thỏa thuận,1.000 m²,"Diên Khánh, Khánh Hòa",cho-thue-kho-nha-xuong-dat
"Cho thuê nhà xưởng, kho gần TP. HCM, giá ưu đãi, gọi ngay 0906 938 ***",Giá thỏa thuận,3.000 m²,"Cần Giuộc, Long An",cho-thue-kho-nha-xuong-dat
"Cho thuê kho xưởng diện tích lớn, hợp đồng lâu dài Hưng Long, Bình Chánh",21 triệu/tháng,200 m²,"Bình Chánh, Hồ Chí Minh",cho-thue-kho-nha-xuong-dat
"Cho thuê lô đất 2 mặt tiền đường Trần Bạch Đằng. Quận Ngũ Hành Sơn, biển Đà Nẵng",150 triệu/tháng,12.000 m²,"Ngũ Hành Sơn, Đà Nẵng",cho-thue-kho-nha-xuong-dat
Cho thuê 1000m2 đất có sẵn nhà xây dựng cấp 4 mặt tiền Võ Nguyên Giáp - Biển Mỹ Khê Đà Nẵng,250 triệu/tháng,1.000 m²,"Sơn Trà, Đà Nẵng",cho-thue-kho-nha-xuong-dat
Cho thuê kho xưởng trung tâm Cẩm Lệ,60 triệu/tháng,3.000 m²,"Cẩm Lệ, Đà Nẵng",cho-thue-kho-nha-xuong-dat
Kho xưởng mới cho thuê ở Quốc Lộ 1A Phường An Phú Đông Quận 12. DT 5380m2,145 triệu/tháng,5.380 m²,"Quận 12, Hồ Chí Minh",cho-thue-kho-nha-xuong-dat
Kho xưởng mới cho thuê ở Quốc lộ 1A Phường An Phú Đông Quận 12. DT 1.200m2,120 triệu/tháng,1.200 m²,"Quận 12, Hồ Chí Minh",cho-thue-kho-nha-xuong-dat
Cho thuê đất công nghiệp tại tỉnh Quảng Nam 0935 372 ***,Giá thỏa thuận,150.000 m²,"Núi Thành, Quảng Nam",cho-thue-kho-nha-xuong-dat
"CHO THUÊ ĐẤT CÔNG NGHIỆP TẠI PHONG ĐIỀN, THỪA THIÊN HUẾ 0935 372 ***",Giá thỏa thuận,15.000 m²,"Phong Điền, Thừa Thiên Huế",cho-thue-kho-nha-xuong-dat
"Kho xưởng mới cho thuê ở Vĩnh Lộc, Xã Vĩnh Lộc B, Huyện Bình Chánh DT 3.000m2",120 triệu/tháng,3.000 m²,"Bình Chánh, Hồ Chí Minh",cho-thue-kho-nha-xuong-dat
"Kho xưởng mới cho thuê ở Võ Hữu Lợi, Xã Lê Minh Xuân, Huyện Bình Chánh DT 500m2",23 triệu/tháng,500 m²,"Bình Chánh, Hồ Chí Minh",cho-thue-kho-nha-xuong-dat
"Kho xưởng mới cho thuê ở Đông Thạnh 5, Xã Đông Thạnh, Huyện Hóc Môn DT 4.000m2",50 triệu/tháng,4.000 m²,"Hóc Môn, Hồ Chí Minh",cho-thue-kho-nha-xuong-dat
Cho thuê mặt bằng nhà xưởng 200 m2 có điện 3 pha nước sạch,60 nghìn/m²,200 m²,"Mê Linh, Hà Nội",cho-thue-kho-nha-xuong-dat
"Kho xưởng mới cho thuê ở Tây Lân, Phường Tân Tạo, Quận Bình Tân DT 700m2",45 triệu/tháng,700 m²,"Bình Tân, Hồ Chí Minh",cho-thue-kho-nha-xuong-dat
"Cho thuê làm kho bãi 2500m2 đất trống MT đường Đê Ông Sâu, xe 5 tấn chạy, 0909 884 ***, miễn QC, TG",3 triệu/tháng,2.500 m²,"Cần Giuộc, Long An",cho-thue-kho-nha-xuong-dat
Chính chủ cần cho thuê kho xưởng DT: 300 - 500 - 1.000 - 1.500m2 tại Lê Trọng Tấn - Hà Đông - HN,65 nghìn/m²,1.000 m²,"Hoài Đức, Hà Nội",cho-thue-kho-nha-xuong-dat
"Chính chủ cho thuê gấp 300m2, 500m2, 1000m2 tại Tân Lập (Trạm Trôi), Hoài Đức, Hà Nội",75 nghìn/m²,1.000 m²,"Đan Phượng, Hà Nội",cho-thue-kho-nha-xuong-dat
"Chính chủ cho thuê gấp 300m2, 500m2, 1000m2 tại Tân Lập (Trạm Trôi), Hoài Đức, Hà Nội",85 nghìn/m²,1.000 m²,"Đan Phượng, Hà Nội",cho-thue-kho-nha-xuong-dat
Cho thuê kho 6.800m2 Đường Đỗ Văn Dậy - môi trường thoải mái,Giá thỏa thuận,6.800 m²,"Hóc Môn, Hồ Chí Minh",cho-thue-kho-nha-xuong-dat
"Cho thuê mặt bằng 250m2 đẳng cấp tại vị trí vàng - Quốc Lộ 1A, phường Tân Tạo A, Quận Bình Tân",Giá thỏa thuận,250 m²,"Bình Tân, Hồ Chí Minh",cho-thue-kho-nha-xuong-dat
"Chính chủ cho thuê, mặt tiền, 15x93m, thuận tiên KD kho xưởng, cửa hàng, văn phòng, giá 200tr",200 triệu/tháng,1.390 m²,"Quận 11, Hồ Chí Minh",cho-thue-kho-nha-xuong-dat
"Cho thuê cặp đất ngang 9m mặt tiền đường Nguyễn Văn Linh, Đà Nẵng gần trường Đại học Duy Tân",120 triệu/tháng,"208,6 m²","Hải Châu, Đà Nẵng",cho-thue-kho-nha-xuong-dat
"Cho thuê mặt bằng đất trống trung tâm phường Thạnh Mỹ Lợi, TP. Thủ Đức",6 triệu/tháng,154 m²,"Quận 2, Hồ Chí Minh",cho-thue-kho-nha-xuong-dat
"Kho xưởng mới cho thuê ở Đỗ Văn Dậy, Xã Tân Hiệp, Huyện Hóc Môn DT 6.800m2",Giá thỏa thuận,6.800 m²,"Hóc Môn, Hồ Chí Minh",cho-thue-kho-nha-xuong-dat
"Chính chủ Cho thuê kho xưởng tại Cần Giuộc Long An, có điện 3pha, PCCC, giá 50tr/th có thương luong",50 triệu/tháng,5.000 m²,"Cần Giuộc, Long An",cho-thue-kho-nha-xuong-dat
"Cho thuê xưởng MT Nguyễn Duy Trinh, Trường Thạnh, Q9, DT: 12m x 24m, công nhận 300m2, giá: 18 tr/th",18 triệu/tháng,300 m²,"Quận 9, Hồ Chí Minh",cho-thue-kho-nha-xuong-dat
"Cho thuê xưởng 7000m2 trong cụm công nghiệp, Hố Nai, Đồng Nai",40 nghìn/m²,7.000 m²,"Trảng Bom, Đồng Nai",cho-thue-kho-nha-xuong-dat
"Cho thuê Kho - Xưởng mặt tiền Nguyễn Duy Trinh, Phú Hữu, Q9, ngay gần vòng xoay Phú Hữu, 1400m2",25 triệu/tháng,1.400 m²,"Quận 9, Hồ Chí Minh",cho-thue-kho-nha-xuong-dat
"Cho thuê nhà xưởng 6.000m2 trong KCN Biên Hòa, Đồng Nai",660 triệu/tháng,10.000 m²,"Biên Hòa, Đồng Nai",cho-thue-kho-nha-xuong-dat
"Cho thuê kho xưởng 9000m2 trong cụm công nghiệp Tam Phước, Biên Hòa, Đồng Nai",630 triệu/tháng,16.000 m²,"Biên Hòa, Đồng Nai",cho-thue-kho-nha-xuong-dat
"Cho thuê đất mặt tiền Tô Hiệu, Phường 7, Đà Lạt đường nhựa lớn thuận tiện di chuyển",60 triệu/tháng,3.000 m²,"Đà Lạt, Lâm Đồng",cho-thue-kho-nha-xuong-dat
"Cho thuê đất mặt tiền Vòng Lâm Viên, P8, Đà Lạt gần KDL Rừng Lá Kim diện tích lớn tiện kinh doanh",150 triệu/tháng,16.000 m²,"Đà Lạt, Lâm Đồng",cho-thue-kho-nha-xuong-dat
"Cho thuê đất Khe Sanh, Phường 10, Đà Lạt thuận tiện đầu tư kinh doanh nhà hàng, cafe view",18 triệu/tháng,800 m²,"Đà Lạt, Lâm Đồng",cho-thue-kho-nha-xuong-dat
Cho thuê đất Nguyễn Đình Quân Phường 5 Đà Lạt đã có sẵn mô hình cafe trang trại vào kinh doanh ngay,"15,13 triệu/tháng",15.000 m²,"Đà Lạt, Lâm Đồng",cho-thue-kho-nha-xuong-dat
"Cho thuê đất mặt tiền Nguyên Tử Lực, Phường 8, Đà Lạt vị trí kinh doanh tốt",40 triệu/tháng,646 m²,"Đà Lạt, Lâm Đồng",cho-thue-kho-nha-xuong-dat
"Cho thuê đất nông nghiệp Xô Viết Nghệ Tĩnh, Phường 7, Đà Lạt hợp kinh doanh cafe chỉ 10 tr/tháng",10 triệu/tháng,3.515 m²,"Đà Lạt, Lâm Đồng",cho-thue-kho-nha-xuong-dat
Cho thuê mặt bằng đường Lê Hồng Phong,35 triệu/tháng,240 m²,"Nha Trang, Khánh Hòa",cho-thue-kho-nha-xuong-dat
"Xưởng Phường Tân Phước Khánh, Tân Uyên, Bình Dương. TDT 6000m2",200 triệu/tháng,3.700 m²,"Tân Uyên, Bình Dương",cho-thue-kho-nha-xuong-dat
"Cho thuê đất 150m2 mặt tiền kinh doanh đường Song Hành, P. An Phú An Khánh, Q2. Giá thương lượng",80 triệu/tháng,150 m²,"Quận 2, Hồ Chí Minh",cho-thue-kho-nha-xuong-dat
Cho thuê 300m2 kho chứa hàng trong KCN Tân Bình P Tây Thạnh Q Tân Phú,27 triệu/tháng,300 m²,"Tân Phú, Hồ Chí Minh",cho-thue-kho-nha-xuong-dat
Cho thuê xưởng KCN Sóng Thần. TDT: 2ha,"122,44 nghìn/m²",12.000 m²,"Dĩ An, Bình Dương",cho-thue-kho-nha-xuong-dat
Kho 7700m2 Thạnh Xuân - Quận 12. (tách lẻ 1000m2),120 nghìn/m²,7.700 m²,"Quận 12, Hồ Chí Minh",cho-thue-kho-nha-xuong-dat
Cho thuê mặt bằng trống dt 2080m2 (dt lớn) vị trí trung tâm gần siêu thị phù hợp kd nhà hàng coffee,100 triệu/tháng,2.080 m²,"Vũng Tàu, Bà Rịa Vũng Tàu",cho-thue-kho-nha-xuong-dat
"Cho thuê kho, nhà xưởng 2.700m2, tại An Dương, có PCCC, trạm biến áp đường xe công",Giá thỏa thuận,2.700 m²,"An Dương, Hải Phòng",cho-thue-kho-nha-xuong-dat
Công ty chúng tôi cần cho thuê 1700 - 2.000m2 kho gần khu CN VSIP Hải Phòng,55 nghìn/m²,2.000 m²,"Thủy Nguyên, Hải Phòng",cho-thue-kho-nha-xuong-dat
"Cho thuê 6200 - 10.000m2 kho xưởng tại An Lão, PCCC tự động nghiệm thu, khung Zamil cao 12m",Giá thỏa thuận,10.000 m²,"An Lão, Hải Phòng",cho-thue-kho-nha-xuong-dat
"Cho thuê 6200 - 10.000m2 kho xưởng tại An Lão, PCCC tự động nghiệm thu, khung Zamil cao 12m",Giá thỏa thuận,10.000 m²,"An Lão, Hải Phòng",cho-thue-kho-nha-xuong-dat
Cho thuê nhà xưởng trong khu công nghiệp Nam Cầu Kiền Thuỷ Nguyên diện tích từ 1.000- 2400-4060m2,118 nghìn/m²,1.000 m²,"Thủy Nguyên, Hải Phòng",cho-thue-kho-nha-xuong-dat
"Cho thuê kho xưởng lớn mặt tiền 16m đường Thoại Ngọc Hầu, P. Phú Thạnh, Q. Tân Phú",140 triệu/tháng,1.000 m²,"Tân Phú, Hồ Chí Minh",cho-thue-kho-nha-xuong-dat
"Cho thuê 5ha đất trống mặt tiền Liên Phường - Võ Chí Công, P. Phước Long B, Q9, LH 0938 140 ***",15 nghìn/m²,50.000 m²,"Quận 9, Hồ Chí Minh",cho-thue-kho-nha-xuong-dat
"Cho thuê nhà xưởng từ 4500-6000-6200 tại an dương, Hải Phòng. Chủ trương ngành nghề sản xuất cơ khí",Giá thỏa thuận,6.000 m²,"An Dương, Hải Phòng",cho-thue-kho-nha-xuong-dat
Kho 720m2 Đỗ Xuân Hợp - PCCC nghiệm thu - bảo vệ - cont 24/24,100 nghìn/m²,720 m²,"Quận 9, Hồ Chí Minh",cho-thue-kho-nha-xuong-dat
