Title,Price,Area,Location,type
Phòng trọ hiện đại cho thuê ở 86 Phường 10 Quận 6 DT 25m2,"4,5 triệu/tháng",25 m²,"Quận 6, Hồ Chí Minh",cho-thue-nha-tro-phong-tro
Phòng trọ hiện đại cho thuê ở An Dương Vương Phường 10 Quận 6 DT 20m2,"4,3 triệu/tháng",20 m²,"Quận 6, Hồ Chí Minh",cho-thue-nha-tro-phong-tro
Trống sẵn 1 phòng ngay khu sân bay,5 triệu/tháng,25 m²,"Tân Bình, Hồ Chí Minh",cho-thue-nha-tro-phong-tro
"Căn hộ mini full nội thất đầy đủ tiện nghi, khu sân bay","5,5 triệu/tháng",30 m²,"Tân Bình, Hồ Chí Minh",cho-thue-nha-tro-phong-tro
"Phòng ban công giá rẻ Phường 9, Phú Nhuận cực xinh ngập nắng","6,5 triệu/tháng",35 m²,"Phú Nhuận, Hồ Chí Minh",cho-thue-nha-tro-phong-tro
"Cho thuê phòng trọ, Nhà trọ Mình Lâm, đường NL4, cạnh chợ Mỹ phước 3","1,2 triệu/tháng",16 m²,"Bến Cát, Bình Dương",cho-thue-nha-tro-phong-tro
Cho thuê phòng duplex ngay Hoàng Hoa Thám,8 triệu/tháng,35 m²,"Tân Bình, Hồ Chí Minh",cho-thue-nha-tro-phong-tro
"Phòng studio full NT cửa sổ lớn ban công thoáng mát, thang máy, máy giặt riêng","6,2 triệu/tháng",35 m²,"Bình Thạnh, Hồ Chí Minh",cho-thue-nha-tro-phong-tro
Phòng gác cao có ban công giá rẻ dưới 5 triệu chất lượng,4 triệu/tháng,35 m²,"Gò Vấp, Hồ Chí Minh",cho-thue-nha-tro-phong-tro
"Cửa sổ, ban công đón nắng thoáng mát tại Phan Đăng Lưu gần chợ Bà Chiểu, QBT giá chỉ 6 triệu/th",6 triệu/tháng,30 m²,"Bình Thạnh, Hồ Chí Minh",cho-thue-nha-tro-phong-tro
"Studio vách ngăn, mặt tiền đường Vĩnh Viễn Q10, Vạn Hạnh Mall, UEH, Hoa Sen, BV Nhi Đồng 1","6,6 triệu/tháng",35 m²,"Quận 10, Hồ Chí Minh",cho-thue-nha-tro-phong-tro
"Chính chủ cho thuê studio mới xây 100% ngay Vườn Lài giao Lũy Bán Bích, gần Đầm Sen và Aeon Tân Phú","4,5 triệu/tháng",30 m²,"Tân Phú, Hồ Chí Minh",cho-thue-nha-tro-phong-tro
Cho thuê phòng studio 35m2 giá chỉ 6 triệu mặt tiền Út Tịch Tân Bình,6 triệu/tháng,35 m²,"Tân Bình, Hồ Chí Minh",cho-thue-nha-tro-phong-tro
"Căn hộ mini quận 3, có cửa sổ rộng rãi",7 triệu/tháng,30 m²,"Quận 3, Hồ Chí Minh",cho-thue-nha-tro-phong-tro
"Phòng duplex đẹp, thiết kế hiện đại gần cầu Tân Thuận Quân 7 Hình thật giá thật",6 triệu/tháng,40 m²,"Quận 7, Hồ Chí Minh",cho-thue-nha-tro-phong-tro
"Cho thuê nhà trọ nguyên căn hẻm đẹp đường Hai Bà Trưng, Quận 3 giá chỉ 14 triệu",14 triệu/tháng,40 m²,"Quận 3, Hồ Chí Minh",cho-thue-nha-tro-phong-tro
"Phòng trọ hiện đại cho thuê ở Cách Mạng Tháng Tám, Phường 12, Quận 3 DT 35m2",7 triệu/tháng,35 m²,"Quận 3, Hồ Chí Minh",cho-thue-nha-tro-phong-tro
Phòng trọ hiện đại cho thuê ở đường 9 Phường 09 Quận Gò Vấp DT 35m2,6 triệu/tháng,35 m²,"Gò Vấp, Hồ Chí Minh",cho-thue-nha-tro-phong-tro
Cho thuê phòng có nội thất gần Ngã 4 Bảy Hiền Quận Tân Bình,6 triệu/tháng,35 m²,"Tân Bình, Hồ Chí Minh",cho-thue-nha-tro-phong-tro
Phòng studio full NT cửa sổ lớn ban công thoáng mát,"5,5 triệu/tháng",35 m²,"Bình Thạnh, Hồ Chí Minh",cho-thue-nha-tro-phong-tro
Phòng trọ hiện đại cho thuê ở Đồng Nai Phường 15 Quận 10 DT 20m2,"5,8 triệu/tháng",20 m²,"Quận 10, Hồ Chí Minh",cho-thue-nha-tro-phong-tro
Phòng trọ hiện đại cho thuê ở Hồ Thị Kỷ Phường 01 Quận 10 DT 20m2,"4,5 triệu/tháng",20 m²,"Quận 10, Hồ Chí Minh",cho-thue-nha-tro-phong-tro
Phòng trọ hiện đại cho thuê ở Sư Vạn Hạnh Phường 12 Quận 10 DT 20m2,5 triệu/tháng,20 m²,"Quận 10, Hồ Chí Minh",cho-thue-nha-tro-phong-tro
Phòng trọ hiện đại cho thuê ở Tô Hiến Thành Phường 14 Quận 10 DT 20m2,5 triệu/tháng,20 m²,"Quận 10, Hồ Chí Minh",cho-thue-nha-tro-phong-tro
"Phòng trọ hiện đại cho thuê ở Thích Minh Nguyệt, Phường 02, Quận Tân Bình DT 25m2",5 triệu/tháng,25 m²,"Tân Bình, Hồ Chí Minh",cho-thue-nha-tro-phong-tro
"Phòng trọ hiện đại cho thuê ở Tân Quý, phường Tân Quý, quận Tân Phú, DT 20m2","5,2 triệu/tháng",20 m²,"Tân Phú, Hồ Chí Minh",cho-thue-nha-tro-phong-tro
Cho thuê căn hộ dịch vụ full nội thất,"4,5 triệu/tháng",20 m²,"Quận 7, Hồ Chí Minh",cho-thue-nha-tro-phong-tro
Phòng studio full NT cửa sổ lớn nằm ngay khu trung Tâm sát bên Cầu Bông,"5,9 triệu/tháng",30 m²,"Bình Thạnh, Hồ Chí Minh",cho-thue-nha-tro-phong-tro
"Phòng trọ giá rẻ full nội thất, gác cao sạch sẽ thoáng mát ngay Hương Lộ 2 - Tân Hòa Đông","3,5 triệu/tháng",28 m²,"Bình Tân, Hồ Chí Minh",cho-thue-nha-tro-phong-tro
"Phòng trọ hiện đại cho thuê Tân Quý, Phường Tân Quý, Quận Tân Phú DT 25m2","4,5 triệu/tháng",25 m²,"Tân Phú, Hồ Chí Minh",cho-thue-nha-tro-phong-tro
Phòng trọ máy lạnh gần khu 586,"1,6 triệu/tháng",20 m²,"Cái Răng, Cần Thơ",cho-thue-nha-tro-phong-tro
"Phòng trọ hiện đại cho thuê ở Cao Văn Ngọc, phường Phú Trung, quận Tân Phú DT 25m2","4,8 triệu/tháng",25 m²,"Tân Phú, Hồ Chí Minh",cho-thue-nha-tro-phong-tro
"Cho thuê phòng 50m2, 2PN, full NT, nhà thang máy siêu đẹp xịn mịn, trung tâm quận 1. Giá 12tr5","12,5 triệu/tháng",50 m²,"Quận 1, Hồ Chí Minh",cho-thue-nha-tro-phong-tro
"Phòng trọ ban công, full nội thất máy giặt riêng ngay chân cầu Bông, Q1","6,5 triệu/tháng",25 m²,"Bình Thạnh, Hồ Chí Minh",cho-thue-nha-tro-phong-tro
"Phòng trọ hiện đại cho thuê ở Hoàng Sa, Phường 05, Quận Tân Bình DT 25m2",6 triệu/tháng,25 m²,"Tân Bình, Hồ Chí Minh",cho-thue-nha-tro-phong-tro
"Căn hộ mini full nội thất, ngay Etown Cộng Hòa",6 triệu/tháng,25 m²,"Tân Bình, Hồ Chí Minh",cho-thue-nha-tro-phong-tro
"Phòng full nội thất đầy đủ tiện nghi, khu sân bay","5,8 triệu/tháng",30 m²,"Tân Bình, Hồ Chí Minh",cho-thue-nha-tro-phong-tro
"Căn hộ mini full nội thất, đầy đủ tiện nghi/khu sân bay",7 triệu/tháng,30 m²,"Tân Bình, Hồ Chí Minh",cho-thue-nha-tro-phong-tro
"Căn hộ DV Quận 1, có cửa sổ rộng rãi","9,5 triệu/tháng",35 m²,"Quận 1, Hồ Chí Minh",cho-thue-nha-tro-phong-tro
Phòng căn hộ 30m2 full NT thang máy ngay Nguyễn Văn Đậu Bình Thạnh gần chợ Bà Chiểu,"6,5 triệu/tháng",30 m²,"Bình Thạnh, Hồ Chí Minh",cho-thue-nha-tro-phong-tro
Khai trương căn hộ 30m2 full NT cửa sổ thoáng gần chợ Tân Định,6 triệu/tháng,30 m²,"Quận 1, Hồ Chí Minh",cho-thue-nha-tro-phong-tro
Căn hộ dịch vụ hiện đại full nội thất Trung Tâm Phú Nhuận,"6,5 triệu/tháng",35 m²,"Phú Nhuận, Hồ Chí Minh",cho-thue-nha-tro-phong-tro
Căn hộ studio full NT cửa sổ thoáng gần ĐH Văn Lang,"5,8 triệu/tháng",30 m²,"Bình Thạnh, Hồ Chí Minh",cho-thue-nha-tro-phong-tro
Hệ thống căn hộ duplex balcony full NT - gần ngã tư Phú Nhuận,"6,5 triệu/tháng",35 m²,"Phú Nhuận, Hồ Chí Minh",cho-thue-nha-tro-phong-tro
Căn hộ giá sinh viên full NT cửa sổ lớn gần ngã tư Phú Nhuận,"5,4 triệu/tháng",30 m²,"Phú Nhuận, Hồ Chí Minh",cho-thue-nha-tro-phong-tro
"Khai trương căn hộ studio balcon full NT - Thích Quảng Đức, gần ngã tư Phú Nhuận","5,5 triệu/tháng",30 m²,"Phú Nhuận, Hồ Chí Minh",cho-thue-nha-tro-phong-tro
"Phòng có nội thất 40m2 Quận 1, kế Dinh Độc Lập, chợ Bến Thành, Tao Đàn Park, Bitexco, Takashimaya","6,5 triệu/tháng",40 m²,"Quận 1, Hồ Chí Minh",cho-thue-nha-tro-phong-tro
Khai trương căn hộ 40m2 balcon full NT - gần công viên Gia Định,"6,2 triệu/tháng",40 m²,"Phú Nhuận, Hồ Chí Minh",cho-thue-nha-tro-phong-tro
Chuỗi căn hộ studio balcony full NT - thang máy - gần chợ Bà Chiểu,7 triệu/tháng,35 m²,"Bình Thạnh, Hồ Chí Minh",cho-thue-nha-tro-phong-tro
Cho thuê căn hộ mini hiện đại gần Đường Phan Đình Phùng,"6,5 triệu/tháng",35 m²,"Phú Nhuận, Hồ Chí Minh",cho-thue-nha-tro-phong-tro
Cho thuê phòng full nội thất có bancon - gần cầu Thị Nghè,6 triệu/tháng,30 m²,"Bình Thạnh, Hồ Chí Minh",cho-thue-nha-tro-phong-tro
"Phòng dạng Duplex full nội thất, đầy đủ tiện nghi, ngay ngã tư Bảy Hiền","6,5 triệu/tháng",45 m²,"Tân Bình, Hồ Chí Minh",cho-thue-nha-tro-phong-tro
"Cho thuê phòng ngay CV Lê Thị Riêng, giáp Q10","8,5 triệu/tháng",40 m²,"Tân Bình, Hồ Chí Minh",cho-thue-nha-tro-phong-tro
"Cho thuê phòng full nội thất có bancon ngay chợ Hoàng Hoa Thám, quận Tân Bình","5,5 triệu/tháng",32 m²,"Tân Bình, Hồ Chí Minh",cho-thue-nha-tro-phong-tro
Trống sẵn 1 phòng ngay CV Lê Thị Riêng,"8,5 triệu/tháng",40 m²,"Quận 10, Hồ Chí Minh",cho-thue-nha-tro-phong-tro
Studio full nội thất ngay đại học Văn Hiến - free xe và phí dịch vụ,"3,5 triệu/tháng",20 m²,"Tân Phú, Hồ Chí Minh",cho-thue-nha-tro-phong-tro
"Cho thuê phòng dạng studio, duplex, ngay CV Hoàng Văn Thụ","6,5 triệu/tháng",35 m²,"Tân Bình, Hồ Chí Minh",cho-thue-nha-tro-phong-tro
"Khai trương phòng mới 100% bancon máy giặt riêng ngay Tân Hải, quận Tân Bình","5,8 triệu/tháng",30 m²,"Tân Bình, Hồ Chí Minh",cho-thue-nha-tro-phong-tro
Phòng studio cửa sổ thoáng full NT có hầm xe thang máy ngay gần học viện Cán Bộ,"5,2 triệu/tháng",30 m²,"Bình Thạnh, Hồ Chí Minh",cho-thue-nha-tro-phong-tro
Phòng ban công 30m2 full NT rộng thoáng ngay P12 Bình Thạnh,"5,5 triệu/tháng",30 m²,"Bình Thạnh, Hồ Chí Minh",cho-thue-nha-tro-phong-tro
Căn Hộ 1PN tách bếp có ban công thoáng 35m2 siêu rộng full NT,"6,5 triệu/tháng",35 m²,"Phú Nhuận, Hồ Chí Minh",cho-thue-nha-tro-phong-tro
Phòng trọ hiện đại cho thuê ở Trần Phú Phường 4 Quận 5 DT 30m2,"5,5 triệu/tháng",30 m²,"Quận 5, Hồ Chí Minh",cho-thue-nha-tro-phong-tro
Phòng trọ hiện đại cho thuê ở Hàn Hải Nguyên Phường 02 Quận 11 DT 27m2,"4,9 triệu/tháng",27 m²,"Quận 11, Hồ Chí Minh",cho-thue-nha-tro-phong-tro
"Gấp, phòng rộng thoáng tiện nghi ngay quận 3, tiện qua Quận 1 - Phú Nhuận",8 triệu/tháng,40 m²,"Quận 3, Hồ Chí Minh",cho-thue-nha-tro-phong-tro
"Studio full nội thất, có đầy đủ tiện nghi tại Tân Quy quận 7","5,5 triệu/tháng",30 m²,"Quận 7, Hồ Chí Minh",cho-thue-nha-tro-phong-tro
Cho thuê phòng trọ đường Lê Văn Sỹ Tân Bình chỉ 5 triệu có gác rộng 35m2,5 triệu/tháng,35 m²,"Tân Bình, Hồ Chí Minh",cho-thue-nha-tro-phong-tro
"Phòng mới 100% - đủ nội thất, có thang máy - Đường Trần Hưng Đạo - 20m2",5 triệu/tháng,20 m²,"Quận 1, Hồ Chí Minh",cho-thue-nha-tro-phong-tro
"Đường Tân Quý, Tân Phú - studio có gác - 20m2 - thuận tiện di chuyển","5,2 triệu/tháng",20 m²,"Tân Phú, Hồ Chí Minh",cho-thue-nha-tro-phong-tro
Phòng Cityland studio ban công giá hợp lí chốt ngay,8 triệu/tháng,40 m²,"Gò Vấp, Hồ Chí Minh",cho-thue-nha-tro-phong-tro
"Căn hộ DV mới keng 100% ban công thoáng, máy giặt riêng ngay Đại Học Văn Lang Bình Thạnh","6,3 triệu/tháng",35 m²,"Bình Thạnh, Hồ Chí Minh",cho-thue-nha-tro-phong-tro
"Phòng trọ full nội thất Trần Thị Nơi, Quận 8","6,5 triệu/tháng",30 m²,"Quận 8, Hồ Chí Minh",cho-thue-nha-tro-phong-tro
Duplex full nội thất ngay Nguyễn Thị Thập Q7,"6,5 triệu/tháng",30 m²,"Quận 7, Hồ Chí Minh",cho-thue-nha-tro-phong-tro
"Chính chủ cho thuê phòng trọ số 551/29 Phạm Văn Chí, P7, Q6 thông ra Đại Lộ Võ Văn Kiệt","1,8 triệu/tháng",10 m²,"Quận 6, Hồ Chí Minh",cho-thue-nha-tro-phong-tro
Phòng Trống Ngay Phan Đăng Lưu,"5,5 triệu/tháng",15 m²,"Phú Nhuận, Hồ Chí Minh",cho-thue-nha-tro-phong-tro
CHDV phòng trọ 1PN tách bếp balcon siêu to gần chợ Tân Định ưu đãi khi check in tại quận 1,"7,5 triệu/tháng",35 m²,"Quận 1, Hồ Chí Minh",cho-thue-nha-tro-phong-tro
Căn hộ siêu xịn tại Quận 1. Ban công rộng,"9,5 triệu/tháng",35 m²,"Quận 1, Hồ Chí Minh",cho-thue-nha-tro-phong-tro
Sản phẩm duplex ban công mới nhất khu vực Âu Cơ - đại học Văn Hiến,"3,9 triệu/tháng",25 m²,"Tân Bình, Hồ Chí Minh",cho-thue-nha-tro-phong-tro
"Cho thuê nhiều phòng CH mini ở Cát Lái, Q2, TP Thủ Đức, mới khai trương ở liền được",5 triệu/tháng,20 m²,"Quận 2, Hồ Chí Minh",cho-thue-nha-tro-phong-tro
"Phòng trọ full nội thất, khu sân bay, giáp Phú Nhuận","5,5 triệu/tháng",30 m²,"Tân Bình, Hồ Chí Minh",cho-thue-nha-tro-phong-tro
"Khai trương dự án căn hộ dịch vụ hot nhất Tân Bình, giáp Quận 10, 3","6,5 triệu/tháng",35 m²,"Tân Bình, Hồ Chí Minh",cho-thue-nha-tro-phong-tro
"Phòng dạng studio full nội thất, ngay khu sân bay",5 triệu/tháng,25 m²,"Tân Bình, Hồ Chí Minh",cho-thue-nha-tro-phong-tro
Trống sẵn 1 phòng duplex ngay CV Hoàng Văn Thụ,"8,5 triệu/tháng",40 m²,"Tân Bình, Hồ Chí Minh",cho-thue-nha-tro-phong-tro
"Cho thuê 1PN, bếp riêng, bancol, ngay Hoàng Hoa Thám",8 triệu/tháng,45 m²,"Tân Bình, Hồ Chí Minh",cho-thue-nha-tro-phong-tro
"Cho thuê phòng ban công riêng, ngay Hoàng Sa",7 triệu/tháng,36 m²,"Tân Bình, Hồ Chí Minh",cho-thue-nha-tro-phong-tro
"Trống sẵn studio, 1PN, ngay khu sân bay",7 triệu/tháng,40 m²,"Tân Bình, Hồ Chí Minh",cho-thue-nha-tro-phong-tro
Trống sẵn 1 phòng ngay khu sân bay,"5,5 triệu/tháng",28 m²,"Tân Bình, Hồ Chí Minh",cho-thue-nha-tro-phong-tro
Duplex full nội thất đối diện E. Town Cộng Hòa,6 triệu/tháng,38 m²,"Tân Bình, Hồ Chí Minh",cho-thue-nha-tro-phong-tro
"Cho thuê phòng studio khép kín, full đồ, nhà đô thị xây mới","4,3 triệu/tháng",35 m²,"Hà Đông, Hà Nội",cho-thue-nha-tro-phong-tro
"Cho thuê phòng duplex cửa sổ thoáng, 30m2, Xô Viết Nghệ Tĩnh, Bình Thạnh","5,5 triệu/tháng",30 m²,"Bình Thạnh, Hồ Chí Minh",cho-thue-nha-tro-phong-tro
"Cho thuê phòng 25m2 có máy lạnh - Đường Nguyễn Phi Khanh, Phường Tân Định, Quận 1","6,2 triệu/tháng",25 m²,"Quận 1, Hồ Chí Minh",cho-thue-nha-tro-phong-tro
"Studio ban công 40m2 full nội thất siêu thoáng ngay chợ Tân Quy, gần Lotte Q7","7,5 triệu/tháng",40 m²,"Quận 7, Hồ Chí Minh",cho-thue-nha-tro-phong-tro
"Cho thuê phòng CHDV mới xây xong ở Cát Lái, TP Thủ Đức, mới khai trương tại Q2",5 triệu/tháng,20 m²,"Thủ Đức, Hồ Chí Minh",cho-thue-nha-tro-phong-tro
"Phòng trọ hiện đại cho thuê ở Võ Văn Kiệt, Phường 10 Quận 5 DT 25m2","5,5 triệu/tháng",25 m²,"Quận 5, Hồ Chí Minh",cho-thue-nha-tro-phong-tro
"Studio ban công 35m2, tại Nguyễn Văn Thương D1, gần Hàng Xanh, cầu Sài Gòn, Landmark 81","9,5 triệu/tháng",35 m²,"Bình Thạnh, Hồ Chí Minh",cho-thue-nha-tro-phong-tro
"Phòng mới 100% studio mới siêu xinh gần Cầu Ông Lãnh, Bitexco, ngã Sáu Phù Đổng",7 triệu/tháng,30 m²,"Quận 1, Hồ Chí Minh",cho-thue-nha-tro-phong-tro
"Phòng trọ hiện đại cho thuê ở Nguyễn Bỉnh Khiêm, Phường Đa Kao Quận 1DT 18m2","4,5 triệu/tháng",18 m²,"Quận 1, Hồ Chí Minh",cho-thue-nha-tro-phong-tro
"Cho thuê phòng căn hộ nhỏ tại đường Lê Lợi, Quận 1, gần chợ Bến Thành, nằm trên tuyến đường chính",5 triệu/tháng,25 m²,"Quận 1, Hồ Chí Minh",cho-thue-nha-tro-phong-tro
"Phòng trọ hiện đại cho thuê ở Cách Mạng Tháng Tám, Phường 05, Quận 3, DT 30m2",5 triệu/tháng,30 m²,"Quận 3, Hồ Chí Minh",cho-thue-nha-tro-phong-tro
"Bình Thới vòng xoay Lê Đại Hành, Q10, Q11 full nội thất mới",6 triệu/tháng,35 m²,"Quận 11, Hồ Chí Minh",cho-thue-nha-tro-phong-tro
Phòng trọ hiện đại cho thuê ở Trường Chinh Phường Tân Thới Nhất Quận 12. DT 50m2,"4,8 triệu/tháng",50 m²,"Quận 12, Hồ Chí Minh",cho-thue-nha-tro-phong-tro
"Phòng trọ hiện đại cho thuê ở Lý Thường Kiệt, Phường 14, Quận 10 DT 25m2","5,9 triệu/tháng",25 m²,"Quận 10, Hồ Chí Minh",cho-thue-nha-tro-phong-tro
"Cho thuê phòng 45m2 đường Nguyễn Đình Chính, PN, đủ nội thất",6 triệu/tháng,45 m²,"Phú Nhuận, Hồ Chí Minh",cho-thue-nha-tro-phong-tro
"Phòng trọ hiện đại cho thuê ở Hoa Hồng Phường 2, Quận Phú Nhuận DT 20m2",5 triệu/tháng,20 m²,"Phú Nhuận, Hồ Chí Minh",cho-thue-nha-tro-phong-tro
Phòng trọ có gác cửa sổ thoáng full nội thất đầy đủ tiện ích ngay Nguyễn Văn Quá Quận 12,"3,5 triệu/tháng",35 m²,"Quận 12, Hồ Chí Minh",cho-thue-nha-tro-phong-tro
"Phòng trọ 50m2 đường Cộng Hòa, khu Etown, Lotte, sân bay",6 triệu/tháng,50 m²,"Tân Bình, Hồ Chí Minh",cho-thue-nha-tro-phong-tro
Phòng trọ hiện đại cho thuê ở Cộng Hòa Phường 13 Quận Tân Bình DT 20m2,"5,7 triệu/tháng",20 m²,"Tân Bình, Hồ Chí Minh",cho-thue-nha-tro-phong-tro
Phòng trọ hiện đại cho thuê ở Lương Minh Nguyệt Phường Phú Thọ Hoà Quận Tân Phú DT 88m2,4 triệu/tháng,88 m²,"Tân Phú, Hồ Chí Minh",cho-thue-nha-tro-phong-tro
Cho thuê phòng 25m2 Cao Văn Ngọc Quận Tân Phú,"4,8 triệu/tháng",25 m²,"Tân Phú, Hồ Chí Minh",cho-thue-nha-tro-phong-tro
Phòng trọ hiện đại cho thuê ở Cao Lỗ Phường 4 Quận 8 DT 68m2,5 triệu/tháng,68 m²,"Quận 8, Hồ Chí Minh",cho-thue-nha-tro-phong-tro
"Phòng trọ hiện đại cho thuê ở Nguyễn Biểu Phường 1, Quận 5 DT 70m2",4 triệu/tháng,70 m²,"Quận 5, Hồ Chí Minh",cho-thue-nha-tro-phong-tro
"Phòng trọ hiện đại cho thuê ở Hoàng Văn Thụ, Phường 8, Phú Nhuận DT 20m2","5,5 triệu/tháng",20 m²,"Phú Nhuận, Hồ Chí Minh",cho-thue-nha-tro-phong-tro
"Phòng trọ hiện đại cho thuê Đường 8, Phường Bình Hưng Hòa, Bình Tân, DT 32m2","5,3 triệu/tháng",32 m²,"Bình Tân, Hồ Chí Minh",cho-thue-nha-tro-phong-tro
"CHDV full NT new 100%, Hoàng Văn Thụ, Diện tích 30 - 35m2 (có ban công)","5,5 triệu/tháng",30 m²,"Phú Nhuận, Hồ Chí Minh",cho-thue-nha-tro-phong-tro
Phòng trọ hiện đại trung tâm Phú Nhuận,11 triệu/tháng,35 m²,"Phú Nhuận, Hồ Chí Minh",cho-thue-nha-tro-phong-tro
Phòng trọ cao cấp cửa sổ thoáng full nội thất an ninh tuyệt đối ngay công viên làng hoa,"3,8 triệu/tháng",30 m²,"Gò Vấp, Hồ Chí Minh",cho-thue-nha-tro-phong-tro
"Cho thuê phòng trọ Nguyễn Đình Chiểu, P4, Q3. DT 18m2, có máy lạnh, máy giặt",4 triệu/tháng,18 m²,"Quận 3, Hồ Chí Minh",cho-thue-nha-tro-phong-tro
"Studio ban công full NT Đ.Nguyễn Đình Chiểu 30m2 Q3, kế ĐH Kinh Tế, ĐH Mở, hồ Con Rùa, Tao Đàn Park","6,3 triệu/tháng",30 m²,"Quận 3, Hồ Chí Minh",cho-thue-nha-tro-phong-tro
Phòng mới 100% vào ở ngay đầy đủ tiện nghi,"2,8 triệu/tháng",30 m²,"Bình Tân, Hồ Chí Minh",cho-thue-nha-tro-phong-tro
"Phòng trọ hiện đại cho thuê ở Cách Mạng Tháng Tám, Phường 10, Quận 3, DT 30m2",6 triệu/tháng,30 m²,"Quận 3, Hồ Chí Minh",cho-thue-nha-tro-phong-tro
Căn hộ bancon full nội thất bao phí ngay mặt tiền Tôn Thất Thuyết Quận 4,"8,5 triệu/tháng",35 m²,"Quận 4, Hồ Chí Minh",cho-thue-nha-tro-phong-tro
Phòng trọ hiện đại cho thuê ở Thích Quảng Đức Phường 4 Quận Phú Nhuận DT 25m2,"5,3 triệu/tháng",25 m²,"Phú Nhuận, Hồ Chí Minh",cho-thue-nha-tro-phong-tro
"Cho thuê nhanh phòng 20m2 đường Kỳ Đồng, 5,2 triệu/tháng","5,2 triệu/tháng",20 m²,"Quận 3, Hồ Chí Minh",cho-thue-nha-tro-phong-tro
"Cho thuê phòng tại chung cư Lê Lợi, P. Bến Thành, Quận 1. Với diện tích rộng 17m2",5 triệu/tháng,17 m²,"Quận 1, Hồ Chí Minh",cho-thue-nha-tro-phong-tro
"Phòng trọ hiện đại cho thuê ở Lê Văn Sỹ, Phường 12, Quận 3, DT 25m2","5,5 triệu/tháng",25 m²,"Quận 3, Hồ Chí Minh",cho-thue-nha-tro-phong-tro
"Phòng Quận 3, có cửa sổ rộng rãi",8 triệu/tháng,30 m²,"Quận 3, Hồ Chí Minh",cho-thue-nha-tro-phong-tro
Phòng trọ hiện đại cho thuê ở Nguyễn Kiệm Phường 4 Quận Phú Nhuận Dt 20m2,"5,5 triệu/tháng",20 m²,"Phú Nhuận, Hồ Chí Minh",cho-thue-nha-tro-phong-tro
Phòng trọ hiện đại cho thuê ở Hồ Văn Huê Phường 9 Quận Phú Nhuận DT 30m2,5 triệu/tháng,30 m²,"Phú Nhuận, Hồ Chí Minh",cho-thue-nha-tro-phong-tro
"Phòng trọ hiện đại cho thuê ở Trần Kế Xương Phường 07 Quận Phú Nhuận, DT 20m2","5,2 triệu/tháng",20 m²,"Phú Nhuận, Hồ Chí Minh",cho-thue-nha-tro-phong-tro
Phòng trọ hiện đại cho thuê ở Bùi Đình Túy Phường 12 Quận Bình Thạnh DT 35m2,6 triệu/tháng,35 m²,"Bình Thạnh, Hồ Chí Minh",cho-thue-nha-tro-phong-tro
Cho thuê phòng trọ tiện nghi gần Chợ Bà Chiểu,2 triệu/tháng,9 m²,"Bình Thạnh, Hồ Chí Minh",cho-thue-nha-tro-phong-tro
"Phòng trọ hiện đại cho thuê ở Phạm Văn Bạch, Phường 15, Quận Tân Bình DT 25m2",5 triệu/tháng,25 m²,"Tân Bình, Hồ Chí Minh",cho-thue-nha-tro-phong-tro
Phòng mới 100% đầy đủ nội thất vào ở ngay 3tr,3 triệu/tháng,30 m²,"Bình Tân, Hồ Chí Minh",cho-thue-nha-tro-phong-tro
"Phòng trọ hiện đại cho thuê ở Hoàng Hoa Thám, Phường 12, Quận Tân Bình Dt 25m2","5,2 triệu/tháng",25 m²,"Tân Bình, Hồ Chí Minh",cho-thue-nha-tro-phong-tro
"Phòng trọ hiện đại cho thuê ở Bàu Cát 7, Phường 15, Quận Tân Bình DT 30m2","4,2 triệu/tháng",30 m²,"Tân Bình, Hồ Chí Minh",cho-thue-nha-tro-phong-tro
"Phòng trọ không bếp - thoáng mát - gần cầu sông Hàn chỉ 2,9 triệu/tháng","2,9 triệu/tháng",25 m²,"Sơn Trà, Đà Nẵng",cho-thue-nha-tro-phong-tro
Chung cư mini chính chủ cho thuê tại mặt đường Văn Tiến Dũng - máy giặt riêng - full đồ,"5,15 triệu/tháng",25 m²,"Bắc Từ Liêm, Hà Nội",cho-thue-nha-tro-phong-tro
"Phòng trọ hiện đại cho thuê ở Âu Cơ, Phường 14, Quận Tân Bình Dt 40m2","5,8 triệu/tháng",40 m²,"Tân Bình, Hồ Chí Minh",cho-thue-nha-tro-phong-tro
"Phòng trọ hiện đại cho thuê ở Bạch Đằng, Phường 2, Quận Tân Bình DT 28m2","5,8 triệu/tháng",28 m²,"Tân Bình, Hồ Chí Minh",cho-thue-nha-tro-phong-tro
"Phòng trọ hiện đại cho thuê ở Cửu Long, Phường 2, Quận Tân Bình DT 20m2",6 triệu/tháng,20 m²,"Tân Bình, Hồ Chí Minh",cho-thue-nha-tro-phong-tro
"Phòng trọ hiện đại cho thuê ở Lê Lợi, Phường Bến Thành Quận 1 DT 17m2",5 triệu/tháng,17 m²,"Quận 1, Hồ Chí Minh",cho-thue-nha-tro-phong-tro
"Phòng trọ hiện đại cho thuê ở Lê Lợi, Phường Bến Thành Quận 1 DT 17m2",5 triệu/tháng,17 m²,"Quận 1, Hồ Chí Minh",cho-thue-nha-tro-phong-tro
"Cho thuê căn hộ dịch vụ mới xây ngay siêu thị Emart Phan Huy Ích, full nội thất tiện nghi","4,3 triệu/tháng",25 m²,"Gò Vấp, Hồ Chí Minh",cho-thue-nha-tro-phong-tro
"Phòng trọ hiện đại cho thuê ở Nguyễn Trãi Phường Nguyễn Cư Trinh Quận 1, DT 25m2","5,5 triệu/tháng",25 m²,"Quận 1, Hồ Chí Minh",cho-thue-nha-tro-phong-tro
"Phòng trọ hiện đại cho thuê Hoàng Sa Phường Đa Kao Quận 1, DT 26m2","5,4 triệu/tháng",26 m²,"Quận 1, Hồ Chí Minh",cho-thue-nha-tro-phong-tro
"Cho thuê căn hộ 1PN. Có gym, hồ bơi. Full nội thất. Giá rẻ tại trung tâm Thảo Điền, Quận 2",10 triệu/tháng,60 m²,"Quận 2, Hồ Chí Minh",cho-thue-nha-tro-phong-tro
"Phòng trọ hiện đại cho thuê ở Tạ Quang Bửu, Phường 6, Quận 8 DT 15m2","4,2 triệu/tháng",15 m²,"Quận 8, Hồ Chí Minh",cho-thue-nha-tro-phong-tro
"Phòng trọ hiện đại cho thuê ở Dương Bá Trạc, Phường 2, Quận 8 DT 28m2","4,2 triệu/tháng",28 m²,"Quận 8, Hồ Chí Minh",cho-thue-nha-tro-phong-tro
"Cho thuê phòng 35m2 đường 9, Phường 9, Quận Gò Vấp",6 triệu/tháng,35 m²,"Gò Vấp, Hồ Chí Minh",cho-thue-nha-tro-phong-tro
"Phòng trọ cao cấp cho thuê ở Âu Dương Lân, Phường 3, Quận 8, DT 22m2",5 triệu/tháng,22 m²,"Quận 8, Hồ Chí Minh",cho-thue-nha-tro-phong-tro
"Duplex full nội thất ngay Huỳnh Tấn Phát, Q7","4,8 triệu/tháng",25 m²,"Quận 7, Hồ Chí Minh",cho-thue-nha-tro-phong-tro
"Cho thuê phòng trọ đường đường 86, Phường 10, Quận 6 - 25m2","4,5 triệu/tháng",25 m²,"Quận 6, Hồ Chí Minh",cho-thue-nha-tro-phong-tro
Cho thuê phòng nhỏ 20m2 đường 1 Quận Bình Tân ngay mũi tàu Văn Cao đi vào,4 triệu/tháng,20 m²,"Bình Tân, Hồ Chí Minh",cho-thue-nha-tro-phong-tro
"Phòng trọ hiện đại cho thuê ở Phạm Ngọc Thạch, Phường Võ Thị Sáu, Quận 3, DT 25m2",6 triệu/tháng,25 m²,"Quận 3, Hồ Chí Minh",cho-thue-nha-tro-phong-tro
"Cách Mạng Tháng 8, P12, Q3 - giá 7tr/th - studio 35m2",7 triệu/tháng,35 m²,"Quận 3, Hồ Chí Minh",cho-thue-nha-tro-phong-tro
