Title,Price,Area,Location,type
"Kho giá rẻ 1500m2, giá 60tr, mặt tiền đường Vĩnh Lộc, gần UBND Xã Vĩnh Lộc B",60 triệu/tháng,1.500 m²,"Bình Chánh, Hồ Chí Minh",cho-thue-kho-nha-xuong-dat
"Đất vị trí đắc địa cho thuê ở Đường Điện Biên Phủ, Phường 15, Bình Thạnh, DT 105m2",20 triệu/tháng,105 m²,"Bình Thạnh, Hồ Chí Minh",cho-thue-kho-nha-xuong-dat
Cho thuê kho Quận 7 giá rẻ 1000m2 nhanh chỉ 95 nghìn/m/tháng,95 triệu/tháng,1.000 m²,"Quận 7, Hồ Chí Minh",cho-thue-kho-nha-xuong-dat
Cho thuê 5000m2 đất làm sân bank thể thao,70 triệu/tháng,5.000 m²,"Nhà Bè, Hồ Chí Minh",cho-thue-kho-nha-xuong-dat
Cho thuê cặp đất khu dân cư Làng Đại Học. DT 10x30m mỗi lô* giá: 27tr/ tháng trục thông 20m,80 triệu/tháng,500 m²,"Nhà Bè, Hồ Chí Minh",cho-thue-kho-nha-xuong-dat
Cho thuê lô đất 6000m2 giá từ 100tr/tháng. MT Đào Sư Tích,100 triệu/tháng,6.000 m²,"Nhà Bè, Hồ Chí Minh",cho-thue-kho-nha-xuong-dat
"Cho thuê 1000m2 đất mặt tiền đường số 9, Linh Tây thủ đức 50tr/ tháng",50 triệu/tháng,1.000 m²,"Thủ Đức, Hồ Chí Minh",cho-thue-kho-nha-xuong-dat
"Cho thuê 5400m2 đất mặt tiền Lý Tế Xuyên, Linh Đông, Thủ Đức 80tr/ tháng",80 triệu/tháng,5.400 m²,"Thủ Đức, Hồ Chí Minh",cho-thue-kho-nha-xuong-dat
Cho thuê kho 200m2 - 500m2 Nhà Bè theo nhu cầu khách hàng,Giá thỏa thuận,240 m²,"Nhà Bè, Hồ Chí Minh",cho-thue-kho-nha-xuong-dat
Kho xưởng giá rẻ nhiều loại diện tích Nhà Bè,13 triệu/tháng,380 m²,"Nhà Bè, Hồ Chí Minh",cho-thue-kho-nha-xuong-dat
Chuyên kho xưởng giá rẻ nhiều loại diện tích,13 triệu/tháng,380 m²,"Nhà Bè, Hồ Chí Minh",cho-thue-kho-nha-xuong-dat
"Đất vị trí đắc địa cho thuê ở Nguyễn Văn Khạ, xã Phú Hòa Đông, huyện Củ Chi, DT 10000m2",25 triệu/tháng,10.000 m²,"Củ Chi, Hồ Chí Minh",cho-thue-kho-nha-xuong-dat
"Đất vị trí đắc địa cho thuê ở Cây Da, xã Tân Phú Trung, huyện Củ Chi, DT 2400m2",25 triệu/tháng,2.400 m²,"Củ Chi, Hồ Chí Minh",cho-thue-kho-nha-xuong-dat
"Cho thuê kho xưởng 600m2, giá ưu đãi tại Phú Nhuận",60 triệu/tháng,600 m²,"Phú Nhuận, Hồ Chí Minh",cho-thue-kho-nha-xuong-dat
"Cho thuê kho 400m2 cạnh đường Nguyễn Hữu Thọ, giá 24tr/tháng. LH: 0911 411 *** E Hường",24 triệu/tháng,400 m²,"Nhà Bè, Hồ Chí Minh",cho-thue-kho-nha-xuong-dat
"Cho thuê cặp đất KDC Thái Sơn BQP, DT 10x25m giá từ 11tr/tháng. LH: 0909 460 *** Đức",11 triệu/tháng,250 m²,"Nhà Bè, Hồ Chí Minh",cho-thue-kho-nha-xuong-dat
"Mặt bằng cho thuê Kinh Dương Vương, Bình Tân - DT 1.300m2",120 triệu/tháng,1.300 m²,"Bình Tân, Hồ Chí Minh",cho-thue-kho-nha-xuong-dat
"Đường Hoàng Văn Thụ, Phú Nhuận, có cho thuê kho DT 600m2 rộng rãi",60 triệu/tháng,600 m²,"Phú Nhuận, Hồ Chí Minh",cho-thue-kho-nha-xuong-dat
"Cho thuê mặt bằng nhà trẻ ở Song Hành, Quận 2 - DT 680m2",168 nghìn/m²,680 m²,"Quận 2, Hồ Chí Minh",cho-thue-kho-nha-xuong-dat
"Cho thuê đất mặt tiền đường Trương Văn Bang, sát công chứng Lê Văn Dũng, 16x20m, giá 50 triệu/tháng",50 triệu/tháng,320 m²,"Quận 2, Hồ Chí Minh",cho-thue-kho-nha-xuong-dat
"Chuyên cho thuê đất KDC Làng Đại Học, Lê Văn Lương. Dt: 10x20m 10x30m 1000m2 3000m2.10tr - 50tr",20 triệu/tháng,660 m²,"Nhà Bè, Hồ Chí Minh",cho-thue-kho-nha-xuong-dat
"Cho thuê đất số 26 đường số 17, khu An Phú An Khánh (mặt sau đường Song Hành), 10x20m, giá 30tr/th",30 triệu/tháng,200 m²,"Quận 2, Hồ Chí Minh",cho-thue-kho-nha-xuong-dat
"Cho thuê kho bãi trống DT lớn ở QL 1A, Bình Chánh - 5.000m2",70 nghìn/m²,5 m²,"Bình Chánh, Hồ Chí Minh",cho-thue-kho-nha-xuong-dat
"Kho xưởng mới cho thuê ở Đông Lân, Xã Bà Điểm, Huyện Hóc Môn DT 500m2",25 triệu/tháng,500 m²,"Hóc Môn, Hồ Chí Minh",cho-thue-kho-nha-xuong-dat
Cho thuê kho mặt tiền đường Trần Đại Nghĩa (xe công vào thoải mái) - Có diện tích 1000m2,70 triệu/tháng,1.000 m²,"Bình Chánh, Hồ Chí Minh",cho-thue-kho-nha-xuong-dat
"Cho thuê kho 300m2 Bà Điểm, sát Quốc Lộ 1A xe cont 24/24. Giá sốc 15 triệu",15 triệu/tháng,300 m²,"Hóc Môn, Hồ Chí Minh",cho-thue-kho-nha-xuong-dat
"Cho thuê xưởng khu công nghiêp Sông Mây, Bắc Sơn, Trảng Bom, Đồng Nai, 3000m2",168 triệu/tháng,3.000 m²,"Trảng Bom, Đồng Nai",cho-thue-kho-nha-xuong-dat
Chính chủ cần cho thuê đất lô góc 2 mặt tiền QL61,25 triệu/tháng,"125,9 m²","Gò Quao, Kiên Giang",cho-thue-kho-nha-xuong-dat
"Cho thuê kho xưởng Xuân Thới Thượng, Hóc Môn, 600m2 giá siêu rẻ chỉ 15 triệu, đường xe công",15 triệu/tháng,600 m²,"Hóc Môn, Hồ Chí Minh",cho-thue-kho-nha-xuong-dat
"Cho thuê kho xưởng Bà Điểm, sát Quốc Lộ 1A 750m2 giá 50 triệu. Kho 2 mặt tiền Công Đậu 2 cái 24/24",50 triệu/tháng,750 m²,"Hóc Môn, Hồ Chí Minh",cho-thue-kho-nha-xuong-dat
"Cho thuê kho mới đẹp Đường Âu Cơ, xe cont vào 320m2, giá 38tr/tháng 0926 922 ***",38 triệu/tháng,320 m²,"Tân Phú, Hồ Chí Minh",cho-thue-kho-nha-xuong-dat
Cho thuê xưởng 7x40m - Mặt tiền TL9 - 13 triệu/ tháng,13 triệu/tháng,280 m²,"Đức Hòa, Long An",cho-thue-kho-nha-xuong-dat
Kho xưởng mới cho thuê ở Tỉnh Lộ 41 Phường Thạnh Lộc Quận 12. DT 600m2,26 triệu/tháng,600 m²,"Quận 12, Hồ Chí Minh",cho-thue-kho-nha-xuong-dat
"Kho giá rẻ 1000m2, đường Bình Thành, Bình Tân, giá 50 nghìn/m2, đường container",50 nghìn/m²,1.000 m²,"Bình Tân, Hồ Chí Minh",cho-thue-kho-nha-xuong-dat
"Cho thuê đất lớn tại Quốc Lộ 22, Xã Xuân Thới Đông, Hóc Môn - 7468m2, giá cực kỳ hấp dẫn",65 triệu/tháng,7.468 m²,"Hóc Môn, Hồ Chí Minh",cho-thue-kho-nha-xuong-dat
"Kho xưởng 2 mặt tiền, DT: 2.070m2, đường CN12 trong KCN Tân Bình, PCCC tiêu chuẩn","111,3 nghìn/m²",2.070 m²,"Tân Phú, Hồ Chí Minh",cho-thue-kho-nha-xuong-dat
"Kho xưởng mới cho thuê ở Nguyễn Trọng Quyền, Phường Tân Thới Hoà, Quận Tân Phú DT 300m2",24 triệu/tháng,300 m²,"Tân Phú, Hồ Chí Minh",cho-thue-kho-nha-xuong-dat
"Cho thuê đất có DT 11.000m2 MT Võ Trần Chí, Bình Chánh",150 triệu/tháng,11.000 m²,"Bình Chánh, Hồ Chí Minh",cho-thue-kho-nha-xuong-dat
"Đường Hoàng Văn Thụ - cho thuê kho xưởng 600m2 - an ninh, yên tĩnh - quận Tân Bình",60 triệu/tháng,600 m²,"Tân Bình, Hồ Chí Minh",cho-thue-kho-nha-xuong-dat
Chuyên kho xưởng giá rẻ nhiều loại diện tích,13 triệu/tháng,380 m²,"Nhà Bè, Hồ Chí Minh",cho-thue-kho-nha-xuong-dat
"Kho xưởng 1900m2 (đang làm may), đường Quốc Lộ 1A, Quận 12, có PCCC",199 triệu/tháng,1.900 m²,"Quận 12, Hồ Chí Minh",cho-thue-kho-nha-xuong-dat
"Đường Lê Thị Riêng - Cho thuê xưởng 500m2 mặt tiền - Phường Thới An, Quận 12",48 triệu/tháng,500 m²,"Quận 12, Hồ Chí Minh",cho-thue-kho-nha-xuong-dat
Cho thuê cặp đôi kho mini - có điện 3 pha - 15 triệu/ tháng,15 triệu/tháng,250 m²,"Đức Hòa, Long An",cho-thue-kho-nha-xuong-dat
"Kho xưởng 1014m2, P. TTN - Quận 12, có PCCC tự động, xe container tới kho, giá 99tr/tháng",99 triệu/tháng,1.014 m²,"Quận 12, Hồ Chí Minh",cho-thue-kho-nha-xuong-dat
Đất vị trí đắc địa cho thuê ở An Phú Đông Phường An Phú Đông Quận 12 DT 1.800m2,27 triệu/tháng,1.800 m²,"Quận 12, Hồ Chí Minh",cho-thue-kho-nha-xuong-dat
Kho xưởng mới cho thuê ở Lũy Bán Bích Phường Phú Trung Quận Tân Phú DT 230m2,24 triệu/tháng,230 m²,"Tân Phú, Hồ Chí Minh",cho-thue-kho-nha-xuong-dat
Cần cho thuê tại đường Đào Trí Quận 7 - Đất mặt tiền 1.000 m2 có thể làm kho bãi,40 triệu/tháng,1.000 m²,"Quận 7, Hồ Chí Minh",cho-thue-kho-nha-xuong-dat
Cho thuê xưởng 450 m2 - 11 triệu/ tháng,11 triệu/tháng,450 m²,"Đức Hòa, Long An",cho-thue-kho-nha-xuong-dat
"Đường Thanh Niên, Xã Phạm Văn Hai - DT 1.000m2 cần cho thuê phân xưởng có điện 3pa mặt tiền đường",60 triệu/tháng,1.000 m²,"Bình Chánh, Hồ Chí Minh",cho-thue-kho-nha-xuong-dat
"Cho thuê Kho xưởng ở tại KCN Cát lái, Quận 2 - Diện tích 720m2",110 nghìn/m²,720 m²,"Quận 2, Hồ Chí Minh",cho-thue-kho-nha-xuong-dat
"Kho 300m2 mặt tiền Trường Chinh, làm showroom, gần cầu Tham Lương, giá rẻ",39 triệu/tháng,300 m²,"Quận 12, Hồ Chí Minh",cho-thue-kho-nha-xuong-dat
"Đường Trần Đại Nghĩa, Xã Bình Chánh, Bình Chánh kho có diện tích 1.000m2 cần cho thuê",70 triệu/tháng,1.000 m²,"Bình Chánh, Hồ Chí Minh",cho-thue-kho-nha-xuong-dat
Cho thuê 12.000 m2 nhà xưởng xây sẵn tại Hải Dương,Giá thỏa thuận,16.000 m²,"Tứ Kỳ, Hải Dương",cho-thue-kho-nha-xuong-dat
"Cho thuê đất trống kinh doanh 400m2 đường Dương Đức Hiền, Phường Tây Thạnh, Tân Phú",40 triệu/tháng,400 m²,"Tân Phú, Hồ Chí Minh",cho-thue-kho-nha-xuong-dat
"Cho thuê kho, xưởng MT 24m, Nguyễn Hữu Thọ, Nhà Bè DT 800m2 - 70 triệu/tháng",70 triệu/tháng,800 m²,"Nhà Bè, Hồ Chí Minh",cho-thue-kho-nha-xuong-dat
Kho tại Bình Tân cho thuê có diện tích lớn đến 600m2,60 triệu/tháng,600 m²,"Tân Bình, Hồ Chí Minh",cho-thue-kho-nha-xuong-dat
"Cho thuê kho diện tích nhỏ, kho mini đa dạng, thời gian thuê linh hoạt",3 triệu/tháng,20 m²,"Quận 10, Hồ Chí Minh",cho-thue-kho-nha-xuong-dat
"Cho thuê kho xưởng đường Liên Khu 1 - 6, Bình Trị Đông B, Bình Tân DT 600m2 - địa điểm đắc địa",60 triệu/tháng,600 m²,"Bình Tân, Hồ Chí Minh",cho-thue-kho-nha-xuong-dat
"Kho xưởng cho thuê Lê Văn Tách Dĩ An, vị trí đẹp, mặt tiền QL1A, ngay chân cầu vượt Sóng Thần.",90 nghìn/m²,1.000 m²,"Dĩ An, Bình Dương",cho-thue-kho-nha-xuong-dat
"Nguyễn Hữu Thọ, Nhà Bè, Hồ Chí Minh - cho thuê kho, xưởng MT 800m2",70 triệu/tháng,800 m²,"Nhà Bè, Hồ Chí Minh",cho-thue-kho-nha-xuong-dat
Cho thuê kho mặt tiền lộ Lý Thường Kiệt 5.000M2,Giá thỏa thuận,2.925 m²,"Sóc Trăng, Sóc Trăng",cho-thue-kho-nha-xuong-dat
Cho thuê 2 kho mặt tiền Quốc lộ 1A khu công nghiệp,Giá thỏa thuận,400 m²,"Châu Thành, Sóc Trăng",cho-thue-kho-nha-xuong-dat
"Cho thuê 2 kho xưởng KCN Hải Sơn, DT: 2.000m2 - 2.400m2, Long An",153 triệu/tháng,2.000 m²,"Đức Hòa, Long An",cho-thue-kho-nha-xuong-dat
"Cho thuê kho xưởng Nguyễn Cửu Phú, DT: 750m2, giá: 50k/m2, Bình Tân",50 nghìn/m²,750 m²,"Bình Tân, Hồ Chí Minh",cho-thue-kho-nha-xuong-dat
"Cho thuê kho xưởng Quốc Lộ 1A, DT: 1.800m2, giá: 65tr/th, Bình Chánh",65 triệu/tháng,1.800 m²,"Bình Chánh, Hồ Chí Minh",cho-thue-kho-nha-xuong-dat
"Kho bãi xưởng cho thuê 6000m2 hoặc từng phần, Tân Thới Nhất Quận 12",90 triệu/tháng,989 m²,"Quận 12, Hồ Chí Minh",cho-thue-kho-nha-xuong-dat
"Cho thuê kho xưởng ở Bình Quới, Bình Thạnh, DT 700m2 - 85tr/tháng",85 triệu/tháng,700 m²,"Bình Thạnh, Hồ Chí Minh",cho-thue-kho-nha-xuong-dat
Chính chủ cho thuê kho tại Phú Thị - Gia Lâm diện tích 560m2,Giá thỏa thuận,560 m²,"Gia Lâm, Hà Nội",cho-thue-kho-nha-xuong-dat
"Chính chủ cho thuê kho xưởng 80m2 mặt đường 32, ngay ngã 4 Trôi - Hoài Đức - HN",Giá thỏa thuận,80 m²,"Hoài Đức, Hà Nội",cho-thue-kho-nha-xuong-dat
Chính chủ cho thuê nhà kho mới dựng tại Bùi Công Trừng - Hóc Môn. DT 700m2 kho dựng 350m2 16tr/th,16 triệu/tháng,700 m²,"Hóc Môn, Hồ Chí Minh",cho-thue-kho-nha-xuong-dat
"Cho thuê kho xưởng 1000m2 Tân Định, Bến Cát, Bình Dương. Chỉ 20 triệu/tháng. Xưởng 700m2",20 triệu/tháng,1.000 m²,"Bến Cát, Bình Dương",cho-thue-kho-nha-xuong-dat
"Cho thuê kho gần 1000m2 Định Hòa, Thủ Dầu Một gần sân golf Phú Mỹ",40 triệu/tháng,950 m²,"Thủ Dầu Một, Bình Dương",cho-thue-kho-nha-xuong-dat
"Cho thuê kho xưởng 4000m2 Tân Định, Bến Cát, Bình Dương, chỉ 2,8 usd/m2 (250 triệu/tháng)",250 triệu/tháng,5.500 m²,"Bến Cát, Bình Dương",cho-thue-kho-nha-xuong-dat
Cần cho thuê kho xưởng tại Bến Lức Long An dienejt ích 1655m2 giá chỉ 40tr/tháng,40 triệu/tháng,1.665 m²,"Bến Lức, Long An",cho-thue-kho-nha-xuong-dat
Chính chủ cần cho thuê nhà kho 1655m2 tại Bến Lức Long An,40 triệu/tháng,1.665 m²,"Bến Lức, Long An",cho-thue-kho-nha-xuong-dat
"Ngay gần sân bay TSN - Đường Hoàng Văn Thụ Phường 2, Quận Tân Bình - cho thuê kho xưởng 600m2",60 triệu/tháng,600 m²,"Tân Bình, Hồ Chí Minh",cho-thue-kho-nha-xuong-dat
"Cho thuê kho giá rẻ tại đường Tôn Thất Thuyết, Q4 có DT 700m2",125 triệu/tháng,700 m²,"Quận 4, Hồ Chí Minh",cho-thue-kho-nha-xuong-dat
"Cho thuê nhà xưởng ở Tỉnh Lộ 10, P. Tân Tạo A, Q. Bình Tân có DT 1.470m2","101,43 triệu/tháng",1.470 m²,"Bình Tân, Hồ Chí Minh",cho-thue-kho-nha-xuong-dat
Nhà xưởng 560m2 giá quá rẻ bảo đảm không có kho thứ hai!,12 triệu/tháng,560 m²,"Tân Uyên, Bình Dương",cho-thue-kho-nha-xuong-dat
Kho xưởng mới cho thuê ở Lê Đình Cẩn Phường Tân Tạo Quận Bình Tân DT 230m2,12 triệu/tháng,230 m²,"Bình Tân, Hồ Chí Minh",cho-thue-kho-nha-xuong-dat
Cho thuê kho KCN Trà Nóc - 2000m2,80 triệu/tháng,2.000 m²,"Bình Thủy, Cần Thơ",cho-thue-kho-nha-xuong-dat
"Cho thuê mặt bằng 2000m2 Tiến Thành, sát Novawolrd Phan Thiết, đường Lạc Long Quân",30 triệu/tháng,20.000 m²,"Phan Thiết, Bình Thuận",cho-thue-kho-nha-xuong-dat
"Đường Hoàng Văn Thụ, Phú Nhuận - Cho thuê kho xưởng 600m2 - an ninh, thuận tiện",60 triệu/tháng,600 m²,"Phú Nhuận, Hồ Chí Minh",cho-thue-kho-nha-xuong-dat
"Cho thuê xưởng 4000m2 An Viễn, Trảng Bom. Gần khu công nghiệp Giang Điền",80 triệu/tháng,4.000 m²,"Trảng Bom, Đồng Nai",cho-thue-kho-nha-xuong-dat
Cho thuê 20.000m2 đất công cộng bám công viên Quận Long Biên - hạ tầng san lấp. LH 0906 218 ***,Giá thỏa thuận,20.000 m²,"Long Biên, Hà Nội",cho-thue-kho-nha-xuong-dat
"Cần cho thuê mặt bằng kinh doanh, làm kho xưởng sản xuất, 420m2",8 triệu/tháng,420 m²,"Thanh Oai, Hà Nội",cho-thue-kho-nha-xuong-dat
"Cho thuê đất có nhà cấp 4, số 3i Nguyễn Thượng Hiền, P5, Q. Bình Thạnh, TP HCM",30 triệu/tháng,65 m²,"Bình Thạnh, Hồ Chí Minh",cho-thue-kho-nha-xuong-dat
Cho thuê 7000m2 nhà xưởng phường Tam Phước Biên Hoà giá 320 triệu Lh 0933 725 ***,320 triệu/tháng,7.000 m²,"Biên Hòa, Đồng Nai",cho-thue-kho-nha-xuong-dat
"Cho thuê kho xưởng MT Hồ Ngọc Lãm, phường An Lạc, Quận Bình Tân",30 triệu/tháng,300 m²,"Bình Tân, Hồ Chí Minh",cho-thue-kho-nha-xuong-dat
"Cho thuê kho xưởng MT Võ Chí Công, phường Phú Hữu, Quận 9",180 triệu/tháng,4.000 m²,"Quận 9, Hồ Chí Minh",cho-thue-kho-nha-xuong-dat
Hiếm: Lô đất 5x27m 2 mặt tiền Lương Định Của gần Trường Tuệ Đức chỉ 20 tr/th kí dài hạn 0938 311 ***,20 triệu/tháng,135 m²,"Quận 2, Hồ Chí Minh",cho-thue-kho-nha-xuong-dat
"Cho thuê đất 3000m2, lô góc 3 mặt tiền đường xe tải Tô Ngọc Vân, Phường 15, Gò Vấp",40 triệu/tháng,3.000 m²,"Gò Vấp, Hồ Chí Minh",cho-thue-kho-nha-xuong-dat
"Kho trống 15x40m đường xe công Lũy Bán Bích, P. Tân Thới Hòa mới cứng giá 50tr/th",50 triệu/tháng,550 m²,"Tân Phú, Hồ Chí Minh",cho-thue-kho-nha-xuong-dat
"Cần cho thuê kho trống DT 1.600m2 Q7, HCM",120 nghìn/m²,1.600 m²,"Quận 7, Hồ Chí Minh",cho-thue-kho-nha-xuong-dat
"Cần cho thuê kho diện tích 1.600m2 Tân Thuận Đông Q7, HCM có thể hoạt động cầu lông, golf điện tử",120 nghìn/m²,1.600 m²,"Quận 7, Hồ Chí Minh",cho-thue-kho-nha-xuong-dat
"Chính chủ cần cho thuê kho diện tích 1.600m2 Q7, HCM có thể hoạt động cầu lông, golf điện tử",120 nghìn/m²,1.600 m²,"Quận 7, Hồ Chí Minh",cho-thue-kho-nha-xuong-dat
"Cho thuê kho làm sân cầu lông, golf điện tử, diện tích 30x50m Quận 7, HCM",120 nghìn/m²,1.600 m²,"Quận 7, Hồ Chí Minh",cho-thue-kho-nha-xuong-dat
Chính chủ cho thuê kho trống 1.600m2,120 nghìn/m²,1.600 m²,"Quận 7, Hồ Chí Minh",cho-thue-kho-nha-xuong-dat
Kho mới cứng trần cao Hòa Bình 15x35m P. Hiệp Tân xe cont tới kho giá 45tr/th,45 triệu/tháng,500 m²,"Tân Phú, Hồ Chí Minh",cho-thue-kho-nha-xuong-dat
Kho mới cứng 10x22m Lũy Bán Bích kho mới trần cao đường thông xe tải P Hiệp Tân giá 23tr/th,23 triệu/tháng,220 m²,"Tân Phú, Hồ Chí Minh",cho-thue-kho-nha-xuong-dat
Cho thuê nhà làm văn phòng - kho DT: 7x30m nhà 1 trệt 1 lửng. Đường 12m KDC Làng Đại Học ABC,15 triệu/tháng,210 m²,"Nhà Bè, Hồ Chí Minh",cho-thue-kho-nha-xuong-dat
"Cho thuê kho, xưởng ở Hoàng Văn Thụ có DT 600m2 - giá rẻ bất ngờ chỉ 60tr/tháng",60 triệu/tháng,600 m²,"Phú Nhuận, Hồ Chí Minh",cho-thue-kho-nha-xuong-dat
Cho thuê lô góc Phan Liêm với Lệ Lộ gần biển sau khách sạn Mường Thanh,30 triệu/tháng,220 m²,"Ngũ Hành Sơn, Đà Nẵng",cho-thue-kho-nha-xuong-dat
"Cho thuê Kho xưởng đẹp ở Đường Hoàng Văn Thụ, , Quận Phú Nhuận DT 600m2",60 triệu/tháng,600 m²,"Phú Nhuận, Hồ Chí Minh",cho-thue-kho-nha-xuong-dat
Kho cho thuê rộng 600m2 tại Phú Nhuận giá hấp dẫn giá 60tr/tháng,60 triệu/tháng,600 m²,"Phú Nhuận, Hồ Chí Minh",cho-thue-kho-nha-xuong-dat
"Tại Khu Vực Hoàng Văn Thụ, Phú Nhuận Cho Thuê Kho Xưởng Tiện Nghi - 600m, 60 Triệu/Tháng",60 triệu/tháng,600 m²,"Phú Nhuận, Hồ Chí Minh",cho-thue-kho-nha-xuong-dat
"Ngay gần Sân bay TSN - Phường 2, Quận Tân Bình, TP. HCM cho thuê kho xưởng 600m2",60 triệu/tháng,600 m²,"Tân Bình, Hồ Chí Minh",cho-thue-kho-nha-xuong-dat
Cho thuê kho ngoại quan trung tâm Logistics ICD Vĩnh Phúc,Giá thỏa thuận,1.000 m²,"Bình Xuyên, Vĩnh Phúc",cho-thue-kho-nha-xuong-dat
"Cho thuê kho xưởng gần cổng 11, cách đường Bùi Văn Hòa 500m",10 triệu/tháng,423 m²,"Biên Hòa, Đồng Nai",cho-thue-kho-nha-xuong-dat
"Cho thuê kho xưởng - vị trí đắc địa tại phường 2, quận Tân Bình, TP. HCM - giá 60 triệu/th",60 triệu/tháng,600 m²,"Tân Bình, Hồ Chí Minh",cho-thue-kho-nha-xuong-dat
"Cho thuê kho xưởng đẹp 600m2 ở đường Hoàng Văn Thụ, Phường 2, Quận Tân Bình, TP. HCM",60 triệu/tháng,600 m²,"Tân Bình, Hồ Chí Minh",cho-thue-kho-nha-xuong-dat
"Cho thuê kho xưởng 600m2, ngay gần sân bay TSN - phường 2, quận Tân Bình, TP. HCM",60 triệu/tháng,600 m²,"Tân Bình, Hồ Chí Minh",cho-thue-kho-nha-xuong-dat
"Cho thuê kho xưởng đẹp ở Đường Hoàng Văn Thụ, Phường 2, Quận Tân Bình DT 600m2",60 triệu/tháng,600 m²,"Tân Bình, Hồ Chí Minh",cho-thue-kho-nha-xuong-dat
Cho thuê nhà xưởng mới 2.000m2,70 triệu/tháng,2.000 m²,"Vinh, Nghệ An",cho-thue-kho-nha-xuong-dat
Cho thuê nhà xưởng 1.300m2 tại khu công nghiệp Quang Minh - Mê Linh - Hà Nội,Giá thỏa thuận,1.300 m²,"Mê Linh, Hà Nội",cho-thue-kho-nha-xuong-dat
Cho thuê xưởng DB4 300m2 - đối diện KDC Sun Casa Central Vsip II Tân Uyên,15 triệu/tháng,300 m²,"Tân Uyên, Bình Dương",cho-thue-kho-nha-xuong-dat
Cho thuê xưởng vòng xoay Định Hoà - Thủ Dầu Một - Bình Dương,65 triệu/tháng,1.080 m²,"Thủ Dầu Một, Bình Dương",cho-thue-kho-nha-xuong-dat
Cho thuê mặt bằng kinh doanh đắc địa 930m2 ở Trần Não Quận 2,200 triệu/tháng,930 m²,"Quận 2, Hồ Chí Minh",cho-thue-kho-nha-xuong-dat
Chính chủ cần cho thuê nhà kho 1655m2 tại Bến Lức Long An,40 triệu/tháng,1.665 m²,"Bến Lức, Long An",cho-thue-kho-nha-xuong-dat
"Kho xưởng rộng 2.700m2, tại đường Bà Thiên giá 40tr/tháng",40 triệu/tháng,2.700 m²,"Củ Chi, Hồ Chí Minh",cho-thue-kho-nha-xuong-dat
"Cho thuê 6000m2 đất mặt tiền Phước Thắng, Phường 12, TP Vũng Tàu (có thể hợp tác đầu tư)",Giá thỏa thuận,6.000 m²,"Vũng Tàu, Bà Rịa Vũng Tàu",cho-thue-kho-nha-xuong-dat
"Kho xưởng cho thuê tại Hoàng Văn Thụ, Phú Nhuận giá 60tr/tháng",60 triệu/tháng,600 m²,"Phú Nhuận, Hồ Chí Minh",cho-thue-kho-nha-xuong-dat
Nằm tại mặt tiền đường Nguyễn Văn Linh kho diện tích 100m2 cho thuê,7 triệu/tháng,100 m²,"Quận 8, Hồ Chí Minh",cho-thue-kho-nha-xuong-dat
Cho thuê xưởng lớn DT 350m2 điện 3 pha,28 triệu/tháng,350 m²,"Bình Tân, Hồ Chí Minh",cho-thue-kho-nha-xuong-dat
"Kho diện tích lớn nhỏ, có ô kệ để hàng sỉ lẻ thương mại điện tử, mỹ phẩm ở trung tâm Hồ Chí Minh",4 triệu/tháng,50 m²,"Phú Nhuận, Hồ Chí Minh",cho-thue-kho-nha-xuong-dat
Cho thuê xưởng Tân Bình Dĩ An Bình Dương 200m2 điện 3 pha đường xe công giá 13 triệu,13 triệu/tháng,200 m²,"Dĩ An, Bình Dương",cho-thue-kho-nha-xuong-dat
Gần cây xăng Văn Cao cho thuê kho diện tích 200m2 Quận Bình Tân,25 triệu/tháng,200 m²,"Bình Tân, Hồ Chí Minh",cho-thue-kho-nha-xuong-dat
"Cho thuê xưởng SX xi mạ trong KCN Hải Sơn, Long An xưởng 8200m2",Giá thỏa thuận,8.200 m²,"Đức Hòa, Long An",cho-thue-kho-nha-xuong-dat
"Cho thuê xưởng 1.200m2, Trần Văn Giàu ngay ngã tư Nguyễn Văn Cự",80 triệu/tháng,1.200 m²,"Bình Tân, Hồ Chí Minh",cho-thue-kho-nha-xuong-dat
"Cho thuê mặt bằng kho xưởng đắc địa 1.300m2 ở đường Kinh Dương Vương, Bình Tân",120 triệu/tháng,1.300 m²,"Bình Tân, Hồ Chí Minh",cho-thue-kho-nha-xuong-dat
"Kho Tân Thành, quận Tân Phú cho thuê 220m2 - 22tr",22 triệu/tháng,220 m²,"Tân Phú, Hồ Chí Minh",cho-thue-kho-nha-xuong-dat
Cho thuê thời vụ kho 2000-6000m2 gần ccn tân an 25k/1m2/ tháng,25 nghìn/m²,6.000 m²,"Buôn Ma Thuột, Đắk Lắk",cho-thue-kho-nha-xuong-dat
Cho thuê cụm kho 8000m2 sân bãi 6000m2 KCN Tâm Thắng Cưjut Đắk Nông có bình điện,25 nghìn/m²,8.000 m²,"Cư Jút, Đắk Nông",cho-thue-kho-nha-xuong-dat
"Cho thuê kho ở Nguyễn Văn Bá, Thủ Đức - S 1250m2","87,5 triệu/tháng",1.250 m²,"Thủ Đức, Hồ Chí Minh",cho-thue-kho-nha-xuong-dat
"Ở Lê Đình Cẩn, Bình Tân cho thuê kho xưởng có DT 230m2",12 triệu/tháng,230 m²,"Bình Tân, Hồ Chí Minh",cho-thue-kho-nha-xuong-dat
Cho thuê xưởng mặt tiền đường 181 huyện Củ Chi giá 25tr/tháng,25 triệu/tháng,700 m²,"Củ Chi, Hồ Chí Minh",cho-thue-kho-nha-xuong-dat
"Cần cho thuê kho rộng. 18x18m P28, Bình Thạnh",25 triệu/tháng,324 m²,"Bình Thạnh, Hồ Chí Minh",cho-thue-kho-nha-xuong-dat
Cho thuê kho 1200 m2 giá 120tr/th. Tại Thủ Đức,120 triệu/tháng,1.200 m²,"Thủ Đức, Hồ Chí Minh",cho-thue-kho-nha-xuong-dat
"Mặt tiền đường Bình Chiểu, Cho thuê xưởng 500m2",38 triệu/tháng,500 m²,"Thủ Đức, Hồ Chí Minh",cho-thue-kho-nha-xuong-dat
"Kho kết cấu hệ cột thép i DT 500m2, đường Lã Xuân Oai, P. Long Trường cho thuê",25 triệu/tháng,500 m²,"Quận 9, Hồ Chí Minh",cho-thue-kho-nha-xuong-dat
Cho thuê kho 500m2 Bà Điểm giá 25tr/tháng,25 triệu/tháng,500 m²,"Hóc Môn, Hồ Chí Minh",cho-thue-kho-nha-xuong-dat
Cho thuê kho QL13 Q. Bình Thạnh 239m2 giá 50tr/tháng,50 triệu/tháng,239 m²,"Bình Thạnh, Hồ Chí Minh",cho-thue-kho-nha-xuong-dat
Xưởng rộng lớn: 600m2 với trần cao. Cho thuê tại huyện Hóc Môn,30 triệu/tháng,600 m²,"Hóc Môn, Hồ Chí Minh",cho-thue-kho-nha-xuong-dat
"Cần cho thuê kho hình L diện tích 250m2, hình L Quận Bình Tân",20 triệu/tháng,250 m²,"Bình Tân, Hồ Chí Minh",cho-thue-kho-nha-xuong-dat
Kho cho thuê phường Thảo Điền giá 30tr/tháng - DT 300m2,30 triệu/tháng,300 m²,"Quận 2, Hồ Chí Minh",cho-thue-kho-nha-xuong-dat
Mặt bằng đường Lê Quát cho thuê kho - 2.000m2,200 triệu/tháng,2.000 m²,"Tân Phú, Hồ Chí Minh",cho-thue-kho-nha-xuong-dat
Cho thuê kho rộng 366m2 đường Võ Thành Trang,45 triệu/tháng,366 m²,"Tân Bình, Hồ Chí Minh",cho-thue-kho-nha-xuong-dat
Mặt tiền Quốc lộ 1A cho thuê kho DT lớn,80 triệu/tháng,1.000 m²,"Bình Tân, Hồ Chí Minh",cho-thue-kho-nha-xuong-dat
Kho xưởng 1000m2 tại mặt tiền đường Quốc Lộ xe container di chuyển thoải mái,Giá thỏa thuận,1.000 m²,"Quận 12, Hồ Chí Minh",cho-thue-kho-nha-xuong-dat
Kho xưởng 500m2 giá tốt vị trí gần Đầm Sen tại quận Tân Phú,50 nghìn/m²,500 m²,"Tân Phú, Hồ Chí Minh",cho-thue-kho-nha-xuong-dat
Cho thuê kho xưởng 1600m2 giá rẻ vị trí đẹp tại quận Bình Tân,88 triệu/tháng,1.600 m²,"Bình Tân, Hồ Chí Minh",cho-thue-kho-nha-xuong-dat
Nhà kho mặt tiền Hồ Văn Mên 1000m2 giá 27tr/th,27 triệu/tháng,851 m²,"Thuận An, Bình Dương",cho-thue-kho-nha-xuong-dat
