Title,Price,Area,Location,type
"Phòng trọ Quận 3, studio ban công, gần Bờ Kè, cầu Công Lý, chùa Vĩnh Nghiêm",7 triệu/tháng,35 m²,"Quận 3, Hồ Chí Minh",cho-thue-nha-tro-phong-tro
"Căn hộ cửa sổ thoáng, full nội thất, gần ĐH TDT, RMIT, Lotte Mart Q7, Siêu Thị Go",5 triệu/tháng,25 m²,"Quận 7, Hồ Chí Minh",cho-thue-nha-tro-phong-tro
Phòng 35m2 full nội thất 2 mặt cửa sổ thoáng Thăng Long P4 Tân Bình - ưu đãi mạnh cuối năm,"5,2 triệu/tháng",35 m²,"Tân Bình, Hồ Chí Minh",cho-thue-nha-tro-phong-tro
Cho thuê phòng gần ngay công viên Lê Thị Riêng,12 triệu/tháng,45 m²,"Tân Bình, Hồ Chí Minh",cho-thue-nha-tro-phong-tro
Cho thuê CHDV 2PN 70m2 full nội thất cao cấp - máy giặt riêng gần công viên Hoàng Văn Thụ,"12,5 triệu/tháng",70 m²,"Tân Bình, Hồ Chí Minh",cho-thue-nha-tro-phong-tro
"Căn hộ giá rẻ, ngã tư Bảy Hiền, ban công, full nội thất, gần đại học Văn Lang",6 triệu/tháng,30 m²,"Tân Bình, Hồ Chí Minh",cho-thue-nha-tro-phong-tro
"Cho thuê nhà trọ, phòng trọ tại Phường 10, Quận Tân Bình","5,2 triệu/tháng",39 m²,"Tân Bình, Hồ Chí Minh",cho-thue-nha-tro-phong-tro
Phòng full nội thất dọn vào ở liền ngay vòng xoay Lăng Cha Cả,"6,8 triệu/tháng",30 m²,"Tân Bình, Hồ Chí Minh",cho-thue-nha-tro-phong-tro
Phòng trọ giá rẻ full nội thất ngay Hoà Bình - Lũy Bán Bích,"4,8 triệu/tháng",30 m²,"Tân Phú, Hồ Chí Minh",cho-thue-nha-tro-phong-tro
"Cho thuê nhà trọ MT Cao Thắng Q10 gồm 11p 3,9tr/th ful NT ở ngay VIP, LH 0901 600 *** Phi Nguyễn","3,9 triệu/tháng",23 m²,"Quận 10, Hồ Chí Minh",cho-thue-nha-tro-phong-tro
"Phòng mới xây cho thuê khu Tên Lửa, 35m2, có thang máy, có bảo vệ","2,9 triệu/tháng",35 m²,"Bình Tân, Hồ Chí Minh",cho-thue-nha-tro-phong-tro
"Căn hộ mini mới xây, có thang may, 30m2, WC riêng, hệ thống camera, báo cháy, có máy lạnh, ban công","2,5 triệu/tháng",25 m²,"Bình Tân, Hồ Chí Minh",cho-thue-nha-tro-phong-tro
"Chdv cửa sổ đón nắng rộng lớn - 30m2 - Đ/C: Chu Văn An, Bình Thạnh","5,5 triệu/tháng",30 m²,"Bình Thạnh, Hồ Chí Minh",cho-thue-nha-tro-phong-tro
"Cho thuê phòng trọ có gác tại đường Lê Đức Thọ, Gò Vấp (ngay chợ Xóm Mới)","3,9 triệu/tháng",25 m²,"Gò Vấp, Hồ Chí Minh",cho-thue-nha-tro-phong-tro
"Cho thuê phòng trọ giá từ 2tr/tháng, sạch sẽ, thoáng mát",2 triệu/tháng,20 m²,"Nha Trang, Khánh Hòa",cho-thue-nha-tro-phong-tro
"Cho thuê phòng trọ giá 1,6tr sát biển, thoáng mát, sạch sẽ, an ninh","1,6 triệu/tháng",20 m²,"Nha Trang, Khánh Hòa",cho-thue-nha-tro-phong-tro
TingTong 99 - duy nhất 1 phòng CCMN dành cho sinh viên Kinh Công - Kinh Kỹ - Times City,"3,85 triệu/tháng",25 m²,"Hai Bà Trưng, Hà Nội",cho-thue-nha-tro-phong-tro
Trống sẵn phòng full nội thất mới bếp xa giường kế Q3,"5,5 triệu/tháng",35 m²,"Phú Nhuận, Hồ Chí Minh",cho-thue-nha-tro-phong-tro
TingTong 32 - siêu phẩm studio full nội thất cao cấp có bãi ô tô gần Ngã Tư Sở vào ở ngay,"5,55 triệu/tháng",25 m²,"Thanh Xuân, Hà Nội",cho-thue-nha-tro-phong-tro
"Phòng cho thuê ngay Đại học Xã hội và nhân văn, Đài truyền hình, cửa sổ lớn thang máy","5,5 triệu/tháng",25 m²,"Quận 1, Hồ Chí Minh",cho-thue-nha-tro-phong-tro
Phòng cho thuê full nội thất ngay Đường 26 Tháng 3,"4,2 triệu/tháng",30 m²,"Bình Tân, Hồ Chí Minh",cho-thue-nha-tro-phong-tro
Phòng cho thuê mới xây nội thất và 1 phòng cửa sổ ban công ngay sát Aeon Tân Phú,3 triệu/tháng,35 m²,"Bình Tân, Hồ Chí Minh",cho-thue-nha-tro-phong-tro
"Phòng cho thuê duplex ban công, cửa sổ ngay Hương Lộ 2, giá cực rẻ phòng cực sang","3,2 triệu/tháng",28 m²,"Bình Tân, Hồ Chí Minh",cho-thue-nha-tro-phong-tro
Phòng duplex full nội thất ngay Bình Long giao Lê Thúc Hoạch,"3,6 triệu/tháng",30 m²,"Bình Tân, Hồ Chí Minh",cho-thue-nha-tro-phong-tro
Hot! Căn hộ xịn sò cực sang ngay Hương Lộ 2 giảm giá cực mạnh,"3,7 triệu/tháng",25 m²,"Bình Tân, Hồ Chí Minh",cho-thue-nha-tro-phong-tro
"Pass phòng trọ (22m2 chưa tính gác) hẻm 8 Nguyễn Thiện Thuật, Bình Thạnh","4,5 triệu/tháng",22 m²,"Bình Thạnh, Hồ Chí Minh",cho-thue-nha-tro-phong-tro
"TingTong 90 - CCMN full đồ khu vực Nguyễn Khang, Yên Hòa cần người ở ngay","4,85 triệu/tháng",25 m²,"Cầu Giấy, Hà Nội",cho-thue-nha-tro-phong-tro
"Thuê phòng xinh xắn, 40m2, gía 9tr, đường Võ Thị Sáu, Quận 1",9 triệu/tháng,40 m²,"Quận 1, Hồ Chí Minh",cho-thue-nha-tro-phong-tro
Cho thuê phòng trọ cao cấp khu ven sông - đối diện ĐH RMIT Quận 7,"4,5 triệu/tháng",20 m²,"Quận 7, Hồ Chí Minh",cho-thue-nha-tro-phong-tro
"Quận 1 cho thuê phòng có nội thất cửa sổ lớn gần cầu Calmette, Bùi Viện","5,5 triệu/tháng",35 m²,"Quận 1, Hồ Chí Minh",cho-thue-nha-tro-phong-tro
Siêu phẩm studio balcony - full nội thất - An Khánh,6 triệu/tháng,30 m²,"Quận 2, Hồ Chí Minh",cho-thue-nha-tro-phong-tro
"Thuê phòng, full nội thất, tách bếp, 40m2, gía 8.7tr, Đường Võ Thị Sáu, Quận 1","8,7 triệu/tháng",40 m²,"Quận 1, Hồ Chí Minh",cho-thue-nha-tro-phong-tro
"Thuê phòng, full nội thất, tách bếp, 40m2, gía 8.7tr, Đường Võ Thị Sáu, Quận 1","8,7 triệu/tháng",40 m²,"Quận 1, Hồ Chí Minh",cho-thue-nha-tro-phong-tro
Hạ giá siêu phẩm bên trong toà nhà mới toanh ngay Phạm Văn Chiêu - Gò Vấp,"3,9 triệu/tháng",22 m²,"Gò Vấp, Hồ Chí Minh",cho-thue-nha-tro-phong-tro
"Căn hộ nằm ngay ngã tư Bảy Hiền, đại học Văn Hiến, Phường 10, Tân Bình, New 100%","4,8 triệu/tháng",30 m²,"Tân Bình, Hồ Chí Minh",cho-thue-nha-tro-phong-tro
"Phòng luxury 27m2 hẻm 1502/8 Nguyễn Duy Trinh, TP Thủ Đức chỉ 2 triệu 6","2,6 triệu/tháng",27 m²,"Quận 9, Hồ Chí Minh",cho-thue-nha-tro-phong-tro
"Thuê phòng xinh, 40m2, Đường Nguyễn Bỉnh Khiêm, gía 8tr, Đường Nguyễn Bỉnh Khiêm, Quận 1",8 triệu/tháng,40 m²,"Quận 1, Hồ Chí Minh",cho-thue-nha-tro-phong-tro
Phòng Duplex 3tr full nội thất tại Gò Vấp,3 triệu/tháng,20 m²,"Gò Vấp, Hồ Chí Minh",cho-thue-nha-tro-phong-tro
"Cho thuê phòng đầy đủ nội thất, gần ngay ngã 4 Phú Nhuận khu ẩm thực Phan Xích Long, LH: 0384 090 ***",7 triệu/tháng,30 m²,"Phú Nhuận, Hồ Chí Minh",cho-thue-nha-tro-phong-tro
Khánh Hội Q4 - Cửa sổ lớn siêu thoáng,7 triệu/tháng,30 m²,"Quận 4, Hồ Chí Minh",cho-thue-nha-tro-phong-tro
"Lê Văn Sỹ, Q3 - máy giặt riêng - Full NT",6 triệu/tháng,30 m²,"Quận 3, Hồ Chí Minh",cho-thue-nha-tro-phong-tro
Phòng 30m2 full nội thất 2 mặt cửa sổ thoáng Thăng Long P4 Tân Bình giá 4.5 triệu/th,"4,5 triệu/tháng",30 m²,"Tân Bình, Hồ Chí Minh",cho-thue-nha-tro-phong-tro
"Phòng full nội thất 50m2 1 phòng ngủ + phòng khách Lam Sơn P2 Tân Bình, giá 6 triệu/th",6 triệu/tháng,50 m²,"Tân Bình, Hồ Chí Minh",cho-thue-nha-tro-phong-tro
"Phòng trọ mới 22m2 giá sinh viên, WC riêng, giờ giấc tự do","2,8 triệu/tháng",22 m²,"Tân Phú, Hồ Chí Minh",cho-thue-nha-tro-phong-tro
CHDV full nội thất 1PN tách bếp nằm gần sân bay,"8,5 triệu/tháng",35 m²,"Tân Bình, Hồ Chí Minh",cho-thue-nha-tro-phong-tro
"Siêu sale cuối năm căn bancon full nội thất, đầy đủ tiện nghi, gần ngã tư Bảy Hiền",7 triệu/tháng,40 m²,"Tân Bình, Hồ Chí Minh",cho-thue-nha-tro-phong-tro
"Cho Thuê phòng 30m2 sát đường Phan Xích Long, Phú Nhuận chỉ 4.9tr/tháng","4,9 triệu/tháng",30 m²,"Phú Nhuận, Hồ Chí Minh",cho-thue-nha-tro-phong-tro
"Căn hộ nằm ngay gần sân bay Tân Sân Nhất, P2 Tân Bình. Full nội thất mới đẹp có cả ban công siêu to",8 triệu/tháng,40 m²,"Tân Bình, Hồ Chí Minh",cho-thue-nha-tro-phong-tro
Cho thuê căn hộ duplex mới xây full nội thất,"4,5 triệu/tháng",35 m²,"Quận 2, Hồ Chí Minh",cho-thue-nha-tro-phong-tro
Ký Túc Xá - Tô Ký - Nguyễn Ảnh Thủ - Q12,"1,09 triệu/tháng",70 m²,"Quận 12, Hồ Chí Minh",cho-thue-nha-tro-phong-tro
"Chính chủ cho thuê phòng full nội thất tại 15B Lê Thánh Tôn, Quận 1","4,5 triệu/tháng",25 m²,"Quận 1, Hồ Chí Minh",cho-thue-nha-tro-phong-tro
"7tr có căn hộ cao cấp 1K1N tại Quan Nhân, Thanh Xuân, full nội thất, ban công",7 triệu/tháng,40 m²,"Thanh Xuân, Hà Nội",cho-thue-nha-tro-phong-tro
