Title,Price,Area,Location,type
Studio siêu mới - siêu xịn nội khu sân bay Tân Sơn Nhất,7 triệu/tháng,30 m²,"Tân Bình, Hồ Chí Minh",cho-thue-nha-tro-phong-tro
"Cho thuê phòng đường Trần Nhật Duật Q1 có nội thất có cửa sổ gần Cầu Ông Lãnh, Phố đi bộ","6,5 triệu/tháng",40 m²,"Quận 1, Hồ Chí Minh",cho-thue-nha-tro-phong-tro
"Căn hộ studio cửa sổ full kính ngay trung tâm Q7, Lotte, gần Q1, Q4, Q5","5,8 triệu/tháng",30 m²,"Quận 7, Hồ Chí Minh",cho-thue-nha-tro-phong-tro
"Cho thuê phòng trọ duplex (full nội thất) tại đường số 8, Gò Vấp","5,1 triệu/tháng",30 m²,"Gò Vấp, Hồ Chí Minh",cho-thue-nha-tro-phong-tro
Căn hộ dịch vụ full nội thất mặt tiền 407 Nguyễn Văn Khối,"5,5 triệu/tháng",35 m²,"Gò Vấp, Hồ Chí Minh",cho-thue-nha-tro-phong-tro
Cho thuê nhà Duplex máy giặt riêng nội thất đầy đủ gần cầu Chữ Y - Dạ Nam Q8,"5,8 triệu/tháng",35 m²,"Quận 8, Hồ Chí Minh",cho-thue-nha-tro-phong-tro
Cho thuê phòng trọ cửa sổ lớn gần khách sạn Pullman bộ công an trung tâm thành phố tại quận 1,"7,5 triệu/tháng",35 m²,"Quận 1, Hồ Chí Minh",cho-thue-nha-tro-phong-tro
Có phòng full nội thất cao cấp tại Phú Nhuận cho thuê 5tr/tháng,5 triệu/tháng,30 m²,"Phú Nhuận, Hồ Chí Minh",cho-thue-nha-tro-phong-tro
Cho thuê phòng rộng đường Nguyễn Trãi Q1 giá 5tr5/tháng,"5,5 triệu/tháng",25 m²,"Quận 1, Hồ Chí Minh",cho-thue-nha-tro-phong-tro
Phòng trọ đầy đủ ban công cửa sổ lớn mới khai trương mặt tiền Hoà Hảo Quận 10,6 triệu/tháng,30 m²,"Quận 10, Hồ Chí Minh",cho-thue-nha-tro-phong-tro
Cho thuê phòng cao cấp giá 5tr4 tại Q1,"5,4 triệu/tháng",26 m²,"Quận 1, Hồ Chí Minh",cho-thue-nha-tro-phong-tro
"Cho thuê phòng 22m2 trung tâm Tân Bình, không chung chủ",5 triệu/tháng,11 m²,"Tân Bình, Hồ Chí Minh",cho-thue-nha-tro-phong-tro
Cho thuê phòng phố Chùa Láng và Cầu Giấy 0968 410 ***,6 triệu/tháng,25 m²,"Đống Đa, Hà Nội",cho-thue-nha-tro-phong-tro
"Studio ban công diện tích lớn tại Lê Văn Thọ, gần công viên Làng Hoa - Quang Trung - Thống Nhất","5,4 triệu/tháng",25 m²,"Gò Vấp, Hồ Chí Minh",cho-thue-nha-tro-phong-tro
Cho thuê gấp phòng ban công lớn ngay chân Cầu Ông Lãnh mới khai trương,8 triệu/tháng,45 m²,"Quận 1, Hồ Chí Minh",cho-thue-nha-tro-phong-tro
"Cho thuê phòng diện tích: 40m2 Cầu Kho, Quận 1",10 triệu/tháng,40 m²,"Quận 1, Hồ Chí Minh",cho-thue-nha-tro-phong-tro
"Phòng đẹp, mới full nội thất - ban công ngay chợ Tân Mỹ Quận 7","6,9 triệu/tháng",30 m²,"Quận 7, Hồ Chí Minh",cho-thue-nha-tro-phong-tro
Cho thuê phòng rộng hẻm đường quận 3. Giá 9tr/th,9 triệu/tháng,36 m²,"Quận 3, Hồ Chí Minh",cho-thue-nha-tro-phong-tro
Cho thuê phòng theo dãy diện tích 35m2 - cửa sổ to - hình thật 100%,"3,5 triệu/tháng",35 m²,"Gò Vấp, Hồ Chí Minh",cho-thue-nha-tro-phong-tro
Phòng full nội thất cơ bản cho thuê 6 triệu/tháng tại Nhà Bè,6 triệu/tháng,78 m²,"Nhà Bè, Hồ Chí Minh",cho-thue-nha-tro-phong-tro
Cho thuê phòng có nội thất ban công cửa sổ lớn Cầu Kênh Tẻ Quận 4,7 triệu/tháng,40 m²,"Quận 4, Hồ Chí Minh",cho-thue-nha-tro-phong-tro
"Phòng duplex full nội thất - gần cầu Phú Mỹ, trục đường Nguyễn Thị Thập Q7",5 triệu/tháng,30 m²,"Quận 7, Hồ Chí Minh",cho-thue-nha-tro-phong-tro
Phòng ban công - cửa sổ full nội thất nằm ngay mặt tiền Nguyễn Thị Thập Q7,"5,5 triệu/tháng",28 m²,"Quận 7, Hồ Chí Minh",cho-thue-nha-tro-phong-tro
"Cho thuê phòng Studio, Duplex máy giặt riêng, gần cầu Tân Thuận Quận 7","5,2 triệu/tháng",40 m²,"Quận 7, Hồ Chí Minh",cho-thue-nha-tro-phong-tro
"Cho thuê phòng giá rẻ nội thất full 4,2 triệu/tháng - 15 m2","4,2 triệu/tháng",15 m²,"Quận 8, Hồ Chí Minh",cho-thue-nha-tro-phong-tro
"KTX giá rẻ chỉ 990k hỗ trợ cho HSSV, NVVP, NLĐ",990 nghìn/tháng,20 m²,"Quận 10, Hồ Chí Minh",cho-thue-nha-tro-phong-tro
"Cho thuê phòng duplex (gác) full nội thất, đầy đủ tiện nghi trung tâm Quận 7","6,2 triệu/tháng",40 m²,"Quận 7, Hồ Chí Minh",cho-thue-nha-tro-phong-tro
Cho thuê tới 30m2 có. Sân thượng chill giá 5tr/tháng,5 triệu/tháng,30 m²,"Phú Nhuận, Hồ Chí Minh",cho-thue-nha-tro-phong-tro
"Phòng full nội thất, khu vực Phú Mỹ Hưng an ninh Quận 7","7,5 triệu/tháng",24 m²,"Quận 7, Hồ Chí Minh",cho-thue-nha-tro-phong-tro
"Studio full nội thất như hình, an ninh tốt, nhiều tiện nghi - gần bến xe Miền Đông",Giá thỏa thuận,30 m²,"Bình Thạnh, Hồ Chí Minh",cho-thue-nha-tro-phong-tro
"Phòng tầng trệt cho thuê khu Quận 3 - TP.HCM, giá 6tr3/th","6,3 triệu/tháng",30 m²,"Quận 3, Hồ Chí Minh",cho-thue-nha-tro-phong-tro
"Cho thuê phòng trọ 18m2 ngay mặt tiền đường Âu Dương Lân, P3, Quận 8","2,8 triệu/tháng",18 m²,"Quận 8, Hồ Chí Minh",cho-thue-nha-tro-phong-tro
"Studio 25 - 35m2, Phường 6, Gò Vấp","5,4 triệu/tháng",35 m²,"Gò Vấp, Hồ Chí Minh",cho-thue-nha-tro-phong-tro
Chính chủ cho thuê phòng ở số 9 ngõ 160 Lạc Long Quân,"3,8 triệu/tháng",25 m²,"Tây Hồ, Hà Nội",cho-thue-nha-tro-phong-tro
"Căn hộ mới 1PN, cửasổ, máy giặt riêng, full NT gần cầu Calmette, Chợ Bến Thành, Bitexco, Takashiya","7,9 triệu/tháng",40 m²,"Quận 1, Hồ Chí Minh",cho-thue-nha-tro-phong-tro
Cho thuê phòng Dương Bá Trạc Q8 ban công lớn nội thất đầy đủ,7 triệu/tháng,35 m²,"Quận 8, Hồ Chí Minh",cho-thue-nha-tro-phong-tro
Phòng đẹp cần cho thuê siêu vip tại Bình Thạnh full NT,Giá thỏa thuận,45 m²,"Bình Thạnh, Hồ Chí Minh",cho-thue-nha-tro-phong-tro
"Phòng trống cho thuê, khu vực an ninh, bancol + cửa sổ thoáng, Lê Văn Sỹ, Phú Nhuận",5 triệu/tháng,30 m²,"Phú Nhuận, Hồ Chí Minh",cho-thue-nha-tro-phong-tro
"Phòng ở ghép cao cấp ngay ĐH FPT, Hutech, Cty Samsung, khu CNC bao trọn gói, dọn vs hàng ngày","1,4 triệu/tháng",45 m²,"Quận 9, Hồ Chí Minh",cho-thue-nha-tro-phong-tro
"Ngay ĐH Ngân Hàng, ĐH SPKT 1,6km, ĐH Nông Lâm, KHTN, CNTT, FPT - Phòng ở ghép Nam full nội thất","1,7 triệu/tháng",45 m²,"Thủ Đức, Hồ Chí Minh",cho-thue-nha-tro-phong-tro
"Dành cho nam, mới 100% full nội thất ngay ĐH Sư Phạm Kỹ Thuật, Ngân Hàng, Hutech, ngã tư Thủ Đức","1,7 triệu/tháng",50 m²,"Thủ Đức, Hồ Chí Minh",cho-thue-nha-tro-phong-tro
"Gần ngã 4 Thủ Đức, ĐH SPKT, ngân hàng, ở ghép - homestay cao cấp Bao trọn gói full tiện nghi","1,5 triệu/tháng",25 m²,"Thủ Đức, Hồ Chí Minh",cho-thue-nha-tro-phong-tro
"Phòng cho thuê hẻm đường Bùi Viện, Phường Phạm Ngũ Lão, Quận 1. Giá 22 tr/tháng",22 triệu/tháng,56 m²,"Quận 1, Hồ Chí Minh",cho-thue-nha-tro-phong-tro
"Cho thuê phòng dạng studio, duplex, ngay CV Hoàng Văn Thụ","6,5 triệu/tháng",35 m²,"Tân Bình, Hồ Chí Minh",cho-thue-nha-tro-phong-tro
Chốt ngay căn hộ view sân bay mới xây 100% đường Nguyễn Văn Công,"6,8 triệu/tháng",30 m²,"Gò Vấp, Hồ Chí Minh",cho-thue-nha-tro-phong-tro
"Duplex đầy đủ nội thất, không giới hạn người và xe, ngay Lý Thường Kiệt","6,5 triệu/tháng",40 m²,"Quận 10, Hồ Chí Minh",cho-thue-nha-tro-phong-tro
"Cho thuê phòng Studio, 1PN, ngay Cách Mạng Tháng Tám",10 triệu/tháng,45 m²,"Quận 3, Hồ Chí Minh",cho-thue-nha-tro-phong-tro
"Studio bancol full nội thất, khu sân bay, CV Hoàng Văn Thụ",7 triệu/tháng,35 m²,"Phú Nhuận, Hồ Chí Minh",cho-thue-nha-tro-phong-tro
"Khai trương dự án Duplex ngay Lý Thường Kiệt, Lạc Long Quân","6,5 triệu/tháng",30 m²,"Quận 10, Hồ Chí Minh",cho-thue-nha-tro-phong-tro
CHDV diện tích 40m2 mặt tiền đường ngay Quang Trung,"5,5 triệu/tháng",40 m²,"Gò Vấp, Hồ Chí Minh",cho-thue-nha-tro-phong-tro
"Cho thuê phòng khu vực Trần Não 25m2 đường 19 An Khánh, Quận 2","4,5 triệu/tháng",25 m²,"Quận 2, Hồ Chí Minh",cho-thue-nha-tro-phong-tro
