Title,Price,Area,Location,type
"Cho thuê kho 500m2, 1000m2 đường Liên Phường, P. Phú Hữu, Quận 9, gần khu công nghệ cao quận 9",42 triệu/tháng,500 m²,"Quận 9, Hồ Chí Minh",cho-thue-kho-nha-xuong-dat
"Cho thuê nhà xưởng DT: 4000m2 giá 150 triệu/tháng đường quốc lộ 1A, quận 12 DT: 0944 977 ***",150 triệu/tháng,4.000 m²,"Quận 12, Hồ Chí Minh",cho-thue-kho-nha-xuong-dat
Cho thuê nhà xưởng nằm phường An Phú Đông Quận 12 DT: 1200m2 giá 80 tr/tháng LH: 0908 561 ***,80 triệu/tháng,1.200 m²,"Quận 12, Hồ Chí Minh",cho-thue-kho-nha-xuong-dat
"Cho thuê nhà xưởng Phường An Phú Đông, Quận 12 DT: 1100m2 giá 50 triệu/tháng, LH: 0908 561 ***",50 triệu/tháng,1.100 m²,"Quận 12, Hồ Chí Minh",cho-thue-kho-nha-xuong-dat
"Cho thuê nhà xưởng Long An 2000m2, 4500m2, 10000m2",320 triệu/tháng,10.000 m²,"Đức Hòa, Long An",cho-thue-kho-nha-xuong-dat
"Chính chủ cho thuê kho tại Ba La - Yên Nghĩa, Hà Đông, Hà Nội. DT 300m2, 500m2 và 1500m2",75 nghìn/m²,500 m²,"Hà Đông, Hà Nội",cho-thue-kho-nha-xuong-dat
Chính chủ cho thuê kho 800m2 Quận 7 giá chỉ 70tr/ tháng. Liên hệ: 0965 893 ***,70 triệu/tháng,800 m²,"Quận 7, Hồ Chí Minh",cho-thue-kho-nha-xuong-dat
Cho thuê kho xưởng DT 4000m2 kho/tổng 7000m2 - giá 220tr/th. Đường Nguyễn Văn Quá - Quang Trung,220 triệu/tháng,4.000 m²,"Quận 12, Hồ Chí Minh",cho-thue-kho-nha-xuong-dat
"Cho thuê đất Trần Văn Trứ cho thuê chỉ 70 triệu/ tháng, rẻ nhất thị trường. Lh: 0962 118 ***",70 triệu/tháng,228 m²,"Hải Châu, Đà Nẵng",cho-thue-kho-nha-xuong-dat
Đồng An 2 trong KCN: Xưởng 10000m2 vp 820m PCCC tự động SX Đa ngành nghề. Người nước ngoài đứng tên,900 triệu/tháng,18.200 m²,"Thủ Dầu Một, Bình Dương",cho-thue-kho-nha-xuong-dat
"Chính chủ cần cho thuê kho, xưởng 1300m2, ngay sát Quốc Lộ 21B, xã Kim Thư, huyện Thanh Oai",40 triệu/tháng,1.300 m²,"Thanh Oai, Hà Nội",cho-thue-kho-nha-xuong-dat
Cho thuê kho 850m2 đường Hoàng Quốc Việt giá 70tr/th. LH: Duy 0789 070 ***,70 triệu/tháng,850 m²,"Quận 7, Hồ Chí Minh",cho-thue-kho-nha-xuong-dat
"Cho thuê kho bãi Quận 7 DT 550m2 container vào tận cửa, PCCC chuẩn mua bảo hiểm",55 triệu/tháng,550 m²,"Quận 7, Hồ Chí Minh",cho-thue-kho-nha-xuong-dat
"Mr Chính cho thuê kho xưởng ccn Thanh Oai. 650m2 & 1000m2, 3000m2 giá 80k/m2. sân rộng, có cẩu trục",80 nghìn/m²,650 m²,"Thanh Oai, Hà Nội",cho-thue-kho-nha-xuong-dat
"Cho thuê 650m2 kho nhà xưởng mặt tiền đường Quốc Lộ 1A đoạn Hòa Châu, Hòa Vang, Đà Nẵng",35 triệu/tháng,630 m²,"Hòa Vang, Đà Nẵng",cho-thue-kho-nha-xuong-dat
"Cho thuê 1000m2 1200m2 2400m2 4000m2 5000m2 6500m2 8600m2 10.000m2 kho xưởng KCN Hòa Khánh, Đà Nẵng",200 triệu/tháng,5.000 m²,"Liên Chiểu, Đà Nẵng",cho-thue-kho-nha-xuong-dat
"Cho thuê, 2000m, 4000m, 5000m, 6000m, 10000m2 kho nhà xưởng trong khu công nghiệp Hòa Cầm, TP ĐN",200 triệu/tháng,4.000 m²,"Cẩm Lệ, Đà Nẵng",cho-thue-kho-nha-xuong-dat
"Cho thuê 500m², 860m2, 1000m², 1500m², 2000m², 2500m², 3000m², 10.000m2 kho nhà xưởng KCN Hòa Cầm",70 triệu/tháng,2.000 m²,"Cẩm Lệ, Đà Nẵng",cho-thue-kho-nha-xuong-dat
"Cần cho thuê 1500m2 kho, nhà xưởng",Giá thỏa thuận,1.500 m²,"Đông Anh, Hà Nội",cho-thue-kho-nha-xuong-dat
Cho thuê mặt bằng làm kho hoặc văn phòng 72m2 khu Cư Xá Điện Lực Trường Thọ,7 triệu/tháng,72 m²,"Thủ Đức, Hồ Chí Minh",cho-thue-kho-nha-xuong-dat
"Cần cho thuê dài hạn nhà mặt đường khu phân lô đất dịch vụ Yên Nghĩa, Hà Đông, Hà Nội",5 triệu/tháng,50 m²,"Hà Đông, Hà Nội",cho-thue-kho-nha-xuong-dat
Cho thuê tổng 2200m2: Kho 1500m2 + VP 200m sân 500m đường container 40F trần thạch cao nền gạch men,150 triệu/tháng,2.200 m²,"Bình Tân, Hồ Chí Minh",cho-thue-kho-nha-xuong-dat
"Cho thuê xưởng 2500m2. Đường xe công. Điện hạ trạm 250kva Thuận An, Bình Dương",65 triệu/tháng,2.500 m²,"Thuận An, Bình Dương",cho-thue-kho-nha-xuong-dat
"Mr Chính cho thuê gấp kho xưởng gần CCN Di Trạch, Hoài Đức. 1000-3500m2 khung zamil cao 9 - 11m",50 nghìn/m²,1.000 m²,"Hoài Đức, Hà Nội",cho-thue-kho-nha-xuong-dat
"Xưởng trong KCN Bình Dương 3470m2 giấy tờ đầy đủ người nước ngoài đứng tên, SX ngành nghề KCN OK",440 triệu/tháng,5.200 m²,"Thủ Dầu Một, Bình Dương",cho-thue-kho-nha-xuong-dat
"Xưởng An Phú 1600m2 PCCC vách tường, đường cont. Điện hạ bình, SX nhiều ngành nghề",90 triệu/tháng,1.600 m²,"Thuận An, Bình Dương",cho-thue-kho-nha-xuong-dat
"Xưởng Thuận An 10000m2 giấy tờ đầy đủ, PCCC, giấy phép xây dựng, môi trường ok, đường cont, SX ok",600 triệu/tháng,10.000 m²,"Thuận An, Bình Dương",cho-thue-kho-nha-xuong-dat
"Chính chủ cho thuê gần 2ha đất mặt tiền, sổ riêng",60 triệu/tháng,20.000 m²,"Phú Quốc, Kiên Giang",cho-thue-kho-nha-xuong-dat
"Xưởng An Điền Bến Cát, 2500 - 4500m2 cho thuê lẻ ok. Giấy tờ đầy đủ, PCCC Tự động đường cont SX ok",420 triệu/tháng,7.000 m²,"Bến Cát, Bình Dương",cho-thue-kho-nha-xuong-dat
"Xưởng Vĩnh Tân Tân Uyên DT 3800m2 xưởng, 300m2 văn phòng, pccc, đường cont, sx đa ngành nghề gỗ ok",260 triệu/tháng,4.100 m²,"Tân Uyên, Bình Dương",cho-thue-kho-nha-xuong-dat
"Xưởng trong KCN Mỹ Phước Bình Dương xưởng 10000m2, văn phòng nhà ở 1000m2 người nước ngoài đứng tên",1 tỷ/tháng,11.000 m²,"Bến Cát, Bình Dương",cho-thue-kho-nha-xuong-dat
"Xưởng Bình Chuẩn Thuận An, PCCC vách tường, VP trong xưởng. Đường cont SX nhiều ngành nghề",85 triệu/tháng,1.800 m²,"Thuận An, Bình Dương",cho-thue-kho-nha-xuong-dat
"Xưởng Tân Uyên Bình Dương, DT 2300m2 có Vp điện Hạ Bình. Sx nhiều ngành nghề gỗ trắng, bao bì",90 triệu/tháng,2.300 m²,"Tân Uyên, Bình Dương",cho-thue-kho-nha-xuong-dat
Xưởng Hội Nghĩa Tân Uyên DT 2300m đường Cont giá thuê 90 triệu tháng Sx đa ngành nghề,90 triệu/tháng,2.300 m²,"Tân Uyên, Bình Dương",cho-thue-kho-nha-xuong-dat
"Xưởng Tân Phước Khánh Tân Uyên 1000m2 giá 45 triệu tháng đường cont, điện 3 pha, lắp cẩu trục ok",45 triệu/tháng,1.000 m²,"Tân Uyên, Bình Dương",cho-thue-kho-nha-xuong-dat
"Xưởng Đất Cuốc Tân Uyên 4200, 4500m2 PCCC vách tường thẩm duyệt chủ trương cơ khí đường cont",240 triệu/tháng,4.200 m²,"Bắc Tân Uyên, Bình Dương",cho-thue-kho-nha-xuong-dat
"Xưởng Bình Hoà Thuận An 500m, có VP điện 3 pha đường cont, giá 27 triệu thương lượng",27 triệu/tháng,500 m²,"Thuận An, Bình Dương",cho-thue-kho-nha-xuong-dat
Xưởng An Phú Thuận An 2300m2 - 2300m2. Có pccc vách tường. VP trong xưởng đường cont SX ok,80 triệu/tháng,2.300 m²,"Thuận An, Bình Dương",cho-thue-kho-nha-xuong-dat
"Xưởng Tân Phước Khánh Tân Uyên 950m2 điện 3 pha đường cont, Sx nhiều ngành nghề: 45 triệu/tháng",45 triệu/tháng,950 m²,"Tân Uyên, Bình Dương",cho-thue-kho-nha-xuong-dat
"Xưởng Thuận Giao Thuận An 1600m2 giá 55 triệu, PCCC vách tường, VP ngoài, điện 3 pha SX ok",55 triệu/tháng,1.600 m²,"Thuận An, Bình Dương",cho-thue-kho-nha-xuong-dat
"Cho thuê kho xưởng 19.000m2 KCN Sóng Thần, Dĩ An, Bình Dương",935 triệu/tháng,19.000 m²,"Dĩ An, Bình Dương",cho-thue-kho-nha-xuong-dat
"Xưởng 7600m2 Thuận Giao Thuận An. PCCC tự động, điện 560kva VP trong và ngoài xưởng giấy tờ đầy đủ",520 triệu/tháng,7.600 m²,"Thuận An, Bình Dương",cho-thue-kho-nha-xuong-dat
"Xưởng Thuận Giao Thuận An 7700m2 PCCC tự động, đường cont, sx nhiều ngành nghề. Ưu tiên sạch",560 triệu/tháng,14.000 m²,"Thuận An, Bình Dương",cho-thue-kho-nha-xuong-dat
"Xưởng Bình Chuẩn Thuận An 7000m VP riêng PCCC vách tường, giấy tờ đầy đủ, đường cont 420 triệu",420 triệu/tháng,7.000 m²,"Thuận An, Bình Dương",cho-thue-kho-nha-xuong-dat
"Xưởng trong khu công nghiệp Bình Dương: 6800m2 văn phòng 400m2, PCCC tự động sx đa ngành nghề gỗ ok",530 triệu/tháng,7.200 m²,"Bến Cát, Bình Dương",cho-thue-kho-nha-xuong-dat
"Xưởng Thuận Giao 6600m2 VP nhà ở 1000m2, PCCC vách tường (tự động nếu cần lắp). Điện 560kva",480 triệu/tháng,7.600 m²,"Thuận An, Bình Dương",cho-thue-kho-nha-xuong-dat
Xưởng 12000m2 cụm công nghiệp Tân Uyên giấy tờ đầy đủ SX đa ngành nghề. Người nước ngoài đứng tên,860 triệu/tháng,12.000 m²,"Bắc Tân Uyên, Bình Dương",cho-thue-kho-nha-xuong-dat
"Cho thuê 2 nhà xưởng liền kề, mỗi xưởng 2400 m2, Bình Tiền, Đức Hòa Hạ, Long An",160 triệu/tháng,2.400 m²,"Đức Hòa, Long An",cho-thue-kho-nha-xuong-dat
Xưởng Bến Cát 10800m2 giấy tờ đầy đủ SX tất cả ngành nghề. Đường cont VP nhà ở bên ngoài giá rẻ,660 triệu/tháng,10.800 m²,"Bến Cát, Bình Dương",cho-thue-kho-nha-xuong-dat
"Xưởng trong KCN Rạch Bắp 6800m2 VP 400m2 PCCC tự động Sx đa ngành nghề, người nước ngoài đứng tên",560 triệu/tháng,7.200 m²,"Bến Cát, Bình Dương",cho-thue-kho-nha-xuong-dat
"Cho thuê xưởng tổng DT 6000 m2, Nguyễn Hữu Trí, xã Thanh Phú, huyện Bến Lức, Long An",250 triệu/tháng,6.000 m²,"Bến Lức, Long An",cho-thue-kho-nha-xuong-dat
Xưởng cụm công nghiệp Thuận An khuôn viên riêng SX nhiều ngành nghề giấy tờ đầy đủ. Đường Cont,360 triệu/tháng,4.500 m²,"Thuận An, Bình Dương",cho-thue-kho-nha-xuong-dat
"Cho thuê nhà xưởng 15000m2 trong tổng DT 2,6 ha trong KCN Phú An Thạnh, Bến Lức, Long An",Giá thỏa thuận,15.000 m²,"Bến Lức, Long An",cho-thue-kho-nha-xuong-dat
