Title,Price,Area,Location,type
"Cho thuê phòng trọ cửa sổ full nội thất gần chợ Bà Chiểu, đại học Văn Lang",7 triệu/tháng,28 m²,"Bình Thạnh, Hồ Chí Minh",cho-thue-nha-tro-phong-tro
Cho thuê phòng trọ cửa sổ full nội thất gần Ngã Tư Hàng Xanh,7 triệu/tháng,28 m²,"Bình Thạnh, Hồ Chí Minh",cho-thue-nha-tro-phong-tro
"Cho thuê phòng trọ có gác, cửa sổ full nội thất gần ngã tư Hàng Xanh",7 triệu/tháng,28 m²,"Bình Thạnh, Hồ Chí Minh",cho-thue-nha-tro-phong-tro
"Cho thuê phòng trọ cửa sổ full nội thất gần chợ Bà Chiểu, Phan Đăng Lưu","5,9 triệu/tháng",25 m²,"Bình Thạnh, Hồ Chí Minh",cho-thue-nha-tro-phong-tro
"Phòng trọ ban công full nội thất, máy giặt riêng gần Ngã Tư Hàng Xanh, cầu Thị Nghè","6,8 triệu/tháng",25 m²,"Bình Thạnh, Hồ Chí Minh",cho-thue-nha-tro-phong-tro
"Cho thuê phòng trọ full nội thất, máy giặt riêng, cửa sổ thoáng gần cầu Công Lý","5,7 triệu/tháng",30 m²,"Phú Nhuận, Hồ Chí Minh",cho-thue-nha-tro-phong-tro
"Phòng trọ full nội thất, máy giặt riêng gần chợ Bà Chiểu, Lê Quang Định, Nơ Trang Long","8,5 triệu/tháng",35 m²,"Bình Thạnh, Hồ Chí Minh",cho-thue-nha-tro-phong-tro
"Cho thuê phòng trọ ban công full nội thất, máy giặt riêng gần ngã tư Hàng Xanh","7,2 triệu/tháng",40 m²,"Bình Thạnh, Hồ Chí Minh",cho-thue-nha-tro-phong-tro
"Phòng trọ ban công, cửa sổ full nội thất gần Ngã Tư Phú Nhuận, Phan Đăng Lưu, Phan Xích Long","5,9 triệu/tháng",25 m²,"Phú Nhuận, Hồ Chí Minh",cho-thue-nha-tro-phong-tro
Cho thuê phòng ban công gần cầu bông full nội thất,7 triệu/tháng,35 m²,"Bình Thạnh, Hồ Chí Minh",cho-thue-nha-tro-phong-tro
"Cho thuê phòng trọ có gác, cửa sổ full nội thất gần chợ Bà Chiểu, Nơ Trang Long, Phan Đăng Lưu",7 triệu/tháng,30 m²,"Bình Thạnh, Hồ Chí Minh",cho-thue-nha-tro-phong-tro
"Studio lớn full nội thất dưới chân cầu Nguyễn Văn Cừ, tòa nhà có bảo vệ 24/7 Quận 8","6,2 triệu/tháng",30 m²,"Quận 8, Hồ Chí Minh",cho-thue-nha-tro-phong-tro
"Phòng trọ ban công full nội thất, máy giặt riêng gần Ngã Tư Phú Nhuận, Phan Đăng Lưu","6,5 triệu/tháng",38 m²,"Phú Nhuận, Hồ Chí Minh",cho-thue-nha-tro-phong-tro
"Phòng trọ có gác, cửa sổ full nội thất, máy giặt riêng gần Ngã Tư Hàng Xanh","5,5 triệu/tháng",20 m²,"Bình Thạnh, Hồ Chí Minh",cho-thue-nha-tro-phong-tro
"Cho thuê phòng trọ ban công full nội thất, bếp riêng ngay chợ Bà Chiểu","6,5 triệu/tháng",28 m²,"Bình Thạnh, Hồ Chí Minh",cho-thue-nha-tro-phong-tro
"Cho thuê phòng trọ 1PN cửa sổ full nội thất, máy giặt riêng ngay Phan Đăng Lưu","8,5 triệu/tháng",28 m²,"Phú Nhuận, Hồ Chí Minh",cho-thue-nha-tro-phong-tro
"Cho thuê phòng trọ cửa sổ full nội thất, máy giặt riêng gần Ngã Tư Hàng Xanh",9 triệu/tháng,40 m²,"Bình Thạnh, Hồ Chí Minh",cho-thue-nha-tro-phong-tro
"Cho thuê phòng trọ full nội thất gần ngã tư Hàng Xanh, cầu Thị Nghè",8 triệu/tháng,35 m²,"Bình Thạnh, Hồ Chí Minh",cho-thue-nha-tro-phong-tro
"Cho thuê phòng trọ ban công full nội thất, máy giặt riêng gần cầu Công Lý","7,5 triệu/tháng",35 m²,"Phú Nhuận, Hồ Chí Minh",cho-thue-nha-tro-phong-tro
Phòng trọ cao cấp full nội thất có ban công chill riêng biệt,"4,2 triệu/tháng",16 m²,"Gò Vấp, Hồ Chí Minh",cho-thue-nha-tro-phong-tro
"Phòng trọ có gác, ban công, full nội thất, máy giặt riêng Vạn Kiếp gần chợ Bà Chiểu, Phan Xích Long","5,5 triệu/tháng",30 m²,"Bình Thạnh, Hồ Chí Minh",cho-thue-nha-tro-phong-tro
"Studio cửa sổ lớn ngay cầu Nguyễn Văn Cừ, cầu chữ Y, Jollibee Trần Hưng Đạo Quận 5",7 triệu/tháng,50 m²,"Quận 5, Hồ Chí Minh",cho-thue-nha-tro-phong-tro
"Cho thuê phòng có phòng xông hơi ngay cầu Nguyễn Văn Cừ, Chợ Rạch Ông Quận 8",6 triệu/tháng,50 m²,"Quận 8, Hồ Chí Minh",cho-thue-nha-tro-phong-tro
Cho thuê phòng ban công nằm gần cầu Phú Mỹ Quận 7 đúng giá,"6,5 triệu/tháng",40 m²,"Quận 7, Hồ Chí Minh",cho-thue-nha-tro-phong-tro
Cho thuê phòng Duplex ban công siêu đẹp ngay trung tâm Quận 7,"6,2 triệu/tháng",35 m²,"Quận 7, Hồ Chí Minh",cho-thue-nha-tro-phong-tro
"Cho thuê phòng đẹp, thiết kế hiện đại ngay chợ Tân Mỹ Quận 7","5,7 triệu/tháng",30 m²,"Quận 7, Hồ Chí Minh",cho-thue-nha-tro-phong-tro
"Cho thuê phòng studio ban công 50m2 ngay Cầu Nguyễn Văn Cừ, chợ Rạch Ông Quận 8",6 triệu/tháng,50 m²,"Quận 8, Hồ Chí Minh",cho-thue-nha-tro-phong-tro
"Phòng duplex thiết kế hiện đại, nằm gần cầu Phú Mỹ, Phú Mỹ Hưng Quận 7","5,5 triệu/tháng",35 m²,"Quận 7, Hồ Chí Minh",cho-thue-nha-tro-phong-tro
"Cho thuê phòng ban công siêu to full nội thất, nằm ngay sau Lotte Mart Quận 7 không đăng ảo",8 triệu/tháng,40 m²,"Quận 7, Hồ Chí Minh",cho-thue-nha-tro-phong-tro
"Cho thuê phòng duplex ngay Nguyễn Thị Thập, Quận 7",5 triệu/tháng,30 m²,"Quận 7, Hồ Chí Minh",cho-thue-nha-tro-phong-tro
"Cho thuê phòng duplex studio gần câu Tân Thuận, Khu chế xuất Quận 7","4,6 triệu/tháng",30 m²,"Quận 7, Hồ Chí Minh",cho-thue-nha-tro-phong-tro
Cho thuê phòng ngủ tách bếp máy giặt riêng gần cầu Kênh Tẻ Quận 7,"6,8 triệu/tháng",30 m²,"Quận 7, Hồ Chí Minh",cho-thue-nha-tro-phong-tro
"Cho thuê phòng Studio, Duplex máy giặt riêng, gần cầu Tân Thuận Quận 7","5,2 triệu/tháng",40 m²,"Quận 7, Hồ Chí Minh",cho-thue-nha-tro-phong-tro
"Phòng đẹp, mới full nội thất - ban công ngay chợ Tân Mỹ Quận 7","6,9 triệu/tháng",30 m²,"Quận 7, Hồ Chí Minh",cho-thue-nha-tro-phong-tro
Khai trương phòng ban công mới xây ngay BV Thống Nhất - 2P đi ngã tư Bảy Hiền,5 triệu/tháng,25 m²,"Tân Bình, Hồ Chí Minh",cho-thue-nha-tro-phong-tro
"1 phòng ngủ có ban công và máy giặt riêng ở Nguyễn Cửu Vân, Bình Thạnh",10 triệu/tháng,35 m²,"Bình Thạnh, Hồ Chí Minh",cho-thue-nha-tro-phong-tro
Ảnh thật giá thật tại Bình Thạnh cần cho thuê full NT - 40m2,6 triệu/tháng,40 m²,"Bình Thạnh, Hồ Chí Minh",cho-thue-nha-tro-phong-tro
Studio full nội thất trên đường Giải Phóng gần công viên Hoàng Văn Thụ Quận Tân Bình,"6,3 triệu/tháng",30 m²,"Tân Bình, Hồ Chí Minh",cho-thue-nha-tro-phong-tro
"Cho thuê phòng bancol tại Bình Thạnh, đúng hình đúng giá, DT 40m2",7 triệu/tháng,40 m²,"Bình Thạnh, Hồ Chí Minh",cho-thue-nha-tro-phong-tro
Khai trương căn hộ phòng trọ cao cấp ban công siêu đẹp khu sân bay,8 triệu/tháng,50 m²,"Tân Bình, Hồ Chí Minh",cho-thue-nha-tro-phong-tro
Cho thuê phòng ban công sân vườn quận 1 dành cho người yêu thiên nhiên,"10,5 triệu/tháng",30 m²,"Quận 1, Hồ Chí Minh",cho-thue-nha-tro-phong-tro
Phòng trọ ban công full nội thất 35m2 gần cầu Công Lý,"7,5 triệu/tháng",35 m²,"Phú Nhuận, Hồ Chí Minh",cho-thue-nha-tro-phong-tro
"Cho thuê phòng ngay trunng tâm thành phố gần Bitexco, Bùi Viện, cầu Calmette, Bảo Tàng Mỹ Thuật","7,5 triệu/tháng",30 m²,"Quận 1, Hồ Chí Minh",cho-thue-nha-tro-phong-tro
Phòng trọ bancol siêu thoáng vị trí đắc địa ngay trung tâm Lê Đức Thọ di chuyển thuận tiện,"4,8 triệu/tháng",35 m²,"Gò Vấp, Hồ Chí Minh",cho-thue-nha-tro-phong-tro
Cho thuê studio gần sân bay Tân Sơn Nhất - Lăng Cha Cả,"6,5 triệu/tháng",30 m²,"Tân Bình, Hồ Chí Minh",cho-thue-nha-tro-phong-tro
Căn hộ studio đầy đủ nội giá siêu tốt quận Tân Bình,"4,2 triệu/tháng",30 m²,"Tân Bình, Hồ Chí Minh",cho-thue-nha-tro-phong-tro
Cho thuê phòng cửa sổ lớn full nội thất Nguyễn Trãi Quận 1,5 triệu/tháng,45 m²,"Quận 1, Hồ Chí Minh",cho-thue-nha-tro-phong-tro
"Studio 1 phòng ngủ đường Nguyễn Thị Thập Quận 7, gần Lotte 40m2 giá ưu đãi cuối năm","8,3 triệu/tháng",40 m²,"Quận 7, Hồ Chí Minh",cho-thue-nha-tro-phong-tro
"Phòng trọ đầy đủ nội thất gần cầu Lê Văn Sỹ, giá từ 6tr - 8tr, không tính phí xe máy. LH 0975 439 ***",6 triệu/tháng,30 m²,"Quận 3, Hồ Chí Minh",cho-thue-nha-tro-phong-tro
"Phòng cho thuê ở 1-2 người, nội thất siêu đẹp, có đầy đủ nội thất, toà nhà ngay trung tâm Quận 1","4,8 triệu/tháng",20 m²,"Quận 1, Hồ Chí Minh",cho-thue-nha-tro-phong-tro
"Phòng trọ quận 1 đầy đủ nội thất, có cửa sổ thoáng, an ninh, sạch sẽ, giờ giấc tự do",5 triệu/tháng,25 m²,"Quận 1, Hồ Chí Minh",cho-thue-nha-tro-phong-tro
"Phòng cho thuê đầy đủ nội thất gần Nguyễn Trãi - Quận 1, an ninh, giờ giấc tự do",5 triệu/tháng,25 m²,"Quận 1, Hồ Chí Minh",cho-thue-nha-tro-phong-tro
Phòng trọ gác cao 1m8 full nội thất Hoà Bình Tô Hiệu Luỹ Bán Bích Vườn Lài Lạc Long Quân,"4,3 triệu/tháng",30 m²,"Tân Phú, Hồ Chí Minh",cho-thue-nha-tro-phong-tro
Căn hộ DV 1PN cao cấp - sang trọng - nhà mới - ngay cầu vượt Cây Gõ,"7,8 triệu/tháng",40 m²,"Quận 6, Hồ Chí Minh",cho-thue-nha-tro-phong-tro
Căn hộ đầy đủ tiện nghi - nhà mới 100% - ngay cầu Nguyễn Văn Cừ,"4,9 triệu/tháng",30 m²,"Quận 8, Hồ Chí Minh",cho-thue-nha-tro-phong-tro
Duplex full nội thất mới - không giới hạn người ở - ngay cầu Hoàng Hoa Thám,"4,3 triệu/tháng",30 m²,"Tân Bình, Hồ Chí Minh",cho-thue-nha-tro-phong-tro
Khai trương chung cư mini - Full nội thất - Mới 100% - Hiện đại - Ngay Lý Thường Kiệt - Bắc Hải,"6,4 triệu/tháng",40 m²,"Quận 10, Hồ Chí Minh",cho-thue-nha-tro-phong-tro
"Studio full NT, đường CMT8, Quận 10, đối diện CV Lê Thị Riêng, vòng xoay Dân Chủ",5 triệu/tháng,30 m²,"Quận 10, Hồ Chí Minh",cho-thue-nha-tro-phong-tro
Khai trương phòng trọ mới 100% ở Âu Cơ - Tân Phú giáp Tân Bình,"4,6 triệu/tháng",35 m²,"Tân Phú, Hồ Chí Minh",cho-thue-nha-tro-phong-tro
"Phòng trọ 25m2 đối diện Giga Mall, giá 4tr2/tháng - Phạm Văn Đồng, Q. Thủ Đức (chính chủ)","4,2 triệu/tháng",25 m²,"Thủ Đức, Hồ Chí Minh",cho-thue-nha-tro-phong-tro
"Studio ban công, vách ngăn bếp, Lê Văn Sỹ, Quận 3, ngay cầu Lê Văn Sỹ","6,4 triệu/tháng",35 m²,"Quận 3, Hồ Chí Minh",cho-thue-nha-tro-phong-tro
Cho thuê phòng có nội thất bancon cửa sổ lớn ĐH Luật ĐH Nguyễn Tất Thành Quận 4,"5,5 triệu/tháng",40 m²,"Quận 4, Hồ Chí Minh",cho-thue-nha-tro-phong-tro
"Cho thuê phòng ban công lớn có nội thất Cô Giang, Cầu Ông Lãnh, Quận 1",8 triệu/tháng,40 m²,"Quận 1, Hồ Chí Minh",cho-thue-nha-tro-phong-tro
"Studio cửa sổ lớn - Hoàng Hoa Thám, Cộng Hòa gần Sân Bay",6 triệu/tháng,45 m²,"Tân Bình, Hồ Chí Minh",cho-thue-nha-tro-phong-tro
"Phòng full nội thất, ban công, ngay Huỳnh Mẫn Đạt Bình Thạnh sát UEF, Hutech",6 triệu/tháng,40 m²,"Bình Thạnh, Hồ Chí Minh",cho-thue-nha-tro-phong-tro
"Chính chủ cho thuê phòng trống đầu tháng 1, khu vực Đặng Thuỳ Trâm - Bình Lợi","5,5 triệu/tháng",30 m²,"Bình Thạnh, Hồ Chí Minh",cho-thue-nha-tro-phong-tro
"Ký túc xá cao cấp giá rẻ, giờ tự do, gần Nguyễn Oanh - Quang Trung, Gò Vấp, trọn gói 1,4 triệu","1,4 triệu/tháng",100 m²,"Gò Vấp, Hồ Chí Minh",cho-thue-nha-tro-phong-tro
"Khai trương căn hộ dịch vụ mới xây, gác cao nội thất mới 100% giá ưu đãi","3,6 triệu/tháng",28 m²,"Bình Tân, Hồ Chí Minh",cho-thue-nha-tro-phong-tro
"Cho thuê phòng trọ giá rẻ đầy đủ nội thất, gác cao ngay ngã tư Bốn Xã","3,5 triệu/tháng",25 m²,"Bình Tân, Hồ Chí Minh",cho-thue-nha-tro-phong-tro
Về quê cần pass phòng có để lại nội thất,"4,1 triệu/tháng",26 m²,"Tân Bình, Hồ Chí Minh",cho-thue-nha-tro-phong-tro
"Cho thuê phòng bancol thoáng, nội thất sang trọng, đầy đủ tiện nghi, ngay Trần Trọng Cung","7,3 triệu/tháng",35 m²,"Quận 7, Hồ Chí Minh",cho-thue-nha-tro-phong-tro
"Cho thuê phòng gần đường Tôn Đức Thắng, cầu Ba Son, chợ Tân Định, nhà thờ Đức Bà",7 triệu/tháng,50 m²,"Quận 1, Hồ Chí Minh",cho-thue-nha-tro-phong-tro
"Cho thuê phòng cửa sổ thoáng, nội thất sang trọng, đầy đủ tiện nghi, ngay Nam Kỳ Khởi Nghĩa","6,3 triệu/tháng",32 m²,"Quận 3, Hồ Chí Minh",cho-thue-nha-tro-phong-tro
Phòng căn hộ studio full nội thất gần khu vực K300,7 triệu/tháng,30 m²,"Tân Bình, Hồ Chí Minh",cho-thue-nha-tro-phong-tro
Cho thuê phòng bancol 30m2 chỉ tính tiền điện nước gần EMart Phan Huy Ích Gò Vấp,"4,3 triệu/tháng",32 m²,"Gò Vấp, Hồ Chí Minh",cho-thue-nha-tro-phong-tro
"Studio, tách bếp, cửa sổ, 30m2, full NT gần cầu chữ Y, cầu Nguyễn Văn Cừ, Đh Sài Gòn, chợ An Đông","5,5 triệu/tháng",30 m²,"Quận 8, Hồ Chí Minh",cho-thue-nha-tro-phong-tro
Cho thuê phòng ban công cực chill gần ĐH Văn Lang full nội thất,"6,5 triệu/tháng",35 m²,"Bình Thạnh, Hồ Chí Minh",cho-thue-nha-tro-phong-tro
Phòng trọ 1PN đầy đủ nội thất ban công cửa sổ lớn máy giặt riêng Nguyễn Thái Bình quận 1,6 triệu/tháng,40 m²,"Quận 1, Hồ Chí Minh",cho-thue-nha-tro-phong-tro
"Phòng trọ máy lạnh ngay Aeon Mall Tên Lửa, Bình Tân. DT 20m2 giá 3tr/th cho nuôi pet",3 triệu/tháng,20 m²,"Bình Tân, Hồ Chí Minh",cho-thue-nha-tro-phong-tro
(Chính chủ) phòng đầy đủ nội thất P13 Bình Thạnh giao với Phạm Văn Đồng,"4,4 triệu/tháng",18 m²,"Bình Thạnh, Hồ Chí Minh",cho-thue-nha-tro-phong-tro
"Cho thuê phòng cửa sổ, nội thất sang trọng, đầy đủ tiện nghi, ngay cầu Trần Khánh Dư","6,8 triệu/tháng",30 m²,"Quận 1, Hồ Chí Minh",cho-thue-nha-tro-phong-tro
Cho thuê phòng trọ KTX giá siêu hời LH 0911 067 ***,"1,3 triệu/tháng",65 m²,"Phú Nhuận, Hồ Chí Minh",cho-thue-nha-tro-phong-tro
"Phòng duplex siêu xinh, thiết kế sang trọng Nam Kỳ Khởi Nghĩa Quận 3. Ở được ngay","6,5 triệu/tháng",30 m²,"Quận 3, Hồ Chí Minh",cho-thue-nha-tro-phong-tro
Studio full nội thất gần khu vực ngã tư Bảy Hiền,7 triệu/tháng,30 m²,"Tân Bình, Hồ Chí Minh",cho-thue-nha-tro-phong-tro
"Cho thuê căn hộ dịch vụ full nội thất ngay ngã tư Văn Cao, Ba Đình, HN. Gần TTTM Lotte, KS Daewoo","3,5 triệu/tháng",25 m²,"Ba Đình, Hà Nội",cho-thue-nha-tro-phong-tro
Phòng trọ đầy đủ tiện nghi Hồ Văn Huê,"1,3 triệu/tháng",70 m²,"Phú Nhuận, Hồ Chí Minh",cho-thue-nha-tro-phong-tro
Phòng thuê cao cấp full nội thất Tân Bình,10 triệu/tháng,45 m²,"Tân Bình, Hồ Chí Minh",cho-thue-nha-tro-phong-tro
Phòng duplex nằm ngay ngã tư Gò Mây - giá ưu đãi!,3 triệu/tháng,25 m²,"Bình Tân, Hồ Chí Minh",cho-thue-nha-tro-phong-tro
"Căn hộ dịch vụ mới tinh chỉ 2,2 triệu/1 tháng ngay Lê Trọng Tấn, cách Đại Học Công Thương 1km","2,2 triệu/tháng",25 m²,"Tân Phú, Hồ Chí Minh",cho-thue-nha-tro-phong-tro
"Căn hộ thông minh, thang máy, chỉ tính điện nước, Lê Văn Sỹ Quận Phú Nhuận Chỉ Cần Xách Vali Vào ở","4,3 triệu/tháng",18 m²,"Phú Nhuận, Hồ Chí Minh",cho-thue-nha-tro-phong-tro
"Hỗ trợ tìm phòng giá tốt cho sinh viên, phòng full nội thất, thoáng mát, ngay đại học Văn Lang",6 triệu/tháng,30 m²,"Bình Thạnh, Hồ Chí Minh",cho-thue-nha-tro-phong-tro
Căn hộ studio full nội thất gần khu vực chợ Phạm Văn Hai,6 triệu/tháng,30 m²,"Tân Bình, Hồ Chí Minh",cho-thue-nha-tro-phong-tro
"Phòng trọ giá rẻ sẵn máy lạnh - ngay Trường Chinh, gần cầu Tham Lương","3,2 triệu/tháng",20 m²,"Tân Bình, Hồ Chí Minh",cho-thue-nha-tro-phong-tro
Phòng trọ siêu rẻ siêu hời Quận 2 ở liền được,4 triệu/tháng,30 m²,"Quận 2, Hồ Chí Minh",cho-thue-nha-tro-phong-tro
"Cho thuê phòng trung tâm Quận 3, Võ Thị Sáu - DT 50m2",6 triệu/tháng,50 m²,"Quận 3, Hồ Chí Minh",cho-thue-nha-tro-phong-tro
"Thuê nguyên căn hộ DV 1PN + 1WC đầy đủ nội thất ngay trung tâm Q1, Lý Tự Trọng - DT 20m2",6 triệu/tháng,20 m²,"Quận 1, Hồ Chí Minh",cho-thue-nha-tro-phong-tro
"Sắp hết - phòng ban công, cửa sổ lớn view đẹp, có bếp Quận 3","6,5 triệu/tháng",23 m²,"Quận 3, Hồ Chí Minh",cho-thue-nha-tro-phong-tro
Phòng trọ cao cấp mới xây thị trấn Nhà Bè,"3,2 triệu/tháng",15 m²,"Nhà Bè, Hồ Chí Minh",cho-thue-nha-tro-phong-tro
Căn hộ studio đầy đủ nội thất gần ngã tư Bảy Hiền,7 triệu/tháng,30 m²,"Tân Bình, Hồ Chí Minh",cho-thue-nha-tro-phong-tro
"Cho thuê 1PN ban công - CMT8 Quận 3, đối diện CV Lê Thị Riêng, vòng xoay Dân Chủ","8,5 triệu/tháng",45 m²,"Quận 3, Hồ Chí Minh",cho-thue-nha-tro-phong-tro
"Cho thuê phòng giá rẻ, gác cao sẵn máy lạnh ở Trường Chinh, P14, Tân Bình","3,7 triệu/tháng",25 m²,"Tân Bình, Hồ Chí Minh",cho-thue-nha-tro-phong-tro
Phòng đủ nội thất ngay trung tâm quận 10,"4,8 triệu/tháng",35 m²,"Quận 10, Hồ Chí Minh",cho-thue-nha-tro-phong-tro
Khai trương căn hộ DV mới 100% full tiện nghi,"7,8 triệu/tháng",45 m²,"Bình Thạnh, Hồ Chí Minh",cho-thue-nha-tro-phong-tro
Chủ nhà khai trương duplex bancol 45m2 full nội thất cao cấp - Thành Thái,"6,5 triệu/tháng",45 m²,"Quận 10, Hồ Chí Minh",cho-thue-nha-tro-phong-tro
Chủ nhà khai trương duplex bancol 45m2 full nội thất cao cấp - Thành Thái,"6,5 triệu/tháng",45 m²,"Quận 10, Hồ Chí Minh",cho-thue-nha-tro-phong-tro
"Ban công gió lộng, bếp ngăn riêng - cho thuê phòng, phòng Quận 3",6 triệu/tháng,20 m²,"Quận 3, Hồ Chí Minh",cho-thue-nha-tro-phong-tro
Cho thuê nhà nội thất đầy đủ ban công rộng lớn thoáng ngay Tôn Thất Thuyết Quận 4,"5,8 triệu/tháng",35 m²,"Quận 4, Hồ Chí Minh",cho-thue-nha-tro-phong-tro
Đang sẵn sàng - cho thuê phòng Quận 3 view siêu đẹp Võ Văn Tần,"6,5 triệu/tháng",25 m²,"Quận 3, Hồ Chí Minh",cho-thue-nha-tro-phong-tro
"Căn hộ cửa sổ lớn nội thất đầy đủ ngay cầu Ngay Công Viên Hoàng Văn Thụ, Phú Nhuận",7 triệu/tháng,40 m²,"Phú Nhuận, Hồ Chí Minh",cho-thue-nha-tro-phong-tro
"Cho thuê 1 phòng riêng trong chung cư Topaz Elite gần cầu chữ Y, Phạm Hùng","3,8 triệu/tháng",15 m²,"Quận 8, Hồ Chí Minh",cho-thue-nha-tro-phong-tro
"Cho thuê phòng trọ nhà mặt tiền Chợ Q4 (Tôn Thất Thuyết) giờ giấc tự do, không chung chủ 2.4triệu","2,4 triệu/tháng",25 m²,"Quận 4, Hồ Chí Minh",cho-thue-nha-tro-phong-tro
"Studio đường Nguyễn Thị Thập gần chợ Tân Mỹ Quận 7, giá sinh viên full nội thất","4,6 triệu/tháng",35 m²,"Quận 7, Hồ Chí Minh",cho-thue-nha-tro-phong-tro
"Cho thuê phòng trọ lối đi riêng có BV có ban công có nhà VS có bếp 20 - 30m2 giá từ 2,8 - 3tr/tháng",3 triệu/tháng,25 m²,"Tân Bình, Hồ Chí Minh",cho-thue-nha-tro-phong-tro
"Chính chủ cho thuê căn hộ dịch vụ đầy đủ tiện nghi giá rẻ cho sinh viên, chỉ từ 1.4-2 tr/tháng","1,4 triệu/tháng",18 m²,"Bình Thạnh, Hồ Chí Minh",cho-thue-nha-tro-phong-tro
"Cho thuê CCMN mới tinh, full đồ tại 203 Kim Ngưu","4,6 triệu/tháng",25 m²,"Hai Bà Trưng, Hà Nội",cho-thue-nha-tro-phong-tro
"Căn hộ studio/1PN ngay Trung Sơn, gần Lotte Q7, tiện qua Q1, Q5, Q8","7,5 triệu/tháng",40 m²,"Bình Chánh, Hồ Chí Minh",cho-thue-nha-tro-phong-tro
Cho thuê Duplex Chill ngay Etown Cộng Hoà,"3,8 triệu/tháng",25 m²,"Tân Bình, Hồ Chí Minh",cho-thue-nha-tro-phong-tro
"Phòng studio nội thất đầy đủ, cửa sổ lớn gần Lê Văn Sỹ Phú Nhuận",7 triệu/tháng,35 m²,"Phú Nhuận, Hồ Chí Minh",cho-thue-nha-tro-phong-tro
Căn hộ studio đầy đủ nội thất gần khu K300,"5,7 triệu/tháng",30 m²,"Tân Bình, Hồ Chí Minh",cho-thue-nha-tro-phong-tro
Cho thuê phòng giá sinh viên tại Bình Thạnh ngay VLU CS2,5 triệu/tháng,35 m²,"Bình Thạnh, Hồ Chí Minh",cho-thue-nha-tro-phong-tro
Siêu phẩm mới tinh - studio ban công khu sân bay Tân Sơn Nhất,"6,5 triệu/tháng",35 m²,"Tân Bình, Hồ Chí Minh",cho-thue-nha-tro-phong-tro
Phòng trọ cao cấp gần Aeon Mall Bình Tân,"4,8 triệu/tháng",20 m²,"Bình Tân, Hồ Chí Minh",cho-thue-nha-tro-phong-tro
Căn hộ studio đầy đủ nội thất gần khu K300,8 triệu/tháng,30 m²,"Tân Bình, Hồ Chí Minh",cho-thue-nha-tro-phong-tro
Căn hộ studio đầy đủ nội thất gần khu K300,"5,7 triệu/tháng",30 m²,"Tân Bình, Hồ Chí Minh",cho-thue-nha-tro-phong-tro
"Phòng trọ gần Aeon Mall Bình Tân full, đầy đủ tiện nghi","5,5 triệu/tháng",35 m²,"Bình Tân, Hồ Chí Minh",cho-thue-nha-tro-phong-tro
Cho thuê phòng có ban công thoáng tại Bình Thạnh full NT,6 triệu/tháng,40 m²,"Bình Thạnh, Hồ Chí Minh",cho-thue-nha-tro-phong-tro
"Cho thuê gấp phòng đầy đủ nội thất mới khai trương gần cầu Ông Lãnh , Q1",8 triệu/tháng,40 m²,"Quận 3, Hồ Chí Minh",cho-thue-nha-tro-phong-tro
Căn hộ DV quận 1 đường Đặng Dung full nội thất có ban công,8 triệu/tháng,30 m²,"Quận 1, Hồ Chí Minh",cho-thue-nha-tro-phong-tro
Cho thuê phòng diện tích 30m2 + full NT + thiết kế basic vị trí Trần Quang Khải Quận 1,7 triệu/tháng,30 m²,"Quận 1, Hồ Chí Minh",cho-thue-nha-tro-phong-tro
Căn hộ new 100% với thiết kế sang trọng - ban công cực chill - giá rẻ lại tốt,7 triệu/tháng,40 m²,"Quận 1, Hồ Chí Minh",cho-thue-nha-tro-phong-tro
CCMN 1 ngủ + 1 gác xép full đồ Quan Nhân ở luôn,5 triệu/tháng,25 m²,"Thanh Xuân, Hà Nội",cho-thue-nha-tro-phong-tro
"Ảnh thật giá thật, sạch sẽ thoáng mát tiện nghi tại Bình Thạnh tiện Qua quận 1 gần các trường ĐH",6 triệu/tháng,35 m²,"Bình Thạnh, Hồ Chí Minh",cho-thue-nha-tro-phong-tro
"Ảnh thật giá thật, cho thuê phòng thoáng mát, tiện nghi tại Bình Thạnh",7 triệu/tháng,30 m²,"Bình Thạnh, Hồ Chí Minh",cho-thue-nha-tro-phong-tro
"Căn phòng trong mơ! CCMN Nguyên Xá - Văn Trì phòng mới, đẹp","3,95 triệu/tháng",22 m²,"Bắc Từ Liêm, Hà Nội",cho-thue-nha-tro-phong-tro
"Phòng duplex, ngay vòng xoay Điện Biên Phủ Quận 1 - Bình Thạnh","5,5 triệu/tháng",29 m²,"Bình Thạnh, Hồ Chí Minh",cho-thue-nha-tro-phong-tro
Phòng đầy đủ tiện nghi ngay Phan Văn Trị - Chu Văn An,"5,5 triệu/tháng",20 m²,"Bình Thạnh, Hồ Chí Minh",cho-thue-nha-tro-phong-tro
Phòng thuê trọ cho sinh viên Tôn Đức Thắng RMIT ở chung cư Thanh Bình ngay Lotte Mart Q7,4 triệu/tháng,20 m²,"Quận 7, Hồ Chí Minh",cho-thue-nha-tro-phong-tro
Căn hộ studio full nội thất gần khu vực K300,6 triệu/tháng,30 m²,"Tân Bình, Hồ Chí Minh",cho-thue-nha-tro-phong-tro
CHDV mới xây có máy giặt riêng full nội thất gần Văn Lang và đại học Công Nghiệp,"5,5 triệu/tháng",30 m²,"Bình Thạnh, Hồ Chí Minh",cho-thue-nha-tro-phong-tro
Cho thuê phòng trọ giá rẻ chỉ từ 2tr5 - 3tr gần ĐH Công Nghiệp tại khu đô thị Lideco,Giá thỏa thuận,40 m²,"Hoài Đức, Hà Nội",cho-thue-nha-tro-phong-tro
"Cho thuê căn hộ dịch vụ 30m2 - 35m2 giá 5,5tr - 6tr/th, gần Lê Văn Việt, P. Hiệp Phú, Tp Thủ Đức","5,5 triệu/tháng",30 m²,"Quận 9, Hồ Chí Minh",cho-thue-nha-tro-phong-tro
"Trống sẵn phòng duplex phường 12, Bình Thạnh - phòng mới, giờ giấc tự do","5,5 triệu/tháng",20 m²,"Bình Thạnh, Hồ Chí Minh",cho-thue-nha-tro-phong-tro
"Sleepbox Bình Thạnh, gần đại học UEF, Hồng Bàng, Hutech","2,3 triệu/tháng",20 m²,"Bình Thạnh, Hồ Chí Minh",cho-thue-nha-tro-phong-tro
Phòng rộng thoáng dạng 1 trệt 1 lửng ngay cầu Thanh Đa,"5,4 triệu/tháng",30 m²,"Bình Thạnh, Hồ Chí Minh",cho-thue-nha-tro-phong-tro
"Phòng cho nữ thuê giá từ rẻ quận 1 - giờ tự do, không chung chủ","3,8 triệu/tháng",15 m²,"Quận 1, Hồ Chí Minh",cho-thue-nha-tro-phong-tro
"Phòng ban công thoát mát ngay làng đại học khu B, gần ĐH Tôn Đức Thắng","4,4 triệu/tháng",20 m²,"Quận 7, Hồ Chí Minh",cho-thue-nha-tro-phong-tro
"Phòng trọ 20m2 có gác, đầy đủ tiện ích đường Điện Biên Phủ, Bình Thạnh","5,5 triệu/tháng",20 m²,"Bình Thạnh, Hồ Chí Minh",cho-thue-nha-tro-phong-tro
"Cho thuê phòng tại Trần Kế Xương, P7, Phú Nhuận","5,2 triệu/tháng",20 m²,"Phú Nhuận, Hồ Chí Minh",cho-thue-nha-tro-phong-tro
"1PN ban công máy giặt riêng full NT gần cầu Calmette chợ Bến Thành, Bitexco, Takashiya, ĐH Văn Lang","7,9 triệu/tháng",40 m²,"Quận 1, Hồ Chí Minh",cho-thue-nha-tro-phong-tro
