Title,Price,Area,Location,type
Cho thuê phòng ở 322/95 Mỹ Đình (thông ra ngõ 180 Đình Thôn) trong nhà 5 tầng mới,3 triệu/tháng,20 m²,"Nam Từ Liêm, Hà Nội",cho-thue-nha-tro-phong-tro
"Cho thuê phòng trọ VIP 22m2 mới xây xong tại 1023, đường 16A4, xã Đức Hoà Hạ, Đức Hoà Long An",2 triệu/tháng,22 m²,"Đức Hòa, Long An",cho-thue-nha-tro-phong-tro
"Cho thuê phòng trọ VIP 22m2 mới xây xong tại 1023, đường 16A4, xã Đức Hoà Hạ, Đức Hoà Long An",2 triệu/tháng,22 m²,"Đức Hòa, Long An",cho-thue-nha-tro-phong-tro
"Cho thuê phòng trọ VIP 22m2 mới xây xong tại 1023, đường 16A4, xã Đức Hoà Hạ, Đức Hoà Long An",2 triệu/tháng,22 m²,"Đức Hòa, Long An",cho-thue-nha-tro-phong-tro
"Căn hộ dịch vụ (Nhà trọ cao cấp) Kiba Cozy - 26 m2 tại Cống Quỳnh, Quận 1 mới hoàn thành","8,5 triệu/tháng",26 m²,"Quận 1, Hồ Chí Minh",cho-thue-nha-tro-phong-tro
"Siêu phẩm cuối năm căn 1PN bancon full nội thất, đầy đủ tiện nghi, gần sân bay Tân Sơn Nhất",6 triệu/tháng,40 m²,"Tân Bình, Hồ Chí Minh",cho-thue-nha-tro-phong-tro
"Căn hộ dịch vụ (Nhà trọ cao cấp) Kiba Cozy - 26 m2 tại Cống Quỳnh, Quận 1 mới hoàn thành","8,5 triệu/tháng",26 m²,"Quận 1, Hồ Chí Minh",cho-thue-nha-tro-phong-tro
"Căn hộ dịch vụ (Nhà trọ cao cấp) Kiba Cozy - 26 m2 tại Cống Quỳnh, Quận 1 mới hoàn thành","8,5 triệu/tháng",26 m²,"Quận 1, Hồ Chí Minh",cho-thue-nha-tro-phong-tro
"Siêu phẩm cuối năm căn studio full nội thất, đầy đủ tiện nghi, gần sân bay tân sơn nhất",8 triệu/tháng,40 m²,"Tân Bình, Hồ Chí Minh",cho-thue-nha-tro-phong-tro
"Căn hộ nằm ngay Gần Sân Bay Tân Sân Nhất P2 Tân Bình, full nội thất mới đẹp ban công rộng","8,5 triệu/tháng",35 m²,"Tân Bình, Hồ Chí Minh",cho-thue-nha-tro-phong-tro
Căn hộ an ninh giá rẻ full nội thất ban công 35m2 SVD Phú Thọ,"5,8 triệu/tháng",35 m²,"Quận 10, Hồ Chí Minh",cho-thue-nha-tro-phong-tro
"Siêu phẩm cuối năm căn 1PN bancon full nội thất, gần trục đường cộng hòa",10 triệu/tháng,40 m²,"Tân Bình, Hồ Chí Minh",cho-thue-nha-tro-phong-tro
Căn hộ studio full kính full nội thất ngay nội khu sân bay - công viên Gia Định,7 triệu/tháng,35 m²,"Tân Bình, Hồ Chí Minh",cho-thue-nha-tro-phong-tro
Cho thuê phòng trọ ngay trung tâm Quận 3,6 triệu/tháng,35 m²,"Quận 3, Hồ Chí Minh",cho-thue-nha-tro-phong-tro
"Ở ngay - phòng gác lửng cửa sổ lớn đường Dương Văn Dương, Tân Phú","3,8 triệu/tháng",25 m²,"Tân Phú, Hồ Chí Minh",cho-thue-nha-tro-phong-tro
"Duplex ban công rộng 50m2 - ngay trung tâm Q4, tiện di chuyển Q1, nhà xe rộng rãi nhà mới","5,8 triệu/tháng",50 m²,"Quận 4, Hồ Chí Minh",cho-thue-nha-tro-phong-tro
"Cho thuê phòng Quận 3, ban công máy giặt riêng, gần Bờ Kè, cầu Công Lý",7 triệu/tháng,35 m²,"Quận 3, Hồ Chí Minh",cho-thue-nha-tro-phong-tro
"Phòng trọ 1PN, ban công, full NT Đào Duy Anh gần Nguyễn Kiệm, Hoàng Văn Thụ",7 triệu/tháng,45 m²,"Phú Nhuận, Hồ Chí Minh",cho-thue-nha-tro-phong-tro
Cho thuê phòng 35m2 có bếp WC riêng MT đường Số 4 KDC Bình Đăng P. 6 Quận 8,"3,7 triệu/tháng",35 m²,"Quận 8, Hồ Chí Minh",cho-thue-nha-tro-phong-tro
Duplex ban công 50m2 - đầy đủ nội thất - khu Tân Quy - cách Lotte 5 đi xe - 3 - 4 khách ở thoải mái,"5,5 triệu/tháng",50 m²,"Quận 7, Hồ Chí Minh",cho-thue-nha-tro-phong-tro
Duplex ban công 50m2 - đầy đủ nội thất - khu Tân Quy - cách Lotte 5 đi xe - 3 - 4 khách ở thoải mái,"5,5 triệu/tháng",50 m²,"Quận 7, Hồ Chí Minh",cho-thue-nha-tro-phong-tro
Ký túc xá - khu công nghệ cao - Hutech - FPT - Q9,"1,19 triệu/tháng",100 m²,"Quận 9, Hồ Chí Minh",cho-thue-nha-tro-phong-tro
Studio/ 1PN ban công tách bếp - 50m2 - Khu an ninh - 24/24 gần Lottemart chỉ mất 5 đi xe,"5,5 triệu/tháng",50 m²,"Quận 7, Hồ Chí Minh",cho-thue-nha-tro-phong-tro
"Phòng ban công cao cấp full nội thất gần cầu Lê Văn Sỹ, chợ Nguyễn Văn Trỗi Q3","6,2 triệu/tháng",35 m²,"Quận 3, Hồ Chí Minh",cho-thue-nha-tro-phong-tro
Cho thuê phòng trọ cao cấp có cửa sổ trời ngay ngã tư Bảy Hiền,"3,5 triệu/tháng",25 m²,"Tân Bình, Hồ Chí Minh",cho-thue-nha-tro-phong-tro
Căn hộ duplex 45m2 full nội thất có ban công mới xây ngay Luỹ Bán Bích - Quận 11,"5,5 triệu/tháng",45 m²,"Tân Phú, Hồ Chí Minh",cho-thue-nha-tro-phong-tro
"Cho thuê phòng, Hoàng Sa, Quận 3, giá 5tr và 7tr5/th",5 triệu/tháng,40 m²,"Quận 3, Hồ Chí Minh",cho-thue-nha-tro-phong-tro
"Cho thuê phòng trọ, nhà trọ khép kín có điều hòa nóng lạnh giá rẻ - Yên Nghĩa, gần đại học Phenikaa","2,2 triệu/tháng",20 m²,"Hà Đông, Hà Nội",cho-thue-nha-tro-phong-tro
Mình có căn nhà mới xây ở đường Man Thiện,"4,2 triệu/tháng",40 m²,"Quận 9, Hồ Chí Minh",cho-thue-nha-tro-phong-tro
"Cho thuê phòng tại 61 Nguyễn Minh Hoàng, P.12, Tân Bình, khu K300, 4.5 tr/tháng","4,5 triệu/tháng",25 m²,"Tân Bình, Hồ Chí Minh",cho-thue-nha-tro-phong-tro
"Cho thuê phòng hẻm 227 Nguyễn Trọng Tuyển, Phú Nhuận (Pass Phòng)","3,6 triệu/tháng",15 m²,"Phú Nhuận, Hồ Chí Minh",cho-thue-nha-tro-phong-tro
Căn hộ full nội thất ban công rộng gần ngã tư Bảy Hiền,"6,5 triệu/tháng",40 m²,"Tân Bình, Hồ Chí Minh",cho-thue-nha-tro-phong-tro
Phòng cho thuê có ban công gần khu Bàu Cát - Etown Cộng Hòa,"5,5 triệu/tháng",28 m²,"Tân Bình, Hồ Chí Minh",cho-thue-nha-tro-phong-tro
"CHDV ở KDC Cityland Park Hills P10, đầy đủ tiện nghi, setup nội thất theo yêu cầu, giá từ 5tr - 8tr",5 triệu/tháng,30 m²,"Gò Vấp, Hồ Chí Minh",cho-thue-nha-tro-phong-tro
"Phòng trọ mới xây - thiết kế hiện đại - có máy lạnh, khoá vân tay - hẻm đường Trần Hoàng Na","2,5 triệu/tháng",25 m²,"Ninh Kiều, Cần Thơ",cho-thue-nha-tro-phong-tro
"Thuê phòng xinh, 40m2, giá 7tr2, full nội thất, Đường Trần Doãn Khanh, Quận 1","7,2 triệu/tháng",40 m²,"Quận 1, Hồ Chí Minh",cho-thue-nha-tro-phong-tro
Phòng studio mới 100% full nội thất có ban công máy giặt riêng rộng 45m2 gần ngã tư Phú Nhuận,"6,8 triệu/tháng",45 m²,"Phú Nhuận, Hồ Chí Minh",cho-thue-nha-tro-phong-tro
"Trống duy nhất 1 phòng studio, ban công full, NT quận Tân Phú","3,5 triệu/tháng",25 m²,"Tân Phú, Hồ Chí Minh",cho-thue-nha-tro-phong-tro
"Cho thuê căn hộ 1PN, 1PK đầy đủ nội thất khu sân bay quận Tân Bình","7,5 triệu/tháng",40 m²,"Tân Bình, Hồ Chí Minh",cho-thue-nha-tro-phong-tro
Cho thuê phòng ngay Bờ Kè Hoàng Sa,8 triệu/tháng,40 m²,"Phú Nhuận, Hồ Chí Minh",cho-thue-nha-tro-phong-tro
Cho thuê phòng ngay Bờ Kè Hoàng Sa,8 triệu/tháng,40 m²,"Phú Nhuận, Hồ Chí Minh",cho-thue-nha-tro-phong-tro
Cho thuê phòng mới 100% sạch sẽ - thoáng mát 25m2 Luỹ Bán Bích - Âu Cơ,"3,6 triệu/tháng",25 m²,"Tân Phú, Hồ Chí Minh",cho-thue-nha-tro-phong-tro
"Cho thuê homestay, ký túc xá, phòng trọ ở ghép, đầy đủ tiện nghi, thoáng mát Thủ Đức","1,5 triệu/tháng",30 m²,"Thủ Đức, Hồ Chí Minh",cho-thue-nha-tro-phong-tro
"Cho thuê studio, duplex, ngay CV Hoàng Văn Thụ","6,5 triệu/tháng",35 m²,"Tân Bình, Hồ Chí Minh",cho-thue-nha-tro-phong-tro
"Cho thuê ký túc xá mới xây an ninh, đầy đủ tiện nghi cao cấp, sạch sẽ ngay Lê Văn Việt, Quận 9","1,5 triệu/tháng",30 m²,"Quận 9, Hồ Chí Minh",cho-thue-nha-tro-phong-tro
"Cho thuê Sleepbox hiện đại, đầy đủ tiện nghi, phòng trọ ở ghép giá rẻ có mặt ở nhiều quận của TPHCM","1,8 triệu/tháng",30 m²,"Quận 3, Hồ Chí Minh",cho-thue-nha-tro-phong-tro
Cho thuê phòng duplex ngay Lý Thường Kiệt,"6,5 triệu/tháng",30 m²,"Quận 10, Hồ Chí Minh",cho-thue-nha-tro-phong-tro
"Cho thuê phòng trống, căn hộ dịch vụ ngay chung cư Sky9 - chung cư Hausneo",4 triệu/tháng,24 m²,"Quận 9, Hồ Chí Minh",cho-thue-nha-tro-phong-tro
"Phòng dạng duplex full nội thất, đầy đủ tiện nghi, ngay ngã tư Bảy Hiền","6,5 triệu/tháng",45 m²,"Tân Bình, Hồ Chí Minh",cho-thue-nha-tro-phong-tro
"Cho thuê căn hộ studio full nội thất giá 5tr, cửa sổ, gần cầu Ông Lãnh, đường Trịnh Văn Cấn Quận 1",5 triệu/tháng,25 m²,"Quận 1, Hồ Chí Minh",cho-thue-nha-tro-phong-tro
"Cho thuê phòng trọ ở ghép, homestay, sleepbox, ký túc xá Quận 8",Giá thỏa thuận,50 m²,"Quận 8, Hồ Chí Minh",cho-thue-nha-tro-phong-tro
"Cho thuê Sleepbox có cửa khóa, nội thất riêng, chỉ từ 4 box, tiện nghi, cao cấp Q.10","2,1 triệu/tháng",30 m²,"Quận 10, Hồ Chí Minh",cho-thue-nha-tro-phong-tro
"Cho thuê phòng trọ ở ghép, KTX, đầy đủ tiện nghi cao cấp, 1tr Q. Gò Vấp",1 triệu/tháng,30 m²,"Gò Vấp, Hồ Chí Minh",cho-thue-nha-tro-phong-tro
Cho thuê căn hộ studio đầy đủ nội thất khu sân bay quận Tân Bình,6 triệu/tháng,30 m²,"Tân Bình, Hồ Chí Minh",cho-thue-nha-tro-phong-tro
"Căn hộ full nội thất - có ban công giá sinh viên ngay vòng xoay Trần Não, cạnh cầu Sài Gòn","4,7 triệu/tháng",25 m²,"Quận 2, Hồ Chí Minh",cho-thue-nha-tro-phong-tro
"Thuê phòng xinh xắn, 40m2, full nội thất, đường Hoàng Sa, gía 9tr7, Quận 1","9,7 triệu/tháng",40 m²,"Quận 1, Hồ Chí Minh",cho-thue-nha-tro-phong-tro
Cho thuê phòng studio đầy đủ nội thất khu sân bay quận Tân Bình,"5,5 triệu/tháng",30 m²,"Tân Bình, Hồ Chí Minh",cho-thue-nha-tro-phong-tro
"Phòng studio rộng 40m2 full nội thất cửa sổ trời, có thang máy gần ngã tư Phú Nhuận","6,3 triệu/tháng",40 m²,"Phú Nhuận, Hồ Chí Minh",cho-thue-nha-tro-phong-tro
Cho thuê phòng giá tốt sinh viên - văn phòng 25m2 Luỹ Bán Bích - Thoại Ngọc Hầu,"2,99 triệu/tháng",25 m²,"Tân Phú, Hồ Chí Minh",cho-thue-nha-tro-phong-tro
"Cho thuê phòng 1 phòng ngủ, đầy đủ nội thất ban công thoáng khu sân bay quận Tân Bình","7,5 triệu/tháng",40 m²,"Tân Bình, Hồ Chí Minh",cho-thue-nha-tro-phong-tro
Phòng studio rộng 50m2 full nội thất ban công có thang máy gần cầu Thị Nghè,"7,5 triệu/tháng",50 m²,"Bình Thạnh, Hồ Chí Minh",cho-thue-nha-tro-phong-tro
Phòng studio đầy đủ nội thất gần khu sân bay,6 triệu/tháng,40 m²,"Tân Bình, Hồ Chí Minh",cho-thue-nha-tro-phong-tro
Khai chương cho thuê phòng full nội thất gần Đặng Thùy Trâm đặc biệt gần 3 trường đh,6 triệu/tháng,30 m²,"Bình Thạnh, Hồ Chí Minh",cho-thue-nha-tro-phong-tro
"Cho thuê căn hộ - phòng trọ khu Trung Sơn. DT 20m2, 30m2. 35m2, có máy chiếu film trong phòng",4 triệu/tháng,25 m²,"Bình Chánh, Hồ Chí Minh",cho-thue-nha-tro-phong-tro
Phòng studio full nội thất ngay ngã tư Bảy Hiền quận Tân Bình,"6,5 triệu/tháng",38 m²,"Tân Bình, Hồ Chí Minh",cho-thue-nha-tro-phong-tro
Chính chủ cho thuê 1PN tách bếp giá rẻ gần CV Lê thị Riêng,5 triệu/tháng,35 m²,"Tân Bình, Hồ Chí Minh",cho-thue-nha-tro-phong-tro
Cho thuê phòng 1PN có nội thất cửa sổ lớn Đinh Công Tráng Quận 1,"7,2 triệu/tháng",35 m²,"Quận 1, Hồ Chí Minh",cho-thue-nha-tro-phong-tro
Căn hộ studio bancol ngay Tô Hiệu Hoà Bình,"4,5 triệu/tháng",35 m²,"Tân Phú, Hồ Chí Minh",cho-thue-nha-tro-phong-tro
Cho thuê căn hộ dv giá 7tr5 tại Trần Não - Vòng xoay Trần Não - Quận 2,"7,5 triệu/tháng",35 m²,"Quận 2, Hồ Chí Minh",cho-thue-nha-tro-phong-tro
Cho thuê Studio siêu hot trống lại,"4,8 triệu/tháng",25 m²,"Quận 2, Hồ Chí Minh",cho-thue-nha-tro-phong-tro
Phòng trọ giá sinh viên tại Đường D2,"1,6 triệu/tháng",9 m²,"Bình Thạnh, Hồ Chí Minh",cho-thue-nha-tro-phong-tro
Căn hộ dịch vụ 2PN 2WC cửa sổ 50m2 full NT Bạch Đằng kế sân bay TSN,"8,5 triệu/tháng",50 m²,"Tân Bình, Hồ Chí Minh",cho-thue-nha-tro-phong-tro
"Thuê phòng, 40m2, gía 8tr, full nội thất, đường Võ Thị Sáu, Quận 1",8 triệu/tháng,40 m²,"Quận 1, Hồ Chí Minh",cho-thue-nha-tro-phong-tro
"Chung cư mini mới xây 100% gác đứng full nội thất ngay Luỹ Bán Bích, Hoà Bình, quận 11","4,3 triệu/tháng",40 m²,"Tân Phú, Hồ Chí Minh",cho-thue-nha-tro-phong-tro
Cho thuê phòng đẹp giá tốt full nội thất 28m2 ngay ngã tư Bốn Xã,"3,4 triệu/tháng",28 m²,"Bình Tân, Hồ Chí Minh",cho-thue-nha-tro-phong-tro
Phòng Studio tách bếp Ban Công rộng full nội thất An ninh 24/24 Gần Công Viên Hoàng Văn Thụ,"6,8 triệu/tháng",40 m²,"Phú Nhuận, Hồ Chí Minh",cho-thue-nha-tro-phong-tro
Ký Túc Xá - Nguyễn Tất Thành - Q4,"1,39 triệu/tháng",65 m²,"Quận 4, Hồ Chí Minh",cho-thue-nha-tro-phong-tro
Studio ban công full nội thất ngay Pandora Trường Chinh Tân Bình,5 triệu/tháng,28 m²,"Tân Bình, Hồ Chí Minh",cho-thue-nha-tro-phong-tro
"Thuê phòng xinh, 40m2, full nội thất, đường Trần Quang Khải, tách bếp, Quận 1",8 triệu/tháng,40 m²,"Quận 1, Hồ Chí Minh",cho-thue-nha-tro-phong-tro
"Cho thuê căn hộ giá rẻ khu công nghiệp Tân Bình, ngay cầu Tham Lương, hầm xe hơi, bảo vệ 24/24",3 triệu/tháng,30 m²,"Tân Bình, Hồ Chí Minh",cho-thue-nha-tro-phong-tro
"Chính chủ cho thuê phòng trọ cao cấp, không gian thoáng mát, nội thất trang bị đầy đủ giá 2tr8/th","2,8 triệu/tháng",15 m²,"Củ Chi, Hồ Chí Minh",cho-thue-nha-tro-phong-tro
Cho thuê CHDV 2PN đầy đủ nội thất gần Ngã tư Bảy Hiền - Lý Thường Kiệt Tân Bình,"7,5 triệu/tháng",60 m²,"Tân Bình, Hồ Chí Minh",cho-thue-nha-tro-phong-tro
"Căn hộ dv full nội thất gần cầu Kiệu, ngã tư Phú Nhuận giáp Q1","6,8 triệu/tháng",30 m²,"Phú Nhuận, Hồ Chí Minh",cho-thue-nha-tro-phong-tro
"Phòng trọ quận 1 35m2, ban công lớn và nội thất đầy đủ, ngay Hồ Hảo Hớn, giá từ 5tr",5 triệu/tháng,35 m²,"Quận 1, Hồ Chí Minh",cho-thue-nha-tro-phong-tro
Phòng duplex cửa sổ bancol lớn full nội thất tại gần ngã tư Hàng Xanh,5 triệu/tháng,35 m²,"Bình Thạnh, Hồ Chí Minh",cho-thue-nha-tro-phong-tro
"Căn hộ duplex - đầy đủ nội thất - ngay Lũy Bán Bích - ngã 4 Lũy Bán Bích, Hòa Bình","3,9 triệu/tháng",30 m²,"Tân Phú, Hồ Chí Minh",cho-thue-nha-tro-phong-tro
"Cho thuê phòng tại số nhà 12 ngõ 230 phố Lạc Trung quận Hai Bà Trưng, Hà Nội","5,5 triệu/tháng",35 m²,"Hai Bà Trưng, Hà Nội",cho-thue-nha-tro-phong-tro
"Căn hộ mini cho thuê mới - ngay trung tâm - cạnh Q1, Vinhomes, Hàng Xanh, Bà Chiểu",5 triệu/tháng,40 m²,"Bình Thạnh, Hồ Chí Minh",cho-thue-nha-tro-phong-tro
"Chính chủ cho thuê chung cư mini (20 - 28m2) ở Ngọc Thụy, Long Biên giá 3 - 3,6 tr/tháng","2,8 triệu/tháng",25 m²,"Long Biên, Hà Nội",cho-thue-nha-tro-phong-tro
Phòng mới xây 100% - máy lạnh - gần phần mềm Quang Trung,4 triệu/tháng,30 m²,"Quận 12, Hồ Chí Minh",cho-thue-nha-tro-phong-tro
Phòng mới xây - gác - máy lạnh giá rẻ,"3,5 triệu/tháng",28 m²,"Quận 12, Hồ Chí Minh",cho-thue-nha-tro-phong-tro
Phòng mới xây giá cực kì đẹp Q12,"3,3 triệu/tháng",25 m²,"Quận 12, Hồ Chí Minh",cho-thue-nha-tro-phong-tro
Dự án mới - máy lạnh - ngay CV Quang Trung,"4,1 triệu/tháng",28 m²,"Quận 12, Hồ Chí Minh",cho-thue-nha-tro-phong-tro
Trống căn qua ĐH TDM chỉ 2P đi bộ,"2,5 triệu/tháng",25 m²,"Thủ Dầu Một, Bình Dương",cho-thue-nha-tro-phong-tro
"Cho thuê phòng trọ D2 giá chỉ 1,5tr/tháng.","1,5 triệu/tháng",40 m²,"Bình Thạnh, Hồ Chí Minh",cho-thue-nha-tro-phong-tro
"Cho thuê phòng trọ KTX ngay ĐH Hutech giá chỉ 1,5tr/tháng","1,5 triệu/tháng",20 m²,"Bình Thạnh, Hồ Chí Minh",cho-thue-nha-tro-phong-tro
Phòng gần CĐ công nghệ - giá rẻ - ko giới hạn người ở,"3,3 triệu/tháng",32 m²,"Thủ Đức, Hồ Chí Minh",cho-thue-nha-tro-phong-tro
Phòng trọ - Ngay cầu Gò Dưa - Gần CĐ Công Nghệ,"3,2 triệu/tháng",25 m²,"Thủ Đức, Hồ Chí Minh",cho-thue-nha-tro-phong-tro
"Phòng trọ gần đại học Nguyễn Tất Thành. Đang giảm, ở ngay!","3,19 triệu/tháng",23 m²,"Quận 12, Hồ Chí Minh",cho-thue-nha-tro-phong-tro
"1 phòng ngủ ban công 40m2 Đ. Nguyễn Thái Bình Quận 1, Gần Bitexco, chợ Bến Thành, Dinh Độc Lập","7,5 triệu/tháng",40 m²,"Quận 1, Hồ Chí Minh",cho-thue-nha-tro-phong-tro
Studio cửa sổ đón nắng full nội thất ngay khu công nghiệp Tân Bình giáp quận 12 siêu thoáng mát,"5,5 triệu/tháng",30 m²,"Tân Bình, Hồ Chí Minh",cho-thue-nha-tro-phong-tro
Cho thuê phòng mới khai trương ngay Luỹ Bán Bích,"4,5 triệu/tháng",30 m²,"Tân Phú, Hồ Chí Minh",cho-thue-nha-tro-phong-tro
Căn hộ mini kế bên đại học Văn Hiến gác bancol có máy giặt riêng,"5,8 triệu/tháng",35 m²,"Tân Bình, Hồ Chí Minh",cho-thue-nha-tro-phong-tro
"Phòng trọ cây xanh & ban công 666/27 đường 3/2, P14, Q10, sàn đúc 25m2","3,1 triệu/tháng",25 m²,"Quận 10, Hồ Chí Minh",cho-thue-nha-tro-phong-tro
"Căn studio, duplex gác, rộng cao giá sinh viên chỉ từ 3trX gần Lotte",4 triệu/tháng,30 m²,"Quận 7, Hồ Chí Minh",cho-thue-nha-tro-phong-tro
"Căn hộ dịch vụ 2PN full nội thất, đầy đủ tiện nghi, gần sân bay Tân Sân Nhất",10 triệu/tháng,40 m²,"Tân Bình, Hồ Chí Minh",cho-thue-nha-tro-phong-tro
Phòng studio có ban công full nội thất rộng 35m2 full nội thất gần ngã tư Hàng Xanh,"5,9 triệu/tháng",35 m²,"Bình Thạnh, Hồ Chí Minh",cho-thue-nha-tro-phong-tro
CHDV cửa sổ lớn đón nắng - nội thất sang trọng y hình ngay chợ Tân Quy,"4,8 triệu/tháng",30 m²,"Quận 7, Hồ Chí Minh",cho-thue-nha-tro-phong-tro
"Studio full nội thất, thiết kế hiện đại gần Lotte Mart và chợ Tân Mỹ cam kết đúng hình đúng giá","5,5 triệu/tháng",30 m²,"Quận 7, Hồ Chí Minh",cho-thue-nha-tro-phong-tro
Cho thuê phòng ban công nằm gần cầu Phú Mỹ Quận 7 đúng giá,"6,2 triệu/tháng",40 m²,"Quận 7, Hồ Chí Minh",cho-thue-nha-tro-phong-tro
"2 phòng đẹp full nội thất khu dân cư Nam Long Quận 7, ở liền được","6,5 triệu/tháng",40 m²,"Quận 7, Hồ Chí Minh",cho-thue-nha-tro-phong-tro
Sale up to 50%(còn 1 phòng) ở ngay! Phòng trọ nằm tại đường Nguyễn Văn Quá Q. 12,"3,69 triệu/tháng",23 m²,"Quận 12, Hồ Chí Minh",cho-thue-nha-tro-phong-tro
"Cho thuê CCMN ngõ 79 Dương Quảng Hàm, 1PN, 1PK, giá từ 3.6tr/tháng, đủ đồ. Bác Cường 0357 883 ***","3,6 triệu/tháng",45 m²,"Cầu Giấy, Hà Nội",cho-thue-nha-tro-phong-tro
"Chính chủ cho thuê phòng rộng 25m2 tại ngõ 66B Triều Khúc, khép kín, full đồ, giá 3tr/tháng. Ở ngay",3 triệu/tháng,25 m²,"Thanh Xuân, Hà Nội",cho-thue-nha-tro-phong-tro
"Căn hộ ban công cao cấp full nội thất chợ Tân Định, nhà thờ Tân Định, công viên Lê Văn Tám Q1",6 triệu/tháng,45 m²,"Quận 1, Hồ Chí Minh",cho-thue-nha-tro-phong-tro
Phòng mới xây có gác ngay đường Lê Văn Việt,"3,2 triệu/tháng",22 m²,"Quận 9, Hồ Chí Minh",cho-thue-nha-tro-phong-tro
Căn hộ dịch vụ full nội thất giá rẻ ngay Phước Long,"5,6 triệu/tháng",30 m²,"Quận 9, Hồ Chí Minh",cho-thue-nha-tro-phong-tro
Ký túc xá - cầu Khánh Hội - Q1,"1,39 triệu/tháng",70 m²,"Quận 1, Hồ Chí Minh",cho-thue-nha-tro-phong-tro
"Chính chủ cho thuê phòng DV - ""cửa sổ"" đón nắng ngay THCS Đoàn Thị Điểm",7 triệu/tháng,35 m²,"Quận 3, Hồ Chí Minh",cho-thue-nha-tro-phong-tro
Cho thuê homestay ghép full nội thất tại F-Home Xuân La 1tr6 bao điện nước mạng LH 0919 579 ***,"1,6 triệu/tháng",100 m²,"Tây Hồ, Hà Nội",cho-thue-nha-tro-phong-tro
Khai trương phòng trọ Vinhomes Grand Park Quận 9,3 triệu/tháng,15 m²,"Quận 9, Hồ Chí Minh",cho-thue-nha-tro-phong-tro
Khai trương phòng trọ khu đô thị Vinhomes Grand Park Quận 9,3 triệu/tháng,6 m²,"Quận 9, Hồ Chí Minh",cho-thue-nha-tro-phong-tro
Mô hình cộng đồng sinh viên và người mới ra trường,"2,3 triệu/tháng",6 m²,"Quận 9, Hồ Chí Minh",cho-thue-nha-tro-phong-tro
"Phòng cho thuê thoáng, full nội thất, Ngay Phan Xích Long, Ngã Tư Phú Nhuận","5,5 triệu/tháng",27 m²,"Phú Nhuận, Hồ Chí Minh",cho-thue-nha-tro-phong-tro
"Phòng cho thuê ban công thoáng, full nội thất, ngay chợ Bà Chiểu, Bùi Hữu Nghĩa, Bình Thạnh","6,3 triệu/tháng",30 m²,"Bình Thạnh, Hồ Chí Minh",cho-thue-nha-tro-phong-tro
"Phòng trọ cho thuê full nội thất cửa sổ thoáng, vòng xoay Điện Biên Phủ, Nguyễn Văn Thủ, Quận 1","6,3 triệu/tháng",27 m²,"Quận 1, Hồ Chí Minh",cho-thue-nha-tro-phong-tro
Cho thuê phòng có máy lạnh ngay khu đô thị Vạn Phúc City QL 13 Thủ Đức,2 triệu/tháng,20 m²,"Thủ Đức, Hồ Chí Minh",cho-thue-nha-tro-phong-tro
Phòng balcony đón nắng tách bếp - 5p đi Lotte Q7,"4,8 triệu/tháng",31 m²,"Quận 7, Hồ Chí Minh",cho-thue-nha-tro-phong-tro
"Cho thuê phòng trọ mới xây tại địa chỉ 132 - 134 đường Chợ Lớn, Quận 6, P11, TP. HCM. 0972 474 ***","2,7 triệu/tháng",22 m²,"Quận 6, Hồ Chí Minh",cho-thue-nha-tro-phong-tro
"Phòng cho thuê balcony thoáng full nội thất bảo vệ 24/7 gần chợ Bà Chiểu Nguyễn Văn Đậu, Bình Thạnh","6,2 triệu/tháng",30 m²,"Bình Thạnh, Hồ Chí Minh",cho-thue-nha-tro-phong-tro
"Phòng cho thuê cửa sổ thoáng, full nội thất, gần chợ Bà Chiểu, Hoàng Hoa Thám, Bình Thạnh","6,2 triệu/tháng",30 m²,"Bình Thạnh, Hồ Chí Minh",cho-thue-nha-tro-phong-tro
"Cho thuê căn hộ dịch vụ mới full NT, thoáng gần cầu Bình Lợi, Nơ Trang Long, Bình Thạnh","5,9 triệu/tháng",30 m²,"Bình Thạnh, Hồ Chí Minh",cho-thue-nha-tro-phong-tro
"Cho thuê phòng tách bếp ban công thoáng, máy giặt riêng ngay chợ Bà Chiểu, Bùi Đình Tuý, Bình Thạnh","6,7 triệu/tháng",30 m²,"Bình Thạnh, Hồ Chí Minh",cho-thue-nha-tro-phong-tro
"Phòng cho thuê thoáng gần cầu Thị Nghè, Ngô Tất Tố, Bình Thạnh","6,5 triệu/tháng",30 m²,"Bình Thạnh, Hồ Chí Minh",cho-thue-nha-tro-phong-tro
"Phòng cho thuê ban công thoáng, máy giặt riêng, ngay công trường Dân Chủ, Nguyễn Phúc Nguyên, Q.3",7 triệu/tháng,30 m²,"Quận 3, Hồ Chí Minh",cho-thue-nha-tro-phong-tro
"Phòng cho thuê mới ban công cửa sổ thoáng, gần chợ Bà Chiểu, ngã tư Hàng Xanh, Bình Thạnh","6,2 triệu/tháng",30 m²,"Bình Thạnh, Hồ Chí Minh",cho-thue-nha-tro-phong-tro
"Phòng cho thuê balcon thoáng, full nội thất, gần chợ Tân Định, Huỳnh Tịnh Của, Q3","6,2 triệu/tháng",28 m²,"Quận 3, Hồ Chí Minh",cho-thue-nha-tro-phong-tro
"Phòng cho thuê cửa sổ thoáng, full NT, gần cầu Đỏ, Hutech, Nguyễn Xí, Bình Thạnh",6 triệu/tháng,28 m²,"Bình Thạnh, Hồ Chí Minh",cho-thue-nha-tro-phong-tro
"Phòng cho thuê tách bếp cửa sổ thoáng, 40m2 gần ĐH Hutech, Quốc Lộ 13, Bình Thạnh","6,5 triệu/tháng",40 m²,"Bình Thạnh, Hồ Chí Minh",cho-thue-nha-tro-phong-tro
"Phòng mới cho thuê cửa sổ thoáng - máy giặt riêng ngay cầu Lê Văn Sỹ, Trần Quốc Thảo, Quận 3","6,5 triệu/tháng",30 m²,"Quận 3, Hồ Chí Minh",cho-thue-nha-tro-phong-tro
"Cho thuê phòng riêng tại Đồng Nhân - Hai Bà Trưng. Gần Bách Khoa, Kinh Tế, Xây Dựng. 50m ra ô tô","2,7 triệu/tháng",18 m²,"Hai Bà Trưng, Hà Nội",cho-thue-nha-tro-phong-tro
"Cho thuê phòng + nội thất giá rẻ trung tâm mặt tiền ngay Liên Phường, P. Phước Long B, TP. Thủ Đức","3,8 triệu/tháng",30 m²,"Quận 9, Hồ Chí Minh",cho-thue-nha-tro-phong-tro
Khai trương dự án mới studio full nội thất máy giặt riêng gần công viên Lê Thị Riêng,"6,7 triệu/tháng",30 m²,"Quận 10, Hồ Chí Minh",cho-thue-nha-tro-phong-tro
"Phòng cho thuê ban công cửa sổ thoáng ngay phố Bùi Viện, Tôn Thất Tùng, Quận 1","6,7 triệu/tháng",30 m²,"Quận 1, Hồ Chí Minh",cho-thue-nha-tro-phong-tro
"Phòng cho thuê fulL NT, máy giặt riêng thoáng ngay cầu Lê Văn Sỹ, chùa Vĩnh Nghiêm, Quận 3",6 triệu/tháng,30 m²,"Quận 3, Hồ Chí Minh",cho-thue-nha-tro-phong-tro
"Phòng Studio thoáng mát, full nội thất, an ninh 24/24 thang máy hầm xe","6,5 triệu/tháng",40 m²,"Bình Thạnh, Hồ Chí Minh",cho-thue-nha-tro-phong-tro
"Phòng studio siêu rộng có ban công thoáng mát, cạnh quận 1, an ninh 24/24",6 triệu/tháng,40 m²,"Bình Thạnh, Hồ Chí Minh",cho-thue-nha-tro-phong-tro
"Phòng Studio rộng thoáng mát, tách bếp có thang máy hầm xe, ra vào vân tay, an ninh 24/24","6,8 triệu/tháng",40 m²,"Phú Nhuận, Hồ Chí Minh",cho-thue-nha-tro-phong-tro
