Title,Price,Area,Location,type
"Phòng trọ đường Hà Huy Giáp, phường Thạnh Xuân Q12","2,2 triệu/tháng",25 m²,"Quận 12, Hồ Chí Minh",cho-thue-nha-tro-phong-tro
"Phòng trọ sinh viên 800 nghìn/th - Quận Hà Đông, Hà Nội",800 nghìn/tháng,22 m²,"Hà Đông, Hà Nội",cho-thue-nha-tro-phong-tro
Phòng mới đẹp có thiết kế thoáng sáng sạch tinh tế ở trung tâm Phường 22 Quận Bình Thạnh,"4,9 triệu/tháng",22 m²,"Bình Thạnh, Hồ Chí Minh",cho-thue-nha-tro-phong-tro
"Phòng có ban công cửa sổ, thiết kế đẹp gần trung tâm Q1,2","6,5 triệu/tháng",20 m²,"Bình Thạnh, Hồ Chí Minh",cho-thue-nha-tro-phong-tro
Cho thuê phòng trọ đầy đủ tiên nghi - có thang máy,"2,5 triệu/tháng",25 m²,"Cái Răng, Cần Thơ",cho-thue-nha-tro-phong-tro
Phòng duplex mới xây 25m2 gần bệnh viện Thủ Đức,"3,3 triệu/tháng",45 m²,"Thủ Đức, Hồ Chí Minh",cho-thue-nha-tro-phong-tro
Cho thuê căn hộ 1PN cửa sổ lớn máy giặt riêng Cô Giang - ĐH Văn Lang Q1,"8,5 triệu/tháng",40 m²,"Quận 1, Hồ Chí Minh",cho-thue-nha-tro-phong-tro
Căn hộ 1PN bancon full nội thất ĐH Y Dược Quận 5,"7,8 triệu/tháng",25 m²,"Quận 11, Hồ Chí Minh",cho-thue-nha-tro-phong-tro
"TingTong 42 còn trống 1 phòng giá rẻ - ban công riêng, cửa sổ siêu thoáng - full đồ - vào ở luôn","3,85 triệu/tháng",45 m²,"Bắc Từ Liêm, Hà Nội",cho-thue-nha-tro-phong-tro
"Cho thuê căn hộ dịch vụ 1N1K, studio 35 - 45m2 tại Lạc Long Quân, Tây Hồ giá chỉ từ 3.8tr/tháng","3,8 triệu/tháng",25 m²,"Tây Hồ, Hà Nội",cho-thue-nha-tro-phong-tro
"Cho thuê chung cư mini tại 102 Nguyễn Đổng Chi, Cầu Diễm, Từ Liêm, Hà Nội","4,5 triệu/tháng",35 m²,"Nam Từ Liêm, Hà Nội",cho-thue-nha-tro-phong-tro
"Căn hộ ban công 35m2 Toà nhà thang máy gần Bùi Viện Q1, vòng xoay Dân Chủ","7,5 triệu/tháng",50 m²,"Quận 3, Hồ Chí Minh",cho-thue-nha-tro-phong-tro
"Cho thuê phòng siêu thoáng, tách bếp phòng khách tại bình thạnh",8 triệu/tháng,,"Bình Thạnh, Hồ Chí Minh",cho-thue-nha-tro-phong-tro
"Cho thuê phòng tại Bình Thạnh full NT, DT 40m2 an ninh, yên tĩnh, thoáng tiện nghi",8 triệu/tháng,40 m²,"Bình Thạnh, Hồ Chí Minh",cho-thue-nha-tro-phong-tro
"Cho thuê căn hộ khép kín 32m2, đủ đồ khu Liễu Giai, Vạn Bảo, giá từ 4,5 tr/tháng","4,5 triệu/tháng",32 m²,"Ba Đình, Hà Nội",cho-thue-nha-tro-phong-tro
"Phòng Studio siêu đẹp, an ninh cao & gần Lotte Mart & Phú Mỹ Hưng - đường Nguyễn Thị Thập, Quận 7",7 triệu/tháng,35 m²,"Quận 7, Hồ Chí Minh",cho-thue-nha-tro-phong-tro
Cần cho thuê phòng trọ full nội thất giá rẻ quận 3,6 triệu/tháng,20 m²,"Quận 3, Hồ Chí Minh",cho-thue-nha-tro-phong-tro
Cho thuê phòng có gác - gần trường ĐH GTVT - gần đường Lê Văn Việt - có máy lạnh,"3,6 triệu/tháng",25 m²,"Quận 9, Hồ Chí Minh",cho-thue-nha-tro-phong-tro
Cho thuê full nội thất - 40m2 gần các trường ĐH và khu CNC,"4,5 triệu/tháng",40 m²,"Quận 9, Hồ Chí Minh",cho-thue-nha-tro-phong-tro
"Phòng 30 - 40m2 xanh - sạch Gò Vấp, có ban công, full tiện ích - ưu đãi khai trương",5 triệu/tháng,40 m²,"Gò Vấp, Hồ Chí Minh",cho-thue-nha-tro-phong-tro
"Phòng mới, có ban công, ngay GV - vào ở ngay","5,2 triệu/tháng",40 m²,"Gò Vấp, Hồ Chí Minh",cho-thue-nha-tro-phong-tro
Cho thuê phòng full NT cửa sổ siêu xịn gần sân bay,"7,5 triệu/tháng",35 m²,"Tân Bình, Hồ Chí Minh",cho-thue-nha-tro-phong-tro
"Cho thuê phòng giờ giấc tự do, mặt tiền đường Bà Hạt","2,5 triệu/tháng",15 m²,"Quận 10, Hồ Chí Minh",cho-thue-nha-tro-phong-tro
"Cho thuê phòng trọ đầy đủ nội thất tại 10/11 Nguyễn Cảnh Dị, Phường 4, Tân Bình","4,5 triệu/tháng",25 m²,"Tân Bình, Hồ Chí Minh",cho-thue-nha-tro-phong-tro
"Cho thuê CCMN Mỹ Đình - Nam Từ Liêm mặt phố - view triệu đô - ban công, DT 35m2, KK full đồ, 5tr/th","5,3 triệu/tháng",35 m²,"Nam Từ Liêm, Hà Nội",cho-thue-nha-tro-phong-tro
"Ưu đãi lớn dịp lễ cho thuê CCMN Lê Đức Thọ, Nam Từ Liêm studio 30m2, full đồ, ban công cửa sổ sáng","5,5 triệu/tháng",30 m²,"Nam Từ Liêm, Hà Nội",cho-thue-nha-tro-phong-tro
Cho thuê phòng full nội thất - giá rẻ,"2,6 triệu/tháng",30 m²,"Gò Vấp, Hồ Chí Minh",cho-thue-nha-tro-phong-tro
Chính chủ cho thuê phòng Xuân La Xuân Đỉnh cách Đại Sứ Quán Hàn Quốc có 100m nhà khép kín tiện nghi,"3,8 triệu/tháng",30 m²,"Bắc Từ Liêm, Hà Nội",cho-thue-nha-tro-phong-tro
"Cho thuê phòng chính chủ khu vực an ninh tại phường 26, quận Bình Thạnh","2,4 triệu/tháng",18 m²,"Bình Thạnh, Hồ Chí Minh",cho-thue-nha-tro-phong-tro
"Phòng trọ giá rẻ gần khu CNC, DH Hutech khu E, Lã Xuân Oai, Quận 9",2 triệu/tháng,20 m²,"Quận 9, Hồ Chí Minh",cho-thue-nha-tro-phong-tro
Studio ban công siêu thoáng trên đường Trần Quang Diệu Q3,"6,9 triệu/tháng",30 m²,"Quận 3, Hồ Chí Minh",cho-thue-nha-tro-phong-tro
"Phòng đầy đủ tiện nghi 115/49/34 Lê Văn Sỹ, Phú Nhuận","2,5 triệu/tháng",20 m²,"Phú Nhuận, Hồ Chí Minh",cho-thue-nha-tro-phong-tro
"Chính chủ cho thuê phòng trọ ngõ 87 Yên Xá, diện tích 30m2 gác xép điều hòa nóng lạnh khép kín mới","3,3 triệu/tháng",30 m²,"Thanh Trì, Hà Nội",cho-thue-nha-tro-phong-tro
"Mình còn 1 phòng trống cạnh cổng trường ĐH Giao Thông Vận Tải đường TCH 18, Tân Chánh Hiệp, Q12","3,5 triệu/tháng",30 m²,"Quận 12, Hồ Chí Minh",cho-thue-nha-tro-phong-tro
"Ký túc xá cao cấp giá rẻ Gò Vấp, ngay Quang Trung - Nguyễn Oanh, trọn gói 1,4 triệu, giờ giấc tự do","1,4 triệu/tháng",35 m²,"Gò Vấp, Hồ Chí Minh",cho-thue-nha-tro-phong-tro
"Phòng cho thuê gần Ufm, khu chế xuất, cầu Phú Mỹ Quận 7","4,3 triệu/tháng",35 m²,"Quận 7, Hồ Chí Minh",cho-thue-nha-tro-phong-tro
Ký túc xá nữ giường tầng hậu mãi tối ưu,"1,4 triệu/tháng",16 m²,"Gò Vấp, Hồ Chí Minh",cho-thue-nha-tro-phong-tro
Phòng Studio Full NT cửa sổ lớn đầy đủ tiện nghi Ngay Khu Trung Tâm,6 triệu/tháng,25 m²,"Bình Thạnh, Hồ Chí Minh",cho-thue-nha-tro-phong-tro
Phòng Studio Full NT cửa sổ giếng trời ngay Ngã Tư Phú Nhuận,"5,5 triệu/tháng",25 m²,"Phú Nhuận, Hồ Chí Minh",cho-thue-nha-tro-phong-tro
Phòng Studio full NT tách bếp siêu xịn mịn đầy đủ tiện nghi,6 triệu/tháng,30 m²,"Bình Thạnh, Hồ Chí Minh",cho-thue-nha-tro-phong-tro
"Phòng studio full NT cửa sổ ban công thoáng mát gần Cầu Đỏ, ĐH Văn Lang 3",5 triệu/tháng,30 m²,"Bình Thạnh, Hồ Chí Minh",cho-thue-nha-tro-phong-tro
"Cho thuê phòng trọ Đường Đông Hưng Thuận 31, Phường Tân Hưng Thuận, Quận 12, Hồ Chí Minh","1,5 triệu/tháng",22 m²,"Quận 12, Hồ Chí Minh",cho-thue-nha-tro-phong-tro
Nguyễn Trung Ngạn Q1 - Full nội thất - đẹp,"6,5 triệu/tháng",28 m²,"Quận 1, Hồ Chí Minh",cho-thue-nha-tro-phong-tro
Pass phòng trọ cạnh Vườn Lài - Luỹ Bán Bích,4 triệu/tháng,40 m²,"Tân Phú, Hồ Chí Minh",cho-thue-nha-tro-phong-tro
Phòng studio ban công tách bếp rộng 40m2 ra vào vân tay bảo an ninh 24/24,6 triệu/tháng,40 m²,"Bình Thạnh, Hồ Chí Minh",cho-thue-nha-tro-phong-tro
"Phòng studio Full nội thất tách bếp có ban công thoáng mát, thang máy hầm xe, an ninh 24/24","8,3 triệu/tháng",45 m²,"Bình Thạnh, Hồ Chí Minh",cho-thue-nha-tro-phong-tro
Khai trương chuỗi phòng có gác mới tinh 100% gần ĐH Văn Lang full nội thất,5 triệu/tháng,40 m²,"Bình Thạnh, Hồ Chí Minh",cho-thue-nha-tro-phong-tro
"Phòng studio full nội thất Có máy giặt Riêng, Thang máy hầm xe, gần công viên Gia định","7,3 triệu/tháng",40 m²,"Phú Nhuận, Hồ Chí Minh",cho-thue-nha-tro-phong-tro
Cho thuê căn hộ DV full nội thất 30m2 Ung Văn Khiêm đặc biệt gần ĐH Hutech,"6,6 triệu/tháng",30 m²,"Bình Thạnh, Hồ Chí Minh",cho-thue-nha-tro-phong-tro
"Khai trương studio, ưu đãi cuối năm, mới 100%, sân bay Tân Sơn Nhất","7,5 triệu/tháng",39 m²,"Tân Bình, Hồ Chí Minh",cho-thue-nha-tro-phong-tro
"Bùi Huy Bích Q. 8, dạng phòng có gác, full nội thất","4,4 triệu/tháng",25 m²,"Quận 8, Hồ Chí Minh",cho-thue-nha-tro-phong-tro
"Phòng studio có ban công, full nội thất máy giặt riêng, an ninh 24/24 ra vào vân tay","6,3 triệu/tháng",35 m²,"Phú Nhuận, Hồ Chí Minh",cho-thue-nha-tro-phong-tro
"Cho thuê, căn hộ dịch vụ, bancol siêu rộng, Phạm Văn Chiêu","3,5 triệu/tháng",27 m²,"Gò Vấp, Hồ Chí Minh",cho-thue-nha-tro-phong-tro
