Title,Price,Area,Location,type
"Cho thuê kho xưởng diện tích đa dạng gần vòng xoay Tân An, ĐT 833 thuộc TP. Tân An, tỉnh Long An",40 nghìn/m²,20.000 m²,"Tân An, Long An",cho-thue-kho-nha-xuong-dat
Cho thuê kho xưởng 1000m2 tại KCN Hiệp Phước,80 nghìn/m²,1.000 m²,"Nhà Bè, Hồ Chí Minh",cho-thue-kho-nha-xuong-dat
"Cho thuê kho đường Liên Phường, Phú Hữu, Quận 9",15 triệu/tháng,350 m²,"Thủ Đức, Hồ Chí Minh",cho-thue-kho-nha-xuong-dat
"Cho thuê kho xưởng kết hợp làm văn phòng tại tổ 60 Tân Mai, diện tích 250m2, giá 25tr/tháng",25 triệu/tháng,250 m²,"Hoàng Mai, Hà Nội",cho-thue-kho-nha-xuong-dat
Cho thuê xưởng sản xuất tại Hải Phòng - Liên hệ: 0862 828 ***,Giá thỏa thuận,2.600 m²,"Kiến An, Hải Phòng",cho-thue-kho-nha-xuong-dat
Cho thuê mặt bằng diện tích 1100m2 tại đường Hải Sơn - Tân Đức,60 triệu/tháng,1.100 m²,"Đức Hòa, Long An",cho-thue-kho-nha-xuong-dat
"Kho xưởng cho thuê giá rẻ, quận Tân Bình, DT: 700m2 / 900m2 / 1.000m2 / 2.000m2 / 4.000m2",54 triệu/tháng,900 m²,"Tân Bình, Hồ Chí Minh",cho-thue-kho-nha-xuong-dat
"Nhà xưởng cho thuê Bình Mỹ Củ Chi, gần quận 12, Hóc Môn, DT: 2.000m2, giá 40tr/th",40 triệu/tháng,2.000 m²,"Củ Chi, Hồ Chí Minh",cho-thue-kho-nha-xuong-dat
"Kho xưởng cho thuê Quận 12, DT: 6000m2, giá 270tr/th",270 triệu/tháng,6.000 m²,"Quận 12, Hồ Chí Minh",cho-thue-kho-nha-xuong-dat
"Cho thuê kho - xưởng. DT từ: 500m2, 1000m2, 1500m2, 2000m2, 2500m2, đến 150.000m2 tại Hưng Yên",36 nghìn/m²,150.000 m²,"Văn Lâm, Hưng Yên",cho-thue-kho-nha-xuong-dat
"Kho xưởng cho thuê tại khu công nghiệp, Tân Bình, quận Tân Phú, DT: 2.000m2 - 7.000m2",240 triệu/tháng,4.000 m²,"Tân Phú, Hồ Chí Minh",cho-thue-kho-nha-xuong-dat
"Kho xưởng cho thuê phường Đông Hưng Thuận, Quận 12, DT: 300m2",25 triệu/tháng,300 m²,"Quận 12, Hồ Chí Minh",cho-thue-kho-nha-xuong-dat
"Nhà xưởng cho thuê khu công nghiệp Xuyên Á, Hoàng Gia, Đức Hoà, Long An, DT: 4,800m2",147 triệu/tháng,4.800 m²,"Đức Hòa, Long An",cho-thue-kho-nha-xuong-dat
Kho xưởng cho thuê giá rẻ quận 12 thành phố Hồ Chí Minh diện tích đa dạng,40 triệu/tháng,600 m²,"Quận 12, Hồ Chí Minh",cho-thue-kho-nha-xuong-dat
"Kho xưởng cho thuê gần ngã tư 550, Thuận An, Bình Dương, DT: 1.200m2",65 triệu/tháng,1.200 m²,"Thuận An, Bình Dương",cho-thue-kho-nha-xuong-dat
"Kho xưởng cho thuê Tỉnh Lộ 15, Tân Quy, Củ Chi, DT: 7.000m2",175 triệu/tháng,7.000 m²,"Củ Chi, Hồ Chí Minh",cho-thue-kho-nha-xuong-dat
Kho xưởng cho thuê quận 12 tại thành phố Hồ Chí Minh,45 triệu/tháng,1.000 m²,"Quận 12, Hồ Chí Minh",cho-thue-kho-nha-xuong-dat
"Kho xưởng cho thuê gần An Sương, Quận 12, DT: 2.000m2, 3.000m2, 5.000m2, có PCCC",170 triệu/tháng,2.000 m²,"Quận 12, Hồ Chí Minh",cho-thue-kho-nha-xuong-dat
"Kho xưởng cho thuê Lê Thị Riêng, Thới An, Quận 12, DT: 600m2, giá 25tr/th",25 triệu/tháng,600 m²,"Quận 12, Hồ Chí Minh",cho-thue-kho-nha-xuong-dat
"Kho xưởng cho thuê đường Lê Văn Khương, Hiệp Thành, Quận 12, DT: 300m2, giá 15tr/th",15 triệu/tháng,300 m²,"Quận 12, Hồ Chí Minh",cho-thue-kho-nha-xuong-dat
"Giỏ hàng kho xưởng Nhà Bè, đang trống",45 nghìn/m²,1.300 m²,"Nhà Bè, Hồ Chí Minh",cho-thue-kho-nha-xuong-dat
Cho thuê kho DT từ 100 - 200 - 5000m2 - 0912 666 ***,Giá thỏa thuận,1.000 m²,"Hà Đông, Hà Nội",cho-thue-kho-nha-xuong-dat
"CĐT cho thuê kho xưởng 200 - 500 - 5000m2 Hoài Đức, Kho hoàn toàn mới, đẹp và chất lượng cao",Giá thỏa thuận,5.000 m²,"Hoài Đức, Hà Nội",cho-thue-kho-nha-xuong-dat
"Cho thuê kho xưởng 550m2, 800m2 và 1000m2 ở Bình Chánh",45 triệu/tháng,800 m²,"Bình Chánh, Hồ Chí Minh",cho-thue-kho-nha-xuong-dat
"Cho thuê kho xưởng 200m2, 500m2 và 1100m2 ở Quận 8",55 triệu/tháng,500 m²,"Quận 8, Hồ Chí Minh",cho-thue-kho-nha-xuong-dat
"Cho thuê kho xưởng 318m2, 550m2 và 1000m2 ở Quận 8",25 triệu/tháng,318 m²,"Quận 8, Hồ Chí Minh",cho-thue-kho-nha-xuong-dat
"Cho thuê kho xưởng mặt bằng kinh doanh 360m2, 500m2 và 1000m2 ở Nhà Bè",26 triệu/tháng,360 m²,"Nhà Bè, Hồ Chí Minh",cho-thue-kho-nha-xuong-dat
"Cho thuê kho xưởng 300m2, 600m2 và 1500m2 ở Q7",25 triệu/tháng,300 m²,"Quận 7, Hồ Chí Minh",cho-thue-kho-nha-xuong-dat
"Xưởng 6600m2 VP 1000m2, PCCC tự động điện 400kva, SX nhiều ngành nghề. Giấy tờ đầy đủ đường cont",560 triệu/tháng,7.600 m²,"Thuận An, Bình Dương",cho-thue-kho-nha-xuong-dat
Cho thuê kho cont cập cửa P14 - Gvấp - y hình,70 triệu/tháng,700 m²,"Gò Vấp, Hồ Chí Minh",cho-thue-kho-nha-xuong-dat
Cho thuê kho Nguyễn Thị Tú - 60 ngàn/m2 - cont cập cửa,60 nghìn/m²,500 m²,"Bình Tân, Hồ Chí Minh",cho-thue-kho-nha-xuong-dat
Cho thuê kho Ngọc Hồi DT 1000m2 xe công đỗ cửa giá 75k/m2 LH 0982 727 ***,75 nghìn/m²,1.000 m²,"Thanh Trì, Hà Nội",cho-thue-kho-nha-xuong-dat
"Kho từ 200m2, KCN Tân Bình - kho dựng - giá rẻ. Container cập cửa",100 nghìn/m²,300 m²,"Tân Phú, Hồ Chí Minh",cho-thue-kho-nha-xuong-dat
Còn trống 250m2 kho có văn phòng. Y hình - KCNTB,Giá thỏa thuận,250 m²,"Tân Phú, Hồ Chí Minh",cho-thue-kho-nha-xuong-dat
Cho thuê 400m2 sử dụng - đường tải 8T - chỉ 20tr/tháng,20 triệu/tháng,400 m²,"Bình Tân, Hồ Chí Minh",cho-thue-kho-nha-xuong-dat
Cho thuê kho 500m2 Phan Trọng Tuệ xe công đỗ cửa giá 80k/m2 LH 0982 727 ***,40 triệu/tháng,500 m²,"Thanh Trì, Hà Nội",cho-thue-kho-nha-xuong-dat
"Cho thuê kho Trần Điền 170m2 xe 5 tấn đỗ, giá 16 triệu/tháng, LH 0982 727 ***",16 triệu/tháng,170 m²,"Hoàng Mai, Hà Nội",cho-thue-kho-nha-xuong-dat
Cho thuê kho Linh Đàm 120m2 xe công đỗ cửa giá 115k/m2/th LH 0982 727 ***,"13,8 triệu/tháng",120 m²,"Hoàng Mai, Hà Nội",cho-thue-kho-nha-xuong-dat
Cho thuê kho Ngọc Hồi 1300m2 giá 75k/m2 xe công đỗ cửa LH 0982 727 ***,"97,5 triệu/tháng",1.300 m²,"Thanh Trì, Hà Nội",cho-thue-kho-nha-xuong-dat
Cho thuê kho Trần Điền 300m2 xe 5 tấn đỗ cửa giá 22tr LH 0982 727 ***,22 triệu/tháng,300 m²,"Hoàng Mai, Hà Nội",cho-thue-kho-nha-xuong-dat
Xưởng 2500m2 giá 120 triệu Khánh Bình Tân Uyên SX đa ngành nghề pccc vách tường điện 250kva,120 triệu/tháng,2.500 m²,"Tân Uyên, Bình Dương",cho-thue-kho-nha-xuong-dat
"654. Cho thuê kho xưởng KCN Tân Đức, Đức Hòa, Long An - Giá siêu rẻ - DT đa dạng",51 nghìn/m²,30.000 m²,"Đức Hòa, Long An",cho-thue-kho-nha-xuong-dat
Cho thuê kho 620m2 mặt tiền Nguyễn Văn Linh có điện 3 pha,28 triệu/tháng,620 m²,"Bình Thủy, Cần Thơ",cho-thue-kho-nha-xuong-dat
Cho thuê 2 kho mới gần xe Ford có PCCC và điện 3 pha,65 triệu/tháng,1.000 m²,"Cái Răng, Cần Thơ",cho-thue-kho-nha-xuong-dat
Cho thuê kho mặt tiền 440 m2 kế chợ Cái Răng,25 triệu/tháng,440 m²,"Cái Răng, Cần Thơ",cho-thue-kho-nha-xuong-dat
Cho thuê kho 800 m2 mới xây gần cầu Cần Thơ,50 triệu/tháng,800 m²,"Cái Răng, Cần Thơ",cho-thue-kho-nha-xuong-dat
Cho thuê kho 3 kho mới xây mặt tiền Nguyễn Văn Linh,25 triệu/tháng,400 m²,"Bình Thủy, Cần Thơ",cho-thue-kho-nha-xuong-dat
Cho thuê kho 4.000 m2 mặt tiền Quốc lộ 1A có điện 3 pha,120 triệu/tháng,4.000 m²,"Cái Răng, Cần Thơ",cho-thue-kho-nha-xuong-dat
Cho thuê Kho 6.000 m2 mặt tiền Quốc Lộ 1A có điện 3 pha,180 triệu/tháng,6.000 m²,"Châu Thành A, Hậu Giang",cho-thue-kho-nha-xuong-dat
Cho thuê nhà ngang 9m mặt tiền Nguyễn Văn Cừ 35 triệu,35 triệu/tháng,350 m²,"Ninh Kiều, Cần Thơ",cho-thue-kho-nha-xuong-dat
Cho thuê đất 108 m2 mặt tiền đường Nguyễn Văn Cừ 8 triệu,8 triệu/tháng,108 m²,"Ninh Kiều, Cần Thơ",cho-thue-kho-nha-xuong-dat
Cho thuê nhà xưởng khu vực Tân Uyên Bình Dương,"55,65 nghìn/m²",9.000 m²,"Tân Uyên, Bình Dương",cho-thue-kho-nha-xuong-dat
Cho thuê kho xưởng gần cầu Đồng Nai thuộc Dĩ An Bình Dương,140 triệu/tháng,3.000 m²,"Dĩ An, Bình Dương",cho-thue-kho-nha-xuong-dat
"Cho thuê nhà xưởng trong cụm công nghiệp Phước Bình, Long Thành Đồng nai",45 nghìn/m²,2.800 m²,"Long Thành, Đồng Nai",cho-thue-kho-nha-xuong-dat
"Cho thuê nhà xưởng Đất Cuốc, Huyện Bắc Tân Uyên Bình Dương",59 nghìn/m²,20.000 m²,"Bắc Tân Uyên, Bình Dương",cho-thue-kho-nha-xuong-dat
