Title,Price,Area,Location,type
Cho thuê kho xưởng tại Hưng Yên - Khu CN Yên Mỹ- Hưng Yên,"93,52 nghìn/m²",12.000 m²,"Yên Mỹ, Hưng Yên",cho-thue-kho-nha-xuong-dat
Cho thuê kho xưởng đẹp tại Hưng Yên - Thị xã Mỹ Hào - Hưng Yên,93 nghìn/m²,2.000 m²,"Mỹ Hào, Hưng Yên",cho-thue-kho-nha-xuong-dat
Đất cho thuê mặt tiền đường Hồ Chí Minh,Giá thỏa thuận,5.000 m²,"Chơn Thành, Bình Phước",cho-thue-kho-nha-xuong-dat
Cho thuê kho tại Đức Giang - p Đức Giang- Long Biên,70 nghìn/m²,250 m²,"Long Biên, Hà Nội",cho-thue-kho-nha-xuong-dat
Cho thuê kho tại Yên Viên - Thị trấn Yên Viên - Gia Lâm,55 nghìn/m²,400 m²,"Gia Lâm, Hà Nội",cho-thue-kho-nha-xuong-dat
Cho thuê kho rẻ tại Gia Lâm - Xã Kiên Thành- Gia Lâm,25 nghìn/m²,2.500 m²,"Gia Lâm, Hà Nội",cho-thue-kho-nha-xuong-dat
Cho thuê kho tại Yên Viên - Xã Yên Viên- Gia Lâm,55 nghìn/m²,600 m²,"Gia Lâm, Hà Nội",cho-thue-kho-nha-xuong-dat
Cho thuê kho xưởng đẹp tại Gia Lâm - Xã Ninh Hiệp- Gia Lâm,Giá thỏa thuận,1.500 m²,"Gia Lâm, Hà Nội",cho-thue-kho-nha-xuong-dat
Cho thuê kho nhỏ rẻ tại Phù Đổng - Xã Phù Đổng- Gia Lâm,"6,5 triệu/tháng",100 m²,"Gia Lâm, Hà Nội",cho-thue-kho-nha-xuong-dat
"Cho thuê đất 500m2 nở hậu, free 1 tháng giá chỉ 80 triệu, gần Xuân Thủy",80 triệu/tháng,500 m²,"Quận 2, Hồ Chí Minh",cho-thue-kho-nha-xuong-dat
Cho thuê mặt bằng cấp 4 giá còn 22 triệu được làm kho nhẹ hoặc văn phòng 150m2 - đường 11,22 triệu/tháng,100 m²,"Quận 2, Hồ Chí Minh",cho-thue-kho-nha-xuong-dat
Cho thuê mặt bằng kho sạch sẽ 150m2 giá chỉ còn 22 triệu mới 100% - đường 10,22 triệu/tháng,150 m²,"Quận 2, Hồ Chí Minh",cho-thue-kho-nha-xuong-dat
Cho thuê mặt bằng kho hiện kinh doanh gạch 144m2 giá 23 triệu,23 triệu/tháng,144 m²,"Quận 2, Hồ Chí Minh",cho-thue-kho-nha-xuong-dat
"Cho thuê nhà tiền chế làm kho, có thể đăng ký điện 3 pha 80m2 giá 15 triệu",15 triệu/tháng,80 m²,"Quận 2, Hồ Chí Minh",cho-thue-kho-nha-xuong-dat
Cho thuê mặt bằng kho tiền chế 90m2 đường Trương Văn Bang - 14 triệu,14 triệu/tháng,90 m²,"Quận 2, Hồ Chí Minh",cho-thue-kho-nha-xuong-dat
"Cho thuê kho tiền chế, đường ô tô qua lại 90m2 giá 14 triệu - BTĐ",14 triệu/tháng,90 m²,"Quận 2, Hồ Chí Minh",cho-thue-kho-nha-xuong-dat
"Cho thuê kho sân trước rộng, đường xe tải DT: 6x30 giá 28 triệu",28 triệu/tháng,180 m²,"Quận 2, Hồ Chí Minh",cho-thue-kho-nha-xuong-dat
"Cho thuê mặt bằng ngang 8 mét, sân trước rộng giá 32 triệu - có thể làm kho",32 triệu/tháng,160 m²,"Quận 2, Hồ Chí Minh",cho-thue-kho-nha-xuong-dat
"Cho thuê kho đẹp Tô Ngọc Vân, P. Tam Phú 1T1L có thang nâng hàng (có sẵn máy may nếu dùng)",35 triệu/tháng,400 m²,"Thủ Đức, Hồ Chí Minh",cho-thue-kho-nha-xuong-dat
Cho thuê kho xưởng khu vực Nguyễn Xiển đường Vành Đai 3 Hà Nội,Giá thỏa thuận,500 m²,"Thanh Xuân, Hà Nội",cho-thue-kho-nha-xuong-dat
"Cho thuê đất góc 2MT Bưng Ông Thoàn, P. Phú Hữu, Q9",50 triệu/tháng,2.500 m²,"Quận 9, Hồ Chí Minh",cho-thue-kho-nha-xuong-dat
"Kho xưởng cho thuê 560m2, giá chỉ 12tr/th",12 triệu/tháng,560 m²,"Tân Uyên, Bình Dương",cho-thue-kho-nha-xuong-dat
"Xưởng may 3000m2 cho thuê quận 12, giá 110 triệu/tháng",110 triệu/tháng,3.000 m²,"Quận 12, Hồ Chí Minh",cho-thue-kho-nha-xuong-dat
"Xưởng cho thuê 800m2, cầu Sắt Sập, đường Thới An 16, Q.12",29 triệu/tháng,800 m²,"Quận 12, Hồ Chí Minh",cho-thue-kho-nha-xuong-dat
"Cho thuê kho xưởng giá rẻ Quận 12 300m2, 500m2, 800m2, 1000m2, 2000m2, 5000m2",65 triệu/tháng,1.100 m²,"Quận 12, Hồ Chí Minh",cho-thue-kho-nha-xuong-dat
"Cho thuê kho xưởng giá rẻ Quận 12 300m2, 500m2, 800m2, 1000m2, 2000m2, 5000m2",25 triệu/tháng,600 m²,"Quận 12, Hồ Chí Minh",cho-thue-kho-nha-xuong-dat
2.797m2 Xưởng khu công nghệ cao Thủ Đức,100 nghìn/m²,2.797 m²,"Thủ Đức, Hồ Chí Minh",cho-thue-kho-nha-xuong-dat
"Cho thuê xưởng 2700m2 Bắc Sơn, Trảng Bom, Đồng Nai. Giá 60tr/tháng",60 triệu/tháng,2.700 m²,"Trảng Bom, Đồng Nai",cho-thue-kho-nha-xuong-dat
"Cho thuê kho xưởng DT 1000m² mặt tiền đường Đào Trí, Q7, giá 90tr/th - LH: 0918 278 ***",90 triệu/tháng,1.000 m²,"Quận 7, Hồ Chí Minh",cho-thue-kho-nha-xuong-dat
"Cho thuê 300m2 kho trống suốt sạch sẽ, Quốc Lộ 13 Hiệp Bình Phước Thủ Đức giá 24tr",24 triệu/tháng,300 m²,"Thủ Đức, Hồ Chí Minh",cho-thue-kho-nha-xuong-dat
"Cho thuê xưởng 1000m2 Trảng Dài, Biên Hòa. Gần đường Đồng Khởi. Có PCCC",30 triệu/tháng,1.000 m²,"Biên Hòa, Đồng Nai",cho-thue-kho-nha-xuong-dat
Cần cho thuê nhà xưởng mới xây trên khu đất 1ha đẹp nhất KCN Hựu Thạnh,72 nghìn/m²,7.000 m²,"Đức Hòa, Long An",cho-thue-kho-nha-xuong-dat
Cần cho thuê gấp mặt bằng 25x30 mặt tiền Lê Văn Lương giá 70tr/tháng vị trí cực đẹp để kinh doanh,70 triệu/tháng,750 m²,"Quận 7, Hồ Chí Minh",cho-thue-kho-nha-xuong-dat
Cho thuê đất Bùi Trang Chước 430m2,15 triệu/tháng,430 m²,"Cẩm Lệ, Đà Nẵng",cho-thue-kho-nha-xuong-dat
"Cho thuê kho 160m2, gần cầu Long Biên",13 triệu/tháng,160 m²,"Long Biên, Hà Nội",cho-thue-kho-nha-xuong-dat
Cho thuê đất Hoà Xuân 300m2 cách cầu Hoà Xuân 500m,10 triệu/tháng,300 m²,"Cẩm Lệ, Đà Nẵng",cho-thue-kho-nha-xuong-dat
"Cho thuê đất 600m2 góc 3MT TVB vị trí số 1 KD, 300 - 600m2 đg 20m, Có đất dài hạn",15 triệu/tháng,300 m²,"Quận 2, Hồ Chí Minh",cho-thue-kho-nha-xuong-dat
"Cho thuê nhà máy - cơ hội đầu tư tại Phú Xuyên, Hà Nội. LH 0906 218 ***",500 triệu/tháng,28.300 m²,"Phú Xuyên, Hà Nội",cho-thue-kho-nha-xuong-dat
"Cho thuê kho xưởng, nhà máy sản xuất gần đường Chu Huy Mân, Long Biên, LH: 0906 218 ***","1,8 tỷ/tháng",30.000 m²,"Long Biên, Hà Nội",cho-thue-kho-nha-xuong-dat
"Chính chủ cho thuê kho xưởng tại 544 Phúc Diễn - Xuân Phương, S 200m2, 13 tr/th 0902 111 ***",13 triệu/tháng,200 m²,"Nam Từ Liêm, Hà Nội",cho-thue-kho-nha-xuong-dat
"Cho thuê kho 6000m2 - Thủ Đức. (115k/m2) - PCCC tự động, cont 24/24",115 nghìn/m²,6.000 m²,"Thủ Đức, Hồ Chí Minh",cho-thue-kho-nha-xuong-dat
Chuyên cho thuê kho xưởng theo yêu cầu khách hàng khu Nam Sai Gon,15 triệu/tháng,200 m²,"Nhà Bè, Hồ Chí Minh",cho-thue-kho-nha-xuong-dat
Cho thuê kho mặt tiền Phạm Hữu Lầu giá rẻ 280m2 giá 13tr/th,13 triệu/tháng,280 m²,"Nhà Bè, Hồ Chí Minh",cho-thue-kho-nha-xuong-dat
Chuyên cho thuê kho xưởng theo yêu cầu khách hàng khu Nam Sai Gòn,12 triệu/tháng,250 m²,"Nhà Bè, Hồ Chí Minh",cho-thue-kho-nha-xuong-dat
Cho thuê kho xưởng 820/6 QL1A DT: 850m2. 40tr/1 tháng. DT: 19*45m,40 triệu/tháng,850 m²,"Bình Tân, Hồ Chí Minh",cho-thue-kho-nha-xuong-dat
"Cho thuê xưởng 2100m2. Điện 560kva. Sản xuất 24/ 24 đều ok. Tân Phước Khánh, Tân Uyên, Bình Dương",75 triệu/tháng,2.100 m²,"Tân Uyên, Bình Dương",cho-thue-kho-nha-xuong-dat
Kho cho thuê 600m2 Hoàng Ngân P16 Q8,50 triệu/tháng,600 m²,"Quận 8, Hồ Chí Minh",cho-thue-kho-nha-xuong-dat
"Cho thuê kho xưởng tại Đông Anh DT: 300m2; 500m2; 1,050 m2 giá rẻ. Cách TT Hà Nội 15 phút lái xe CC",38 nghìn/m²,950 m²,"Đông Anh, Hà Nội",cho-thue-kho-nha-xuong-dat
"Chính chủ cho thuê đất xây dựng nhà xưởng DT: 100m2, 300m2, 500m2, 2500m2 cách cầu Nhật Tân 4,5km","6,5 triệu/tháng",2.500 m²,"Đông Anh, Hà Nội",cho-thue-kho-nha-xuong-dat
