Title,Price,Area,Location,type
Phòng trọ ngay sân bay - đủ nội thất - có cửa sổ thoáng,"4,2 triệu/tháng",25 m²,"Tân Bình, Hồ Chí Minh",cho-thue-nha-tro-phong-tro
Cho thuê phòng có gác gần ĐH Văn Lang full nội thất,"6,5 triệu/tháng",40 m²,"Bình Thạnh, Hồ Chí Minh",cho-thue-nha-tro-phong-tro
Cho thuê phòng có nội thất cửa sổ lớn full nội thất ngay Đh Luật Quận 4 cầu Calmette Q1,"7,5 triệu/tháng",35 m²,"Quận 4, Hồ Chí Minh",cho-thue-nha-tro-phong-tro
"Studio mới cứng, ban công rộng, full nội thất, dọn vào ở liền, giá hợp lý ưu đãi khách ở lâu dài",6 triệu/tháng,30 m²,"Tân Bình, Hồ Chí Minh",cho-thue-nha-tro-phong-tro
"Studio ban công cao cấp, 40m đầy đủ nội thất chỉ cần xách vali vào ở, ưu đãi mạnh khách dài hạn","5,5 triệu/tháng",40 m²,"Tân Bình, Hồ Chí Minh",cho-thue-nha-tro-phong-tro
Cho thuê phòng cửa sổ lớn có nội thất Trần Hưng Đạo đại học Văn Lang Q1,7 triệu/tháng,35 m²,"Quận 1, Hồ Chí Minh",cho-thue-nha-tro-phong-tro
Cho thuê phòng ban công gần ĐH Văn Lang full nội thất,"6,5 triệu/tháng",35 m²,"Bình Thạnh, Hồ Chí Minh",cho-thue-nha-tro-phong-tro
Cho thuê phòng có máy giặt riêng có nội thất Nguyễn Thái Bình Cầu Ông Lãnh Q1,"7,5 triệu/tháng",35 m²,"Quận 1, Hồ Chí Minh",cho-thue-nha-tro-phong-tro
"New,100% studio 30m2, nội thất cao cấp,giá 6tr-8tr,máy giặt riêng,thang máy, ưu đãi khách dài hạn",6 triệu/tháng,30 m²,"Tân Bình, Hồ Chí Minh",cho-thue-nha-tro-phong-tro
"Khai trương căn hộ mới,studio 30m2,ngay gần sân bay Tân Sơn Nhất,phường 2,ưu đãi mạnh khách dài hạn",6 triệu/tháng,30 m²,"Tân Bình, Hồ Chí Minh",cho-thue-nha-tro-phong-tro
"Khai trương căn hộ mới,studio 30m2,ngay gần cầu vượt Lăng Cha Cả,phường 4,ưu đãi mạnh khách dài hạn",6 triệu/tháng,40 m²,"Tân Bình, Hồ Chí Minh",cho-thue-nha-tro-phong-tro
"New,100% studio 40m2,nội thất cao cấp,giá 6tr5-8tr, máy giặt riêng,thang máy,ưu đãi khách dài hạn",6 triệu/tháng,30 m²,"Tân Bình, Hồ Chí Minh",cho-thue-nha-tro-phong-tro
"Studio cửa sổ 30m2,đầy đủ nội thất, khu vực yên tĩnh,giá ưu đãi mạnh cho khách dài hạn và thiện chí",6 triệu/tháng,30 m²,"Tân Bình, Hồ Chí Minh",cho-thue-nha-tro-phong-tro
"Khai trương căn hộ mới, studio 30m2,ngay sân bay Tân Sơn Nhất,phường 2, ưu đãi mạnh khách dài hạn",7 triệu/tháng,35 m²,"Tân Bình, Hồ Chí Minh",cho-thue-nha-tro-phong-tro
"Phòng tiện nghi đường Đặng Văn Bi, giá từ 3tr5","3,5 triệu/tháng",30 m²,"Thủ Đức, Hồ Chí Minh",cho-thue-nha-tro-phong-tro
"Trần Quốc Thảo, Q3 - ban công - máy giặt riêng",7 triệu/tháng,30 m²,"Quận 3, Hồ Chí Minh",cho-thue-nha-tro-phong-tro
"New,100% studio 40m2, nội thất cao cấp, giá 6tr5-8tr, máy giặt riêng,thang máy,ưu đãi khách dài hạn",7 triệu/tháng,45 m²,"Tân Bình, Hồ Chí Minh",cho-thue-nha-tro-phong-tro
"Ký túc xá tiện nghi đường Đặng Văn Bi, giá 1tr3","1,3 triệu/tháng",30 m²,"Thủ Đức, Hồ Chí Minh",cho-thue-nha-tro-phong-tro
"Cho thuê phòng có nội thất, có cửa sổ thoáng gần cầu Kênh Tẻ, cầu Tân Thuận",6 triệu/tháng,32 m²,"Quận 4, Hồ Chí Minh",cho-thue-nha-tro-phong-tro
"Phòng ban công, tách bếp, máy giặt riêng, nội thất cao cấp, thang máy, ngay ngã tư Bảy Hiền giá tốt",6 triệu/tháng,45 m²,"Tân Bình, Hồ Chí Minh",cho-thue-nha-tro-phong-tro
Cho thuê căn hộ 1PN ngay sân bay công viên gia định - công viên Hoàng Văn Thụ - gần đại học Huflit,7 triệu/tháng,30 m²,"Tân Bình, Hồ Chí Minh",cho-thue-nha-tro-phong-tro
"Khai trương new,100%,studio 40m2,nội thất cao cấp, máy giặt riêng,bãi xe hơi gần,giá ưu đãi mạnh!","7,5 triệu/tháng",40 m²,"Tân Bình, Hồ Chí Minh",cho-thue-nha-tro-phong-tro
"Phòng Nguyễn Văn Thương gần Landmark 81, Vinhomes, sân golf Him Lam, The Manor Phường 25 Bình Thạnh",8 triệu/tháng,40 m²,"Bình Thạnh, Hồ Chí Minh",cho-thue-nha-tro-phong-tro
"Khai trương tòa nhà Trần Quốc Thảo dạng studio, 1PN gần hồ Con Rùa, Terra Royal, Võ Thị Sáu Quận 3","6,5 triệu/tháng",35 m²,"Quận 3, Hồ Chí Minh",cho-thue-nha-tro-phong-tro
"Ban công - Lê Văn Lương Q7 sát cầu Kênh Tẻ, Thuận Tiện Q4","3,5 triệu/tháng",20 m²,"Quận 7, Hồ Chí Minh",cho-thue-nha-tro-phong-tro
"Phòng trọ ban công full NT gần Nguyễn Văn Đậu, đại học Văn Lang","7,5 triệu/tháng",35 m²,"Bình Thạnh, Hồ Chí Minh",cho-thue-nha-tro-phong-tro
"New,100% studio mới xây,nội thất cao cấp,gần sân bay Tân Sơn Nhất,giá ưu đãi mạnh cho khách dài hạn","7,8 triệu/tháng",40 m²,"Tân Bình, Hồ Chí Minh",cho-thue-nha-tro-phong-tro
Căn hộ studio Tân Bình có thang máy đường Hồng Hà P. 2 Q. Tân Bình,6 triệu/tháng,32 m²,"Tân Bình, Hồ Chí Minh",cho-thue-nha-tro-phong-tro
"Cho thuê phòng đường Trần Hưng Đạo đối diện Bùi Viện, gần chợ Bến Thành, Phạm Ngũ Lão - ban công","6,7 triệu/tháng",36 m²,"Quận 1, Hồ Chí Minh",cho-thue-nha-tro-phong-tro
"Nguyễn Thái Bình Q1, khai trương căn hộ mới xây 100%, nhận đợt khách đầu tiên","10,5 triệu/tháng",40 m²,"Quận 1, Hồ Chí Minh",cho-thue-nha-tro-phong-tro
"Trần Quốc Thảo, Q3 - ban công - máy giặt riêng",7 triệu/tháng,30 m²,"Quận 3, Hồ Chí Minh",cho-thue-nha-tro-phong-tro
Đường Nguyễn Duy Q8 - gần cầu Nguyễn Tri Phương - xịn xò con bò,"6,2 triệu/tháng",30 m²,"Quận 8, Hồ Chí Minh",cho-thue-nha-tro-phong-tro
"Phòng trọ giá rẻ, cửa sổ thoáng, mới 100% đường Lê Đức Thọ",3 triệu/tháng,28 m²,"Gò Vấp, Hồ Chí Minh",cho-thue-nha-tro-phong-tro
Phòng trọ gác cao - Bancol rộng gần sân golf TSN,3 triệu/tháng,30 m²,"Tân Bình, Hồ Chí Minh",cho-thue-nha-tro-phong-tro
Cho thuê phòng trọ cao cấp full nội thất gần công viên Làng Hoa - nhà thiếu nhi Gò Vấp,4 triệu/tháng,30 m²,"Gò Vấp, Hồ Chí Minh",cho-thue-nha-tro-phong-tro
"Giảm giá tháng 7 căn KDC Him Lam, full nội thất, máy giặt riêng, gần Lotte, TĐTU chỉ từ 4tr5/th",5 triệu/tháng,35 m²,"Quận 7, Hồ Chí Minh",cho-thue-nha-tro-phong-tro
"Phòng trọ cửa sổ full NT gần chợ Bà Chiểu, Phan Đăng Lưu, Nguyễn Văn Đậu","6,5 triệu/tháng",25 m²,"Phú Nhuận, Hồ Chí Minh",cho-thue-nha-tro-phong-tro
Thuê căn hộ Gò Vấp dạng 1PN/studio tách bếp mới 100% chưa bóc seal gần công viên Làng Hoa,"5,8 triệu/tháng",35 m²,"Gò Vấp, Hồ Chí Minh",cho-thue-nha-tro-phong-tro
"Studio cửa sổ 30m2 đầy đủ nội thất khu vực yên tĩnh, giá ưu đãi mạnh cho khách dài hạn và thiện chí","5,5 triệu/tháng",30 m²,"Tân Bình, Hồ Chí Minh",cho-thue-nha-tro-phong-tro
"Chính chủ cho thuê 02 phòng tại tầng 4 nhà số 12B ngõ 3 phố Ao Sen, Hà Đông",Giá thỏa thuận,15 m²,"Hà Đông, Hà Nội",cho-thue-nha-tro-phong-tro
"Studio 40m2 ban công lớn thang máy, đầy đủ nội thất, giá ưu đãi mạnh cho khách thiện chí và lâu dài","5,6 triệu/tháng",40 m²,"Tân Bình, Hồ Chí Minh",cho-thue-nha-tro-phong-tro
"New 100% studio 40m2 nội thất cao cấp, giá 6tr5-8tr, máy giặt riêng thang máy, ưu đãi khách dài hạn",6 triệu/tháng,40 m²,"Tân Bình, Hồ Chí Minh",cho-thue-nha-tro-phong-tro
CHDV 100% chưa sử dụng gần ngay sân bay full nội thất,8 triệu/tháng,45 m²,"Tân Bình, Hồ Chí Minh",cho-thue-nha-tro-phong-tro
"Phòng ban công, tách bếp, máy giặt riêng, nội thất cao cấp, thang máy, ngay sân bay giá tốt","8,3 triệu/tháng",45 m²,"Tân Bình, Hồ Chí Minh",cho-thue-nha-tro-phong-tro
"Cho thuê 1 phòng cửa sổ - đường Hoàng Diệu, Phú Nhuận","7,5 triệu/tháng",39 m²,"Phú Nhuận, Hồ Chí Minh",cho-thue-nha-tro-phong-tro
"Cho thuê phòng, Võ Thị Sáu, Quận 3, gần Phạm Ngọc Thạch, hồ Con Rùa","8,5 triệu/tháng",40 m²,"Quận 3, Hồ Chí Minh",cho-thue-nha-tro-phong-tro
"New 100%, studio 40m2, nội thất cao cấp, máy giặt riêng, ưu đãi mạnh cho khách thiện chí và lâu dài","7,8 triệu/tháng",40 m²,"Tân Bình, Hồ Chí Minh",cho-thue-nha-tro-phong-tro
Cho Thuê phòng 40m2 Bancony ngay kế cầu Công Lý thuận tiện di chuyển qua Q3,"6,5 triệu/tháng",35 m²,"Phú Nhuận, Hồ Chí Minh",cho-thue-nha-tro-phong-tro
"Khai trương căn hộ mới, studio 30m2, ngay gần cầu vượt Lăng Cha Cả, P4, ưu đãi mạnh khách dài hạn",6 triệu/tháng,30 m²,"Tân Bình, Hồ Chí Minh",cho-thue-nha-tro-phong-tro
"New 100%, nhà mới xây cao cấp, 40m2, máy giặt riêng, nội thất cao cấp, ưu đãi mạnh khách dài hạn","6,5 triệu/tháng",40 m²,"Tân Bình, Hồ Chí Minh",cho-thue-nha-tro-phong-tro
