Title,Price,Area,Location,type
Khai trương phòng 40m2 cửa sổ ban công rộng thoáng tại Nguyễn Thượng Hiền gần chợ Bà Chiểu,8 triệu/tháng,40 m²,"Bình Thạnh, Hồ Chí Minh",cho-thue-nha-tro-phong-tro
"Cho thuê duplex full nội thất cạnh Lê Văn Việt, khu Công Nghệ Cao, đại học FPT, Vinhome quận 9",4 triệu/tháng,35 m²,"Quận 9, Hồ Chí Minh",cho-thue-nha-tro-phong-tro
Phòng 30m2 full NT tách bếp bancol rộng thoáng tại Bạch Đằng Bình Thạnh,6 triệu/tháng,30 m²,"Bình Thạnh, Hồ Chí Minh",cho-thue-nha-tro-phong-tro
Chính chủ cần cho thuê phòng tại quận 12,"4,5 triệu/tháng",50 m²,"Quận 12, Hồ Chí Minh",cho-thue-nha-tro-phong-tro
Phòng rộng rãi không giới hạn người ở gần sân vận động Phú Thọ,5 triệu/tháng,25 m²,"Quận 10, Hồ Chí Minh",cho-thue-nha-tro-phong-tro
"Cho thuê nhà ở 84 An Dương Vương (gần Cầu Nhật Tân, Lotte Võ Chí Công)","4,5 triệu/tháng",55 m²,"Tây Hồ, Hà Nội",cho-thue-nha-tro-phong-tro
Khai trương căn hộ 1 - 2PN full NT máy giặt riêng tách bếp ngay khu K300 giá sinh viên,5 triệu/tháng,35 m²,"Tân Bình, Hồ Chí Minh",cho-thue-nha-tro-phong-tro
Cho thuê phòng trọ giá sinh viên nam thuê,"2,5 triệu/tháng",18 m²,"Thủ Đức, Hồ Chí Minh",cho-thue-nha-tro-phong-tro
Cho thuê phòng trọ giá sinh viên cho nam,"2,5 triệu/tháng",18 m²,"Thủ Đức, Hồ Chí Minh",cho-thue-nha-tro-phong-tro
"Cho thuê phòng bancol thoáng, NT sang trọng, đầy đủ tiện nghi, ngay phố ẩm thực Phan Xích Long","6,5 triệu/tháng",35 m²,"Phú Nhuận, Hồ Chí Minh",cho-thue-nha-tro-phong-tro
Cho thuê phòng trọ dạng đuplex giá ưu đãi,"2,5 triệu/tháng",19 m²,"Tân Phú, Hồ Chí Minh",cho-thue-nha-tro-phong-tro
Cho thuê phòng trọ cao cấp full nội thất mới 100% KĐT Vạn Phúc City - tách bếp - WC bên ngoài,"5,5 triệu/tháng",30 m²,"Thủ Đức, Hồ Chí Minh",cho-thue-nha-tro-phong-tro
"Cho thuê phòng bancol thoáng, NT sang trọng, đầy đủ tiện nghi, ngay Nguyễn Văn Đậu, Bình Thạnh","5,2 triệu/tháng",30 m²,"Bình Thạnh, Hồ Chí Minh",cho-thue-nha-tro-phong-tro
"Studio full nội thất, ngay Ốc Đào Quận 1","6,5 triệu/tháng",20 m²,"Quận 1, Hồ Chí Minh",cho-thue-nha-tro-phong-tro
Nhà trọ Diệu Thúy cho thuê phòng trọ giá rẻ,600 nghìn/tháng,20 m²,"Nha Trang, Khánh Hòa",cho-thue-nha-tro-phong-tro
Căn hộ dịch vụ mới 100% vừa set up nội thất ngay sân bay Tân Sơn Nhất - khu an ninh yên tĩnh,9 triệu/tháng,40 m²,"Tân Bình, Hồ Chí Minh",cho-thue-nha-tro-phong-tro
"Cho thuê phòng trọ sạch, đẹp giá rẻ",2 triệu/tháng,24 m²,"Bình Tân, Hồ Chí Minh",cho-thue-nha-tro-phong-tro
"Cho thuê phòng bancol thoáng, NT sang trọng, đầy đủ tiện nghi, ngay ngã 6 Cộng Hoà, Phạm Viết Chánh","6,3 triệu/tháng",35 m²,"Quận 1, Hồ Chí Minh",cho-thue-nha-tro-phong-tro
"Phòng trọ mới khai trương 40m2, NT sang trọng, đầy đủ tiện nghi, ngay CV Hoàng Văn Thụ","5,5 triệu/tháng",40 m²,"Tân Bình, Hồ Chí Minh",cho-thue-nha-tro-phong-tro
"Cho thuê phòng bancol to, NT sang trọng, đầy đủ tiện nghi, ngay CV Lê Văn Tám, Nguyễn Đình Chiểu","7,2 triệu/tháng",40 m²,"Quận 1, Hồ Chí Minh",cho-thue-nha-tro-phong-tro
"Căn hộ mini xinh Lê Văn Sỹ - gần nhà thờ Ba Chuông, Quận 3","4,5 triệu/tháng",25 m²,"Quận 3, Hồ Chí Minh",cho-thue-nha-tro-phong-tro
"Cho thuê phòng trọ, giá rẻ tại khu bộ đội, mặt đường 25C, Ấp 3, Phú Thạnh, Nhơn Trạch, Đồng Nai",500 nghìn/tháng,15 m²,"Nhơn Trạch, Đồng Nai",cho-thue-nha-tro-phong-tro
Phòng trọ 2 PN - Hoàng Văn Thụ Tân Bình - sát sân bay TSN - đầy đủ nội thất - phòng thoát mát,9 triệu/tháng,70 m²,"Tân Bình, Hồ Chí Minh",cho-thue-nha-tro-phong-tro
Căn hộ 1 phòng ngủ riêng - Lê Văn Huân Tân Bình - đối diện Etown Cộng Hoà - thang máy ban công,"6,5 triệu/tháng",45 m²,"Tân Bình, Hồ Chí Minh",cho-thue-nha-tro-phong-tro
Căn hộ new 100% - Lê Văn Huân Tân Bình - đối diện Etown Cộng Hoà - toà nhà thang máy đầy đủ nt,"4,5 triệu/tháng",35 m²,"Tân Bình, Hồ Chí Minh",cho-thue-nha-tro-phong-tro
Studio Bình Lợi Bình Thạnh - ban công máy giặt riêng - gần Văn Lang cơ sở 3 - nhà mới nt 100%,6 triệu/tháng,40 m²,"Bình Thạnh, Hồ Chí Minh",cho-thue-nha-tro-phong-tro
Căn hộ DV Bình Thạnh - Nguyễn Văn Thương D1 gần khu Landmark 81 - máy giặt riêng ban công đầy đủ NT,"6,5 triệu/tháng",40 m²,"Bình Thạnh, Hồ Chí Minh",cho-thue-nha-tro-phong-tro
Căn hộ Cộng Hoà Tân Bình - gần Út Tịch Hoàng Văn Thụ - toà nhà thang máy full nội thất,"4,5 triệu/tháng",30 m²,"Tân Bình, Hồ Chí Minh",cho-thue-nha-tro-phong-tro
Căn hộ studio Phan Đăng Lưu Phú Nhuận - gần ngã tư Phú Nhuận - nhà mới nội thất new 100%,5 triệu/tháng,35 m²,"Phú Nhuận, Hồ Chí Minh",cho-thue-nha-tro-phong-tro
"1PN máy giặt riêng gần Đại học Huflit, Đại học Bách Khoa ở được 2,3 người",6 triệu/tháng,25 m²,"Quận 10, Hồ Chí Minh",cho-thue-nha-tro-phong-tro
Mới! Chủ cần cho thuê phòng 3tr ở 2-3 người full nội thất để xe trong nhà miễn phí gần ĐH Văn Hiến,3 triệu/tháng,35 m²,"Tân Bình, Hồ Chí Minh",cho-thue-nha-tro-phong-tro
"Cho thuê phòng tách bếp bancol thoáng, NT sang trọng, Đầy đủ tiện nghi, ngay đại lộ Phạm Văn Đồng","6,3 triệu/tháng",38 m²,"Gò Vấp, Hồ Chí Minh",cho-thue-nha-tro-phong-tro
"Cho thuê phòng full kính, NT sang trọng, đầy đủ tiện nghi, ngay ngã 4 Phú Nhuận, Thích Quảng Đức","7,5 triệu/tháng",38 m²,"Phú Nhuận, Hồ Chí Minh",cho-thue-nha-tro-phong-tro
"Khai trương căn hộ studio full, có máy giặt riêng, cửa sổ lớn - 30m2 - ngay Đại Học Văn Lang","5,8 triệu/tháng",35 m²,"Bình Thạnh, Hồ Chí Minh",cho-thue-nha-tro-phong-tro
"Cho thuê phòng Nguyễn Thượng Hiền, Bình Thạnh, 6tr, 8tr5",6 triệu/tháng,40 m²,"Bình Thạnh, Hồ Chí Minh",cho-thue-nha-tro-phong-tro
"Hệ thống phòng cho thuê hiện đại, thiết kế sang trọng, đi lại thuận tiện Nguyễn Cửu Vân, Bình Thạnh",8 triệu/tháng,40 m²,"Bình Thạnh, Hồ Chí Minh",cho-thue-nha-tro-phong-tro
Siêu phẩm căn hộ mini - full nội thất khu vực trung tâm TPHCM,"4,5 triệu/tháng",30 m²,"Quận 4, Hồ Chí Minh",cho-thue-nha-tro-phong-tro
Cho thuê căn hộ dịch vụ cao cấp 2 phòng ngủ tại quận Hoàn Kiếm,"9,5 triệu/tháng",55 m²,"Hoàn Kiếm, Hà Nội",cho-thue-nha-tro-phong-tro
Ban công 35m2 ngay Cư Xá Bắc Hải Q10,8 triệu/tháng,35 m²,"Quận 10, Hồ Chí Minh",cho-thue-nha-tro-phong-tro
"Phòng trọ nữ 22m2 sạch sẽ, an ninh, ngã tư Bình Thái, XLHN, TP Thủ Đức","2,8 triệu/tháng",22 m²,"Quận 9, Hồ Chí Minh",cho-thue-nha-tro-phong-tro
Cho thuê căn hộ dịch vụ cao cấp 2 phòng ngủ tại quận Hoàn Kiếm,"9,5 triệu/tháng",55 m²,"Hoàn Kiếm, Hà Nội",cho-thue-nha-tro-phong-tro
Ban công 35m2 ngay Cư Xá Bắc Hải Q10,8 triệu/tháng,35 m²,"Quận 10, Hồ Chí Minh",cho-thue-nha-tro-phong-tro
"Phòng trọ nữ 22m2 sạch sẽ, an ninh, ngã tư Bình Thái, XLHN, TP Thủ Đức","2,8 triệu/tháng",22 m²,"Quận 9, Hồ Chí Minh",cho-thue-nha-tro-phong-tro
Phòng trọ 3tr2 ngay gần đại học Văn Hiến có toilet riêng,"3,2 triệu/tháng",20 m²,"Tân Bình, Hồ Chí Minh",cho-thue-nha-tro-phong-tro
"Cho thuê phòng, Đào Duy Anh, Phú Nhuận, Gần Công Viên Gia Định",7 triệu/tháng,40 m²,"Phú Nhuận, Hồ Chí Minh",cho-thue-nha-tro-phong-tro
Cho thuê căn hộ dịch vụ full nội thất đối diện Etown,7 triệu/tháng,25 m²,"Tân Bình, Hồ Chí Minh",cho-thue-nha-tro-phong-tro
Trống sẵn 1 phòng ngay CV Lê Thị Riêng,"8,5 triệu/tháng",40 m²,"Quận 10, Hồ Chí Minh",cho-thue-nha-tro-phong-tro
"Cho thuê phòng ngay CV Lê Thị Riêng, giáp Q.10","8,5 triệu/tháng",40 m²,"Tân Bình, Hồ Chí Minh",cho-thue-nha-tro-phong-tro
"Căn hộ mini full nội thất, đầy đủ tiện nghi/khu sân bay",7 triệu/tháng,30 m²,"Tân Bình, Hồ Chí Minh",cho-thue-nha-tro-phong-tro
Full nội thất - Khu công nghiệp Tân Bình,5 triệu/tháng,30 m²,"Tân Bình, Hồ Chí Minh",cho-thue-nha-tro-phong-tro
Full nội thất - khu sân Etown Cộng Hoà,"6,3 triệu/tháng",30 m²,"Tân Bình, Hồ Chí Minh",cho-thue-nha-tro-phong-tro
Còn 1 phòng khu vực Nguyên Xá - Minh Khai - Cầu Diễn - Hồ Tùng Mậu,"3,7 triệu/tháng",25 m²,"Bắc Từ Liêm, Hà Nội",cho-thue-nha-tro-phong-tro
Chính chủ cho thuê CCMN phòng bếp + vệ sinh riêng,"4,05 triệu/tháng",25 m²,"Thanh Xuân, Hà Nội",cho-thue-nha-tro-phong-tro
"Cho thuê phòng, Bình Thạnh, gần Nguyễn Xí, Phạm Văn Đồng, Đại Học Văn Lang","4,5 triệu/tháng",40 m²,"Bình Thạnh, Hồ Chí Minh",cho-thue-nha-tro-phong-tro
"Studio, cửa sổ lớn, full NT gần cầu Thị Nghè, cầu Điện Biên Phủ, Đh Y Dược, Đh Sài Gòn, cầu Ba Son",5 triệu/tháng,30 m²,"Quận 1, Hồ Chí Minh",cho-thue-nha-tro-phong-tro
"Studio cửa sổ gần bờ kè Hoàng Sa, cầu Kiệu, CV Lê Văn Tám, Đh UEH, VX Công Trường Dân Chủ","5,5 triệu/tháng",30 m²,"Quận 1, Hồ Chí Minh",cho-thue-nha-tro-phong-tro
"Cho thuê phòng studio đầy đủ nội thất công viên Tao Đàn, công viên 23/9","5,7 triệu/tháng",30 m²,"Quận 1, Hồ Chí Minh",cho-thue-nha-tro-phong-tro
Nguyễn Thông Q3 - 2 dạng phòng - gác và không gác,"4,5 triệu/tháng",25 m²,"Quận 3, Hồ Chí Minh",cho-thue-nha-tro-phong-tro
"Cho thuê phòng đường số 3 KDC Trung Sơn: 25m2, đầy đủ nội thất, cửa sổ rộng. 4,5 triệu/tháng","4,5 triệu/tháng",25 m²,"Bình Chánh, Hồ Chí Minh",cho-thue-nha-tro-phong-tro
"Cho thuê căn studio full nội thất tại Nguyễn Duy Trinh, Bình Trưng Tây, quận 2","5,29 triệu/tháng",25 m²,"Quận 2, Hồ Chí Minh",cho-thue-nha-tro-phong-tro
"Cho thuê căn studio full nội thất tại Nguyễn Duy Trinh, Bình Trưng Tây, quận 2","5,29 triệu/tháng",25 m²,"Quận 2, Hồ Chí Minh",cho-thue-nha-tro-phong-tro
"Cho thuê căn hộ full nội thất tại Nguyễn Duy Trinh, Bình Trưng Đông, quận 2","5,5 triệu/tháng",25 m²,"Quận 2, Hồ Chí Minh",cho-thue-nha-tro-phong-tro
"3 bước ra công viên Hòa Bình - phòng full gác xép - ở 3,4 người vô tư","3,6 triệu/tháng",27 m²,"Bắc Từ Liêm, Hà Nội",cho-thue-nha-tro-phong-tro
"Phòng ban công, ngay ngã 3 Lý Thường Kiệt - Bắc Hải, full nt có máy giặt riêng 7tr8/tháng","7,8 triệu/tháng",28 m²,"Tân Bình, Hồ Chí Minh",cho-thue-nha-tro-phong-tro
"Phòng trọ thiết kế sang trọng full NT đầy đủ dịch vụ cửa sổ, P. Bình Thuận, Q7","5,5 triệu/tháng",40 m²,"Quận 7, Hồ Chí Minh",cho-thue-nha-tro-phong-tro
"Hiếm, phòng ngủ sạch thơm bao trọn gói hiếm có khu vực vip Quận 3, trục đường sân bay Tân Sơn Nhất","8,5 triệu/tháng",28 m²,"Quận 3, Hồ Chí Minh",cho-thue-nha-tro-phong-tro
Studio full nội thất xinh xinh có thang máy quận 03,6 triệu/tháng,25 m²,"Quận 3, Hồ Chí Minh",cho-thue-nha-tro-phong-tro
"Cho thuê studio siêu xinh gần công viên 23 Tháng 9, Phố đi bộ Bùi Viện, Chợ Bến Thành, Takashimaya","5,5 triệu/tháng",30 m²,"Quận 1, Hồ Chí Minh",cho-thue-nha-tro-phong-tro
Cho thuê phòng trọ sinh viên 6tr/1 tháng (được ở ghép),6 triệu/tháng,20 m²,"Quận 3, Hồ Chí Minh",cho-thue-nha-tro-phong-tro
"Cho thuê căn studio full nội thất, cửa sổ giá ưu đãi Quận 3 (hỗ trợ giá trong 3 tháng đầu tiên)","5,4 triệu/tháng",16 m²,"Quận 3, Hồ Chí Minh",cho-thue-nha-tro-phong-tro
"Studio full nội thất gần VX Công trường Dân Chủ, Đh UEF, CV Lê Văn Tám, cầu Bông, cầu Điện Biên Phủ","5,8 triệu/tháng",30 m²,"Quận 1, Hồ Chí Minh",cho-thue-nha-tro-phong-tro
Căn hộ studio đầy đủ nội thất gần khu K300,7 triệu/tháng,30 m²,"Tân Bình, Hồ Chí Minh",cho-thue-nha-tro-phong-tro
"Căn studio full nội thất, đầy đủ tiện nghi, gần trục đường Trường Chinh",6 triệu/tháng,30 m²,"Tân Bình, Hồ Chí Minh",cho-thue-nha-tro-phong-tro
"Cho thuê phòng trọ gần chợ Tân Hương, 12m2, phòng mới, đẹp, WC riêng, gần chợ, trường học",2 triệu/tháng,12 m²,"Tân Phú, Hồ Chí Minh",cho-thue-nha-tro-phong-tro
"Cuối phố Nhổn - ngay ĐH Công Nghiệp, Thành Đô - khép kín - phòng đơn full đồ - ở luôn","2,95 triệu/tháng",25 m²,"Bắc Từ Liêm, Hà Nội",cho-thue-nha-tro-phong-tro
"Duplex ban công máy giặt riêng 32m2 Đ. Nguyễn Thượng Hiền Quận 3, hồ Con Rùa, vòng xoay Dân Chủ","6,9 triệu/tháng",32 m²,"Quận 3, Hồ Chí Minh",cho-thue-nha-tro-phong-tro
Căn phòng giá dễ thương còn phòng thì dễ mến,7 triệu/tháng,30 m²,"Bình Thạnh, Hồ Chí Minh",cho-thue-nha-tro-phong-tro
"Khai trương phòng trọ Võ Thị Sáu, Quận 3 thuận tiện đi lại",6 triệu/tháng,35 m²,"Quận 3, Hồ Chí Minh",cho-thue-nha-tro-phong-tro
Cho thuê phòng trọ nội thất full ban công thang máy hầm xe 35m2 an toàn PCCC,"7,5 triệu/tháng",35 m²,"Bình Thạnh, Hồ Chí Minh",cho-thue-nha-tro-phong-tro
"Cho thuê căn hộ DV, Nguyễn Hữu Cảnh, Bình Thạnh, gần ngã tư Hàng Xanh","6,5 triệu/tháng",40 m²,"Bình Thạnh, Hồ Chí Minh",cho-thue-nha-tro-phong-tro
Căn hộ dịch vụ full nội thất đẹp có bacol cửa sổ siêu thoáng mát Nguyễn Hữu Cảnh P22 Bình Thạnh,7 triệu/tháng,35 m²,"Bình Thạnh, Hồ Chí Minh",cho-thue-nha-tro-phong-tro
"Căn hộ DV 1 phòng ngủ 58m2 gần cầu Thị Nghè, Bình Thạnh","8,5 triệu/tháng",58 m²,"Bình Thạnh, Hồ Chí Minh",cho-thue-nha-tro-phong-tro
CHDV full nội thất đẹp Đường Nguyễn Hữu Cảnh trung tâm quận Bình Thạnh giá rẻ,"7,8 triệu/tháng",35 m²,"Bình Thạnh, Hồ Chí Minh",cho-thue-nha-tro-phong-tro
"Đối diện cao đẳng FPT - ngay Xuân Phương, Hòe Thị","3,55 triệu/tháng",25 m²,"Nam Từ Liêm, Hà Nội",cho-thue-nha-tro-phong-tro
"Phòng trọ mới đẹp, full nội thất KDC Trung Sơn","4,5 triệu/tháng",30 m²,"Bình Chánh, Hồ Chí Minh",cho-thue-nha-tro-phong-tro
CCMN 123 Yên Xá - ô tô đỗ cửa - chính chủ - ở luôn,"4,55 triệu/tháng",35 m²,"Thanh Trì, Hà Nội",cho-thue-nha-tro-phong-tro
Khai trương phòng mới giá rẻ khu vực Lê Văn Việt - Hoàng Hữu Nam Q9,"2,7 triệu/tháng",15 m²,"Quận 9, Hồ Chí Minh",cho-thue-nha-tro-phong-tro
"Cho thuê nhà Lake View Q2 - 1PN giá chỉ 6 triệu - Nhà mới, full nội thất. Có chỗ oto, hồ bơi",6 triệu/tháng,40 m²,"Quận 2, Hồ Chí Minh",cho-thue-nha-tro-phong-tro
Studio 30m2 đầy đủ nội thất - Ban công - Quận 1 - Nguyễn Đình Chiểu,7 triệu/tháng,30 m²,"Quận 1, Hồ Chí Minh",cho-thue-nha-tro-phong-tro
"Cho thuê phòng mới, đẹp trong tòa nhà 7 tầng có thang máy và PCCC tại ngõ Nguyễn Văn Huyên","4,8 triệu/tháng",30 m²,"Cầu Giấy, Hà Nội",cho-thue-nha-tro-phong-tro
Cần cho thuê căn hộ DV studio - cửa sổ - chợ Bà Chiểu - hiểm ô tô - bệnh viện Ung Bướu - Gia Định,5 triệu/tháng,45 m²,"Bình Thạnh, Hồ Chí Minh",cho-thue-nha-tro-phong-tro
"Thuê căn hộ Studio cho sinh viên chỉ từ 5tr8, thang máy, cửa sổ trời, đường Trần Quang Khải, Quận 1","5,7 triệu/tháng",30 m²,"Quận 1, Hồ Chí Minh",cho-thue-nha-tro-phong-tro
Chung cư mini giá rẻ full nội thất dành cho anh em sinh viên ngay gần công viên văn hóa Lê Đức Thọ,5 triệu/tháng,30 m²,"Gò Vấp, Hồ Chí Minh",cho-thue-nha-tro-phong-tro
Cho thuê phòng trọ mới xây tại đường Man Thiện Quận 9,"3,8 triệu/tháng",28 m²,"Quận 9, Hồ Chí Minh",cho-thue-nha-tro-phong-tro
Căn hộ bancol full nội thất giá ưu đãi gần Emart Gò Vấp bancol thoáng,"3,9 triệu/tháng",35 m²,"Gò Vấp, Hồ Chí Minh",cho-thue-nha-tro-phong-tro
"Căn hộ mới khai trương full nội thất, giá ưu đãi bancol siêu thoáng không giới hạn người ở","5,2 triệu/tháng",35 m²,"Gò Vấp, Hồ Chí Minh",cho-thue-nha-tro-phong-tro
"Căn hộ full nội thất bancol giá ưu đãi, máy giặt riêng, bancol siêu thoáng mát, miễn phí xe","4,5 triệu/tháng",36 m²,"Gò Vấp, Hồ Chí Minh",cho-thue-nha-tro-phong-tro
Căn hộ bancol mới khai trương Lê Đức Thọ gần ĐH Văn Lang giá sinh viên,5 triệu/tháng,35 m²,"Gò Vấp, Hồ Chí Minh",cho-thue-nha-tro-phong-tro
"Studio cửa sổ, ban công, full NT gần cầu Lê Văn Sỹ, cầu Công Lý, công trường Dân chủ, ga Sài Gòn","7,2 triệu/tháng",30 m²,"Quận 3, Hồ Chí Minh",cho-thue-nha-tro-phong-tro
"Cho thuê phòng duplex mới xây siêu đẹp full nội thất dọn được liền + mặt tiền Đ. Huỳnh Tấn Phát, Q7","5,1 triệu/tháng",40 m²,"Quận 7, Hồ Chí Minh",cho-thue-nha-tro-phong-tro
Phòng cho thuê ngay chợ Hoàng Hoa Thám full nội thất,4 triệu/tháng,25 m²,"Tân Bình, Hồ Chí Minh",cho-thue-nha-tro-phong-tro
Phòng trọ mới xây có gác full nội thất Trịnh Đình Thảo gần Âu Cơ Đại Học Văn Hiến,"4,5 triệu/tháng",30 m²,"Tân Phú, Hồ Chí Minh",cho-thue-nha-tro-phong-tro
Phòng có gác mới xây full nội thất gần Âu Cơ đại học Văn Hiến,"4,5 triệu/tháng",30 m²,"Tân Phú, Hồ Chí Minh",cho-thue-nha-tro-phong-tro
Cho thuê phòng full nội thất Có Balcon Cửa Sổ Đẹp Đường Nguyễn Kiệm Phú Nhuận,"6,2 triệu/tháng",30 m²,"Phú Nhuận, Hồ Chí Minh",cho-thue-nha-tro-phong-tro
"Mình ở KDC Park Riverside nhà không sử dụng hết cần cho thuê phòng tầng 1, bao tất cả phí","3,2 triệu/tháng",30 m²,"Quận 9, Hồ Chí Minh",cho-thue-nha-tro-phong-tro
Cho thuê phòng căn hộ studio full nội thất Đẹp Có Bancol Đường Nguyễn Kiệm Quận Phú Nhuận,6 triệu/tháng,35 m²,"Phú Nhuận, Hồ Chí Minh",cho-thue-nha-tro-phong-tro
Cho thuê phòng Duplex ban công full nội thất tại Quận 7,"5,6 triệu/tháng",40 m²,"Quận 7, Hồ Chí Minh",cho-thue-nha-tro-phong-tro
"Cho thuê phòng duplex, studio mới nằm gần cầu Tân Thuận, cầu Kênh Tẻ Quận 7 giá thật hình thật","5,2 triệu/tháng",30 m²,"Quận 7, Hồ Chí Minh",cho-thue-nha-tro-phong-tro
"Studio full nội thất, thiết kế hiện đại gần Lotte Mart và chợ Tân Mỹ cam kết đúng hình đúng giá","5,5 triệu/tháng",30 m²,"Quận 7, Hồ Chí Minh",cho-thue-nha-tro-phong-tro
Bạn thích phòng đẹp thì không thể bỏ qua phòng này Quận 7 cam kết đúng giá,6 triệu/tháng,30 m²,"Quận 7, Hồ Chí Minh",cho-thue-nha-tro-phong-tro
Cho thuê phòng quận 3 - đường Kỳ Đồng - ban công lầu 2 thang máy full nội thất,"7,8 triệu/tháng",38 m²,"Quận 3, Hồ Chí Minh",cho-thue-nha-tro-phong-tro
"Phòng trọ cho thuê ở Kỳ Đồng, Quận 3 thuận tiện di chuyển giữa các quận","5,5 triệu/tháng",40 m²,"Quận 3, Hồ Chí Minh",cho-thue-nha-tro-phong-tro
"Studio ban công 50m2 full nội thất khu dân cư Nam Long yên tĩnh, chủ nhà dễ tính",7 triệu/tháng,50 m²,"Quận 7, Hồ Chí Minh",cho-thue-nha-tro-phong-tro
Cho thuê phòng ban công nằm gần cầu Phú Mỹ Quận 7 đúng giá,"6,5 triệu/tháng",40 m²,"Quận 7, Hồ Chí Minh",cho-thue-nha-tro-phong-tro
"Nhà mình ở Park Riverside không sử dụng hết cần cho thuê phòng tầng 1, bao tất cả phí","3,2 triệu/tháng",30 m²,"Quận 9, Hồ Chí Minh",cho-thue-nha-tro-phong-tro
"Duplex (gác) full nội thất, máy giặt riêng ngay chợ Lý Phục Man Quận 7 phòng xinh","5,5 triệu/tháng",32 m²,"Quận 7, Hồ Chí Minh",cho-thue-nha-tro-phong-tro
Khai trương phòng mới có ban công gần Etown Cộng Hòa,"5,8 triệu/tháng",30 m²,"Tân Bình, Hồ Chí Minh",cho-thue-nha-tro-phong-tro
Cho thuê căn hộ dịch vụ 1PN - 2PN đường Cộng Hoà,"5,3 triệu/tháng",35 m²,"Tân Bình, Hồ Chí Minh",cho-thue-nha-tro-phong-tro
"1PN - 1 ban công full nội thất trung tâm Quận 7, siêu thoáng mát, xinh","7,7 triệu/tháng",40 m²,"Quận 7, Hồ Chí Minh",cho-thue-nha-tro-phong-tro
"Phòng cho thuê có nội thất đường Số 6 khu Tên Lửa, đối diện chợ Da Sà",3 triệu/tháng,15 m²,"Bình Tân, Hồ Chí Minh",cho-thue-nha-tro-phong-tro
"Cho thuê phòng khu vực Cát Lái, Q2. Phòng đẹp an ninh. LH 0911 490 *** Trung 18T","2,5 triệu/tháng",20 m²,"Quận 2, Hồ Chí Minh",cho-thue-nha-tro-phong-tro
"Cho thuê Duplex Full nội thất - diện tích 40m2 rộng rãi ở được 5 người, Bình Trưng Tây, Quận 2","4,5 triệu/tháng",40 m²,"Quận 2, Hồ Chí Minh",cho-thue-nha-tro-phong-tro
"Phòng mới xây 100% ngay mặt tiền đường Trường Sa, ngay ĐH sư phạm CS2",6 triệu/tháng,30 m²,"Quận 3, Hồ Chí Minh",cho-thue-nha-tro-phong-tro
Duplex - Máy giặt riêng gần cầu Phú Mỹ Quận 7 có bảo vệ,"5,5 triệu/tháng",32 m²,"Quận 7, Hồ Chí Minh",cho-thue-nha-tro-phong-tro
Căn hộ 1 phòng ngủ đầy đủ nội thất gần chợ Phạm Văn Hai,7 triệu/tháng,40 m²,"Tân Bình, Hồ Chí Minh",cho-thue-nha-tro-phong-tro
"Cho thuê phòng trọ + nội thất giá rẻ đối diện trường Đại Học Bách Khoa, Phường 14, Quận 10",6 triệu/tháng,35 m²,"Quận 10, Hồ Chí Minh",cho-thue-nha-tro-phong-tro
Phòng trọ cao cấp 1pn full nội thất quận Tân Bình,10 triệu/tháng,45 m²,"Tân Bình, Hồ Chí Minh",cho-thue-nha-tro-phong-tro
Studio full NT máy giặt riêng cửa sổ thoáng mát ánh sáng đầy đủ đối diện Etown,"6,8 triệu/tháng",30 m²,"Tân Bình, Hồ Chí Minh",cho-thue-nha-tro-phong-tro
Phòng đẹp giá tốt 1 phòng ngủ riêng biệt full nội thất Q. PN,"5,8 triệu/tháng",30 m²,"Phú Nhuận, Hồ Chí Minh",cho-thue-nha-tro-phong-tro
"Studio cửa sổ lớn, full NT gần Công trường Dân Chủ, ga sg, cầu Công Lý","6,9 triệu/tháng",30 m²,"Quận 3, Hồ Chí Minh",cho-thue-nha-tro-phong-tro
Cho thuê trọ sleep box quận 10,"1,7 triệu/tháng",10 m²,"Quận 10, Hồ Chí Minh",cho-thue-nha-tro-phong-tro
"Phòng mini giá rẻ, thoáng mát, an ninh. Trung tâm Phú Nhuận","2,8 triệu/tháng",20 m²,"Phú Nhuận, Hồ Chí Minh",cho-thue-nha-tro-phong-tro
Cho thuê căn hộ dịch vụ full nội thất Đảo Kim Cương giá 8tr5/tháng. Lh 0916 111 ***,"8,5 triệu/tháng",30 m²,"Quận 2, Hồ Chí Minh",cho-thue-nha-tro-phong-tro
Studio full nội thất ngay ngã tư Thủ Đức - Ở được 3 - 4 người,"4,7 triệu/tháng",27 m²,"Thủ Đức, Hồ Chí Minh",cho-thue-nha-tro-phong-tro
Cho thuê căn hộ ban công full nội thất 30m2 ngay Hoà Bình - Luỹ Bán Bích,"4,8 triệu/tháng",30 m²,"Quận 11, Hồ Chí Minh",cho-thue-nha-tro-phong-tro
"Cần cho thuê phòng trọ dịch vụ mới đẹp đường Cống Lở, Phường 15, Quận Tân Bình-gía 5,5 triệu/tháng","5,5 triệu/tháng",30 m²,"Tân Bình, Hồ Chí Minh",cho-thue-nha-tro-phong-tro
Phòng trọ bancol full nội thất mới ngay Nguyễn Văn Đậu Quận Bình Thạnh,5 triệu/tháng,30 m²,"Bình Thạnh, Hồ Chí Minh",cho-thue-nha-tro-phong-tro
"Cho thuê phòng khép kín tại Lạc Long Quân, Xuân La, Tây Hồ: 18m2. Giá 2.5tr","2,5 triệu/tháng",18 m²,"Tây Hồ, Hà Nội",cho-thue-nha-tro-phong-tro
Ký túc xá cao cấp Quận 3 giá rẻ,"2,1 triệu/tháng",40 m²,"Quận 3, Hồ Chí Minh",cho-thue-nha-tro-phong-tro
Ra mắt seepbox chỉ 2 - 4 người mới toanh,"2,3 triệu/tháng",25 m²,"Quận 3, Hồ Chí Minh",cho-thue-nha-tro-phong-tro
Ra mắt seepbox chỉ 2 - 4 người mới toanh,"2,3 triệu/tháng",25 m²,"Quận 3, Hồ Chí Minh",cho-thue-nha-tro-phong-tro
Phòng cho thuê đầy đủ tiện nghi gần chợ Bến Thành,5 triệu/tháng,24 m²,"Quận 1, Hồ Chí Minh",cho-thue-nha-tro-phong-tro
Cho thuê phòng siêu đẹp cửa sổ lớn tại Nguyễn Cửu Vân,"7,5 triệu/tháng",40 m²,"Bình Thạnh, Hồ Chí Minh",cho-thue-nha-tro-phong-tro
"Phòng trọ sleepbox Nguyễn Hữu Cảnh ngay Landmark 81 Bình Thạnh 1,9 triệu","1,9 triệu/tháng",25 m²,"Bình Thạnh, Hồ Chí Minh",cho-thue-nha-tro-phong-tro
"Chính chủ cho thuê phòng ban công, cửa sổ thoáng full NT ngay trung tâm Q3 - Lê Văn Sỹ",5 triệu/tháng,30 m²,"Quận 3, Hồ Chí Minh",cho-thue-nha-tro-phong-tro
"Phòng có nội thất đầy đủ, sân sau rộng thoáng, máy giặt riêng ngay Phan Văn Trị Bình Thạnh","7,5 triệu/tháng",40 m²,"Bình Thạnh, Hồ Chí Minh",cho-thue-nha-tro-phong-tro
Căn hộ dịch vụ studio 1PN balcon lớn 25m2 full NT xách vali vào ở ngay quận Phú Nhuận,"5,8 triệu/tháng",25 m²,"Phú Nhuận, Hồ Chí Minh",cho-thue-nha-tro-phong-tro
"Phòng có nội thất hiện đại, giá thật 100% ngay Đinh Bộ Lĩnh Bình Thạnh",6 triệu/tháng,30 m²,"Bình Thạnh, Hồ Chí Minh",cho-thue-nha-tro-phong-tro
