Title,Price,Area,Location,type
"Cho mặt bằng đẹp tại Lạc Long Quân, P.11, Q. Tân Bình diện tích 150m2",25 triệu/tháng,150 m²,"Tân Bình, Hồ Chí Minh",cho-thue-sang-nhuong-cua-hang-ki-ot
"Mặt bằng 300m2 tại Mã Lò Quận Bình Tân, cần cho thuê với giá cả hấp dẫn",90 triệu/tháng,300 m²,"Bình Tân, Hồ Chí Minh",cho-thue-sang-nhuong-cua-hang-ki-ot
"Cho thuê mặt bằng chính chủ Âu Cơ, P. 9, Q. Tân Bình DT: 130m2",30 triệu/tháng,130 m²,"Tân Bình, Hồ Chí Minh",cho-thue-sang-nhuong-cua-hang-ki-ot
"Cho thuê mặt bằng 330m2 gần Song Hành, quận 2",80 triệu/tháng,330 m²,"Quận 2, Hồ Chí Minh",cho-thue-sang-nhuong-cua-hang-ki-ot
"Cho thuê MBKD Hồng Lạc, Q. Tân Bình, DT: 300 m2",50 triệu/tháng,300 m²,"Tân Bình, Hồ Chí Minh",cho-thue-sang-nhuong-cua-hang-ki-ot
"Cho thuê mặt bằng kinh doanh ở Nguyễn Đình Chiểu, Phường Đa Kao Quận 1 DT 145m2",45 triệu/tháng,145 m²,"Quận 1, Hồ Chí Minh",cho-thue-sang-nhuong-cua-hang-ki-ot
"Cho thuê mặt bằng kinh doanh ở Đường Ung Văn Khiêm, Phường 25, Bình Thạnh, DT 350m2",45 triệu/tháng,350 m²,"Bình Thạnh, Hồ Chí Minh",cho-thue-sang-nhuong-cua-hang-ki-ot
"Cho thuê kho xưởng mới ở Tây Lân, Phường Tân Tạo, Quận Bình Tân, DT 700m2",45 triệu/tháng,700 m²,"Bình Tân, Hồ Chí Minh",cho-thue-sang-nhuong-cua-hang-ki-ot
Cho thuê mặt bằng kinh doanh ở Quốc lộ 1A Phường Bình Hưng Hoà B Quận Bình Tân. DT 1000m2,45 triệu/tháng,1.000 m²,"Bình Tân, Hồ Chí Minh",cho-thue-sang-nhuong-cua-hang-ki-ot
"Nhà 2 mặt tiền Phan Văn Hớn, gần chợ cho thuê",30 triệu/tháng,500 m²,"Hóc Môn, Hồ Chí Minh",cho-thue-sang-nhuong-cua-hang-ki-ot
Cho thuê mặt bằng kinh doanh ở Lê Văn Sỹ Phường 14 Quận 3 DT 200m2,40 triệu/tháng,200 m²,"Quận 3, Hồ Chí Minh",cho-thue-sang-nhuong-cua-hang-ki-ot
"Cho thuê làm văn phòng/spa/shop thời trang đường Trần Quang Diệu, Q3 (126m2)",25 triệu/tháng,60 m²,"Quận 3, Hồ Chí Minh",cho-thue-sang-nhuong-cua-hang-ki-ot
Cho thuê Mặt bằng kinh doanh ở Phan Đăng Lưu Phường 02 Quận Phú Nhuận DT 400m2,40 triệu/tháng,400 m²,"Phú Nhuận, Hồ Chí Minh",cho-thue-sang-nhuong-cua-hang-ki-ot
"Cho thuê mặt bằng kinh doanh 380m2, Nguyễn Thanh Sơn, Quận 2 - Sàn trống suốt, có thang máy đi lại",90 triệu/tháng,380 m²,"Quận 2, Hồ Chí Minh",cho-thue-sang-nhuong-cua-hang-ki-ot
"Cho thuê mặt bằng mặt tiền trung tâm đường Vĩnh Viễn Chính Chủ, Phường 4, Quận 10",22 triệu/tháng,38 m²,"Quận 10, Hồ Chí Minh",cho-thue-sang-nhuong-cua-hang-ki-ot
"Mặt bằng 140m2 hợp kinh doanh cafe, mở quán - giá 25 triệu",25 triệu/tháng,140 m²,"Quận 2, Hồ Chí Minh",cho-thue-sang-nhuong-cua-hang-ki-ot
Mặt bằng kinh doanh đường Bùi Minh Trực 1.200m2 - dễ dàng vận chuyển hàng hóa,100 triệu/tháng,1.200 m²,"Quận 8, Hồ Chí Minh",cho-thue-sang-nhuong-cua-hang-ki-ot
Cho thuê mặt bằng tại P. 9 Q. Tân Bình - chính chủ tầng 1 tạm tính 130 m2,30 triệu/tháng,130 m²,"Tân Bình, Hồ Chí Minh",cho-thue-sang-nhuong-cua-hang-ki-ot
"Cho thuê mặt bằng diện tích 40m2 tại Phan Đăng Lưu, P. 2, Phú Nhuận",40 triệu/tháng,40 m²,"Phú Nhuận, Hồ Chí Minh",cho-thue-sang-nhuong-cua-hang-ki-ot
"Cho thuê mặt bằng kinh doanh ở Ngô Chí Quốc, Phường Bình Chiểu, Quận Thủ Đức DT 161 m2",38 triệu/tháng,161 m²,"Thủ Đức, Hồ Chí Minh",cho-thue-sang-nhuong-cua-hang-ki-ot
"Cho thuê mặt bằng kinh doanh chính chủ, DT 100m2 tại Phường 13, Quận 10",25 triệu/tháng,100 m²,"Quận 10, Hồ Chí Minh",cho-thue-sang-nhuong-cua-hang-ki-ot
Cho thuê mặt bằng kinh doanh làm kho đường Trần Não 100 triệu/tháng - 400 m2 đất nở hậu,100 triệu/tháng,400 m²,"Quận 2, Hồ Chí Minh",cho-thue-sang-nhuong-cua-hang-ki-ot
"Cho thuê MB mặt tiền rộng rãi 560m2, Nguyễn Oanh, Gò Vấp - cơ hội hấp dẫn",120 triệu/tháng,560 m²,"Gò Vấp, Hồ Chí Minh",cho-thue-sang-nhuong-cua-hang-ki-ot
Tại đường Nguyễn Thanh Sơn cho thuê mặt bằng kinh doanh (đối diện cổng vào chung cư Vista Verde),90 triệu/tháng,380 m²,"Quận 2, Hồ Chí Minh",cho-thue-sang-nhuong-cua-hang-ki-ot
"Cho thuê mặt bằng kinh doanh ở Nguyễn Ảnh Thủ Phường Hiệp Thành Quận 12, DT 210m2",25 triệu/tháng,210 m²,"Quận 12, Hồ Chí Minh",cho-thue-sang-nhuong-cua-hang-ki-ot
"Cho thuê mặt bằng kinh doanh ở Trần Bình Trọng, Phường 1, Quận 5 DT 200m2",35 triệu/tháng,200 m²,"Quận 5, Hồ Chí Minh",cho-thue-sang-nhuong-cua-hang-ki-ot
"Cho thuê mặt bằng Đường Khánh Hội, Phường 2, Quận 4, dt: 40m2",25 triệu/tháng,40 m²,"Quận 4, Hồ Chí Minh",cho-thue-sang-nhuong-cua-hang-ki-ot
"Cho thuê MB đường Trần Não, Phường An Khánh (Quận 2 cũ) - Diện tích: 930m2, mặt tiền rộng 16m",200 triệu/tháng,930 m²,"Quận 2, Hồ Chí Minh",cho-thue-sang-nhuong-cua-hang-ki-ot
"Cho thuê MB vị trí đắc địa, Nguyễn Chí Thanh, Quận 5 - Diện tích 160m2 - nhanh tay sở hữu",130 triệu/tháng,160 m²,"Quận 5, Hồ Chí Minh",cho-thue-sang-nhuong-cua-hang-ki-ot
Đường Lê Thị Hồng Gấm cho thuê MB 600m2 tại trung tâm quận 1,350 triệu/tháng,600 m²,"Quận 1, Hồ Chí Minh",cho-thue-sang-nhuong-cua-hang-ki-ot
Cho thuê mặt bằng kinh doanh ở Nguyễn Kiệm Phường 03 Quận Gò Vấp DT 150m2,28 triệu/tháng,150 m²,"Gò Vấp, Hồ Chí Minh",cho-thue-sang-nhuong-cua-hang-ki-ot
"Cho thuê mặt bằng Phạm Văn Đồng, Phường 1, Gò Vấp - diện tích sử dụng: 1.000 m2",299 triệu/tháng,1.000 m²,"Gò Vấp, Hồ Chí Minh",cho-thue-sang-nhuong-cua-hang-ki-ot
"Cho thuê MB Nguyễn Chí Thanh, Quận 5 gần BV Chợ Rẫy - 180m2 - có nở hậu",130 triệu/tháng,180 m²,"Quận 5, Hồ Chí Minh",cho-thue-sang-nhuong-cua-hang-ki-ot
Cho thuê mặt bằng kinh doanh Q1,55 triệu/tháng,80 m²,"Quận 1, Hồ Chí Minh",cho-thue-sang-nhuong-cua-hang-ki-ot
"Cho thuê đất mặt tiền ven sông Thạnh Lộc, Quận 12 DT 1800m2",30 triệu/tháng,1.800 m²,"Quận 12, Hồ Chí Minh",cho-thue-sang-nhuong-cua-hang-ki-ot
"Mặt tiền đường Số 7, Bình Tân - cần cho thuê mặt bằng kinh doanh 240 m2 - cơ hội với giá hấp dẫn",110 triệu/tháng,240 m²,"Bình Tân, Hồ Chí Minh",cho-thue-sang-nhuong-cua-hang-ki-ot
"Cho thuê mặt bằng kinh doanh ở Cách Mạng Tháng Tám Phường 13 Quận 10, DT 100m2",25 triệu/tháng,100 m²,"Quận 10, Hồ Chí Minh",cho-thue-sang-nhuong-cua-hang-ki-ot
"Sang nhượng quán cafe 9x12m, có 4 tầng, sử dụng 400m2 khu cư xá Bình Thới - Quận 11, LH: 0906 021 ***",40 triệu/tháng,400 m²,"Quận 11, Hồ Chí Minh",cho-thue-sang-nhuong-cua-hang-ki-ot
"Cho thuê mặt bằng kinh doanh ở Nguyễn Gia Trí, Phường 25, Quận Bình Thạnh DT 250m2","23,5 triệu/tháng",250 m²,"Bình Thạnh, Hồ Chí Minh",cho-thue-sang-nhuong-cua-hang-ki-ot
"DT 280m2, đường Phạm Văn Đồng, Phường Hiệp Bình Chánh, TP. Thủ Đức - cho thuê mặt bằng",90 triệu/tháng,500 m²,"Thủ Đức, Hồ Chí Minh",cho-thue-sang-nhuong-cua-hang-ki-ot
"Cho thuê mặt bằng Phạm Văn Đồng, 4.100m2, vị trí đắc địa, phù hợp cho nhiều loại hình kinh doanh",650 triệu/tháng,4.100 m²,"Bình Thạnh, Hồ Chí Minh",cho-thue-sang-nhuong-cua-hang-ki-ot
"Cho thuê mặt bằng kinh doanh ở Huỳnh Tấn Phát Phường Tân Phú Quận 7, DT 120m2",25 triệu/tháng,120 m²,"Quận 7, Hồ Chí Minh",cho-thue-sang-nhuong-cua-hang-ki-ot
"Mặt bằng 1.200m2 - cho thuê để kinh doanh đường Bùi Minh Trực Phường 6, Quận 8",100 triệu/tháng,1.200 m²,"Quận 8, Hồ Chí Minh",cho-thue-sang-nhuong-cua-hang-ki-ot
"MB Nguyễn Trãi Q5 - gần Chợ Lớn sạch, mới thoáng mát - 160m2 có máy lạnh âm trần",68 triệu/tháng,275 m²,"Quận 5, Hồ Chí Minh",cho-thue-sang-nhuong-cua-hang-ki-ot
"Cho thuê MB kinh doanh 528m2, đường Kha Vạn Cân - khu trung tâm, góc ngã tư 2 mặt tiền đường",115 triệu/tháng,528 m²,"Thủ Đức, Hồ Chí Minh",cho-thue-sang-nhuong-cua-hang-ki-ot
Đang cho thuê mặt bằng 300m2 tại Mã Lò với giá cả phải chăng,90 triệu/tháng,300 m²,"Bình Tân, Hồ Chí Minh",cho-thue-sang-nhuong-cua-hang-ki-ot
"Cho thuê mặt bằng rộng đẹp với DT rộng rãi 1.500m2 Lê Thị Hà, Hóc Môn",130 triệu/tháng,1.500 m²,"Hóc Môn, Hồ Chí Minh",cho-thue-sang-nhuong-cua-hang-ki-ot
"Cho thuê mặt bằng kinh doanh ở Huỳnh Tấn Phát, Phường Phú Mỹ, Quận 7 DT 150m2",25 triệu/tháng,150 m²,"Quận 7, Hồ Chí Minh",cho-thue-sang-nhuong-cua-hang-ki-ot
"Cho thuê mặt bằng kinh doanh ở Trưng Nữ Vương, thị trấn Hóc Môn, Huyện Hóc Môn DT 500m2",30 triệu/tháng,500 m²,"Hóc Môn, Hồ Chí Minh",cho-thue-sang-nhuong-cua-hang-ki-ot
"Cho thuê mặt bằng kinh doanh ở Trần Quang Diệu, Phường 14, Quận 3, DT 126m2",25 triệu/tháng,126 m²,"Quận 3, Hồ Chí Minh",cho-thue-sang-nhuong-cua-hang-ki-ot
Cho thuê mặt bằng kinh doanh ở Lạc Long Quân Phường 11 Quận Tân Bình DT 150m2,25 triệu/tháng,150 m²,"Tân Bình, Hồ Chí Minh",cho-thue-sang-nhuong-cua-hang-ki-ot
Cho thuê mặt bằng kinh doanh ở Âu Cơ Phường 9 Quận Tân Bình DT 130m2,30 triệu/tháng,130 m²,"Tân Bình, Hồ Chí Minh",cho-thue-sang-nhuong-cua-hang-ki-ot
Cho thuê mặt bằng kinh doanh ở Thống Nhất Phường 11 Quận Gò Vấp DT 200m2,18 triệu/tháng,200 m²,"Gò Vấp, Hồ Chí Minh",cho-thue-sang-nhuong-cua-hang-ki-ot
Cho thuê mặt bằng kinh doanh ở Phạm Văn Bạch Phường 12 Quận Gò Vấp DT 80m2,22 triệu/tháng,80 m²,"Gò Vấp, Hồ Chí Minh",cho-thue-sang-nhuong-cua-hang-ki-ot
Cho thuê mặt bằng kinh doanh ở Nguyễn Văn Khối Phường 08 Quận Gò Vấp DT 200m2,22 triệu/tháng,200 m²,"Gò Vấp, Hồ Chí Minh",cho-thue-sang-nhuong-cua-hang-ki-ot
Cho thuê MB 950m2 - Quốc Hương Quận 2 - Giá: 150 triệu - khu dân trí cao,150 triệu/tháng,950 m²,"Quận 2, Hồ Chí Minh",cho-thue-sang-nhuong-cua-hang-ki-ot
Cho thuê mặt bằng kinh doanh ở Khánh Hội Phường 02 Quận 4 DT 40m2,25 triệu/tháng,40 m²,"Quận 4, Hồ Chí Minh",cho-thue-sang-nhuong-cua-hang-ki-ot
"Cho thuê mặt bằng kinh doanh ở Vĩnh Viễn, phường 4, Quận 10 DT 38m2",22 triệu/tháng,38 m²,"Quận 10, Hồ Chí Minh",cho-thue-sang-nhuong-cua-hang-ki-ot
"Cho thuê mặt bằng tại Thống Nhất, Gò Vấp - chỉ 18.000.000 đồng/tháng dt 200m2",18 triệu/tháng,200 m²,"Gò Vấp, Hồ Chí Minh",cho-thue-sang-nhuong-cua-hang-ki-ot
"Cho thuê mặt bằng 200m2 tại, Phường 8, Nguyễn Văn Khối, Gò Vấp",22 triệu/tháng,200 m²,"Gò Vấp, Hồ Chí Minh",cho-thue-sang-nhuong-cua-hang-ki-ot
"Cho thuê mặt bằng kinh doanh đường Nguyễn Văn Quá, Quận 12 - ngang siêu to khổng lồ (12 m x 17m)",38 triệu/tháng,408 m²,"Quận 12, Hồ Chí Minh",cho-thue-sang-nhuong-cua-hang-ki-ot
Cho thuê mặt bằng MT tại vị trí đắc địa với DT 340m2 đường Nguyễn Thị Thập,180 triệu/tháng,340 m²,"Quận 7, Hồ Chí Minh",cho-thue-sang-nhuong-cua-hang-ki-ot
Cho thuê mặt bằng hoặc sang nhượng toàn bộ tiệm nail ngay hẻm 43 Vườn Lài,3 triệu/tháng,50 m²,"Quận 12, Hồ Chí Minh",cho-thue-sang-nhuong-cua-hang-ki-ot
"Cho thuê MB 950m2 - Đường Quốc Hương, Quận 2 - khu dân cư sầm uất, dân trí cao",150 triệu/tháng,950 m²,"Quận 2, Hồ Chí Minh",cho-thue-sang-nhuong-cua-hang-ki-ot
Cho thuê mặt bằng kinh doanh gần bệnh viện Nhi Đồng Nai,"5,5 triệu/tháng",70 m²,"Biên Hòa, Đồng Nai",cho-thue-sang-nhuong-cua-hang-ki-ot
"Sang nhượng quán cafe Đường 25, Phường Hiệp Bình Chánh, Thủ Đức!",7 triệu/tháng,123 m²,"Thủ Đức, Hồ Chí Minh",cho-thue-sang-nhuong-cua-hang-ki-ot
"Cho thuê mặt bằng đang có sẵn ở đường Số 65, Q7 gần Lotte Mart - 400m2",75 triệu/tháng,320 m²,"Quận 7, Hồ Chí Minh",cho-thue-sang-nhuong-cua-hang-ki-ot
Cho thuê mặt bằng kinh doanh đường Nguyễn Thị Thập phường Tân Quy nơi kinh doanh buôn bán sầm uất,60 triệu/tháng,88 m²,"Quận 7, Hồ Chí Minh",cho-thue-sang-nhuong-cua-hang-ki-ot
"Cho thuê và bán quầy số 8 chợ An Dương. Làm nail, sửa móng tay móng chân rất đắt hàng 0946 913 ***",700 nghìn/tháng,"3,5 m²","Lê Chân, Hải Phòng",cho-thue-sang-nhuong-cua-hang-ki-ot
"Cho thuê MB 207m2 ngang 9m đường Lâm Hoành gần Võ Văn Kiệt, Sơn Trà",27 triệu/tháng,207 m²,"Sơn Trà, Đà Nẵng",cho-thue-sang-nhuong-cua-hang-ki-ot
Cho thuê cửa hàng đẹp mặt phố Bùi Ngọc Dương,6 triệu/tháng,40 m²,"Hai Bà Trưng, Hà Nội",cho-thue-sang-nhuong-cua-hang-ki-ot
Cho thuê mặt bằng kinh doanh giá 12 triệu,12 triệu/tháng,64 m²,"Quận 8, Hồ Chí Minh",cho-thue-sang-nhuong-cua-hang-ki-ot
"Mặt bằng kinh doanh đẹp cho thuê 80m2 ở Lý Tự Trọng, Phường Bến Thành, Quận 1",55 triệu/tháng,80 m²,"Quận 1, Hồ Chí Minh",cho-thue-sang-nhuong-cua-hang-ki-ot
"Mặt bằng kinh doanh đẹp cho thuê 380m2 ở Nguyễn Thanh Sơn, Phường Thạnh Mỹ Lợi, Quận 2",90 triệu/tháng,380 m²,"Quận 2, Hồ Chí Minh",cho-thue-sang-nhuong-cua-hang-ki-ot
"Mặt bằng kinh doanh đẹp cho thuê 930m2 ở Trần Não Phường An Khánh, Quận 2",200 triệu/tháng,930 m²,"Quận 2, Hồ Chí Minh",cho-thue-sang-nhuong-cua-hang-ki-ot
Sang tiệm massage 1T3L 7p mặt tiền Hoàng Diệu 2 Linh Chiểu,380 triệu/tháng,100 m²,"Thủ Đức, Hồ Chí Minh",cho-thue-sang-nhuong-cua-hang-ki-ot
Cho thuê mặt bằng 120m2 mặt tiền Võ Văn Ngân Bình Thọ,130 triệu/tháng,120 m²,"Thủ Đức, Hồ Chí Minh",cho-thue-sang-nhuong-cua-hang-ki-ot
Sang mặt bằng 248m2 mặt tiền đường Linh Đông,30 triệu/tháng,248 m²,"Thủ Đức, Hồ Chí Minh",cho-thue-sang-nhuong-cua-hang-ki-ot
Cho thuê mặt bằng 20m2 mặt tiền Đặng Văn Bi Bình Thọ,14 triệu/tháng,20 m²,"Thủ Đức, Hồ Chí Minh",cho-thue-sang-nhuong-cua-hang-ki-ot
CC cho thuê mặt bằng 1 lầu. Mặt tiền đường Vũ Tông Phan P An Phú. Dt: 5x20m. Nhà 1 lầu giá 20tr/th,20 triệu/tháng,100 m²,"Quận 2, Hồ Chí Minh",cho-thue-sang-nhuong-cua-hang-ki-ot
"Quá rẻ 20tr/th mặt bằng trệt + lầu mặt tiền Trần Lựu, An Phú, Quận 2 (5x20) tiện kinh doanh",20 triệu/tháng,100 m²,"Quận 2, Hồ Chí Minh",cho-thue-sang-nhuong-cua-hang-ki-ot
"Cho thuê biệt thự 300m2 khu compound Nguyễn Văn Hưởng, Thảo Điền. Nội thất cao cấp. Giá 90tr/tháng",90 triệu/tháng,300 m²,"Quận 2, Hồ Chí Minh",cho-thue-sang-nhuong-cua-hang-ki-ot
Mặt bằng kinh doanh đẹp cho thuê 210m2 ở Nguyễn Ảnh Thủ Phường Hiệp Thành Quận 12,25 triệu/tháng,210 m²,"Quận 12, Hồ Chí Minh",cho-thue-sang-nhuong-cua-hang-ki-ot
"Cho thuê MBKD trục đường Xuân Thuỷ, Thảo Điền. DT: 7x20m, giá 130tr/tháng",130 triệu/tháng,140 m²,"Quận 2, Hồ Chí Minh",cho-thue-sang-nhuong-cua-hang-ki-ot
"Cho thuê mặt bằng kinh doanh 528m2, đường Kha Vạn Cân Q Thủ Đức, Tp HCM",115 triệu/tháng,528 m²,"Thủ Đức, Hồ Chí Minh",cho-thue-sang-nhuong-cua-hang-ki-ot
"Cho thuê mặt bằng 1.500 m2 đường Lê Thị Hà, Hóc Môn - Nội thất đầy đủ",130 triệu/tháng,1.500 m²,"Hóc Môn, Hồ Chí Minh",cho-thue-sang-nhuong-cua-hang-ki-ot
Tỉnh lộ 10 Quận Bình Tân - Cho thuê mặt bằng kinh doanh đông đúc 490m2,59 triệu/tháng,490 m²,"Bình Tân, Hồ Chí Minh",cho-thue-sang-nhuong-cua-hang-ki-ot
"Cho thuê MB mặt tiền 340m2 tại vị trí đắc địa, Nguyễn Thị Thập, Phường Tân Quy, Quận 7",180 triệu/tháng,340 m²,"Quận 7, Hồ Chí Minh",cho-thue-sang-nhuong-cua-hang-ki-ot
"Cho thuê MB mặt tiền 560m2, Nguyễn Oanh, Gò Vấp - thích hợp nhiều loại hình kinh doanh",120 triệu/tháng,560 m²,"Gò Vấp, Hồ Chí Minh",cho-thue-sang-nhuong-cua-hang-ki-ot
"Mặt bằng kinh doanh đẹp cho thuê 200m2 ở Thống Nhất, Phường 11, Quận Gò Vấp",18 triệu/tháng,200 m²,"Gò Vấp, Hồ Chí Minh",cho-thue-sang-nhuong-cua-hang-ki-ot
"Mặt bằng kinh doanh đẹp cho thuê 200m2 ở Nguyễn Văn Khối,Phường 8,Quận Gò Vấp",22 triệu/tháng,200 m²,"Gò Vấp, Hồ Chí Minh",cho-thue-sang-nhuong-cua-hang-ki-ot
"Mặt bằng kinh doanh đẹp cho thuê 300m2 ở Mã Lò, Phường Bình Trị Đông A, Quận Bình Tân",40 triệu/tháng,300 m²,"Bình Tân, Hồ Chí Minh",cho-thue-sang-nhuong-cua-hang-ki-ot
Mặt bằng 1.170m2 kinh doanh mọi ngành nghề Đường Kinh Dương Vương,220 triệu/tháng,1.170 m²,"Quận 6, Hồ Chí Minh",cho-thue-sang-nhuong-cua-hang-ki-ot
Cho thuê MBKD 600m2 tại Đường Lê Thị Hồng Gấm trung tâm quận 1,350 triệu/tháng,600 m²,"Quận 1, Hồ Chí Minh",cho-thue-sang-nhuong-cua-hang-ki-ot
"Thiếu người quản lý nên cần sang nhượng Spa đang kinh doanh tốt ở khu Phan Xích Long, Phú Nhuận",20 triệu/tháng,80 m²,"Phú Nhuận, Hồ Chí Minh",cho-thue-sang-nhuong-cua-hang-ki-ot
"Cho thuê shophouse mặt đường A3 VCN Phước Long 2, Nha trang ngang gần 8m",11 triệu/tháng,125 m²,"Nha Trang, Khánh Hòa",cho-thue-sang-nhuong-cua-hang-ki-ot
Cho thuê mặt bằng kinh doanh trục Nguyễn Lương Bằng giá 70 triệu/tháng,70 triệu/tháng,210 m²,"Quận 7, Hồ Chí Minh",cho-thue-sang-nhuong-cua-hang-ki-ot
"Cho thuê mặt bằng góc hai mặt tiền, đường Nguyễn Lương Bằng, Phú Mỹ Hưng. LH 0931 155 ***",70 triệu/tháng,210 m²,"Quận 7, Hồ Chí Minh",cho-thue-sang-nhuong-cua-hang-ki-ot
"Cho thuê mặt bằng Hưng Vượng ngay Phú Mỹ Hưng, làm Spa, văn phòng, quán ăn. Giá 90 triệu",90 triệu/tháng,320 m²,"Quận 7, Hồ Chí Minh",cho-thue-sang-nhuong-cua-hang-ki-ot
"Cần cho thuê mặt bằng đường Nguyễn Đức Cảnh Phú Mỹ Hưng, Q7, giá 90 triệu/tháng. LH: 0931 155 ***",90 triệu/tháng,190 m²,"Quận 7, Hồ Chí Minh",cho-thue-sang-nhuong-cua-hang-ki-ot
"Cho thuê shop góc hai mặt tiền, vị trí đẹp, đường Nguyễn Lương Bằng, Phú Mỹ Hưng LH 0931 155 ***",90 triệu/tháng,195 m²,"Quận 7, Hồ Chí Minh",cho-thue-sang-nhuong-cua-hang-ki-ot
"Cho thuê shop Phú Mỹ Hưng, căn góc vị trí đẹp ngay vị trí đẹp thích làm Spa, văn phòng, quán ăn",70 triệu/tháng,323 m²,"Quận 7, Hồ Chí Minh",cho-thue-sang-nhuong-cua-hang-ki-ot
"Cho thuê mặt bằng tầng trệt Phú Mỹ Hưng làm spa, văn phòng, quán ăn",90 triệu/tháng,320 m²,"Quận 7, Hồ Chí Minh",cho-thue-sang-nhuong-cua-hang-ki-ot
Cho Thuê Kiot Chợ trong TTTM Vincom kinh doanh tại Vinpearland giá ưu đãi chỉ từ 4tr/tháng,4 triệu/tháng,50 m²,"Nha Trang, Khánh Hòa",cho-thue-sang-nhuong-cua-hang-ki-ot
"Cho thuê shop Hưng Vượng 1 đường Số 6, PMH vị trí đắc địa tiện kinh doanh. LH: 0911 021 ***",29 triệu/tháng,100 m²,"Quận 7, Hồ Chí Minh",cho-thue-sang-nhuong-cua-hang-ki-ot
Cho thuê nhanh mặt bằng kinh doanh đường Huỳnh Tấn Phát p Phú Thuận,25 triệu/tháng,60 m²,"Quận 7, Hồ Chí Minh",cho-thue-sang-nhuong-cua-hang-ki-ot
"Cần cho thuê cửa hàng ngay Nguyễn Đức Cảnh Phú Mỹ Hưng, Q7, giá 90 triệu/tháng",90 triệu/tháng,129 m²,"Quận 7, Hồ Chí Minh",cho-thue-sang-nhuong-cua-hang-ki-ot
"Cho thuê mặt bằng kiot liền ngay Phú Mỹ Hưng, Quận 7",70 triệu/tháng,210 m²,"Quận 7, Hồ Chí Minh",cho-thue-sang-nhuong-cua-hang-ki-ot
Cho thuê mặt bằng Nguyễn Lương Bằng tầng trệt 47tr/tháng,47 triệu/tháng,103 m²,"Quận 7, Hồ Chí Minh",cho-thue-sang-nhuong-cua-hang-ki-ot
Cho thuê mặt bằng 50m2 chợ Linh Trung,16 triệu/tháng,50 m²,"Thủ Đức, Hồ Chí Minh",cho-thue-sang-nhuong-cua-hang-ki-ot
"Cho thuê mặt bằng đẳng cấp - 250m2 - Đường Nguyễn Gia Trí, Bình Thạnh",47 triệu/tháng,250 m²,"Bình Thạnh, Hồ Chí Minh",cho-thue-sang-nhuong-cua-hang-ki-ot
Mặt bằng kinh doanh đẹp cho thuê 150m2 ở Nguyễn Kiệm Phường 3 Quận Gò Vấp,28 triệu/tháng,150 m²,"Gò Vấp, Hồ Chí Minh",cho-thue-sang-nhuong-cua-hang-ki-ot
"Kho xưởng mới cho thuê 200m2 ở 1, Phường Bình Hưng Hoà A Quận Bình Tân",25 triệu/tháng,200 m²,"Bình Tân, Hồ Chí Minh",cho-thue-sang-nhuong-cua-hang-ki-ot
Mặt bằng kinh doanh đẹp cho thuê 300m2 ở D3 Phường Phước Long B Quận 9,28 triệu/tháng,300 m²,"Quận 9, Hồ Chí Minh",cho-thue-sang-nhuong-cua-hang-ki-ot
Cho thuê mặt bằng mặt tiền đường Huỳnh Tấn Phát rộng rãi - Diện tích 115m2,25 triệu/tháng,115 m²,"Quận 7, Hồ Chí Minh",cho-thue-sang-nhuong-cua-hang-ki-ot
Sang tiệm nail Số 2C đường 17 P Linh Chiểu Q. Thủ Đức,8 triệu/tháng,60 m²,"Thủ Đức, Hồ Chí Minh",cho-thue-sang-nhuong-cua-hang-ki-ot
"Cho thuê nhà mặt tiền Nguyễn Thị Minh Khai, nhà đẹp 2 tầng, diện tích 60m2. Giá thuê chì 15tr",15 triệu/tháng,60 m²,"Nha Trang, Khánh Hòa",cho-thue-sang-nhuong-cua-hang-ki-ot
"Mặt bằng mặt tiền Nguyễn Thị Minh Khai, gần Tô Hiến Thành. Diện tích 300m2 ngang 10m",100 triệu/tháng,300 m²,"Nha Trang, Khánh Hòa",cho-thue-sang-nhuong-cua-hang-ki-ot
Mặt bằng kinh doanh đẹp cho thuê 250m2 ở Nguyễn Gia Trí Phường 25 Quận Bình Thạnh,47 triệu/tháng,250 m²,"Bình Thạnh, Hồ Chí Minh",cho-thue-sang-nhuong-cua-hang-ki-ot
"Cho thuê nhà hàng mặt tiền Hồng Bàng, gần Tô Hiến Thành. Diện tích 522m2 ngang 10m",200 triệu/tháng,522 m²,"Nha Trang, Khánh Hòa",cho-thue-sang-nhuong-cua-hang-ki-ot
Cho thuê MB kinh doanh Tỉnh Lộ 10 Q. Bình Tân - 490m2 - khu vực kinh doanh đông đúc,59 triệu/tháng,490 m²,"Bình Tân, Hồ Chí Minh",cho-thue-sang-nhuong-cua-hang-ki-ot
"Sang nhượng nhà hàng mặt tiền Hồng Bàng, gần Nguyễn Thị Minh Khai. DT 15m x 30m",60 triệu/tháng,300 m²,"Nha Trang, Khánh Hòa",cho-thue-sang-nhuong-cua-hang-ki-ot
Cho thuê MB kinh doanh 340m2 đường Nguyễn Thị Thập - Khu vực có dân cư đông đúc,180 triệu/tháng,340 m²,"Quận 7, Hồ Chí Minh",cho-thue-sang-nhuong-cua-hang-ki-ot
"Cho thuê shop góc hai mặt tiền, vị trí đẹp, đường Nguyễn Lương Bằng, Phú Mỹ Hưng LH 0931 155 ***",90 triệu/tháng,195 m²,"Quận 7, Hồ Chí Minh",cho-thue-sang-nhuong-cua-hang-ki-ot
"Cho thuê mặt bằng kinh doanh 528m2, đường Kha Vạn Cân, cho thuê dài hạn",115 triệu/tháng,528 m²,"Thủ Đức, Hồ Chí Minh",cho-thue-sang-nhuong-cua-hang-ki-ot
Cần sang nhượng mặt bằng kinh doanh,25 triệu/tháng,200 m²,"Thủ Đức, Hồ Chí Minh",cho-thue-sang-nhuong-cua-hang-ki-ot
"Cho thuê 3ki ốt liền kề đường Liên Huyện, Phường Tân Bình, TP. Dĩ An",15 triệu/tháng,144 m²,"Dĩ An, Bình Dương",cho-thue-sang-nhuong-cua-hang-ki-ot
"Mặt bằng trống 1.086 m2 đã trang bị máy che, và sàn gạch mới, đường số 7, TP. Thủ Đức - Quận 2",75 triệu/tháng,1.086 m²,"Quận 2, Hồ Chí Minh",cho-thue-sang-nhuong-cua-hang-ki-ot
Cho thuê mặt bằng 5x20m ngay sau Song Hành - Trống suốt,20 triệu/tháng,100 m²,"Quận 2, Hồ Chí Minh",cho-thue-sang-nhuong-cua-hang-ki-ot
"Cho thuê MBKD 12x20m, Bình Tân, An Lạc A, mặt tiền đường 7 - DT 240m2",120 triệu/tháng,240 m²,"Bình Tân, Hồ Chí Minh",cho-thue-sang-nhuong-cua-hang-ki-ot
"Cho thuê mặt bằng 600m2 ngay Quốc Lộ 22, Hóc Môn - xe công 40 ra vào",52 triệu/tháng,600 m²,"Hóc Môn, Hồ Chí Minh",cho-thue-sang-nhuong-cua-hang-ki-ot
Cho thuê mặt bằng kinh doanh cách mặt tiền đường chính 1 căn - 200m2 đường Số 1 - Quận Bình Tân,25 triệu/tháng,200 m²,"Bình Tân, Hồ Chí Minh",cho-thue-sang-nhuong-cua-hang-ki-ot
"Cho thuê MB xưởng gỗ 1000m2 đường Hà Huy Giáp - Có sẳn đèn, điện 3fa",38 triệu/tháng,1.000 m²,"Quận 12, Hồ Chí Minh",cho-thue-sang-nhuong-cua-hang-ki-ot
"Cho thuê MB 4x16m, Trương Công Định, P.14, Q.Tân Bình - 8 tr/tháng",8 triệu/tháng,64 m²,"Tân Bình, Hồ Chí Minh",cho-thue-sang-nhuong-cua-hang-ki-ot
"Cho thuê mặt bằng trung tâm thương mại "" Regal Legend "" đường biển Võ Nguyên Giáp TP Đồng Hới",Giá thỏa thuận,1.500 m²,"Đồng Hới, Quảng Bình",cho-thue-sang-nhuong-cua-hang-ki-ot
"Cho thuê mặt bằng kinh doanh 80m2 đường Phạm Văn Bạch, Phường 12, Quận Gò Vấp",22 triệu/tháng,80 m²,"Gò Vấp, Hồ Chí Minh",cho-thue-sang-nhuong-cua-hang-ki-ot
"Nguyễn Sơn Hà, Phường 5, Quận 3 - 84 m2 - cần cho thuê mặt bằng sạch đẹp",30 triệu/tháng,84 m²,"Quận 3, Hồ Chí Minh",cho-thue-sang-nhuong-cua-hang-ki-ot
"Trương Định, Phường 9, Quận 3, TP Hồ Chí Minh - MB đẹp 120 m2 - cần cho thuê",27 triệu/tháng,120 m²,"Quận 3, Hồ Chí Minh",cho-thue-sang-nhuong-cua-hang-ki-ot
"Mặt bằng cho thuê có gác, rộng 35m2",8 triệu/tháng,35 m²,"Tân Bình, Hồ Chí Minh",cho-thue-sang-nhuong-cua-hang-ki-ot
