Title,Price,Area,Location,type
"Phòng trọ hiện đại cho thuê ở Kỳ Đồng, Phường 09, Quận 3 DT 20m2","5,2 triệu/tháng",20 m²,"Quận 3, Hồ Chí Minh",cho-thue-nha-tro-phong-tro
"Phòng trọ hiện đại cho thuê ở Nam Kỳ Khởi Nghĩa, Phường Võ Thị Sáu, Quận 3, DT 30m2","6,3 triệu/tháng",30 m²,"Quận 3, Hồ Chí Minh",cho-thue-nha-tro-phong-tro
Căn hộ full nội thất siêu sang chảnh gần Lotte Mart Quận 7,"6,5 triệu/tháng",30 m²,"Quận 7, Hồ Chí Minh",cho-thue-nha-tro-phong-tro
"Phòng trọ hiện đại cho thuê ở Nguyễn Phi Khanh, Phường Tân Định Quận 1, DT 25m2","5,7 triệu/tháng",25 m²,"Quận 1, Hồ Chí Minh",cho-thue-nha-tro-phong-tro
Phòng trọ hiện đại cho thuê ở 19 Phường An Khánh Quận 2 DT 25m2,"4,5 triệu/tháng",25 m²,"Quận 2, Hồ Chí Minh",cho-thue-nha-tro-phong-tro
"Phòng trọ hiện đại cho thuê ở Trần Hưng Đạo, Phường Cầu Kho Quận 1, DT 20m2",5 triệu/tháng,20 m²,"Quận 1, Hồ Chí Minh",cho-thue-nha-tro-phong-tro
"Khai trương phòng mới 100% phòng mớisiêu xinh gần Cầu Chữ Y, Chợ Rạch Ông, CV Dạ Nam, ĐH CN Sài Gòn","6,5 triệu/tháng",30 m²,"Quận 8, Hồ Chí Minh",cho-thue-nha-tro-phong-tro
Cho thuê phòng CHDV full nội thất đẹp giá 5tr5/tháng. LH 0932 666 *** để xem phòng,"5,5 triệu/tháng",40 m²,"Quận 2, Hồ Chí Minh",cho-thue-nha-tro-phong-tro
"Phòng trọ hiện đại cho thuê ở Nguyễn Hữu Thọ xã Phước Kiển Huyện Nhà Bè, DT 76m2",6 triệu/tháng,76 m²,"Nhà Bè, Hồ Chí Minh",cho-thue-nha-tro-phong-tro
"Cho thuê phòng trọ 157 Cây Da, Dĩ An, Bình Dương","2,8 triệu/tháng",20 m²,"Dĩ An, Bình Dương",cho-thue-nha-tro-phong-tro
Cho thuê phòng 20m2 đường An Dương Vương Phường 10 Quận 6,"4,3 triệu/tháng",20 m²,"Quận 6, Hồ Chí Minh",cho-thue-nha-tro-phong-tro
Phòng mới 100% - đường Âu Dương Lân gần cầu chữ Y - 22m2,5 triệu/tháng,22 m²,"Quận 8, Hồ Chí Minh",cho-thue-nha-tro-phong-tro
"Phòng trọ hiện đại cho thuê ở Hoàng Văn Thụ, Phường 8, Quận Phú Nhuận DT 30m2","5,5 triệu/tháng",30 m²,"Phú Nhuận, Hồ Chí Minh",cho-thue-nha-tro-phong-tro
"Phòng trọ hiện đại cho thuê ở Đường Huỳnh Văn Bánh, Phường 11, Phú Nhuận, DT 20m2",4 triệu/tháng,20 m²,"Phú Nhuận, Hồ Chí Minh",cho-thue-nha-tro-phong-tro
"Phòng trọ full nội thất cửa sổ trời đường Đoàn Thị Điểm, Phan Đăng Lưu, ngay ngã tư Phú Nhuận",5 triệu/tháng,25 m²,"Phú Nhuận, Hồ Chí Minh",cho-thue-nha-tro-phong-tro
"Phòng trọ ban công full nội thất đường Phan Văn Hân, cầu Thị Nghè",6 triệu/tháng,30 m²,"Bình Thạnh, Hồ Chí Minh",cho-thue-nha-tro-phong-tro
Phòng căn hộ 2 gian bếp và phòng ngủ riêng biệt đường Bùi Đình Túy - 35 m2,6 triệu/tháng,35 m²,"Bình Thạnh, Hồ Chí Minh",cho-thue-nha-tro-phong-tro
Cho thuê phòng trọ đường NJ18 Mỹ Phước 3 Bến Cát Bình Dương có gác mới tinh sạch sẽ thoáng mát,1 triệu/tháng,20 m²,"Bến Cát, Bình Dương",cho-thue-nha-tro-phong-tro
Cho thuê phòng trọ đường NJ18 Mỹ Phước 3 Bến Cát Bình Dương có gác mới tinh sạch sẽ thoáng mát,1 triệu/tháng,20 m²,"Bến Cát, Bình Dương",cho-thue-nha-tro-phong-tro
Cho thuê phòng trọ đường NJ18 Mỹ Phước 3 Bến Cát Bình Dương có gác mới tinh sạch sẽ thoáng mát,1 triệu/tháng,20 m²,"Bến Cát, Bình Dương",cho-thue-nha-tro-phong-tro
Cho thuê phòng trọ đường NJ18 Mỹ Phước 3 Bến Cát Bình Dương có gác mới tinh sạch sẽ thoáng mát,1 triệu/tháng,20 m²,"Bến Cát, Bình Dương",cho-thue-nha-tro-phong-tro
"Phòng bacon cửa sổ lớn full nội thất máy giặt riêng CMT8, Quận 10","6,8 triệu/tháng",45 m²,"Quận 10, Hồ Chí Minh",cho-thue-nha-tro-phong-tro
"Dự án mới studio bancon, full nội thất cao cấp máy giặt riêng, trung tâm Q1 đường Nguyễn Thái Bình",7 triệu/tháng,35 m²,"Quận 1, Hồ Chí Minh",cho-thue-nha-tro-phong-tro
"Cho thuê phòng Bình Thạnh. Duplex full tiện ích. Lê Quang Định, Chợ Bà Chiểu","4,5 triệu/tháng",30 m²,"Bình Thạnh, Hồ Chí Minh",cho-thue-nha-tro-phong-tro
"Chính chủ cho thuê phòng rộng 33m2, ngay chợ Tân Bình, Lạc Long Quân",5 triệu/tháng,40 m²,"Tân Bình, Hồ Chí Minh",cho-thue-nha-tro-phong-tro
Khai trương CHDV giá học sinh sinh viên mới xây ngay Chợ Bà Quẹo,"4,2 triệu/tháng",28 m²,"Tân Bình, Hồ Chí Minh",cho-thue-nha-tro-phong-tro
"Cho thuê phòng Bàu Cát 1, Phường 14, Quận Tân Bình","5,5 triệu/tháng",45 m²,"Tân Bình, Hồ Chí Minh",cho-thue-nha-tro-phong-tro
"Sang nhanh dãy trọ 20p full khách HXT Huỳnh Tấn Phát, Nhà Bè",12 triệu/tháng,300 m²,"Nhà Bè, Hồ Chí Minh",cho-thue-nha-tro-phong-tro
"Cho thuê nhà trọ cao cấp Hà Mi. Giá 1tr8/th, 2tr5/th, liên hệ: 0906 848 ***","2,5 triệu/tháng",30 m²,"Cà Mau, Cà Mau",cho-thue-nha-tro-phong-tro
Chủ nhà cho thuê Duplex có ban công 30m2 - free xe,4 triệu/tháng,35 m²,"Quận 11, Hồ Chí Minh",cho-thue-nha-tro-phong-tro
"Duplex mới, máy giặt riêng, Âu Dương Lân Q8, cầu Nguyễn Văn Cừ, ĐH Sư Phạm","5,8 triệu/tháng",40 m²,"Quận 8, Hồ Chí Minh",cho-thue-nha-tro-phong-tro
Cho thuê phòng rộng 40m2 - Lê Quang Định Bình Thạnh,"6,5 triệu/tháng",40 m²,"Bình Thạnh, Hồ Chí Minh",cho-thue-nha-tro-phong-tro
Phòng đẹp ban công tách bếp full nội thất rộng 40m2,"6,3 triệu/tháng",35 m²,"Phú Nhuận, Hồ Chí Minh",cho-thue-nha-tro-phong-tro
Phòng trọ giá rẻ Quận 11 - mới 100% - đều có ban công,4 triệu/tháng,28 m²,"Quận 11, Hồ Chí Minh",cho-thue-nha-tro-phong-tro
"Cho thuê phòng trọ duplex ban công mới xây ngay chợ bà Quẹo, gần chung cư Melody Tân Bình","3,5 triệu/tháng",30 m²,"Tân Bình, Hồ Chí Minh",cho-thue-nha-tro-phong-tro
"Siêu phẩm duplex full nội thất, máy giặt riêng ngay Aeon Mall Tân Phú 3 phút di chuyển","4,4 triệu/tháng",30 m²,"Tân Phú, Hồ Chí Minh",cho-thue-nha-tro-phong-tro
Cho thuê phòng trọ sinh viên bancol đi bộ 150m đến ĐH Công Thương - Giữ phòng đầu T12,"4,1 triệu/tháng",30 m²,"Tân Phú, Hồ Chí Minh",cho-thue-nha-tro-phong-tro
Studio ban công full nội thất ngay sân bay - công viên Hoàng Văn Thụ tuyến đường Thăng Long,"5,3 triệu/tháng",30 m²,"Tân Bình, Hồ Chí Minh",cho-thue-nha-tro-phong-tro
Studio ban công full nội thất ngay khu K300 - Etown/ Lotte Mart Cộng Hoà - Cộng Hoà Plaza,"5,5 triệu/tháng",35 m²,"Tân Bình, Hồ Chí Minh",cho-thue-nha-tro-phong-tro
"Studio ban công Đoàn Văn Bơ Q4, gần cầu Khánh Hội, đh Luật, Nguyễn Tất Thành","6,4 triệu/tháng",30 m²,"Quận 4, Hồ Chí Minh",cho-thue-nha-tro-phong-tro
Khai trương phòng trọ duplex ban công mới 100% ngay Tân Sơn Nhì,"3,5 triệu/tháng",30 m²,"Tân Phú, Hồ Chí Minh",cho-thue-nha-tro-phong-tro
Khai trương phòng trọ duplex gác cao mới 100% nằm giữa đại học Công Thương và Văn Hiến,"3,5 triệu/tháng",20 m²,"Tân Phú, Hồ Chí Minh",cho-thue-nha-tro-phong-tro
"Phòng trọ sạch sẽ, an ninh đường Bàu Gia Thượng 2","1,6 triệu/tháng",35 m²,"Cẩm Lệ, Đà Nẵng",cho-thue-nha-tro-phong-tro
"Cho thuê phòng, trống sẵn tại Bình Thạnh, đối diện Landmark, view mặt tiền. Đúng hình đúng giá","6,2 triệu/tháng",55 m²,"Bình Thạnh, Hồ Chí Minh",cho-thue-nha-tro-phong-tro
"Gấp - Cần cho thuê, tại Bình Thạnh gần Landmark tiện qua Q1, full nội thất",8 triệu/tháng,40 m²,"Bình Thạnh, Hồ Chí Minh",cho-thue-nha-tro-phong-tro
"Cho thuê gấp, tại Bình Thạnh gần trường Hutech, nội thất như hình, diện tích 40m2","6,5 triệu/tháng",,"Bình Thạnh, Hồ Chí Minh",cho-thue-nha-tro-phong-tro
