Title,Price,Area,Location,type
"Mặt bằng kinh doanh vị trí vàng của đường Võ Thị Sáu, 20x30, giá siêu tốt",50 triệu/tháng,600 m²,"Biên Hòa, Đồng Nai",cho-thue-sang-nhuong-cua-hang-ki-ot
"Cho thuê mặt bằng kinh doanh ngay trường Song Ngữ Lạc Hồng phường Bửu Long, Biên Hòa giá tốt",12 triệu/tháng,85 m²,"Biên Hòa, Đồng Nai",cho-thue-sang-nhuong-cua-hang-ki-ot
"Chuyên ký gửi cho thuê MB kinh doanh, VP công ty, kho xưởng theo yêu cầu khu vực Q7, Nam Sài Gòn",100 triệu/tháng,1.000 m²,"Quận 7, Hồ Chí Minh",cho-thue-sang-nhuong-cua-hang-ki-ot
"Cho thuê sàn tầng 2, 600m2, view đường phố tấp nập làm nhà hàng, bar, bia club0906 218 ***",200 triệu/tháng,600 m²,"Thanh Xuân, Hà Nội",cho-thue-sang-nhuong-cua-hang-ki-ot
"Cho thuê mặt bằng đẳng cấp - Đường Nguyễn Gia Trí, Bình Thạnh 250m2 - hệ thống đèn hiện đại",47 triệu/tháng,250 m²,"Bình Thạnh, Hồ Chí Minh",cho-thue-sang-nhuong-cua-hang-ki-ot
"Ung Văn Khiêm Phường 25 Quận Bình Thạnh DT 350m2 cho thuê mặt bằng vị trí siêu đẹp, mặt tiền",45 triệu/tháng,350 m²,"Bình Thạnh, Hồ Chí Minh",cho-thue-sang-nhuong-cua-hang-ki-ot
Cho thuê mặt bằng gần chợ Đường Nguyễn Văn Lạc Bình Thạnh với DT 180m2 - vị trí tốt,70 triệu/tháng,180 m²,"Bình Thạnh, Hồ Chí Minh",cho-thue-sang-nhuong-cua-hang-ki-ot
"Mặt bằng kinh doanh đắc địa 300m2 cho thuê ở D3, Phường Phước Long B, Quận 9",28 triệu/tháng,300 m²,"Quận 9, Hồ Chí Minh",cho-thue-sang-nhuong-cua-hang-ki-ot
"Cho thuê mặt bằng DT 190m2 ở Tăng Nhơn Phú, Quận 9 - nằm trên con đường sầm uất",60 triệu/tháng,190 m²,"Quận 9, Hồ Chí Minh",cho-thue-sang-nhuong-cua-hang-ki-ot
"Với DT 190m2 cho thuê mặt tiền Huỳnh Tấn Phát - Cách Phú Mỹ Hưng 200m, ngay ngã tư Phú Thuận",38 triệu/tháng,190 m²,"Quận 7, Hồ Chí Minh",cho-thue-sang-nhuong-cua-hang-ki-ot
"Mặt bằng kinh doanh đắc địa 150m2 cho thuê ở Lạc Long Quân, Phường 11, Quận Tân Bình",25 triệu/tháng,150 m²,"Tân Bình, Hồ Chí Minh",cho-thue-sang-nhuong-cua-hang-ki-ot
"Cho thuê MB mặt tiền Lâm Văn Bền. Diện tích: 100m2. Đường Lâm Văn Bền, Phường Tân Quy, Quận 7",70 triệu/tháng,100 m²,"Quận 7, Hồ Chí Minh",cho-thue-sang-nhuong-cua-hang-ki-ot
"Mặt bằng kinh doanh đắc địa 80m2 cho thuê ở Phạm Văn Bạch, Phường 12, Quận Gò Vấp",22 triệu/tháng,80 m²,"Gò Vấp, Hồ Chí Minh",cho-thue-sang-nhuong-cua-hang-ki-ot
"Cho thuê MB decor sẵn 45m2 tại Đặng Văn Ngữ, PN khu KD sầm uất phù hợp kd quần áo, nail, salon tóc",18 triệu/tháng,45 m²,"Phú Nhuận, Hồ Chí Minh",cho-thue-sang-nhuong-cua-hang-ki-ot
"Mặt bằng kinh doanh đắc địa 130m2 cho thuê ở Âu Cơ, Phường 09, Quận Tân Bình",30 triệu/tháng,130 m²,"Tân Bình, Hồ Chí Minh",cho-thue-sang-nhuong-cua-hang-ki-ot
Cho thuê kiốt giá gốc. Cơ hội kinh doanh siêu lợi nhuận. Khách du lịch nước ngoài mua sắm quanh năm,"14,3 triệu/tháng","4,14 m²","Hải Châu, Đà Nẵng",cho-thue-sang-nhuong-cua-hang-ki-ot
Mặt bằng kinh doanh đắc địa 40m2 cho thuê ở Khánh Hội Phường 02 Quận 4,25 triệu/tháng,40 m²,"Quận 4, Hồ Chí Minh",cho-thue-sang-nhuong-cua-hang-ki-ot
"Mặt bằng kinh doanh đắc địa 100m2 cho thuê ở Cách Mạng Tháng Tám, Phường 13, Quận 10",25 triệu/tháng,100 m²,"Quận 10, Hồ Chí Minh",cho-thue-sang-nhuong-cua-hang-ki-ot
"Mặt bằng kinh doanh đắc địa 134.4m2 cho thuê ở Phan Văn Trị, Phường 07, Quận Gò Vấp",20 triệu/tháng,"134,4 m²","Gò Vấp, Hồ Chí Minh",cho-thue-sang-nhuong-cua-hang-ki-ot
"Mặt bằng kinh doanh đắc địa 60m2 cho thuê ở Đường Điện Biên Phủ, Phường 22, Bình Thạnh",22 triệu/tháng,60 m²,"Bình Thạnh, Hồ Chí Minh",cho-thue-sang-nhuong-cua-hang-ki-ot
Quận 12 diện tích 750m2 - Cho thuê mặt bằng mặt tiền Lê Văn Khương Phường Hiệp Thành,50 triệu/tháng,750 m²,"Quận 12, Hồ Chí Minh",cho-thue-sang-nhuong-cua-hang-ki-ot
Kiot Chợ Hàn Đà Nẵng - hòa mình trong sự đa dạng và sôi động,11 triệu/tháng,15 m²,"Hải Châu, Đà Nẵng",cho-thue-sang-nhuong-cua-hang-ki-ot
"Cho thuê cửa hàng kinh doanh tại Shop Mỹ Viên, Phú Mỹ Hưng, Q7. DT 168m2 giá 55tr/th. LH 0936 515 ***",55 triệu/tháng,168 m²,"Quận 7, Hồ Chí Minh",cho-thue-sang-nhuong-cua-hang-ki-ot
Mặt bằng kinh doanh đắc địa 100m2 cho thuê ở Bình Lợi Phường 13 Quận Bình Thạnh,21 triệu/tháng,100 m²,"Bình Thạnh, Hồ Chí Minh",cho-thue-sang-nhuong-cua-hang-ki-ot
"Mặt bằng kinh doanh đắc địa 140m2 cho thuê ở Tân Kỳ Tân Quý, Phường Tân Quý, Quận Tân Phú",25 triệu/tháng,140 m²,"Tân Phú, Hồ Chí Minh",cho-thue-sang-nhuong-cua-hang-ki-ot
Cho thuê mặt bằng góc 2 mặt tiền Lâm Văn Bền. Diện tích 100m2,70 triệu/tháng,100 m²,"Quận 7, Hồ Chí Minh",cho-thue-sang-nhuong-cua-hang-ki-ot
Mặt bằng kinh doanh đắc địa 100m2 cho thuê ở Tên Lửa Phường Bình Trị Đông B quận Bình Tân,20 triệu/tháng,100 m²,"Bình Tân, Hồ Chí Minh",cho-thue-sang-nhuong-cua-hang-ki-ot
Mặt bằng kinh doanh đắc địa 80m2 cho thuê ở Tôn Thất Thuyết Phường 16 Quận 4,30 triệu/tháng,80 m²,"Quận 4, Hồ Chí Minh",cho-thue-sang-nhuong-cua-hang-ki-ot
Kiot Chợ Hàn - Đà Nẵng: Nơi bắt đầu hành trình kinh doanh độc đáo,Giá thỏa thuận,5 m²,"Hải Châu, Đà Nẵng",cho-thue-sang-nhuong-cua-hang-ki-ot
Khám phá cơ hội đầu tư sáng tạo tại Kiot Chợ Hàn - Đà Nẵng,Giá thỏa thuận,5 m²,"Hải Châu, Đà Nẵng",cho-thue-sang-nhuong-cua-hang-ki-ot
Chia sẻ mặt bằng kinh doanh - DT 400m2 làm kho đường Trần Não 100 triệu/tháng,100 triệu/tháng,400 m²,"Quận 2, Hồ Chí Minh",cho-thue-sang-nhuong-cua-hang-ki-ot
"Mặt bằng kinh doanh đắc địa 100m2 cho thuê ở Trần Trọng Cung, Phường Tân Thuận Đông, Quận 7",20 triệu/tháng,100 m²,"Quận 7, Hồ Chí Minh",cho-thue-sang-nhuong-cua-hang-ki-ot
Cho thuê mặt bằng - 320m2 nhà hàng đang có sẵn ở TT Q7 gần Lotte Mart,75 triệu/tháng,320 m²,"Quận 7, Hồ Chí Minh",cho-thue-sang-nhuong-cua-hang-ki-ot
"Tại Lý Thường Kiệt, Quận 11 - cho thuê mặt bằng trống mặt tiền với DT 270m2",90 triệu/tháng,270 m²,"Quận 11, Hồ Chí Minh",cho-thue-sang-nhuong-cua-hang-ki-ot
"Cho thuê mặt bằng kinh doanh, Nguyễn Thanh Sơn, Quận 2 - DT 380m2",90 triệu/tháng,380 m²,"Quận 2, Hồ Chí Minh",cho-thue-sang-nhuong-cua-hang-ki-ot
"Đường Nguyễn Đình Chiểu - Cho thuê mặt bằng kinh doanh 145m2 - Phường Đa Kao, Quận 1",45 triệu/tháng,145 m²,"Quận 1, Hồ Chí Minh",cho-thue-sang-nhuong-cua-hang-ki-ot
Cho thuê mặt bằng kinh doanh tại KV đông dân cư Quận Tân Bình,150 triệu/tháng,280 m²,"Tân Bình, Hồ Chí Minh",cho-thue-sang-nhuong-cua-hang-ki-ot
"Đường Lý Tự Trọng, Phường Bến Thành, Quận 1 - mặt bằng kinh doanh 80m2 tại trung tâm",55 triệu/tháng,80 m²,"Quận 1, Hồ Chí Minh",cho-thue-sang-nhuong-cua-hang-ki-ot
Mặt bằng kinh doanh đắc địa 100m2 cho thuê ở Nguyễn Hồng Đào Phường 14 Quận Tân Bình,30 triệu/tháng,50 m²,"Tân Bình, Hồ Chí Minh",cho-thue-sang-nhuong-cua-hang-ki-ot
Sang quán cafe đang kinh doanh có lợi nhuận mỗi tháng 80 - 100tr,88 triệu/tháng,160 m²,"Quận 1, Hồ Chí Minh",cho-thue-sang-nhuong-cua-hang-ki-ot
"Sang nhượng hoặc cho thuê nhà hàng kinh doanh mặt tiền Tú Xương, Quận 3","289,39 triệu/tháng",260 m²,"Quận 3, Hồ Chí Minh",cho-thue-sang-nhuong-cua-hang-ki-ot
"Mặt bằng kinh doanh đắc địa 45m2 cho thuê ở Đồng Đen, Phường 14, Quận Tân Bình",18 triệu/tháng,45 m²,"Tân Bình, Hồ Chí Minh",cho-thue-sang-nhuong-cua-hang-ki-ot
"Cho thuê mặt bằng gần 400m2 mới xây mặt tiền Nguyễn Ái Quốc, p. Tân Tiến",60 triệu/tháng,383 m²,"Biên Hòa, Đồng Nai",cho-thue-sang-nhuong-cua-hang-ki-ot
Cho thuê mặt bằng kinh doanh Quốc Hương 150m2 vị trí cực đẹp giá 55 triệu/tháng,55 triệu/tháng,150 m²,"Quận 2, Hồ Chí Minh",cho-thue-sang-nhuong-cua-hang-ki-ot
"Cho thuê mặt bằng kinh doanh Thảo Điền, vị trí cực đẹp 82m2, giá 28tr/tháng",28 triệu/tháng,82 m²,"Quận 2, Hồ Chí Minh",cho-thue-sang-nhuong-cua-hang-ki-ot
"Mặt bằng kinh doanh đắc địa 88m2 cho thuê ở Nguyễn Thái Bình, Phường Nguyễn Thái Bình, Quận 1",25 triệu/tháng,88 m²,"Quận 1, Hồ Chí Minh",cho-thue-sang-nhuong-cua-hang-ki-ot
"Mặt bằng kinh doanh đắc địa 180m2 cho thuê ở Nguyễn Thái Bình, Phường 12, Quận Tân Bình",20 triệu/tháng,180 m²,"Tân Bình, Hồ Chí Minh",cho-thue-sang-nhuong-cua-hang-ki-ot
"Mặt bằng kinh doanh đắc địa 60.2m2 cho thuê ở Nam Kỳ Khởi Nghĩa, Phường 09, Quận 3",20 triệu/tháng,"60,2 m²","Quận 3, Hồ Chí Minh",cho-thue-sang-nhuong-cua-hang-ki-ot
"Mặt bằng kinh doanh đắc địa 140m2 cho thuê ở Nguyễn Bỉnh Khiêm, Phường Đa Kao, Quận 1",25 triệu/tháng,140 m²,"Quận 1, Hồ Chí Minh",cho-thue-sang-nhuong-cua-hang-ki-ot
"Độc quyền! Cho thuê MB - diện tích 160m2 - vị trí đắc địa, Nguyễn Chí Thanh, Quận 5",130 triệu/tháng,160 m²,"Quận 5, Hồ Chí Minh",cho-thue-sang-nhuong-cua-hang-ki-ot
"Kiot Chợ Hàn - Đà Nẵng: Nơi kinh doanh độc đáo, năng động",15 triệu/tháng,10 m²,"Hải Châu, Đà Nẵng",cho-thue-sang-nhuong-cua-hang-ki-ot
"Mặt bằng kinh doanh đắc địa 70m2 cho thuê ở Huỳnh Văn Bánh, Phường 15, Quận Phú Nhuận",10 triệu/tháng,70 m²,"Phú Nhuận, Hồ Chí Minh",cho-thue-sang-nhuong-cua-hang-ki-ot
"Cho thuê mặt bằng giá 70 triệu/tháng diện tích rộng 1.000m2, Quốc Lộ 50, Bình Chánh",70 triệu/tháng,1.000 m²,"Bình Chánh, Hồ Chí Minh",cho-thue-sang-nhuong-cua-hang-ki-ot
Mặt bằng kinh doanh gần chợ Hà Đông,10 triệu/tháng,65 m²,"Hà Đông, Hà Nội",cho-thue-sang-nhuong-cua-hang-ki-ot
Cho thuê mặt bằng diện tích: 2500m2 mặt tiền đường Hậu Giang,350 triệu/tháng,2.500 m²,"Quận 6, Hồ Chí Minh",cho-thue-sang-nhuong-cua-hang-ki-ot
"Cần cho thuê mặt bằng làm cửa hàng Cư Xá Đô Thành, P4, Q3 50m2 không chung chủ cho ở lại",11 triệu/tháng,50 m²,"Quận 3, Hồ Chí Minh",cho-thue-sang-nhuong-cua-hang-ki-ot
"Cho thuê mặt bằng kinh doanh mặt tiền Quốc Lộ 1A, gần dốc Ông Phật",35 triệu/tháng,1.000 m²,"Quy Nhơn, Bình Định",cho-thue-sang-nhuong-cua-hang-ki-ot
"Mặt bằng kinh doanh Nguyễn Trung Trực , phường Vĩnh Lạc ngang 8,5m kèm theo căn biệt thự sân vườn",Giá thỏa thuận,595 m²,"Rạch Giá, Kiên Giang",cho-thue-sang-nhuong-cua-hang-ki-ot
"Cho thuê nhà 395 Nguyễn Trung Trực, P Vĩnh Lạc, TP Rạch Giá, tỉnh Kiên Giang (nhận tìm MB, nhà)",Giá thỏa thuận,165 m²,"Rạch Giá, Kiên Giang",cho-thue-sang-nhuong-cua-hang-ki-ot
"Cho thuê mặt bằng 180m2 trung tâm đường huyết mạch Quận 7, thoải mái kinh doanh các loại hình",35 triệu/tháng,180 m²,"Quận 7, Hồ Chí Minh",cho-thue-sang-nhuong-cua-hang-ki-ot
Cho thuê 300m2 sân thượng mặt tiền Quận 10. View cực chill. Không gian mở vô cùng thoáng mát gía rẻ,65 triệu/tháng,300 m²,"Quận 10, Hồ Chí Minh",cho-thue-sang-nhuong-cua-hang-ki-ot
"Nhượng toàn bộ cửa hàng thời trang, Phố Thái Hà, Phường Trung Liệt, Đống Đa, Hà Nội",Giá thỏa thuận,75 m²,"Đống Đa, Hà Nội",cho-thue-sang-nhuong-cua-hang-ki-ot
"Cho thuê cửa hàng mặt tiền Xuân Thủy 320m2 - sân vườn - phù hợp nhà hàng, cafe - showroom",150 triệu/tháng,320 m²,"Quận 2, Hồ Chí Minh",cho-thue-sang-nhuong-cua-hang-ki-ot
Cho thuê MB DT 10x30m TT Liên Nghĩa kinh doanh đa ngành nghề,22 triệu/tháng,300 m²,"Đức Trọng, Lâm Đồng",cho-thue-sang-nhuong-cua-hang-ki-ot
"Chính chủ cho thuê mặt bằng kinh doanh, ngang 10m, diện tích sàn 380m2, vỉa hè rộng rãi",90 triệu/tháng,380 m²,"Ninh Kiều, Cần Thơ",cho-thue-sang-nhuong-cua-hang-ki-ot
"Cho thuê mặt tiền ngang 8x25m, mặt tiền Cách Mạng Tháng Tám Quận Tân Bình",125 triệu/tháng,200 m²,"Tân Bình, Hồ Chí Minh",cho-thue-sang-nhuong-cua-hang-ki-ot
Cần sang ki ốt Han Square - phục vụ 5000 lượt mua sắm/ngày. Chủ yếu khách Hàn Quốc và khách Tây,17 triệu/tháng,5 m²,"Hải Châu, Đà Nẵng",cho-thue-sang-nhuong-cua-hang-ki-ot
Sang nhượng ki ốt kinh doanh siêu lợi nhuận HanSquare ngay tuyến phố du lịch đông đúc nhất Đà Nẵng,10 triệu/tháng,3 m²,"Hải Châu, Đà Nẵng",cho-thue-sang-nhuong-cua-hang-ki-ot
"Thuê thẳng mặt bằng 300 m2 MT 30 mét Láng Hạ, Đống Đa 120 tr/ tháng. Mọi mô hình kinh doanh",120 triệu/tháng,300 m²,"Đống Đa, Hà Nội",cho-thue-sang-nhuong-cua-hang-ki-ot
"Cho thuê nhà nguyên căn đường Quốc Hương, trệt 2 lầu (thu nhập 85tr/tháng). Giá thuê chỉ: 35tr",35 triệu/tháng,140 m²,"Quận 2, Hồ Chí Minh",cho-thue-sang-nhuong-cua-hang-ki-ot
"Han Square là dự án độc đáo, đẳng cấp, liền kề chợ Hàn, ngay tâm điểm du lịch giữa Cầu Rồng",12 triệu/tháng,3 m²,"Hải Châu, Đà Nẵng",cho-thue-sang-nhuong-cua-hang-ki-ot
"Cho thuê mặt bằng Nguyễn Duy Trinh, P.Bình Trưng Tây, Q2. DT 6x22m 1 lầu. Nhà mới. Giá chỉ 20tr",20 triệu/tháng,160 m²,"Quận 2, Hồ Chí Minh",cho-thue-sang-nhuong-cua-hang-ki-ot
Sang nhượng cửa hàng kinh doanh đối diện chợ Hàn,Giá thỏa thuận,"3,25 m²","Hải Châu, Đà Nẵng",cho-thue-sang-nhuong-cua-hang-ki-ot
"Cho thuê mặt bằng mặt tiền Phạm Vấn, P. Phú Thọ Hoà, Q. Tân Phú - 4x14m, 1 lầu 2PN. Giá: 10tr/th",10 triệu/tháng,90 m²,"Tân Phú, Hồ Chí Minh",cho-thue-sang-nhuong-cua-hang-ki-ot
Chỉ từ 1tỉ035triệu sở hữu ki ốt siêu lợi nhuận Han Square. Trung tâm mua sắm sầm uất có 1 không 2,"10,2 triệu/tháng",3 m²,"Hải Châu, Đà Nẵng",cho-thue-sang-nhuong-cua-hang-ki-ot
"Kiot Chợ Hàn - Đà Nẵng: Nơi kinh doanh độc đáo, năng động. Sở hữu lâu dài",14 triệu/tháng,13 m²,"Hải Châu, Đà Nẵng",cho-thue-sang-nhuong-cua-hang-ki-ot
"Mở bán 45 ki ốt thương xá chợ Hàn, tâm điểm mua sắm của khách du lịch Hàn Quốc",17 triệu/tháng,5 m²,"Hải Châu, Đà Nẵng",cho-thue-sang-nhuong-cua-hang-ki-ot
Cho thuê 1000m2 MTKD 653 Nguyễn Trãi. DT: 15 x 40m. Bàn giao liền. Thời hạn 5 - 7 năm,Giá thỏa thuận,1.000 m²,"Quận 5, Hồ Chí Minh",cho-thue-sang-nhuong-cua-hang-ki-ot
Han Square - Một cơ hội đầu tư - ngàn cơ hội sinh lời tại đà nẵng,"11,2 triệu/tháng",4 m²,"Hải Châu, Đà Nẵng",cho-thue-sang-nhuong-cua-hang-ki-ot
"Cho thuê ki ốt ngay tại chợ Hàn, kinh doanh siêu lợi nhuận 300% với 2000 lượt khách nước ngoài/ngày",8 triệu/tháng,3 m²,"Hải Châu, Đà Nẵng",cho-thue-sang-nhuong-cua-hang-ki-ot
Cho thuê mặt bằng kinh doanh đắc địa ở Nguyễn Thái Học Phường Cầu Ông Lãnh Quận 1 DT 30m2,20 triệu/tháng,30 m²,"Quận 1, Hồ Chí Minh",cho-thue-sang-nhuong-cua-hang-ki-ot
"Cho thuê Mặt bằng kinh doanh đắc địa ở Đường Ung Văn Khiêm, Phường 25, Bình Thạnh, DT 132m2",30 triệu/tháng,132 m²,"Bình Thạnh, Hồ Chí Minh",cho-thue-sang-nhuong-cua-hang-ki-ot
"Cho thuê mặt bằng kinh doanh giá rẻ nhất tại đường Phạm Văn Thuận, 4x29 giá chỉ 15tr/th",15 triệu/tháng,115 m²,"Biên Hòa, Đồng Nai",cho-thue-sang-nhuong-cua-hang-ki-ot
Siêu lợi nhuận từ kiot TX chợ Hàn - trung tâm mua sắm và du lịch Đà Nẵng chỉ từ 11 triệu,11 triệu/tháng,"4,8 m²","Hải Châu, Đà Nẵng",cho-thue-sang-nhuong-cua-hang-ki-ot
"Cho thuê mặt bằng kinh doanh đắc địa ở Phan Văn Trị, Phường 07, Quận Gò Vấp, DT 134.4m2",20 triệu/tháng,"134,4 m²","Gò Vấp, Hồ Chí Minh",cho-thue-sang-nhuong-cua-hang-ki-ot
Mặt bằng Phạm Văn Đồng Hiệp Bình Chánh Thủ Đức. Đối diện Gigamall,90 triệu/tháng,284 m²,"Thủ Đức, Hồ Chí Minh",cho-thue-sang-nhuong-cua-hang-ki-ot
"Cho thuê mặt bằng kinh doanh mặt tiền QL1A, Quận 12 với DT 350m2",32 triệu/tháng,350 m²,"Quận 12, Hồ Chí Minh",cho-thue-sang-nhuong-cua-hang-ki-ot
"Tổ hợp 8 tầng mua sắm, giải trí, khách sạn tại trung tâm Đà Nẵng - Han Square thương xá chợ Hàn",Giá thỏa thuận,9 m²,"Hải Châu, Đà Nẵng",cho-thue-sang-nhuong-cua-hang-ki-ot
"Cho thuê mặt bằng đẹp đường 4 gần trường Nguyễn An Ninh, 7,2m x 28m",24 triệu/tháng,210 m²,"Biên Hòa, Đồng Nai",cho-thue-sang-nhuong-cua-hang-ki-ot
"""ki - ốt chợ Hàn - đầu tư tại Đà Nẵng, hưởng lợi tức thì!",Giá thỏa thuận,"4,9 m²","Hải Châu, Đà Nẵng",cho-thue-sang-nhuong-cua-hang-ki-ot
Cho thuê ổn định 6 năm kiot chợ Hàn - Trung tâm thương mại Hàn Quốc Han Square - chỉ từ 11tr/tháng,"11,2 triệu/tháng",9 m²,"Hải Châu, Đà Nẵng",cho-thue-sang-nhuong-cua-hang-ki-ot
"DT - 200m2 cho thuê mặt bằng đường Trần Bình Trọng, Phường 1, Quận 5 giá 35.000.000 đ/tháng",35 triệu/tháng,200 m²,"Quận 5, Hồ Chí Minh",cho-thue-sang-nhuong-cua-hang-ki-ot
Ki - ot kinh doanh Han Square ngay chợ Hàn Đà Nẵng cho thuê giá cố định 6 năm,Giá thỏa thuận,4 m²,"Hải Châu, Đà Nẵng",cho-thue-sang-nhuong-cua-hang-ki-ot
"Mặt bằng tại Mã Lò, đang cho thuê với giá cả phải chăng - DT 300m2 - 90tr/tháng",90 triệu/tháng,300 m²,"Bình Tân, Hồ Chí Minh",cho-thue-sang-nhuong-cua-hang-ki-ot
"Chỉ từ 11triệu/tháng sở hữu ngay vị trí đẹp nhất Han Square - Thương xá chợ Hàn, kinh doanh sầm uất",Giá thỏa thuận,5 m²,"Hải Châu, Đà Nẵng",cho-thue-sang-nhuong-cua-hang-ki-ot
Tết đến xuân về - nhanh tay sở hữu kiot tại chợ Hàn để nhận ưu đãi khủng,"11,2 triệu/tháng",4 m²,"Hải Châu, Đà Nẵng",cho-thue-sang-nhuong-cua-hang-ki-ot
"Cho thuê mặt bằng kinh doanh đắc địa ở Nguyễn Ảnh Thủ, Phường Hiệp Thành, Quận 12, DT 210m2",25 triệu/tháng,210 m²,"Quận 12, Hồ Chí Minh",cho-thue-sang-nhuong-cua-hang-ki-ot
"Cho thuê mặt bằng kinh doanh đắc địa ở Tam Đảo, Phường 15, Quận 10, DT 70m2",20 triệu/tháng,70 m²,"Quận 10, Hồ Chí Minh",cho-thue-sang-nhuong-cua-hang-ki-ot
"Đường Nguyễn Đình Chiểu, Phường Đa Kao - Cho thuê mặt bằng kinh doanh 145m2",45 triệu/tháng,145 m²,"Quận 1, Hồ Chí Minh",cho-thue-sang-nhuong-cua-hang-ki-ot
"Cho Thuê Mặt Bằng Vô Cùng Độc Đáo - 800m - Phan Xích Long, P. 02, Q. Phú Nhuận",90 triệu/tháng,800 m²,"Phú Nhuận, Hồ Chí Minh",cho-thue-sang-nhuong-cua-hang-ki-ot
Cho thuê mặt bằng kinh doanh đắc địa ở Bình Lợi Phường 13 Quận Bình Thạnh DT 100m2,23 triệu/tháng,100 m²,"Bình Thạnh, Hồ Chí Minh",cho-thue-sang-nhuong-cua-hang-ki-ot
Lý do ki ốt thương xá chợ Hàn - Han Square là lựa chọn đầu tư hàng đầu,11 triệu/tháng,"3,25 m²","Hải Châu, Đà Nẵng",cho-thue-sang-nhuong-cua-hang-ki-ot
Cho thuê Ki - ot kinh doanh ngay chợ Hàn - Chỉ 11 triệu/tháng,Giá thỏa thuận,7 m²,"Hải Châu, Đà Nẵng",cho-thue-sang-nhuong-cua-hang-ki-ot
"Đường Hồng Lạc, Phường 11, Tân Bình - cho thuê MBKD 300m2 khu vực sầm uất",50 triệu/tháng,300 m²,"Tân Bình, Hồ Chí Minh",cho-thue-sang-nhuong-cua-hang-ki-ot
"Cho thuê mặt bằng kinh doanh đắc địa ở Đường Điện Biên Phủ, Phường 22, Bình Thạnh DT 60m2",22 triệu/tháng,60 m²,"Bình Thạnh, Hồ Chí Minh",cho-thue-sang-nhuong-cua-hang-ki-ot
"Cho thuê DTSD 256 m2 - mặt tiền kinh doanh đường Đỗ Bí, Phường Phú Thạnh, Quận Tân Phú",33 triệu/tháng,256 m²,"Tân Phú, Hồ Chí Minh",cho-thue-sang-nhuong-cua-hang-ki-ot
Cho thuê mặt bằng kinh doanh đắc địa ở Tôn Thất Thuyết Phường 16 Quận 4 DT 80m2,30 triệu/tháng,80 m²,"Quận 4, Hồ Chí Minh",cho-thue-sang-nhuong-cua-hang-ki-ot
"Đường Phan Đăng Lưu, Phường 2, Quận Phú Nhuận - Cho thuê mặt bằng kinh doanh 40m2",40 triệu/tháng,40 m²,"Phú Nhuận, Hồ Chí Minh",cho-thue-sang-nhuong-cua-hang-ki-ot
"Cho thuê mặt bằng kinh doanh đắc địa ở Tên Lửa, Phường Bình Trị Đông B, Quận Bình Tân DT 100m2",20 triệu/tháng,100 m²,"Bình Tân, Hồ Chí Minh",cho-thue-sang-nhuong-cua-hang-ki-ot
"Cho thuê mặt bằng kinh doanh đắc địa Tân Kỳ Tân Quý, Phường Bình Hưng Hoà A, Quận Bình Tân DT 80m2",25 triệu/tháng,80 m²,"Bình Tân, Hồ Chí Minh",cho-thue-sang-nhuong-cua-hang-ki-ot
"Mặt bằng cho thuê độc đáo tại Trần Não, Phường An Khánh (Quận 2 cũ) - DT 930m2",200 triệu/tháng,930 m²,"Quận 2, Hồ Chí Minh",cho-thue-sang-nhuong-cua-hang-ki-ot
"Cho thuê mặt bằng kinh doanh đắc địa ở Tân Kỳ Tân Quý, phường Tân Quý, quận Tân Phú DT 140m2",25 triệu/tháng,140 m²,"Tân Phú, Hồ Chí Minh",cho-thue-sang-nhuong-cua-hang-ki-ot
"Cho thuê mặt bằng kinh doanh đắc địa ở 2F, Phường An Lạc, Quận Bình Tân DT 90m2",10 triệu/tháng,90 m²,"Bình Tân, Hồ Chí Minh",cho-thue-sang-nhuong-cua-hang-ki-ot
"Cho thuê mặt bằng kinh doanh đắc địa 600m2 ở Hoàng Văn Thụ, Phường 02, Quận Tân Bình",60 triệu/tháng,600 m²,"Tân Bình, Hồ Chí Minh",cho-thue-sang-nhuong-cua-hang-ki-ot
"Ki - ốt chợ Hàn, mang lại nhiều hơn những gì khách hàng kì vọng",12 triệu/tháng,4 m²,"Hải Châu, Đà Nẵng",cho-thue-sang-nhuong-cua-hang-ki-ot
"Cho thuê mặt bằng - Vị trí đắc địa tại Phường 2, Quận Tân Bình, TP. HCM - 600m2",60 triệu/tháng,600 m²,"Phú Nhuận, Hồ Chí Minh",cho-thue-sang-nhuong-cua-hang-ki-ot
Đường Hoàng Văn Thụ cho thuê mặt bằng 600m2 - vị trí đắc địa tại phường 2 Quận Tân Bình,60 triệu/tháng,600 m²,"Tân Bình, Hồ Chí Minh",cho-thue-sang-nhuong-cua-hang-ki-ot
"Cho thuê mặt bằng trục đường Dương Tử Giang chỉ 20tr, nhà 3 tầng kiên cố",20 triệu/tháng,130 m²,"Biên Hòa, Đồng Nai",cho-thue-sang-nhuong-cua-hang-ki-ot
"Cho thuê mặt bằng kinh doanh đường N1 giá tốt, hiện trạng đẹp, vào hoạt động ngay",22 triệu/tháng,90 m²,"Biên Hòa, Đồng Nai",cho-thue-sang-nhuong-cua-hang-ki-ot
Cho thuê mặt bằng kinh doanh Phạm Văn Thuận vị trí vàng thuận tiện kinh doanh phù hợp mọi mô hình,75 triệu/tháng,300 m²,"Biên Hòa, Đồng Nai",cho-thue-sang-nhuong-cua-hang-ki-ot
"Han Square - Một cơ hội đầu tư, ngàn cơ hội sinh lời",Giá thỏa thuận,5 m²,"Hải Châu, Đà Nẵng",cho-thue-sang-nhuong-cua-hang-ki-ot
"Cho thuê mặt bằng - vị trí đắc địa tại phường 2, quận Tân Bình, TP. HCM - giá 60 triệu/th - 600m2",60 triệu/tháng,600 m²,"Tân Bình, Hồ Chí Minh",cho-thue-sang-nhuong-cua-hang-ki-ot
"Cho thuê mặt bằng Quốc Hương, Phường Thảo Điền, Quận 2 - DT 800m2",200 triệu/tháng,350 m²,"Quận 2, Hồ Chí Minh",cho-thue-sang-nhuong-cua-hang-ki-ot
"Đường Linh Đông, Thủ Đức - Cho thuê mặt bằng 250m2, vị trí: Đẹp, khu dân cư đông đúc",50 triệu/tháng,250 m²,"Thủ Đức, Hồ Chí Minh",cho-thue-sang-nhuong-cua-hang-ki-ot
Cần cho thuê gấp 2 kiot kinh doanh trước tết ngay trung tâm chợ Hàn - khu phố Hàn Quốc,Giá thỏa thuận,7 m²,"Hải Châu, Đà Nẵng",cho-thue-sang-nhuong-cua-hang-ki-ot
"Kiot Han Square - một cơ hội đầu tư, ngàn cơ hội sinh lời",Giá thỏa thuận,13 m²,"Hải Châu, Đà Nẵng",cho-thue-sang-nhuong-cua-hang-ki-ot
"Cần sang nhượng mặt bằng - có DT 80m2 ở ĐS79, Quận 7",17 triệu/tháng,80 m²,"Quận 7, Hồ Chí Minh",cho-thue-sang-nhuong-cua-hang-ki-ot
"Cho thuê mặt bằng kinh doanh đắc địa ở Trần Trọng Cung, Phường Tân Thuận Đông, Quận 7 DT 100m2",20 triệu/tháng,100 m²,"Quận 7, Hồ Chí Minh",cho-thue-sang-nhuong-cua-hang-ki-ot
Cho thuê ki - ot ngay chợ Hàn - giá rẻ - Kinh doanh buôn bán sầm uất,12 triệu/tháng,8 m²,"Hải Châu, Đà Nẵng",cho-thue-sang-nhuong-cua-hang-ki-ot
"Cho thuê mặt bằng kinh doanh đắc địa 600m2 ở Hoàng Văn Thụ, Phường 2, Quận Tân Bình",60 triệu/tháng,600 m²,"Tân Bình, Hồ Chí Minh",cho-thue-sang-nhuong-cua-hang-ki-ot
"Cho thuê mặt bằng có DT 600m2 vị trí đắc địa tại Phường 2, Quận Tân Bình, TP. HCM - Giá 60 triệu/th",60 triệu/tháng,600 m²,"Tân Bình, Hồ Chí Minh",cho-thue-sang-nhuong-cua-hang-ki-ot
Sang nhượng kiot 5m/2 mặt tiền kinh doanh 23 Nguyễn Thái Học,Giá thỏa thuận,5 m²,"Hải Châu, Đà Nẵng",cho-thue-sang-nhuong-cua-hang-ki-ot
"Đường Tân Phú, mặt tiền Huỳnh Văn Một - Cho thuê mặt bằng tầng trệt 120m2",36 triệu/tháng,120 m²,"Tân Phú, Hồ Chí Minh",cho-thue-sang-nhuong-cua-hang-ki-ot
