Title,Price,Area,Location,type
"Chính chủ cần cho thuê gấp kho xưởng đường Phạm Hữu Lầu. Dt: 660m2 có hệ thống PCCC, giá 100k/m2/th",100 nghìn/m²,660 m²,"Nhà Bè, Hồ Chí Minh",cho-thue-kho-nha-xuong-dat
"Đất trống siêu rộng 27x30m mặt tiền Đinh Bộ Lĩnh Q,Bình Thạnh giá tốt chỉ 180 triệu/th",160 triệu/tháng,810 m²,"Bình Thạnh, Hồ Chí Minh",cho-thue-kho-nha-xuong-dat
Chính chủ cho thuê kho 65m2 tại Tân Thụy Phúc đồng,Giá thỏa thuận,65 m²,"Long Biên, Hà Nội",cho-thue-kho-nha-xuong-dat
Trải nghiệm miễn phí 1 tháng lưu trữ hàng hóa tại kho/xưởng TTC Đặng Huỳnh,Giá thỏa thuận,20.000 m²,"Đức Hòa, Long An",cho-thue-kho-nha-xuong-dat
"Cho thuê kho xưởng mt đường Phạm Hữu Lầu, Phước Kiển, Nhà Bè. Kho mới hơn 800m2 giá 60tr/tháng",60 triệu/tháng,804 m²,"Nhà Bè, Hồ Chí Minh",cho-thue-kho-nha-xuong-dat
"Cho thuê kho, xưởng tại khu công nghiệp Vĩnh Hoàng. Diện tích từ 400m2 đến 1000m2",Giá thỏa thuận,1.000 m²,"Hoàng Mai, Hà Nội",cho-thue-kho-nha-xuong-dat
Cho thuê sân cầu lông 2000 - 12.000m2 An Phú - Q2 - có GPXD (HD 10 năm),40 nghìn/m²,2.000 m²,"Quận 2, Hồ Chí Minh",cho-thue-kho-nha-xuong-dat
Chính chủ cho thuê kho 100 - 200 - 300m2 tại Trung Văn - gần Hà Đông 0942 199 ***,Giá thỏa thuận,100 m²,"Nam Từ Liêm, Hà Nội",cho-thue-kho-nha-xuong-dat
"Cho thuê kho xưởng Hương Lộ 2, DT: 850m2, giá: 55tr/tháng, Bình Tân",55 triệu/tháng,850 m²,"Bình Tân, Hồ Chí Minh",cho-thue-kho-nha-xuong-dat
Chính chủ cho thuê kho xưởng tại La Phù - An Khánh - Lê Trọng Tấn - Hà Đông - Hà Nội,Giá thỏa thuận,10.000 m²,"Hoài Đức, Hà Nội",cho-thue-kho-nha-xuong-dat
"Cho thuê kho 1000m2, gần khu công nghệ cao quận 9",20 triệu/tháng,900 m²,"Thủ Đức, Hồ Chí Minh",cho-thue-kho-nha-xuong-dat
Cho thuê kho xưởng ngay đường Liên Phường Quận 9,16 triệu/tháng,300 m²,"Thủ Đức, Hồ Chí Minh",cho-thue-kho-nha-xuong-dat
Chính chủ cho thuê kho xưởng tại Phú Thị Gia Lâm Hà Nội 0942 199 ***,Giá thỏa thuận,3.000 m²,"Gia Lâm, Hà Nội",cho-thue-kho-nha-xuong-dat
"Cho thuê kho xưởng cụm CN Cầu Gáo - Đan Phượng, Diện tích: 500 - 1000m2",50 nghìn/m²,1.000 m²,"Đan Phượng, Hà Nội",cho-thue-kho-nha-xuong-dat
"Cho thuê kho xưởng PCCC tự động nghiệm thu tại Phố Nối A Yên Mỹ Hưng Yên, Dt: 3000600 012 ***m",65 nghìn/m²,3.000 m²,"Yên Mỹ, Hưng Yên",cho-thue-kho-nha-xuong-dat
"Cho thuê kho xưởng PCCC nghiệm thu tại cụm CN Lai Xá - Hoài Đức, DT: 1000 - 3000m2",75 nghìn/m²,1.000 m²,"Hoài Đức, Hà Nội",cho-thue-kho-nha-xuong-dat
Cho thuê kho xưởng PCCC tự động tại cụm CN Hà Mãn - Thuận Thành - Bắc Ninh,75 nghìn/m²,3.000 m²,"Thuận Thành, Bắc Ninh",cho-thue-kho-nha-xuong-dat
Cho thuê nhà máy 10.000m tại KCN Thạch Thất - Quốc Oai - HN,Giá thỏa thuận,10.000 m²,"Quốc Oai, Hà Nội",cho-thue-kho-nha-xuong-dat
Cho thuê đất và thuê kho xưởng giá từ 4tr/ tháng,4 triệu/tháng,100 m²,"Tuy Hòa, Phú Yên",cho-thue-kho-nha-xuong-dat
"Cho thuê kho xưởng hiện đại tại Khu Công Nghiệp Quang Minh, Mê Linh, Hà Nội. LH 0906 218 ***",110 nghìn/m²,4.500 m²,"Mê Linh, Hà Nội",cho-thue-kho-nha-xuong-dat
Cho thuê nhà xưởng KCN Nam Tân Uyên 3.072m2,"80,14 nghìn/m²",3.072 m²,"Tân Uyên, Bình Dương",cho-thue-kho-nha-xuong-dat
Kho gần gần Xa Lộ Hà Nội - Trần Não 700 - 1000m2 giá từ 115 triệu,115 triệu/tháng,700 m²,"Quận 2, Hồ Chí Minh",cho-thue-kho-nha-xuong-dat
"Cho thuê đất đường Lê Đại Hành, Cẩm Lệ, Đà Nẵng, DT: 165m2 (7,5 x 22m)",8 triệu/tháng,165 m²,"Cẩm Lệ, Đà Nẵng",cho-thue-kho-nha-xuong-dat
"Chính chủ cho thuê mặt bằng 12000m2 tại chân Cầu Đông Trù, Long Biên, Hà Nội",Giá thỏa thuận,12.000 m²,"Long Biên, Hà Nội",cho-thue-kho-nha-xuong-dat
Cho thuê kho xưởng 2800m2 mặt tiền Quốc Lộ 14 Cư Jut Đắk Nông,25 nghìn/m²,2.800 m²,"Cư Jút, Đắk Nông",cho-thue-kho-nha-xuong-dat
Cho thuê kho liền biệt thự tại Q9,100 triệu/tháng,1.698 m²,"Thủ Đức, Hồ Chí Minh",cho-thue-kho-nha-xuong-dat
"Cho thuê đất, nhà xưởng khu vực Long Khánh",15 triệu/tháng,600 m²,"Long Khánh, Đồng Nai",cho-thue-kho-nha-xuong-dat
Cho thuê kho 1800 cụm công nghiệp Tân An BMT có PCCC,60 triệu/tháng,1.800 m²,"Buôn Ma Thuột, Đắk Lắk",cho-thue-kho-nha-xuong-dat
Cho thuê 2800m2 Quốc lộ 14 Cư jut đầy đủ PCCC,25 nghìn/m²,2.800 m²,"Cư Jút, Đắk Nông",cho-thue-kho-nha-xuong-dat
Cho thuê kho chứa hàng 800m2 CCN Tân An Buôn Ma Thuột,30 triệu/tháng,800 m²,"Buôn Ma Thuột, Đắk Lắk",cho-thue-kho-nha-xuong-dat
Cho thuê kho bãi cơ sở gần 1000m2 đường Trần Quý Cáp,27 triệu/tháng,1.000 m²,"Buôn Ma Thuột, Đắk Lắk",cho-thue-kho-nha-xuong-dat
Cho thuê kho + sân bãi mặt tiền Quốc Lộ 14 tổng 4500m2,45 triệu/tháng,4.500 m²,"Buôn Ma Thuột, Đắk Lắk",cho-thue-kho-nha-xuong-dat
Cho thuê đất hợp đồng lâu dài 100m2 giá 15tr tại đường 36 - An Phú,15 triệu/tháng,100 m²,"Quận 2, Hồ Chí Minh",cho-thue-kho-nha-xuong-dat
Kho Thảo Điền sạch sẽ - trần cao giá chỉ từ 20 triệu,Giá thỏa thuận,350 m²,"Quận 2, Hồ Chí Minh",cho-thue-kho-nha-xuong-dat
Đất trống diện tích lớn cho thuê chỉ 17tr tại đường 15 - An Phú 300m2,17 triệu/tháng,300 m²,"Quận 2, Hồ Chí Minh",cho-thue-kho-nha-xuong-dat
Cho thuê đất Đồng Văn Cống - 120m2 giá 12 triệu 2 mặt tiền,12 triệu/tháng,120 m²,"Quận 2, Hồ Chí Minh",cho-thue-kho-nha-xuong-dat
Cho thuê 3 lô liền kề 460m2 giá 75 triệu HĐ được 10 năm - Thạnh Mỹ Lợi,75 triệu/tháng,460 m²,"Quận 2, Hồ Chí Minh",cho-thue-kho-nha-xuong-dat
"Cho thuê đất trống, chính chủ có giấy tờ đầy đủ, được xây nhà cấp 4 hoặc cao tầng - 160m2",15 triệu/tháng,160 m²,"Quận 2, Hồ Chí Minh",cho-thue-kho-nha-xuong-dat
Cho thuê kho trệt 1 lầu - DT: 10x33m đường 6 giá: 50 triệu,50 triệu/tháng,330 m²,"Quận 2, Hồ Chí Minh",cho-thue-kho-nha-xuong-dat
Chính chủ cho thuê đất mặt tiền QL50,Giá thỏa thuận,4.000 m²,"Cần Đước, Long An",cho-thue-kho-nha-xuong-dat
"X599. Cho thuê kho xưởng quận Dương Kinh 1500m2 có điện 3 pha, pccc vòng ngoài",60 nghìn/m²,1.500 m²,"Dương Kinh, Hải Phòng",cho-thue-kho-nha-xuong-dat
"Cho thuê nhà MT đường Mã Lò (Gần Lê Văn Quới) DT 650m2, đang làm xưởng",75 triệu/tháng,650 m²,"Bình Tân, Hồ Chí Minh",cho-thue-kho-nha-xuong-dat
"Cho thuê lô đất góc 2 mặt tiền, ngay đường Số 12 Trần Não, 10x22m, giá chỉ 15tr",15 triệu/tháng,220 m²,"Quận 2, Hồ Chí Minh",cho-thue-kho-nha-xuong-dat
"Cho thuê kho xưởng 1100m2 Lê Văn Quới. Đường container, điện 3fa. Giá 90 triệu/th",90 triệu/tháng,1.100 m²,"Bình Tân, Hồ Chí Minh",cho-thue-kho-nha-xuong-dat
"Cho thuê kho 650m2 - 800m2 Ở phường Thuận Giao, TP Thuận An, Bình Dương",25 triệu/tháng,650 m²,"Thuận An, Bình Dương",cho-thue-kho-nha-xuong-dat
Cho thuê kho 500m2 đường Đào Trí giá 60tr/th. LH: Duy 0789 070 ***,60 triệu/tháng,500 m²,"Quận 7, Hồ Chí Minh",cho-thue-kho-nha-xuong-dat
"Chính chủ cho thuê kho tại Coma Tây Mỗ, Từ Liêm, Hà Nội. DT 300m2 - 500m2 - 1000m2 đến 10.000m2",Giá thỏa thuận,1.000 m²,"Nam Từ Liêm, Hà Nội",cho-thue-kho-nha-xuong-dat
Xưởng cho thuê Hố Nai - Tân Biên,100 triệu/tháng,1.700 m²,"Biên Hòa, Đồng Nai",cho-thue-kho-nha-xuong-dat
Cho thuê 300m2 kho tại đại mỗ xe tải 3 tấn đỗ cửa có wc bên trong,75 nghìn/m²,300 m²,"Nam Từ Liêm, Hà Nội",cho-thue-kho-nha-xuong-dat
"Cho thuê kho đường Phan Huy Ích - diện tích: 7500m2, giá 650 triệu/tháng",650 triệu/tháng,7.500 m²,"Tân Bình, Hồ Chí Minh",cho-thue-kho-nha-xuong-dat
Chính chủ cho thuê kho xưởng tại cụm CN Trường An - An Khánh,Giá thỏa thuận,300 m²,"Hoài Đức, Hà Nội",cho-thue-kho-nha-xuong-dat
Chính chủ cho thuê 500m2 kho xưởng tại Dương Nội Hà Đông,Giá thỏa thuận,500 m²,"Hà Đông, Hà Nội",cho-thue-kho-nha-xuong-dat
"Kho xưởng 2 mặt tiền, DT: 2.070m2, đường CN12 trong KCN Tân Bình, PCCC tiêu chuẩn",Giá thỏa thuận,2.070 m²,"Tân Phú, Hồ Chí Minh",cho-thue-kho-nha-xuong-dat
"Kho 2 mặt tiền 1000m2 đường Tây Lân, Bình Tân, Đường container, có trạm điện, có 3fa",70 triệu/tháng,1.000 m²,"Bình Tân, Hồ Chí Minh",cho-thue-kho-nha-xuong-dat
Chính chủ cho thuê xưởng 5500m2 trong KCN Chơn Thành Bình Phước. LH 0798 268 ***,"55,65 nghìn/m²",5.500 m²,"Chơn Thành, Bình Phước",cho-thue-kho-nha-xuong-dat
Cho thuê kho xưởng 7500m2 tại Chơn Thành. LH 0798 268 ***,"51,2 nghìn/m²",7.500 m²,"Chơn Thành, Bình Phước",cho-thue-kho-nha-xuong-dat
Kho xưởng giá rẻ có PCCC tự động gần KCN Tân Tạo quận Bình Tân,69 nghìn/m²,1.470 m²,"Bình Tân, Hồ Chí Minh",cho-thue-kho-nha-xuong-dat
"Cho thuê kho xưởng đường Lê Văn Quới, Bình Tân - Diện tích: 460m2 - Giá: 27 triệu/tháng",27 triệu/tháng,460 m²,"Bình Tân, Hồ Chí Minh",cho-thue-kho-nha-xuong-dat
"Kho xưởng 1.700m2 mặt tiền Quốc lộ 1A - Bình Tân, giá 130tr, container 24/24",130 triệu/tháng,1.700 m²,"Bình Tân, Hồ Chí Minh",cho-thue-kho-nha-xuong-dat
Chính chủ cho thuê 6000m2 kho xưởng có chia nhỏ diện tích sử dụng tại Hà Đông 0942 199 ***,60 nghìn/m²,6.000 m²,"Hà Đông, Hà Nội",cho-thue-kho-nha-xuong-dat
"Cho thuê nhà kho 500m2 tại đường Thoại Ngọc Hầu, Hòa Thạnh, Tân Phú",100 nghìn/m²,500 m²,"Tân Phú, Hồ Chí Minh",cho-thue-kho-nha-xuong-dat
"Đất mặt tiền Điện Biên Phủ, P. 17, Bình Thạnh, DT 19x38m, giá 120tr/th",120 triệu/tháng,722 m²,"Bình Thạnh, Hồ Chí Minh",cho-thue-kho-nha-xuong-dat
"Chính chủ cho thuê 300 - 500m2 kho xưởng dựng mới tại Lê Trọng Tấn, Hà Đông 0942 199 ***",65 nghìn/m²,300 m²,"Hà Đông, Hà Nội",cho-thue-kho-nha-xuong-dat
Chính chủ cho thuê 100m2 kho có sẵn tại Vạn Phúc 0942 199 ***,Giá thỏa thuận,100 m²,"Hà Đông, Hà Nội",cho-thue-kho-nha-xuong-dat
"Cần cho thuê nhà xưởng mới 1000 - 3000m2 đường Cont 24h tại Trần Đại Nghĩa, Q. Bình Tân",80 nghìn/m²,3.000 m²,"Bình Tân, Hồ Chí Minh",cho-thue-kho-nha-xuong-dat
"Cho thuê kho xưởng mới đẹp rẻ 70k/m2/th đường Phan Huy Ích, P. 14, Quận Gò Vấp",70 nghìn/m²,2.700 m²,"Gò Vấp, Hồ Chí Minh",cho-thue-kho-nha-xuong-dat
"Cho thuê kho xưởng 300m2, Làng Đại Học ABC Phước Kiển Nhà Bè. Giá 20tr/tháng, đường 12m",20 triệu/tháng,300 m²,"Nhà Bè, Hồ Chí Minh",cho-thue-kho-nha-xuong-dat
"Cần cho thuê kho xưởng 2.000m2 mặt tiền Quốc Lộ 1A, thị trấn Tân Túc, huyện Bình Chánh, TP. HCM",120 triệu/tháng,2.000 m²,"Bình Chánh, Hồ Chí Minh",cho-thue-kho-nha-xuong-dat
"Cho thuê kho xưởng trệt lầu 1000m2 tại đường Vĩnh Phú 13, TP. Thuận An, tỉnh Bình Dương",60 triệu/tháng,1.000 m²,"Thuận An, Bình Dương",cho-thue-kho-nha-xuong-dat
"Cho thuê xưởng 500, 1000m2 Xa Lộ Hà Nội - Phước Long A, Quận 9",105 triệu/tháng,1.000 m²,"Quận 9, Hồ Chí Minh",cho-thue-kho-nha-xuong-dat
"Cho thuê kho xưởng 1000m2 và 1500m2 mặt tiền Hồ Văn Long thuộc quận Bình Tân, TP.HCM",75 triệu/tháng,1.500 m²,"Bình Tân, Hồ Chí Minh",cho-thue-kho-nha-xuong-dat
"Cho thuê kho 700m2, 55 triệu/th Đường Tăng Nhơn Phú, Phước Long B, Thủ Đức",55 triệu/tháng,700 m²,"Quận 9, Hồ Chí Minh",cho-thue-kho-nha-xuong-dat
"Cho thuê kho xưởng diện tích đa dạng từ 1000m2 - 5000m2 trong KCN Hiệp Phước, huyện Nhà Bè, TP. HCM",120 nghìn/m²,1.000 m²,"Nhà Bè, Hồ Chí Minh",cho-thue-kho-nha-xuong-dat
"Cho thuê kho đường xe container, Phường Phú Thuận, Quận 7, TPHCM",110 nghìn/m²,1.100 m²,"Quận 7, Hồ Chí Minh",cho-thue-kho-nha-xuong-dat
"Cần cho thuê kho xưởng 700m2 Quốc Lộ 50, Phong Phú, Bình Chánh, thành phố Hồ Chí Minh",47 triệu/tháng,700 m²,"Bình Chánh, Hồ Chí Minh",cho-thue-kho-nha-xuong-dat
"Chính chủ cho thuê kho 300m2 đến 5000m2 tại Đại Lộ Thăng Long. Đường xe conterner vào, an toàn PCCC",65 nghìn/m²,1.000 m²,"Hoài Đức, Hà Nội",cho-thue-kho-nha-xuong-dat
"Cho thuê kho xưởng xây sẵn trong KCN Cầu Cảng Phước Đông, huyện Cần Đước",Giá thỏa thuận,920.000 m²,"Cần Đước, Long An",cho-thue-kho-nha-xuong-dat
"Cho thuê kho, nhà xưởng, đất diện tích 1002ha trong KCN Phú An Thạnh, huyện Bến Lức, tỉnh Long An",Giá thỏa thuận,10.000 m²,"Bến Lức, Long An",cho-thue-kho-nha-xuong-dat
"Cho thuê kho xưởng mới xây, khuôn viên riêng có sẵn văn phòng trong KCN Long Thành, tỉnh Đồng Nai",115 nghìn/m²,2.160 m²,"Long Thành, Đồng Nai",cho-thue-kho-nha-xuong-dat
"Cho thuê đất khu công nghiệp tại KCN Phú Mỹ 2, TX Phú Mỹ, Tỉnh Bà Rịa - Vũng Tàu",Giá thỏa thuận,64.000 m²,"Phú Mỹ, Bà Rịa Vũng Tàu",cho-thue-kho-nha-xuong-dat
"Cho Thuê 1300m2, giá 25tr/tháng",25 triệu/tháng,1.300 m²,"Củ Chi, Hồ Chí Minh",cho-thue-kho-nha-xuong-dat
"Cho thuê kho xưởng diện tích 16m x 22m, hẻm Xe tải Tân Sơn, P. 12, Q. Gò Vấp",40 triệu/tháng,352 m²,"Gò Vấp, Hồ Chí Minh",cho-thue-kho-nha-xuong-dat
Kho MT Phan Văn Hớn 5600m2 giá 280 tr / 1 tháng,280 triệu/tháng,5.600 m²,"Quận 12, Hồ Chí Minh",cho-thue-kho-nha-xuong-dat
Cho thuê 2 kho xưởng giá rẻ Hóc Môn.. 1000m2 giá 40tr và 2000m2 giá 80tr/tháng,80 triệu/tháng,2.000 m²,"Hóc Môn, Hồ Chí Minh",cho-thue-kho-nha-xuong-dat
"Xưởng 4300m2 có PCCC tự động nghiệm thu. Giá 60.104,7đ/m2/tháng","60,1 nghìn/m²",4.300 m²,"Khoái Châu, Hưng Yên",cho-thue-kho-nha-xuong-dat
"CC cần cho thuê gấp 280m2 tại KĐT Linh Đàm, Hoàng Mai cách trường Chu Văn An 200m, xe cont đỗ cửa",18 triệu/tháng,280 m²,"Hoàng Mai, Hà Nội",cho-thue-kho-nha-xuong-dat
"Cty cần cho thuê DT: 1500 - 4500m2 tại Gia Lâm, Hà Nội. Điện 3fa, PCCC nghiệm thu, xuất full HĐ",100 nghìn/m²,2.500 m²,"Gia Lâm, Hà Nội",cho-thue-kho-nha-xuong-dat
"Cho thuê kho MT 1691 Tỉnh Lộ 10, (8x40m), tiện sửa chữa lại tùy khách thuê",45 triệu/tháng,200 m²,"Bình Tân, Hồ Chí Minh",cho-thue-kho-nha-xuong-dat
Cho thuê nhà xưởng TP Thanh Hóa. DT 1150m2 giá từ 10k/m2/th,10 nghìn/m²,1.150 m²,"Thanh Hóa, Thanh Hóa",cho-thue-kho-nha-xuong-dat
"Cho thuê ngay 2.200 m2 kho, xưởng giá rẻ, có PCCC nghiệm thu tại Tân Tiến, Văn Giang, Hưng Yên",65 nghìn/m²,2.200 m²,"Văn Giang, Hưng Yên",cho-thue-kho-nha-xuong-dat
"Cho thuê 2 kho 300m2 và 420m2 ở đường Trường Chinh, xe công ra vào",14 triệu/tháng,420 m²,"Kiến An, Hải Phòng",cho-thue-kho-nha-xuong-dat
"Cho thuê xưởng 230m2, 400m2 đẹp gần bến xe Thượng Lý. Xe công thuận tiện",40 nghìn/m²,400 m²,"Hồng Bàng, Hải Phòng",cho-thue-kho-nha-xuong-dat
"Cho thuê xưởng 1000m2 ở đầu Kiến An, xe công ra vào, riêng biệt xa dân. Có thể mở rộng",50 triệu/tháng,1.000 m²,"Kiến An, Hải Phòng",cho-thue-kho-nha-xuong-dat
"Cho thuê kho xưởng DT 400m2 ở đường Trường Chinh, xe công vào, điện 3 pha",15 triệu/tháng,400 m²,"Kiến An, Hải Phòng",cho-thue-kho-nha-xuong-dat
Xưởng mặt tiền đường nhựa lớn 600m2 25tr,25 triệu/m²,600 m²,"Tân Uyên, Bình Dương",cho-thue-kho-nha-xuong-dat
Cho thuê MB 20x50m Bình Nhâm giáp Lái Thiêu,8 triệu/tháng,1.000 m²,"Thuận An, Bình Dương",cho-thue-kho-nha-xuong-dat
"Tôi Lâm 1983 cho thuê 400m2 nhà (530m2 sàn) kho, xưởng tại Văn Giang, Hưng Yên (Gần Ecopark)",16 triệu/tháng,530 m²,"Văn Giang, Hưng Yên",cho-thue-kho-nha-xuong-dat
"88 tr/th: Lô đất 500m2 (12x40m) ngay Quốc Hương, Phường Thảo Điền, chủ hỗ trợ xin GPXD",88 triệu/tháng,500 m²,"Quận 2, Hồ Chí Minh",cho-thue-kho-nha-xuong-dat
"200 tr/th lô đất góc 2 mặt tiền Xuân Thuỷ, 15x30m, vị trí kế Quán Ba Gác, gần ngã tư Quốc Hương",200 triệu/tháng,450 m²,"Quận 2, Hồ Chí Minh",cho-thue-kho-nha-xuong-dat
"Chính chủ gửi cho thuê đất 2MT QL 1A - Huỳnh Bá Chánh, 2000m2 giá chỉ 100tr/tháng LH 0902 798 ***",100 triệu/tháng,2.000 m²,"Bình Chánh, Hồ Chí Minh",cho-thue-kho-nha-xuong-dat
"Cho thuê 500m2 xưởng mới Lái Thiêu, Tp Thuận An, Bình Dương, Đường lớn, có 3 pha",22 triệu/tháng,500 m²,"Thuận An, Bình Dương",cho-thue-kho-nha-xuong-dat
"Cho thuê nhà xưởng 1500m2, 2000m2, 3000m2 đến 8000m2 tại KCN Phố Nối A, Phố Nối B. LH 0985 675 ***",50 nghìn/m²,4.000 m²,"Văn Lâm, Hưng Yên",cho-thue-kho-nha-xuong-dat
"Chính chủ cho thuê kho - xưởng tại KCN Phố Nối A, DT cho thuê từ 1000m2, 2000m2, 3000m2 đến 50000m2","48,5 nghìn/m²",3.000 m²,"Văn Lâm, Hưng Yên",cho-thue-kho-nha-xuong-dat
"Cho Thuê MBKD, Kho Chứa Hàng MT Ql13 phường Hiệp Bình Phước Thủ Đức",22 triệu/tháng,280 m²,"Thủ Đức, Hồ Chí Minh",cho-thue-kho-nha-xuong-dat
"Cho thuê kho xưởng cách mặt tiền Liên Phường 30m ngang 16m dài 21m, điện 3 pha giá 40 tr/ tháng",40 triệu/tháng,336 m²,"Quận 9, Hồ Chí Minh",cho-thue-kho-nha-xuong-dat
"Cho thuê kho 94, Nguyễn Văn Cự, Bình Tân",28 triệu/tháng,280 m²,"Bình Tân, Hồ Chí Minh",cho-thue-kho-nha-xuong-dat
Chính chủ cho thuê gấp đất 440m2 MT ĐLBD (15 triệu/tháng),15 triệu/tháng,440 m²,"Thủ Dầu Một, Bình Dương",cho-thue-kho-nha-xuong-dat
"Cho thuê kho KCN AMATA, Biên Hòa - Đồng Nai, DT 4.000 m2 chỉ 164 triệu",164 triệu/tháng,4.000 m²,"Biên Hòa, Đồng Nai",cho-thue-kho-nha-xuong-dat
"Cho thuê đất mặt tiền Vạn Thành, Phường 5, Đà Lạt thích hợp đầu tư du lịch",18 triệu/tháng,500 m²,"Đà Lạt, Lâm Đồng",cho-thue-kho-nha-xuong-dat
"Cho thuê đất mặt tiền Cam Ly, Phường 7, Đà Lạt diện tích lớn hiện đang làm nông trại",35 triệu/tháng,12.000 m²,"Đà Lạt, Lâm Đồng",cho-thue-kho-nha-xuong-dat
Cho thuê xưởng đẹp 7x30m có gác 50m2 dưới thông suốt hẻm 6m giá 15 tr/tháng. LH 0919 147 ***,15 triệu/tháng,210 m²,"Quận 12, Hồ Chí Minh",cho-thue-kho-nha-xuong-dat
"Cho thuê đất 1986 - 1986A - 1988 Võ Văn Kiệt, Q. Bình Tân, 2000m2 mặt tiền",Giá thỏa thuận,2.000 m²,"Bình Tân, Hồ Chí Minh",cho-thue-kho-nha-xuong-dat
"Cho thuê mặt bằng chính chủ giá chỉ 19,5 triệu có gác trống suốt - đường 20","19,5 triệu/tháng",150 m²,"Quận 2, Hồ Chí Minh",cho-thue-kho-nha-xuong-dat
"Cho thuê nhà tiền chế có gác lửng 80m2 mặt tiền đường Cao Đức Lân, Phường An Phú chỉ có 10 triệu",10 triệu/tháng,80 m²,"Quận 2, Hồ Chí Minh",cho-thue-kho-nha-xuong-dat
Cho thuê kho/mặt bằng 5x20m được trữ hàng giá chỉ 21 triệu Mai Chí Thọ,21 triệu/tháng,150 m²,"Quận 2, Hồ Chí Minh",cho-thue-kho-nha-xuong-dat
"Cho thuê mặt bằng nhà cấp 4, đang nâng cấp chất lượng giá không đổi 20 triệu - đường 12",20 triệu/tháng,100 m²,"Quận 2, Hồ Chí Minh",cho-thue-kho-nha-xuong-dat
Cho thuê đất lô góc tiện kinh doanh ăn uống 400m2 giá chỉ 30 triệu,30 triệu/tháng,400 m²,"Quận 2, Hồ Chí Minh",cho-thue-kho-nha-xuong-dat
Chính chủ cho thuê đất gấp 400m2 chỉ 30 triệu gần đường Nguyễn Thị Định,30 triệu/tháng,400 m²,"Quận 2, Hồ Chí Minh",cho-thue-kho-nha-xuong-dat
"Cho thuê đất, còn trống 400m2 lô góc cho thuê gấp giá chỉ 35 triệu, view sông",35 triệu/tháng,400 m²,"Quận 2, Hồ Chí Minh",cho-thue-kho-nha-xuong-dat
"Cho thuê 2hecta đất mặt tiền Nguyễn Văn Linh, giá: 25 k/m2/tháng",25 nghìn/m²,20.000 m²,"Bình Chánh, Hồ Chí Minh",cho-thue-kho-nha-xuong-dat
Cho thuê đất xây được 3 lầu giá 50tr diện tích đất của biệt thự,50 triệu/tháng,150 m²,"Quận 2, Hồ Chí Minh",cho-thue-kho-nha-xuong-dat
"Cho thuê đất gần ngay Trần Não hơn 400m2 giá 59 triệu có thể làm showroom, nhà hàng",59 triệu/tháng,413 m²,"Quận 2, Hồ Chí Minh",cho-thue-kho-nha-xuong-dat
Cho thuê đất làm showroom ô tô 414m2 giá 60 triệu - đường Trần Não,60 triệu/tháng,414 m²,"Quận 2, Hồ Chí Minh",cho-thue-kho-nha-xuong-dat
Cho thuê đất vị trí đắc địa phường Thảo Điền 10x15m - giá 70 triệu,70 triệu/tháng,150 m²,"Quận 2, Hồ Chí Minh",cho-thue-kho-nha-xuong-dat
Cho thuê đất ngàng 10 mét - full thổ cư - hđ 5 năm giá 50 triêu - free thời gian set up,50 triệu/tháng,240 m²,"Quận 2, Hồ Chí Minh",cho-thue-kho-nha-xuong-dat
Cho thuê đất Lương Định Của - HĐ trên 5 năm cũng được - giá 58 triệu 200m2,58 triệu/tháng,200 m²,"Quận 2, Hồ Chí Minh",cho-thue-kho-nha-xuong-dat
"Cho thuê kho 200m2 - 400m2 - 1000m2 tại Sơn Trà, Đà Nẵng - Giá cả hấp dẫn",50 triệu/tháng,900 m²,"Sơn Trà, Đà Nẵng",cho-thue-kho-nha-xuong-dat
"Cho thuê đất free 2 tháng set up 240m2, giá 50 triệu - đường 33",50 triệu/tháng,240 m²,"Quận 2, Hồ Chí Minh",cho-thue-kho-nha-xuong-dat
Chính chủ cho thuê đất view sông 280m2 đường Quốc Hương 60 triệu,60 triệu/tháng,280 m²,"Quận 2, Hồ Chí Minh",cho-thue-kho-nha-xuong-dat
"Cho thuê đất trống ngang 20m giá 60 triệu gần Xuân Thủy, Tổng DT 280m2",60 triệu/tháng,280 m²,"Quận 2, Hồ Chí Minh",cho-thue-kho-nha-xuong-dat
Cho thuê đất gần Đại học Văn Hóa 300m2 thổ cư giá 80 triệu,80 triệu/tháng,300 m²,"Quận 2, Hồ Chí Minh",cho-thue-kho-nha-xuong-dat
Cho thuê đất chính chủ 500m2 nở hậu 80 triệu đường 65 - Thảo Điền,80 triệu/tháng,500 m²,"Quận 2, Hồ Chí Minh",cho-thue-kho-nha-xuong-dat
Cho thuê đất không giới hạn thời gian thuê + 200m2 giá 58 triệu,58 triệu/tháng,200 m²,"Quận 2, Hồ Chí Minh",cho-thue-kho-nha-xuong-dat
Cho thuê 1200m2 kho xưởng tại cụm CN Lai Xá Hoài Đức,100 nghìn/m²,1.200 m²,"Hoài Đức, Hà Nội",cho-thue-kho-nha-xuong-dat
"Cho thuê đất và tài sản trên đất 387,5m2 giá 70 triệu căn góc 2 mặt tiền",70 triệu/tháng,"387,5 m²","Quận 2, Hồ Chí Minh",cho-thue-kho-nha-xuong-dat
"Cho thuê 5 hecta mặt tiền đường Thới An 17A P. Thới An Quận 12, giá: 13 nghìn/m2/tháng",13 nghìn/m²,50.000 m²,"Quận 12, Hồ Chí Minh",cho-thue-kho-nha-xuong-dat
Cho thuê đất góc 2 mặt tiền gần Song Hành gần 400m2 giá 70 triệu,70 triệu/tháng,"387,5 m²","Quận 2, Hồ Chí Minh",cho-thue-kho-nha-xuong-dat
Cho thuê đất view sông 400m2 giá 35 triệu đường Bát Nàn,35 triệu/tháng,400 m²,"Quận 2, Hồ Chí Minh",cho-thue-kho-nha-xuong-dat
Cho thuê gấp đất gần Cảng Cát Lái 140m2 giá 20 triệu thương lượng,20 triệu/tháng,140 m²,"Quận 2, Hồ Chí Minh",cho-thue-kho-nha-xuong-dat
Cho thuê đất làm kho xưởng ngang 7m giá 20 triệu thương lượng,20 triệu/tháng,140 m²,"Quận 2, Hồ Chí Minh",cho-thue-kho-nha-xuong-dat
Cho thuê kho xưởng 750m2 Cụm CN An Khánh mặt đường km9 Đại Lộ Thăng Long,Giá thỏa thuận,750 m²,"Hoài Đức, Hà Nội",cho-thue-kho-nha-xuong-dat
Cho thuê xưởng sản xuất nhựa và cơ khí tại An Dương,Giá thỏa thuận,1.040 m²,"An Dương, Hải Phòng",cho-thue-kho-nha-xuong-dat
"Cho thuê kho KCN Từ Liêm, Nam Từ Liêm, HN DT 1000m2 cao 10m, điện 3fa xe công đỗ cửa giá 110k/m2/th",110 nghìn/m²,1.000 m²,"Nam Từ Liêm, Hà Nội",cho-thue-kho-nha-xuong-dat
"Cho thuê kho đường Thuỵ Phương, Bắc Từ Liêm DT 1500m, cao 7m có điện 3fa, xe công đỗ. Giá 70k/m2/th",70 nghìn/m²,1.500 m²,"Bắc Từ Liêm, Hà Nội",cho-thue-kho-nha-xuong-dat
Cho thuê kho xưởng tại Bắc Ninh,"77,9 nghìn/m²",1.000 m²,"Bắc Ninh, Bắc Ninh",cho-thue-kho-nha-xuong-dat
Cho thuê kho xưởng đẹp tại Như Quỳnh - Thị trấn Như Quỳnh- Văn Lâm- Hưng Yên,65 nghìn/m²,4.500 m²,"Văn Lâm, Hưng Yên",cho-thue-kho-nha-xuong-dat
Cho thuê nhà xưởng tại Như Quỳnh - Thị trấn Như Quỳnh- Văn Lâm- Hưng Yên,75 nghìn/m²,2.700 m²,"Văn Lâm, Hưng Yên",cho-thue-kho-nha-xuong-dat
Cho thuê kho xưởng tại Văn Lâm - Thị trấn Như Quỳnh- Văn Lâm- Hưng Yên,70 nghìn/m²,1.300 m²,"Văn Lâm, Hưng Yên",cho-thue-kho-nha-xuong-dat
Cho thuê kho xưởng tại Quang Minh - Thị trấn Quang Minh- Mê Linh- Hà Nội,25 triệu/tháng,1.000 m²,"Mê Linh, Hà Nội",cho-thue-kho-nha-xuong-dat
Cho thuê kho xưởng tại Thái Nguyên - Thành phố Phổ Yên - Thái Nguyên,40 triệu/tháng,900 m²,"Phổ Yên, Thái Nguyên",cho-thue-kho-nha-xuong-dat
Cho thuê kho xưởng rẻ tại Hưng Yên- Khu CN Phố Nối A- Văn Lâm- Hưng Yên,55 nghìn/m²,1.100 m²,"Văn Lâm, Hưng Yên",cho-thue-kho-nha-xuong-dat
